"UPDATED","ENTRY_DATE","EVENT_LCL_DATE","EVENT_LCL_TIME","LOC_CITY_NAME","LOC_STATE_NAME","LOC_CNTRY_NAME","RMK_TEXT","EVENT_TYPE_DESC","FSDO_DESC","REGIST_NBR","FLT_NBR","ACFT_OPRTR","ACFT_MAKE_NAME","ACFT_MODEL_NAME","ACFT_MISSING_FLAG","ACFT_DMG_DESC","FLT_ACTIVITY","FLT_PHASE","FAR_PART","MAX_INJ_LVL","FATAL_FLAG","FLT_CRW_INJ_NONE","FLT_CRW_INJ_MINOR","FLT_CRW_INJ_SERIOUS","FLT_CRW_INJ_FATAL","FLT_CRW_INJ_UNK","CBN_CRW_INJ_NONE","CBN_CRW_INJ_MINOR","CBN_CRW_INJ_SERIOUS","CBN_CRW_INJ_FATAL","CBN_CRW_INJ_UNK","PAX_INJ_NONE","PAX_INJ_MINOR","PAX_INJ_SERIOUS","PAX_INJ_FATAL","PAX_INJ_UNK","GRND_INJ_NONE","GRND_INJ_MINOR","GRND_INJ_SERIOUS","GRND_INJ_FATAL","GRND_INJ_UNK"
"No","30-JUN-25","28-JUN-25","16:35:00Z","CAPRON","ILLINOIS","UNITED STATES","AIRCRAFT CRASHED UNDER UNKNOWN CIRCUMSTANCES, CAPRON, IL.","ACCIDENT","GREATER CHICAGO FSDO","N847CS","","","VANS","RV10","No","SUBSTANTIAL","PERSONAL","EN ROUTE (ENR)","91","FATAL","Yes","0","0","0","1","0","0","0","0","0","0","0","0","0","1","0","0","0","0","0","0"
"No","30-JUN-25","21-JUN-25","22:00:00Z","MIDLOTHIAN","TEXAS","UNITED STATES","AIRCRAFT LANDED HARD DAMAGING NOSE AND MAIN GEARS, MIDLOTHIAN, TX.","ACCIDENT","NORTH TEXAS FSDO","N852BG","","","BURKHART GROB","G-103A TWIN II ACRO","No","SUBSTANTIAL","PERSONAL","LANDING (LDG)","91","NONE","No","1","0","0","0","0","0","0","0","0","0","0","0","0","0","0","0","0","0","0","0"
"No","30-JUN-25","29-JUN-25","19:30:00Z","NEPHI","UTAH","UNITED STATES","AIRCRAFT ON LANDING AND NOSE GEAR BROKE OFF, NEPHI, UT.","ACCIDENT","SALT LAKE CITY FSDO","N3608U","","","CESSNA","182","No","SUBSTANTIAL","PERSONAL","LANDING (LDG)","91","NONE","No","1","0","0","0","0","0","0","0","0","0","0","0","0","0","0","0","0","0","0","0"
"No","30-JUN-25","28-JUN-25","21:20:00Z","TRACY","CALIFORNIA","UNITED STATES","AIRCRAFT ON A SOFT-FIELD TAKEOFF, BANKED HARD TO THE LEFT AS IT BECAME AIRBORNE AND CRASHED ON THE RUNWAY, TRACY, CA.","ACCIDENT","OAKLAND FSDO","N6744F","","","CESSNA","150","No","SUBSTANTIAL","PERSONAL","TAKEOFF (TOF)","91","NONE","No","1","0","0","0","0","0","0","0","0","0","0","0","0","0","0","0","0","0","0","0"
"No","30-JUN-25","29-JUN-25","01:25:00Z","PICNIC HARBOR","ALASKA","UNITED STATES","AIRCRAFT LANDING ON THE BEACH AND FLIPPED OVER, PICNIC HARBOR, AK.","ACCIDENT","ANCHORAGE FSDO","N8085L","","","CESSNA","172","No","SUBSTANTIAL","PERSONAL","LANDING (LDG)","91","NONE","No","1","0","0","0","0","0","0","0","0","0","2","0","0","0","0","0","0","0","0","0"
"No","30-JUN-25","29-JUN-25","14:10:00Z","EUSTIS","FLORIDA","UNITED STATES","AIRCRAFT STRUCK TREES ON DEPARTURE AND CRASHED INTO A POND, EUSTIS, FL.","ACCIDENT","ORLANDO FSDO","N9420Y","","","BEECH","95-B55","No","SUBSTANTIAL","PERSONAL","TAKEOFF (TOF)","91","UNKNOWN","No","0","0","0","0","1","0","0","0","0","0","0","0","0","0","1","0","0","0","0","0"
"No","30-JUN-25","27-JUN-25","16:15:00Z","KELLEYS ISLAND","OHIO","UNITED STATES","AIRCRAFT PORPOISED ON TAKEOFF,  VEERED OFF RUNWAY AND NOSE GEAR COLLAPSED, KELLEYS ISLAND, OH.","ACCIDENT","CLEVELAND FSDO","N30743","","","CESSNA","177","No","SUBSTANTIAL","PERSONAL","TAKEOFF (TOF)","91","MINOR","No","0","1","0","0","0","0","0","0","0","0","0","1","0","0","0","0","0","0","0","0"
"No","30-JUN-25","30-JUN-25","04:05:00Z","KNIK RIVER","ALASKA","UNITED STATES","AIRCRAFT ROLLED OVER ON LANDING, KNIK RIVER, AK.","ACCIDENT","ANCHORAGE FSDO","N531AT","","","ROBINSON","R44","No","SUBSTANTIAL","SIGHT SEEING","LANDING (LDG)","135","NONE","No","1","0","0","0","0","0","0","0","0","0","3","0","0","0","0","0","0","0","0","0"
"No","30-JUN-25","27-JUN-25","20:08:00Z","SANTA BARBARA","CALIFORNIA","UNITED STATES","AIRCRAFT LANDED, TURNED TOO QUICKLY AND THE LEFT WING STRUCK A TAXIWAY SIGN, SANTA BARBARA, CA.","ACCIDENT","VAN NUYS FSDO","N307BE","","","ALEXANDER SCHLEICHER GMBH","ASH 30 MI","No","SUBSTANTIAL","PERSONAL","LANDING (LDG)","91","NONE","No","1","0","0","0","0","0","0","0","0","0","0","0","0","0","0","0","0","0","0","0"
"No","30-JUN-25","29-JUN-25","14:49:00Z","ZEELAND","MICHIGAN","UNITED STATES","AIRCRAFT CRASHED UNDER UNKNOWN CIRCUMSTANCES SHORTLY AFTER TAKEOFF, ZEELAND, MI.","ACCIDENT","GRAND RAPIDS FSDO","N360RF","","","LANCAIR","320/360","No","DESTROYED","PERSONAL","TAKEOFF (TOF)","91","FATAL","Yes","0","0","0","1","0","0","0","0","0","0","0","0","0","0","0","0","0","0","0","0"
"No","30-JUN-25","29-JUN-25","08:36:00Z","YOUNGSTOWN","OHIO","UNITED STATES","AIRCRAFT CRASHED UNDER UNKNOWN CIRCUMSTANCES, YOUNGSTOWN, OH.","ACCIDENT","CLEVELAND FSDO","N441LS","","","CESSNA","441","No","DESTROYED","PERSONAL","INITIAL CLIMB (ICL)","91","FATAL","Yes","0","0","0","1","0","0","0","0","0","0","0","0","0","5","0","0","0","0","0","0"
"No","30-JUN-25","30-JUN-25","02:55:00Z","HELENA","MONTANA","UNITED STATES","AIRCRAFT LANDED AND GROUND LOOPED, HELENA, MT.","ACCIDENT","HELENA FSDO","N50476","","","BELLANCA","7GCBC","No","SUBSTANTIAL","PERSONAL","LANDING (LDG)","91","NONE","No","1","0","0","0","0","0","0","0","0","0","0","0","0","0","0","0","0","0","0","0"
"No","30-JUN-25","28-JUN-25","19:45:00Z","PRIEST LAKE","IDAHO","UNITED STATES","AIRCRAFT CRASHED AND BECAME INVERTED IN THE WATER, PRIEST LAKE, ID.","ACCIDENT","SPOKANE FSDO","N6759K","","","REPUBLIC","RC-3","No","SUBSTANTIAL","PERSONAL","TAKEOFF (TOF)","91","NONE","No","1","0","0","0","0","0","0","0","0","0","1","0","0","0","0","0","0","0","0","0"
"No","03-JUL-25","02-JUL-25","20:13:00Z","MOUNT VERNON","WASHINGTON","UNITED STATES","AIRCRAFT CRASHED UNDER UNKNOWN CIRCUMSTANCES ON DEPARTURE, MOUNT VERNON, WA.","ACCIDENT","SEATTLE FSDO","N774RS","","","EVOLUTION AIRCRAFT","REVOLT","No","UNKNOWN","PERSONAL","TAKEOFF (TOF)","91","FATAL","Yes","0","0","0","1","0","0","0","0","0","0","0","0","0","0","0","0","0","0","0","0"
"No","03-JUL-25","02-JUL-25","18:00:00Z","GALLATIN","TENNESSEE","UNITED STATES","AIRCRAFT CRASHED IN A FIELD UNDER UNKNOWN CIRCUMSTANCES, GALLATIN, TN.","ACCIDENT","NASHVILLE FSDO","N93985","","","ERCOUPE","415-C","No","UNKNOWN","PERSONAL","EN ROUTE (ENR)","91","FATAL","Yes","0","0","0","1","0","0","0","0","0","0","0","0","0","0","0","0","0","0","0","0"
"No","03-JUL-25","02-JUL-25","19:56:00Z","CROSS KEYS","NEW JERSEY","UNITED STATES","AIRCRAFT EXPERIENCED ENGINE ISSUES AFTER DEPARTURE AND CRASHED WHILE RETURNING TO THE AIRPORT AFTER A RUNWAY EXCURSION INTO TREES, CROSS KEYS, NJ.","ACCIDENT","PHILADELPHIA FSDO","N716MM","","","CESSNA","208","No","UNKNOWN","SKYDIVING","TAKEOFF (TOF)","91","SERIOUS","No","0","0","0","0","1","0","0","0","0","0","1","0","3","0","10","0","0","0","0","0"
"No","03-JUL-25","02-JUL-25","16:06:00Z","RALEIGH-DURHAM","NORTH CAROLINA","UNITED STATES","AIRCRAFT LANDED AND POST FLIGHT INSPECTION REVEALED PART OF A FLAP WAS MISSING FROM A WING, RALEIGH-DURHAM, NC.","INCIDENT","GREENSBORO FSDO","N875DN","DAL3247","DELTA AIRLINES","BOEING","737","No","UNKNOWN","COMMERCIAL","EN ROUTE (ENR)","121","NONE","No","0","0","0","0","0","0","0","0","0","0","0","0","0","0","0","0","0","0","0","0"
"No","03-JUL-25","30-JUN-25","19:40:00Z","SEATTLE","WASHINGTON","UNITED STATES","AIRCRAFT LANDED HARD, SEATTLE, WA.","INCIDENT","SEATTLE FSDO","N23UP","","","ROBINSON","R66","No","UNKNOWN","PERSONAL","LANDING (LDG)","","NONE","No","1","0","0","0","0","0","0","0","0","0","1","0","0","0","0","0","0","0","0","0"
"No","03-JUL-25","02-JUL-25","16:55:00Z","GRANTS","NEW MEXICO","UNITED STATES","AIRCRAFT EXPERIENCED ENGINE ISSUES AFTER TAKEOFF AND RETURNED TO AIRPORT, WHILE LANDING VEERED OFF RUNWAY, GRANTS, NM.","INCIDENT","ALBUQUERQUE FSDO","N451Z","","","REPUBLIC","RC-3","No","UNKNOWN","PERSONAL","TAKEOFF (TOF)","91","NONE","No","1","0","0","0","0","0","0","0","0","0","0","0","0","0","0","0","0","0","0","0"
"No","03-JUL-25","02-JUL-25","17:40:00Z","MESQUITE","TEXAS","UNITED STATES","AIRCRAFT INCURRED A PROP STRIKE ON LANDING,  MESQUITE, TX.","INCIDENT","NORTH TEXAS FSDO","N3622A","","","BEECH","E-55","No","UNKNOWN","INSTRUCTION","LANDING (LDG)","91","NONE","No","1","0","0","0","0","0","0","0","0","0","1","0","0","0","0","0","0","0","0","0"
"No","03-JUL-25","02-JUL-25","19:15:00Z","NEW YORK","NEW YORK","UNITED STATES","AIRCRAFT EXPERIENCED A CROSSWIND ON DEPARTURE AND CAME TO A STOP ON THE NOSE, NEW YORK, NY.","INCIDENT","NEW YORK FSDO","N6824H","","","PIPER","J3C-65","No","UNKNOWN","PERSONAL","TAKEOFF (TOF)","91","NONE","No","1","0","0","0","0","0","0","0","0","0","1","0","0","0","0","0","0","0","0","0"
"No","03-JUL-25","02-JUL-25","17:50:00Z","BRUSH","COLORADO","UNITED STATES","AIRCRAFT LOST CONTROL ON LANDING AND VEERED OFF RUNWAY COMING TO REST ON LEFT WINGTIP ON AN EMBANKMENT, BRUSH, CO.","INCIDENT","DENVER FSDO","N7635H","","","PIPER","PA12","No","UNKNOWN","PERSONAL","LANDING (LDG)","91","NONE","No","1","0","0","0","0","0","0","0","0","0","0","0","0","0","0","0","0","0","0","0"
"No","03-JUL-25","02-JUL-25","23:20:00Z","MADISONVILLE","KENTUCKY","UNITED STATES","AIRCRAFT LOST CONTROL AND CRASHED ON THE HELIPAD FOR UNKNOWN REASONS AND CAME TO REST ON ITS SIDE, MADISONVILLE, KY.","INCIDENT","LOUISVILLE FSDO","N21385","","","SCHWEIZER","269C-1","No","UNKNOWN","INSTRUCTION","LANDING (LDG)","91","NONE","No","1","0","0","0","0","0","0","0","0","0","0","0","0","0","0","0","0","0","0","0"
"No","30-JUN-25","27-JUN-25","11:00:00Z","COVINGTON","KENTUCKY","UNITED STATES","AIRCRAFT STRUCK A BIRD DAMAGING PITOT TUBE, COVINGTON, KY.","INCIDENT","CINCINNATI FSDO","N295NV","AAY393","ALLEGIANT AIR","AIRBUS","A320","No","MINOR","COMMERCIAL","TAKEOFF (TOF)","121","NONE","No","0","0","0","0","0","0","0","0","0","0","0","0","0","0","0","0","0","0","0","0"
"No","03-JUL-25","02-JUL-25","17:05:00Z","RIVERSIDE","CALIFORNIA","UNITED STATES","AIRCRAFT PORPOISED ON LANDING, RIVERSIDE, CA.","INCIDENT","RIVERSIDE FSDO","N76901","","","CESSNA","172","No","UNKNOWN","INSTRUCTION","LANDING (LDG)","91","NONE","No","1","0","0","0","0","0","0","0","0","0","0","0","0","0","0","0","0","0","0","0"
"No","03-JUL-25","02-JUL-25","20:13:00Z","CONCORD","CALIFORNIA","UNITED STATES","AIRCRAFT STRUCK A BIRD LEAVING A DENT IN THE LEADING EDGE OF RIGHT WING, CONCORD, CA.","INCIDENT","OAKLAND FSDO","N98436","","","CESSNA","172R","No","UNKNOWN","PERSONAL","APPROACH (APR)","91","NONE","No","0","0","0","0","0","0","0","0","0","0","0","0","0","0","0","0","0","0","0","0"
"No","09-JUL-25","06-JUL-25","18:35:00Z","ANGEL FIRE","NEW MEXICO","UNITED STATES","N5009B CRASHED INTO RISING TERRAIN FOR UNKNOWN REASONS AFTER DEPARTING THE ANGEL FIRE NM AIRPORT.","ACCIDENT","Albuquerque FSDO","N5009B","","","BEECH","F35 R4TS","No","DESTROYED","PERSONAL","INITIAL CLIMB (ICL)","91","FATAL","Yes","0","0","0","1","0","0","0","0","0","0","0","0","0","0","0","0","0","0","0","0"
"No","09-JUL-25","08-JUL-25","18:00:00Z","JENISON","MICHIGAN","UNITED STATES","AIRPLANE WAS TAKING OFF WHEN IT IMPACTED A LAKE IN A GRAVEL PIT ADJACENT TO THE RUNWAY.","ACCIDENT","Grand Rapids FSDO","N29342","","","CESSNA","177","No","SUBSTANTIAL","PERSONAL","TAKEOFF (TOF)","91","NONE","No","1","0","0","0","0","0","0","0","0","0","1","0","0","0","0","0","0","0","0","0"
"No","09-JUL-25","06-JUL-25","17:00:00Z","ILIAMNA","ALASKA","UNITED STATES","EXPERIENCED A HARD LANDING FOR UNKNOWN REASONS NEAR KUKAKLEK LAKE","ACCIDENT","Anchorage FSDO","N67251","","","DE HAVILLAND","DHC2","No","SUBSTANTIAL","UNKNOWN","LANDING (LDG)","","NONE","No","1","0","0","0","0","0","0","0","0","0","5","0","0","0","0","0","0","0","0","0"
"No","09-JUL-25","09-JUL-25","00:10:00Z","MARION","TEXAS","UNITED STATES","WHILE REFUELING ACFT, THE PROP STRUCK PILOT SEVERING THEIR ARM. ACFT MOVED UNOCCUPIED ACROSS TAXIWAY AND SUBSEQUENTLY CRASHED.","ACCIDENT","	San Antonio FSDO","N97577","","","STINSON","S108","No","UNKNOWN","PERSONAL","STANDING (STD)","91","SERIOUS","No","0","0","1","0","0","0","0","0","0","0","0","0","0","0","0","0","0","0","0","0"
"No","09-JUL-25","08-JUL-25","23:00:00Z","LAMBERTVILLE","MICHIGAN","UNITED STATES","AIRCRAFT OVERSHOT RWY 27 AFTER LANDING AND COLLIDED WITH A TREE.","ACCIDENT","East Michigan FSDO","N1229V","","","CESSNA","COL4","No","SUBSTANTIAL","PERSONAL","LANDING (LDG)","91","NONE","No","1","0","0","0","0","0","0","0","0","0","0","0","0","0","0","0","0","0","0","0"
"No","09-JUL-25","08-JUL-25","19:00:00Z","NASHVILLE","TENNESSEE","UNITED STATES","CLEARED TO LAND AND ON LANDING ROLLOUT THE RIGHT BRAKE FAILED, THE AIRCRAFT ROLLED OFF OF THE END OF THE RUNWAY AND IS IN THE GRASS WEST OF THE RUNWAY BUT STILL IN THE RSA.","INCIDENT","Nashville FSDO","N54KJ","","","ECLIPSE AVIATION","EA500","No","UNKNOWN","UNKNOWN","LANDING (LDG)","","NONE","No","1","0","0","0","0","0","0","0","0","0","2","0","0","0","0","0","0","0","0","0"
"No","09-JUL-25","08-JUL-25","12:50:00Z","WHEELING","WEST VIRGINIA","UNITED STATES","ROLLED OFF THE END OF RUNWAY 03 APPROXIMATELY 25 YARDS OFF OF THE LEFT SIDE OF THE RUNWAY.  THE PILOT WAS UNABLE TO GET THE AIRCRAFT TO STOP DUE TO HYDROPLANING.","INCIDENT","Columbus FSDO","N124H","","","CESSNA","525","No","UNKNOWN","UNKNOWN","LANDING (LDG)","","NONE","No","1","0","0","0","0","0","0","0","0","0","2","0","0","0","0","0","0","0","0","0"
"No","09-JUL-25","08-JUL-25","17:50:00Z","WURTSBORO","NEW YORK","UNITED STATES","STRUCK A GOLF CART THAT ENTERED THE RUNWAY WHILE ATTEMPTING TO LAND.","INCIDENT","ALBANY FSDO","N307BG","","","BURKHART GROB","G-103A TWIN II ACRO","No","MINOR","UNKNOWN","LANDING (LDG)","91","MINOR","No","2","0","0","0","0","0","0","0","0","0","0","0","0","0","0","0","1","0","0","0"
"No","09-JUL-25","08-JUL-25","22:47:00Z","CHESTER","CALIFORNIA","UNITED STATES","WHILE CONDUCTING FIREFIGHTING ACTIVITIES, CROSSED THE RIDGE LINE AND STRUCK TREETOPS. AIRCRAFT LANDED AT ROGERS FIELD
AIRPORT (O05) WITHOUT INCIDENT.","INCIDENT","Reno FSDO","N896WP","","","AIR TRACTOR","AT802","No","UNKNOWN","FIREFIGHTING","MANEUVERING (MNV)","139","NONE","No","1","0","0","0","0","0","0","0","0","0","0","0","0","0","0","0","0","0","0","0"
"No","09-JUL-25","30-JUN-25","04:24:00Z","LOS ANGELES","CALIFORNIA","UNITED STATES","GEAR COLLAPSED ON LANDING","INCIDENT","Los Angeles FSDO","N3249C","","","BEECH","BE35","No","MINOR","PERSONAL","LANDING (LDG)","91","NONE","No","1","0","0","0","0","0","0","0","0","0","1","0","0","0","0","0","0","0","0","0"
"No","09-JUL-25","08-JUL-25","18:03:00Z","GAITHERSBURG","MARYLAND","UNITED STATES","SLID OFF THE END OF TAXIWAY A FOR UNKNOWN REASONS AND BECAME STUCK IN THE GRASS","INCIDENT","Baltimore FSDO","N5215E","","","CESSNA","172","No","UNKNOWN","PERSONAL","TAXI (TXI)","91","NONE","No","1","0","0","0","0","0","0","0","0","0","2","0","0","0","0","0","0","0","0","0"
"No","09-JUL-25","08-JUL-25","15:42:00Z","AURORA","ILLINOIS","UNITED STATES","LANDING GEAR COLLAPSED RESULTING IN A PROP STRIKE WHILE LANDING","INCIDENT","Greater Chicago FSDO","N6759J","","","BEECH","BE33","No","UNKNOWN","PERSONAL","LANDING (LDG)","91","NONE","No","1","0","0","0","0","0","0","0","0","0","0","0","0","0","0","0","0","0","0","0"
"No","10-JUL-25","09-JUL-25","21:02:00Z","HOMER","ALASKA","UNITED STATES","AIRCRAFT GROUND LOOPED WHILE LANDING, HOMER, AK.","ACCIDENT","ANCHORAGE FSDO","N2694D","","","CESSNA","170","No","SUBSTANTIAL","PERSONAL","LANDING (LDG)","91","NONE","No","1","0","0","0","0","0","0","0","0","0","0","0","0","0","0","0","0","0","0","0"
"No","10-JUL-25","09-JUL-25","23:30:00Z","CENTURY","FLORIDA","UNITED STATES","AIRCRAFT EXPERIENCED ENGINE ISSUES, MADE A FORCE LANDING IN A FIELD AND CAME TO REST INVERTED, CENTURY, FL.","INCIDENT","ALABAMA AND NW FLORIDA FSDO","N3254C","","","CESSNA","172","No","UNKNOWN","PERSONAL","EN ROUTE (ENR)","91","NONE","No","1","0","0","0","0","0","0","0","0","0","1","0","0","0","0","0","0","0","0","0"
"No","10-JUL-25","09-JUL-25","21:15:00Z","VAN NUYS","CALIFORNIA","UNITED STATES","AIRCRAFT LOST BRAKING CONTROL ON LANDING DAMAGING FUSELAGE AND LEFT WING, VAN NUYS, CA.","INCIDENT","VAN NUYS FSDO","N4746U","","","CESSNA","T206","No","MINOR","PERSONAL","LANDING (LDG)","91","NONE","No","1","0","0","0","0","0","0","0","0","0","2","0","0","0","0","0","0","0","0","0"
"No","10-JUL-25","09-JUL-25","18:25:00Z","CHARLOTTE","NORTH CAROLINA","UNITED STATES","AIRCRAFT BLEW A TIRE AND POST FLIGHT INSPECTION REVEALED DAMAGE TO UNDERSIDE AND LEFT FLAP COWLING, CHARLOTTE, NC.","INCIDENT","CHARLOTTE FSDO","N598NN","JIA5262","PSA AIRLINES","BOMBARDIER","CL-600-2D24","No","MINOR","COMMERCIAL","TAKEOFF (TOF)","121","NONE","No","0","0","0","0","0","0","0","0","0","0","0","0","0","0","0","0","0","0","0","0"
"No","10-JUL-25","09-JUL-25","18:10:00Z","BASTROP","LOUISIANA","UNITED STATES","AIRCRAFT EXPERIENCED ENGINE ISSUES AND MADE A FORCED LANDING ON A ROAD, BASTROP, LA.","INCIDENT","BATON ROUGE FSDO","N259SX","","","SONEX","SONEX","No","UNKNOWN","PERSONAL","EN ROUTE (ENR)","91","NONE","No","1","0","0","0","0","0","0","0","0","0","0","0","0","0","0","0","0","0","0","0"
"No","10-JUL-25","10-JUL-25","03:27:00Z","FORT LAUDERDALE","FLORIDA","UNITED STATES","AIRCRAFT LANDED GEAR UP, FORT LAUDERDALE, FL.","INCIDENT","SOUTH FLORIDA FSDO","N1293T","","","PIPER","PA34","No","UNKNOWN","PERSONAL","LANDING (LDG)","91","NONE","No","1","0","0","0","0","0","0","0","0","0","1","0","0","0","0","0","0","0","0","0"
"No","10-JUL-25","09-JUL-25","18:35:00Z","NEW BRAUNFELS","TEXAS","UNITED STATES","AIRCRAFT STRUCK A TAXIWAY LIGHT, NEW BRAUNFELS, TX.","INCIDENT","SAN ANTONIO FSDO","N29941","","","NORTH AMERICAN","AT-6D","No","UNKNOWN","PERSONAL","TAXI (TXI)","91","NONE","No","1","0","0","0","0","0","0","0","0","0","0","0","0","0","0","0","0","0","0","0"
"No","10-JUL-25","09-JUL-25","21:15:00Z","GREELEY","COLORADO","UNITED STATES","AIRCRAFT LEFT MAIN GEAR COLLAPSED ON LANDING, GREELEY, CO.","INCIDENT","DENVER FSDO","N81210","","","FAIRCHILD","24R-46","No","UNKNOWN","PERSONAL","LANDING (LDG)","91","NONE","No","1","0","0","0","0","0","0","0","0","0","2","0","0","0","0","0","0","0","0","0"
"No","10-JUL-25","09-JUL-25","22:20:00Z","FORT WORTH","TEXAS","UNITED STATES","AIRCRAFT TAXIING FOR DEPARTURE AND STRUCK A VEHICLE, FORT WORTH, TX.","INCIDENT","NORTH TEXAS FSDO","N81894","","","PIPER","PA28","No","UNKNOWN","PERSONAL","TAXI (TXI)","91","NONE","No","1","0","0","0","0","0","0","0","0","0","0","0","0","0","0","0","0","0","0","0"
"No","03-JUL-25","01-JUL-25","13:45:00Z","RIDGELY","MISSOURI","UNITED STATES","AIRCRAFT CRASHED UNDER UNKNOWN CIRCUMSTANCES, RIDGELY, MO.","INCIDENT","KANSAS CITY FSDO","N16726","","","BELL","206","No","UNKNOWN","AERIAL APPLICATION","UNKNOWN (UNK)","137","NONE","No","1","0","0","0","0","0","0","0","0","0","0","0","0","0","0","0","0","0","0","0"
"No","27-JUN-25","26-JUN-25","03:28:00Z","MEEKER","COLORADO","UNITED STATES","AIRCRAFT CRASHED UNDER UNKNOWN CIRCUMSTANCES, MEEKER, CO.","ACCIDENT","SALT LAKE CITY FSDO","N411WJ","","","MD HELICOPTERS","369","No","UNKNOWN","PERSONAL","EN ROUTE (ENR)","91","FATAL","Yes","0","0","0","1","0","0","0","0","0","0","0","0","0","0","0","0","0","0","0","0"
"No","27-JUN-25","26-JUN-25","13:30:00Z","NAHUNTA","GEORGIA","UNITED STATES","AIRCRAFT CAUGHT FIRE DURING START-UP AND FIRE DEPARTMENT EXTINGUISHED THE FIRE, NAHUNTA, GA.","ACCIDENT","ATLANTA FSDO","N4953N","","","CESSNA","182","No","SUBSTANTIAL","PERSONAL","STANDING (STD)","91","NONE","No","1","0","0","0","0","0","0","0","0","0","0","0","0","0","0","0","0","0","0","0"
"No","27-JUN-25","26-JUN-25","14:40:00Z","DAYTON","OHIO","UNITED STATES","AIRCRAFT LANDED LONG AND OVERRAN THE RUNWAY INTO THE GRASS, DAYTON, OH.","INCIDENT","CINCINNATI FSDO","N405BS","","","CESSNA","750","No","UNKNOWN","PERSONAL","LANDING (LDG)","91","NONE","No","1","0","0","0","0","0","0","0","0","0","3","0","0","0","0","0","0","0","0","0"
"No","27-JUN-25","26-JUN-25","14:00:00Z","MOUNT GILEAD","OHIO","UNITED STATES","AIRCRAFT VEERED OFF THE END OF RUNWAY FOR UNKNOWN REASONS, MOUNT GILEAD, OH.","INCIDENT","COLUMBUS FSDO","N3619J","","","CESSNA","T188","No","UNKNOWN","AERIAL APPLICATION","UNKNOWN (UNK)","137","MINOR","No","0","1","0","0","0","0","0","0","0","0","0","0","0","0","0","0","0","0","0","0"
"No","27-JUN-25","27-JUN-25","02:48:00Z","KERNVILLE","CALIFORNIA","UNITED STATES","AIRCRAFT DEPARTED AND SHORTLY AFTER, A  BEARING IN THE ROTOR BLEW OUT AND MADE A PRECAUTIONARY LANDING NEAR LAKE ISABELLA, KERNVILLE, CA.","INCIDENT","FRESNO FSDO","N755BF","","","ENSTROM","280FX","No","UNKNOWN","PERSONAL","TAKEOFF (TOF)","91","NONE","No","1","0","0","0","0","0","0","0","0","0","1","0","0","0","0","0","0","0","0","0"
"No","27-JUN-25","27-JUN-25","02:56:00Z","MOBILE","ALABAMA","UNITED STATES","AIRCRAFT ABORTED TAKEOFF DUE TO A CARGO DOOR OPENING, TAXIED TO THE RAMP AND POST FLIGHT INSPECTION REVEALED DAMAGE TO THE CARGO DOOR, MOBILE, AL.","INCIDENT","ALABAMA AND NW FLORIDA FSDO","N208LS","","","CESSNA","208","No","UNKNOWN","PERSONAL","TAKEOFF (TOF)","91","NONE","No","1","0","0","0","0","0","0","0","0","0","0","0","0","0","0","0","0","0","0","0"
"No","30-JUN-25","25-JUN-25","02:00:00Z","KANTISHNA","ALASKA","UNITED STATES","AIRCRAFT GEAR COLLAPSED AFTER HITTING A DIP, KANTISHNA, AK.","INCIDENT","ANCHORAGE FSDO","N2655D","","","CESSNA","170","No","UNKNOWN","PERSONAL","LANDING (LDG)","91","NONE","No","1","0","0","0","0","0","0","0","0","0","0","0","0","0","0","0","0","0","0","0"
"No","30-JUN-25","26-JUN-25","17:19:00Z","SWEETWATER","TEXAS","UNITED STATES","AIRCRAFT LANDED AND VEERED OFF RUNWAY DUE TO WINDS DAMAGING THE LEFT WING, TAIL AND LANDING GEAR, SWEETWATER, TX.","INCIDENT","LUBBOCK FSDO","N2300A","","","PIPER","PA22","No","UNKNOWN","PERSONAL","LANDING (LDG)","91","NONE","No","1","0","0","0","0","0","0","0","0","0","1","0","0","0","0","0","0","0","0","0"
"No","11-JUL-25","10-JUL-25","14:38:00Z","ST SIMONS ISLAND","GEORGIA","UNITED STATES","AIRCRAFT STRUCK A BIRD LAST WEEK DAMAGING THE LEADING EDGE, TEMPORARY PATCH WAS FABRICATED FOR FERRY FLIGHT AND TEMPORARY PATCH DETACHED FROM WING ON TAKEOFF, ST SIMONS ISLAND, GA.","INCIDENT","ATLANTA FSDO","N67","","","BEECH","300","No","MINOR","FERRY","TAKEOFF (TOF)","91","NONE","No","0","0","0","0","0","0","0","0","0","0","0","0","0","0","0","0","0","0","0","0"
"No","11-JUL-25","10-JUL-25","11:49:00Z","GULF SHORES","ALABAMA","UNITED STATES","AIRCRAFT VEERED OFF RUNWAY WHILE TAXIING AND NOSE GEAR COLLAPSED, GULF SHORES, AL.","INCIDENT","ALABAMA AND NW FLORIDA FSDO","N159MK","","","AIRCRAFT SPRUCE & SPECIALTY","STARDUSTER TOO","No","UNKNOWN","PERSONAL","TAXI (TXI)","91","NONE","No","1","0","0","0","0","0","0","0","0","0","0","0","0","0","0","0","0","0","0","0"
"No","11-JUL-25","10-JUL-25","14:30:00Z","PONCA CITY","OKLAHOMA","UNITED STATES","AIRCRAFT VEERED OFF RUNWAY ON DEPARTURE INCURRING A PROP STRIKE, PONCA CITY, OK.","INCIDENT","WILL ROGERS FSDO","N318EM","","","CIRRUS","SR22T","No","UNKNOWN","PERSONAL","TAKEOFF (TOF)","91","NONE","No","1","0","0","0","0","0","0","0","0","0","0","0","0","0","0","0","0","0","0","0"
"No","11-JUL-25","10-JUL-25","17:52:00Z","KENOSHA","WISCONSIN","UNITED STATES","AIRCRAFT MADE AN EMERGENCY LANDING IN A PARKING LOT DUE TO ENGINE ISSUES, KENOSHA, WI.","INCIDENT","MILWAUKEE FSDO","N369RD","","","ROTORSPORT","CALIDUS","No","UNKNOWN","PERSONAL","EN ROUTE (ENR)","91","NONE","No","1","0","0","0","0","0","0","0","0","0","1","0","0","0","0","0","0","0","0","0"
"No","11-JUL-25","10-JUL-25","16:17:00Z","HOUSTON","TEXAS","UNITED STATES","AIRCRAFT LANDED HARD AND NOSE GEAR COLLAPSED INCURRING A PROP STRIKE, HOUSTON, TX.","INCIDENT","HOUSTON FSDO","N696JE","","","VANS","RV7","No","UNKNOWN","PERSONAL","LANDING (LDG)","91","NONE","No","1","0","0","0","0","0","0","0","0","0","0","0","0","0","0","0","0","0","0","0"
"No","11-JUL-25","10-JUL-25","02:00:00Z","JEFFERSON CITY","MISSOURI","UNITED STATES","AIRCRAFT LOST ALTITUDE DURING DEPARTURE AND SLID OFF THE END OF THE RUNWAY, JEFFERSON CITY, MO.","INCIDENT","KANSAS CITY FSDO","N43060","","","PIPER","PA28","No","UNKNOWN","INSTRUCTION","TAKEOFF (TOF)","91","NONE","No","1","0","0","0","0","0","0","0","0","0","0","0","0","0","0","0","0","0","0","0"
"No","27-JUN-25","26-JUN-25","16:30:00Z","TEMPLE","TEXAS","UNITED STATES","AIRCRAFT EXPERIENCED ENGINE ISSUES AND CRASHED INTO TREES, TEMPLE, TX.","INCIDENT","SAN ANTONIO FSDO","N258CM","","","COSTRUZIONI AERONAUTICHE TECNA","P2010","No","UNKNOWN","INSTRUCTION","APPROACH (APR)","91","NONE","No","1","0","0","0","0","0","0","0","0","0","1","0","0","0","0","0","0","0","0","0"
"No","30-JUN-25","28-JUN-25","20:00:00Z","LATOUCHE ISLAND","ALASKA","UNITED STATES","AIRCRAFT ENCOUNTERED GUSTY WINDS AND HAD A MISHAP, LATOUCHE ISLAND, AK.","INCIDENT","ANCHORAGE FSDO","N55PT","","","PIPER","PA18","No","UNKNOWN","PERSONAL","EN ROUTE (ENR)","91","NONE","No","1","0","0","0","0","0","0","0","0","0","0","0","0","0","0","0","0","0","0","0"
"No","30-JUN-25","29-JUN-25","13:15:00Z","PELZER","SOUTH CAROLINA","UNITED STATES","AIRCRAFT LANDED HARD AND FLIPPED OVER, PELZER, SC.","INCIDENT","COLUMBIA FSDO","N150TP","","","CESSNA","150","No","UNKNOWN","PERSONAL","LANDING (LDG)","91","NONE","No","1","0","0","0","0","0","0","0","0","0","0","0","0","0","0","0","0","0","0","0"
"No","30-JUN-25","27-JUN-25","17:40:00Z","FORT LAUDERDALE","FLORIDA","UNITED STATES","AIRCRAFT EXPERIENCED ENGINE ISSUES,  MADE A FORCED LANDING AND SKIDDED OFF THE SIDE OF THE RUNWAY, FORT LAUDERDALE, FL.","INCIDENT","SOUTH FLORIDA FSDO","N368FS","","","MAULE","M7","No","NONE","PERSONAL","LANDING (LDG)","91","NONE","No","1","0","0","0","0","0","0","0","0","0","1","0","0","0","0","0","0","0","0","0"
"No","30-JUN-25","27-JUN-25","19:35:00Z","STATESBORO","GEORGIA","UNITED STATES","AIRCRAFT LANDED GEAR UP, STATESBORO, GA.","INCIDENT","ATLANTA FSDO","N404DP","","","BEECH","200","No","UNKNOWN","ON DEMAND","LANDING (LDG)","135","NONE","No","1","0","0","0","0","0","0","0","0","0","3","0","0","0","0","0","0","0","0","0"
"No","07-JUL-25","03-JUL-25","14:15:00Z","DELAND","FLORIDA","UNITED STATES","AIRCRAFT DEPARTED AND CRASHED IN A FIELD FOR UNKNOWN REASONS, DELAND, FL.","ACCIDENT","ORLANDO FSDO","N508K","","","EXPERIMENTAL","AVENTURA II","No","UNKNOWN","PERSONAL","TAKEOFF (TOF)","91","SERIOUS","No","0","0","1","0","0","0","0","0","0","0","0","0","0","0","0","0","0","0","0","0"
