"UPDATED","ENTRY_DATE","EVENT_LCL_DATE","EVENT_LCL_TIME","LOC_CITY_NAME","LOC_STATE_NAME","LOC_CNTRY_NAME","RMK_TEXT","EVENT_TYPE_DESC","FSDO_DESC","REGIST_NBR","FLT_NBR","ACFT_OPRTR","ACFT_MAKE_NAME","ACFT_MODEL_NAME","ACFT_MISSING_FLAG","ACFT_DMG_DESC","FLT_ACTIVITY","FLT_PHASE","FAR_PART","MAX_INJ_LVL","FATAL_FLAG","FLT_CRW_INJ_NONE","FLT_CRW_INJ_MINOR","FLT_CRW_INJ_SERIOUS","FLT_CRW_INJ_FATAL","FLT_CRW_INJ_UNK","CBN_CRW_INJ_NONE","CBN_CRW_INJ_MINOR","CBN_CRW_INJ_SERIOUS","CBN_CRW_INJ_FATAL","CBN_CRW_INJ_UNK","PAX_INJ_NONE","PAX_INJ_MINOR","PAX_INJ_SERIOUS","PAX_INJ_FATAL","PAX_INJ_UNK","GRND_INJ_NONE","GRND_INJ_MINOR","GRND_INJ_SERIOUS","GRND_INJ_FATAL","GRND_INJ_UNK"
"No","11-FEB-22","06-FEB-22","00:00:00Z","TALKEETNA","ALASKA","UNITED STATES","AIRCRAFT WAS FOUND INVERTED ON SNOW COVERED GROUND. ALASKA STATE TROOPERS MADE CONTACT WITH OWNER WHO EXPLAINED HE CRASHED UNDER UNKNOWN CIRCUMSTANCES ON JANUARY 5TH, 2022.","INCIDENT","ANCHORAGE FSDO","N96552","","","TAYLORCRAFT","BC-12D","No","UNKNOWN","UNKNOWN","UNKNOWN (UNK)","","UNKNOWN","No","0","0","0","0","1","0","0","0","0","0","0","0","0","0","0","0","0","0","0","0"
"No","17-FEB-22","16-FEB-22","11:20:00Z","COALINGA","CALIFORNIA","UNITED STATES","AIRCRAFT CRASHED UNDER UNKNOWN CIRCUMSTANCES IN A FIELD, COALINGA, CA.","ACCIDENT","FRESNO FSDO","N72297","","","BELL","UH1","No","UNKNOWN","AERIAL APPLICATION","MANEUVERING (MNV)","137","FATAL","Yes","0","0","0","1","0","0","0","0","0","0","0","0","0","0","0","0","0","0","0","0"
"No","17-FEB-22","16-FEB-22","22:35:00Z","LEXINGTON","NORTH CAROLINA","UNITED STATES","AIRCRAFT CRASHED UNDER UNKNOWN CIRCUMSTANCES ON INTERSTATE 85 STRIKING A TRACTOR TRAILER, LEXINGTON, NC.","ACCIDENT","GREENSBORO FSDO","N58LF","","","BEECH","58","No","DESTROYED","PERSONAL","EN ROUTE (ENR)","91","FATAL","Yes","0","0","0","1","0","0","0","0","0","0","0","0","0","0","0","0","2","0","0","0"
"No","17-FEB-22","16-FEB-22","19:55:00Z","WASHINGTON","NORTH CAROLINA","UNITED STATES","AIRCRAFT EXPERIENCED ENGINE ISSUES, LANDED IN A FIELD AND SKIDDED INTO A DITCH, WASHINGTON, NC.","INCIDENT","GREENSBORO FSDO","N114BR","","","PIPER","PA32R","No","UNKNOWN","PERSONAL","EN ROUTE (ENR)","91","NONE","No","1","0","0","0","0","0","0","0","0","0","2","0","0","0","0","0","0","0","0","0"
"No","17-FEB-22","16-FEB-22","19:34:00Z","LANCASTER","SOUTH CAROLINA","UNITED STATES","AIRCRAFT GEAR COLLAPSED ON LANDING, LANCASTER, SC.","INCIDENT","COLUMBIA FSDO","N62EM","","","BEECH","V35","No","MINOR","PERSONAL","LANDING (LDG)","91","NONE","No","1","0","0","0","0","0","0","0","0","0","0","0","0","0","0","0","0","0","0","0"
"No","17-FEB-22","12-FEB-22","20:00:00Z","MOORPARK","CALIFORNIA","UNITED STATES","AIRCRAFT EXPERIENCED ENGINE ISSUES AND LANDED ON A GOLF COURSE, MOORPARK, CA.","INCIDENT","VAN NUYS FSDO","N73S","","","LANCAIR","320","No","MINOR","PERSONAL","EN ROUTE (ENR)","91","NONE","No","1","0","0","0","0","0","0","0","0","0","0","0","0","0","0","0","0","0","0","0"
"No","17-FEB-22","16-FEB-22","16:18:00Z","PAHOKEE","FLORIDA","UNITED STATES","AIRCRAFT LANDED AND FLIPPED OVER, PAHOKEE, FL.","INCIDENT","SOUTH FLORIDA FSDO","N6493M","","","STINSON","108","No","UNKNOWN","PERSONAL","LANDING (LDG)","91","NONE","No","1","0","0","0","0","0","0","0","0","0","1","0","0","0","0","0","0","0","0","0"
"No","17-FEB-22","16-FEB-22","02:55:00Z","LEXINGTON","KENTUCKY","UNITED STATES","AIRCRAFT LANDED HARD AND INCURRED A PROP STRIKE, LEXINGTON, KY.","INCIDENT","LOUISVILLE FSDO","N9258C","","","PIPER","PA28","No","UNKNOWN","PERSONAL","LANDING (LDG)","91","NONE","No","1","0","0","0","0","0","0","0","0","0","1","0","0","0","0","0","0","0","0","0"
"No","17-FEB-22","16-FEB-22","01:50:00Z","JOLON","CALIFORNIA","UNITED STATES","AIRCRAFT CRASHED DURING TEST FLIGHT, JOLON, CA.","INCIDENT","SAN JOSE FSDO","N542AJ","","","JOBY AERO","JAS4-2","No","UNKNOWN","OTHER","UNKNOWN (UNK)","","NONE","No","0","0","0","0","0","0","0","0","0","0","0","0","0","0","0","0","0","0","0","0"
"No","16-FEB-22","15-FEB-22","18:20:00Z","NEW YORK","NEW YORK","UNITED STATES","AIRCRAFT ABORTED TAKEOFF AFTER TWO BLOWN TIRES AND LEFT WING AND FUSELAGE WERE DAMAGED, NEW YORK, NY.","INCIDENT","NEW YORK FSDO","N344PP","AAL2829","AMERICAN AIRLINES","BOEING","737","No","UNKNOWN","COMMERCIAL","TAKEOFF (TOF)","121","NONE","No","2","0","0","0","0","0","0","0","0","0","146","0","0","0","0","0","0","0","0","0"
"No","16-FEB-22","09-FEB-22","22:24:00Z","BUCKEYE","ARIZONA","UNITED STATES","AIRCRAFT LANDED HARD, BUCKEYE, AZ.","INCIDENT","SCOTTSDALE FSDO","N405TB","","","GROB","G 120TP","No","UNKNOWN","INSTRUCTION","LANDING (LDG)","91","NONE","No","1","0","0","0","0","0","0","0","0","0","0","0","0","0","0","0","0","0","0","0"
"No","16-FEB-22","15-FEB-22","14:00:00Z","ISLA DE CULEBRA","PUERTO RICO","PUERTO RICO","AIRCRAFT LOST CONTROL ON LANDING AND VEERED OFF THE RUNWAY INTO THE GRASS, ISLA DE CULEBRA, PR.","INCIDENT","SAN JUAN FSDO","N821RR","","","BRITTEN NORMAN","BN-2A","No","UNKNOWN","PERSONAL","LANDING (LDG)","91","NONE","No","1","0","0","0","0","0","0","0","0","0","2","0","0","0","0","0","0","0","0","0"
"No","16-FEB-22","10-FEB-22","19:30:00Z","HONESDALE","PENNSYLVANIA","UNITED STATES","AIRCRAFT LANDED LONG AND RAN OFF THE END OF THE RUNWAY, HONESDALE, PA.","ACCIDENT","ALLENTOWN FSDO","N5276C","","","CESSNA","T210","No","SUBSTANTIAL","PERSONAL","LANDING (LDG)","91","MINOR","No","0","1","0","0","0","0","0","0","0","0","0","0","0","0","0","0","0","0","0","0"
"No","16-FEB-22","15-FEB-22","20:12:00Z","WINCHESTER","VIRGINIA","UNITED STATES","AIRCRAFT INCURRED A PROP STRIKE DURING A PRACTICE REJECTED TAKEOFF, WINCHESTER, VA.","ACCIDENT","WASHINGTON FSDO","N62DV","","","DIAMOND","DA62","No","SUBSTANTIAL","PERSONAL","TAKEOFF (TOF)","91","NONE","No","1","0","0","0","0","0","0","0","0","0","1","0","0","0","0","0","0","0","0","0"
"No","16-FEB-22","15-FEB-22","17:18:00Z","NEWPORT NEWS","VIRGINIA","UNITED STATES","AIRCRAFT LANDED AND VEERED OFF THE RUNWAY STRIKING A TAXIWAY LIGHT, NEWPORT NEWS, VA.","INCIDENT","RICHMOND FSDO","N52438","","","CESSNA","172","No","UNKNOWN","INSTRUCTION","LANDING (LDG)","91","NONE","No","1","0","0","0","0","0","0","0","0","0","1","0","0","0","0","0","0","0","0","0"
"No","16-FEB-22","15-FEB-22","19:30:00Z","FARMINGDALE","NEW YORK","UNITED STATES","AIRCRAFT LANDED AND VEERED OFF RUNWAY INTO THE GRASS DAMAGING A RUNWAY LIGHT, FARMINGDALE, NY.","INCIDENT","FARMINGDALE FSDO","N64949","","","CESSNA","172","No","UNKNOWN","INSTRUCTION","LANDING (LDG)","91","NONE","No","1","0","0","0","0","0","0","0","0","0","1","0","0","0","0","0","0","0","0","0"
"No","16-FEB-22","15-FEB-22","15:05:00Z","DE KALB","ILLINOIS","UNITED STATES","AIRCRAFT FLOAT GEAR COLLAPSED ON LANDING, DE KALB, IL.","INCIDENT","GREATER CHICAGO FSDO","N66003","","","CESSNA","R172","No","MINOR","PERSONAL","LANDING (LDG)","91","NONE","No","1","0","0","0","0","0","0","0","0","0","1","0","0","0","0","0","0","0","0","0"
