"UPDATED","ENTRY_DATE","EVENT_LCL_DATE","EVENT_LCL_TIME","LOC_CITY_NAME","LOC_STATE_NAME","LOC_CNTRY_NAME","RMK_TEXT","EVENT_TYPE_DESC","FSDO_DESC","REGIST_NBR","FLT_NBR","ACFT_OPRTR","ACFT_MAKE_NAME","ACFT_MODEL_NAME","ACFT_MISSING_FLAG","ACFT_DMG_DESC","FLT_ACTIVITY","FLT_PHASE","FAR_PART","MAX_INJ_LVL","FATAL_FLAG","FLT_CRW_INJ_NONE","FLT_CRW_INJ_MINOR","FLT_CRW_INJ_SERIOUS","FLT_CRW_INJ_FATAL","FLT_CRW_INJ_UNK","CBN_CRW_INJ_NONE","CBN_CRW_INJ_MINOR","CBN_CRW_INJ_SERIOUS","CBN_CRW_INJ_FATAL","CBN_CRW_INJ_UNK","PAX_INJ_NONE","PAX_INJ_MINOR","PAX_INJ_SERIOUS","PAX_INJ_FATAL","PAX_INJ_UNK","GRND_INJ_NONE","GRND_INJ_MINOR","GRND_INJ_SERIOUS","GRND_INJ_FATAL","GRND_INJ_UNK"
"No","26-FEB-24","23-FEB-24","21:01:00Z","SOUTH BEND","INDIANA","UNITED STATES","AIRCRAFT RAN OFF THE RUNWAY INTO SAFETY AREA ON LANDING INCURRING A PROP STRIKE, SOUTH BEND, IN.","INCIDENT","GREATER CHICAGO FSDO","N515DS","","","CESSNA","T206","No","UNKNOWN","UNKNOWN","LANDING (LDG)","91","NONE","No","1","0","0","0","0","0","0","0","0","0","1","0","0","0","0","0","0","0","0","0"
"No","26-FEB-24","24-FEB-24","00:28:00Z","BURNS","OREGON","UNITED STATES","AIRCRAFT EXPERIENCED ENGINE ISSUES AND LANDED ON A ROAD, BURNS, OR.","INCIDENT","BOISE FSDO","N750YB","","","ZENITH","STOL CH750","No","UNKNOWN","PERSONAL","EN ROUTE (ENR)","91","NONE","No","1","0","0","0","0","0","0","0","0","0","0","0","0","0","0","0","0","0","0","0"
"No","26-FEB-24","23-FEB-24","23:10:00Z","FOND DU LAC","WISCONSIN","UNITED STATES","AIRCRAFT ATTEMPTED TO LAND, BUT DUE TO DEER ON THE RUNWAY TRIED TO LAND ON TAXIWAY AND HIT A CULVERT, FOND DU LAC, WI.","ACCIDENT","MILWAUKEE FSDO","N969WT","","","MOONEY","M20T","No","SUBSTANTIAL","PERSONAL","LANDING (LDG)","91","NONE","No","1","0","0","0","0","0","0","0","0","0","1","0","0","0","0","0","0","0","0","0"
"No","26-FEB-24","24-FEB-24","20:45:00Z","HALF MOON BAY","CALIFORNIA","UNITED STATES","AIRCRAFT EXPERIENCED ENGINE ISSUES AND MADE A PRECAUTIONARY LANDING IN A PARKING LOT, HALF MOON BAY, CA.","INCIDENT","SAN JOSE FSDO","N997VA","","","ROBINSON","R44","No","NONE","UNKNOWN","EN ROUTE (ENR)","91","NONE","No","1","0","0","0","0","0","0","0","0","0","1","0","0","0","0","0","0","0","0","0"
"No","26-FEB-24","23-FEB-24","15:40:00Z","TRUTH OR CONSEQUENCES","NEW MEXICO","UNITED STATES","AIRCRAFT LANDED AND FLIPPED OVER AFTER VEERING OFF RUNWAY, TRUTH OR CONSEQUENCES, NM.","INCIDENT","ALBUQUERQUE FSDO","N2669K","","","LUSCOMBE","8E","No","UNKNOWN","PERSONAL","LANDING (LDG)","91","NONE","No","1","0","0","0","0","0","0","0","0","0","0","0","0","0","0","0","0","0","0","0"
"No","26-FEB-24","23-FEB-24","21:48:00Z","TULSA","OKLAHOMA","UNITED STATES","AIRCRAFT LANDED AND VEERED OFF RUNWAY DAMAGING NOSE GEAR AND PROP, TULSA, OK.","INCIDENT","WILL ROGERS FSDO","N3645W","","","PIPER","PA32","No","UNKNOWN","PERSONAL","LANDING (LDG)","91","NONE","No","1","0","0","0","0","0","0","0","0","0","1","0","0","0","0","0","0","0","0","0"
"No","26-FEB-24","24-FEB-24","05:08:00Z","ATLANTIC CITY","NEW JERSEY","UNITED STATES","AIRCRAFT LANDED AND VEERED OFF RUNWAY INTO THE GRASS DAMAGING LEFT WING, ATLANTIC CITY, NJ.","INCIDENT","PHILADELPHIA FSDO","N8356X","","","PIPER","PA34","No","UNKNOWN","PERSONAL","LANDING (LDG)","91","UNKNOWN","No","0","0","0","0","1","0","0","0","0","0","0","0","0","0","0","0","0","0","0","0"
"No","26-FEB-24","24-FEB-24","21:50:00Z","MESQUITE","TEXAS","UNITED STATES","AIRCRAFT STRUCK A BIRD DAMAGING FRONT LANDING GEAR, MESQUITE, TX.","INCIDENT","NORTH TEXAS FSDO","N13982","","","PIPER","PA23","No","UNKNOWN","PERSONAL","APPROACH (APR)","91","NONE","No","1","0","0","0","0","0","0","0","0","0","0","0","0","0","0","0","0","0","0","0"
"No","26-FEB-24","26-FEB-24","02:06:00Z","BARSTOW","CALIFORNIA","UNITED STATES","AIRCRAFT EXPERIENCED ENGINE ISSUES AND MADE AN EMERGENCY LANDING IN A DRY LAKE BED, BARSTOW, CA.","INCIDENT","RIVERSIDE FSDO","N22741","","","CESSNA","150","No","UNKNOWN","PERSONAL","EN ROUTE (ENR)","91","NONE","No","1","0","0","0","0","0","0","0","0","0","0","0","0","0","0","0","0","0","0","0"
"No","26-FEB-24","24-FEB-24","18:52:00Z","ATLANTA","GEORGIA","UNITED STATES","AIRCRAFT LANDED AND VEERED OFF RUNWAY INTO THE GRASS AND HIT AN AIRPORT MARKING SIGN, ATLANTA, GA.","INCIDENT","ATLANTA FSDO","N30169","","","WACO","UPF-7","No","UNKNOWN","PERSONAL","LANDING (LDG)","91","NONE","No","1","0","0","0","0","0","0","0","0","0","0","0","0","0","0","0","0","0","0","0"
"No","26-FEB-24","25-FEB-24","22:35:00Z","MOULTONBOROUGH","NEW HAMPSHIRE","UNITED STATES","AIRCRAFT ON LANDING AND CRASHED INTO THE WOODS, MOULTONBOROUGH, NH.","INCIDENT","PORTLAND ME FSDO","N43892","","","TAYLORCRAFT","BC12-D","No","UNKNOWN","PERSONAL","LANDING (LDG)","91","NONE","No","1","0","0","0","0","0","0","0","0","0","1","0","0","0","0","0","0","0","0","0"
"No","27-FEB-24","26-FEB-24","21:42:00Z","CLARION","IOWA","UNITED STATES","AIRCRAFT LANDED IN GUSTY CONDITIONS, VEERED OFF RUNWAY AND FLIPPED OVER, CLARION, IA.","ACCIDENT","DES MOINES FSDO","N35719","","","CESSNA","172","No","SUBSTANTIAL","PERSONAL","LANDING (LDG)","91","MINOR","No","0","1","0","0","0","0","0","0","0","0","0","0","0","0","0","0","0","0","0","0"
"No","27-FEB-24","26-FEB-24","12:59:00Z","ST PETERSBURG","FLORIDA","UNITED STATES","AIRCRAFT DEPARTED, DELCARED AN EMERGENCY DUE TO A BLOWN TIRE AND RETURNED TO LAND AND STRUCK A RUNWAY LIGHT, ST PETERSBURG, FL.","INCIDENT","TAMPA FSDO","N989AW","","","LEARJET","55","No","UNKNOWN","UNKNOWN","TAKEOFF (TOF)","91","NONE","No","2","0","0","0","0","0","0","0","0","0","2","0","0","0","0","0","0","0","0","0"
"No","27-FEB-24","26-FEB-24","19:40:00Z","CASPER","WYOMING","UNITED STATES","AIRCRAFT COMPLETED PIPELINE FLIGHT, LANDED IN WINDY CONDITIONS AND FLIPPED OVER, CASPER, WY.","ACCIDENT","DENVER FSDO","N739UE","","","CESSNA","172","No","SUBSTANTIAL","OTHER","LANDING (LDG)","91","NONE","No","1","0","0","0","0","0","0","0","0","0","0","0","0","0","0","0","0","0","0","0"
