"UPDATED","ENTRY_DATE","EVENT_LCL_DATE","EVENT_LCL_TIME","LOC_CITY_NAME","LOC_STATE_NAME","LOC_CNTRY_NAME","RMK_TEXT","EVENT_TYPE_DESC","FSDO_DESC","REGIST_NBR","FLT_NBR","ACFT_OPRTR","ACFT_MAKE_NAME","ACFT_MODEL_NAME","ACFT_MISSING_FLAG","ACFT_DMG_DESC","FLT_ACTIVITY","FLT_PHASE","FAR_PART","MAX_INJ_LVL","FATAL_FLAG","FLT_CRW_INJ_NONE","FLT_CRW_INJ_MINOR","FLT_CRW_INJ_SERIOUS","FLT_CRW_INJ_FATAL","FLT_CRW_INJ_UNK","CBN_CRW_INJ_NONE","CBN_CRW_INJ_MINOR","CBN_CRW_INJ_SERIOUS","CBN_CRW_INJ_FATAL","CBN_CRW_INJ_UNK","PAX_INJ_NONE","PAX_INJ_MINOR","PAX_INJ_SERIOUS","PAX_INJ_FATAL","PAX_INJ_UNK","GRND_INJ_NONE","GRND_INJ_MINOR","GRND_INJ_SERIOUS","GRND_INJ_FATAL","GRND_INJ_UNK"
"No","23-OCT-23","22-OCT-23","13:30:00Z","KNOXVILLE","TENNESSEE","UNITED STATES","AIRCRAFT EXPERIENCED ENGINE ISSUES SHORTLY AFTER TAKEOFF, ATTEMPTED TO MAKE AN EMERGENCY LANDING ON THE SHORE OF THE TENNESSEE RIVER, BOUNCED AND WENT INTO THE RIVER, KNOXVILLE, TN.","INCIDENT","NASHVILLE FSDO","N246ML","","","EXPERIMENTAL","AVID FLYER","No","UNKNOWN","PERSONAL","TAKEOFF (TOF)","91","NONE","No","1","0","0","0","0","0","0","0","0","0","0","0","0","0","0","0","0","0","0","0"
"No","23-OCT-23","20-OCT-23","21:29:00Z","JACKSON","TENNESSEE","UNITED STATES","AIRCRAFT VEERED OFF THE RUNWAY AND LANDING GEAR COLLAPSED, JACKSON, TN.","INCIDENT","MEMPHIS FSDO","N9101J","","","PIPER","PA28","No","UNKNOWN","PERSONAL","LANDING (LDG)","91","NONE","No","1","0","0","0","0","0","0","0","0","0","2","0","0","0","0","0","0","0","0","0"
"No","23-OCT-23","21-OCT-23","13:40:00Z","MANHATTAN","KANSAS","UNITED STATES","AIRCRAFT CRASHED INTO A DITCH DUE TO FUEL EXHAUSTION, MANHATTAN, KS.","ACCIDENT","WICHITA FSDO","N52631","","","POWRACHUTE","PEGASUS","No","SUBSTANTIAL","PERSONAL","EN ROUTE (ENR)","91","MINOR","No","0","1","0","0","0","0","0","0","0","0","0","1","0","0","0","0","0","0","0","0"
"No","23-OCT-23","21-OCT-23","01:01:00Z","COVELO","CALIFORNIA","UNITED STATES","AIRCRAFT CRASHED IN A FIELD AFTER TAKEOFF AND POST CRASH FIRE, COVELO, CA.","ACCIDENT","OAKLAND FSDO","N8248K","","","BEECH","A36","No","SUBSTANTIAL","PERSONAL","INITIAL CLIMB (ICL)","91","FATAL","Yes","0","0","0","1","0","0","0","0","0","0","0","0","0","1","0","0","0","0","0","0"
"No","23-OCT-23","20-OCT-23","23:19:00Z","ST PAUL","MINNESOTA","UNITED STATES","AIRCRAFT LANDED GEAR UP, ST PAUL, MN.","INCIDENT","MINNEAPOLIS FSDO","N102FA","","","BEECH","95-A55","No","UNKNOWN","INSTRUCTION","LANDING (LDG)","91","NONE","No","1","0","0","0","0","0","0","0","0","0","1","0","0","0","0","0","0","0","0","0"
"No","23-OCT-23","12-OCT-23","16:00:00Z","RICHMOND","VIRGINIA","UNITED STATES","AIRCRAFT LANDED HARD DAMAGING LANDING GEAR AND WING SPAR, RICHMOND, VA.","INCIDENT","RICHMOND FSDO","N143TU","","","COSTRUZIONI AERONAUTICHE TECNA","P2010","No","UNKNOWN","PERSONAL","LANDING (LDG)","91","UNKNOWN","No","0","0","0","0","1","0","0","0","0","0","0","0","0","0","0","0","0","0","0","0"
"No","23-OCT-23","20-OCT-23","15:51:00Z","STUART","FLORIDA","UNITED STATES","AIRCRAFT NOSE GEAR COLLAPSED ON LANDING, STUART, FL.","INCIDENT","SOUTH FLORIDA FSDO","N210FM","","","CESSNA","P210","No","MINOR","PERSONAL","LANDING (LDG)","91","NONE","No","1","0","0","0","0","0","0","0","0","0","0","0","0","0","0","0","0","0","0","0"
"No","23-OCT-23","22-OCT-23","20:40:00Z","COALINGA","CALIFORNIA","UNITED STATES","AIRCRAFT GEAR COLLAPSED ON LANDING, COALINGA, CA.","INCIDENT","FRESNO FSDO","N211WT","","","CESSNA","177RG","No","UNKNOWN","PERSONAL","LANDING (LDG)","91","NONE","No","1","0","0","0","0","0","0","0","0","0","1","0","0","0","0","0","0","0","0","0"
"No","23-OCT-23","21-OCT-23","23:38:00Z","CONCORD","NORTH CAROLINA","UNITED STATES","AIRCRAFT LANDED AND WHILE TAXIING STRUCK AN AIRPORT SIGN, CONCORD, NC.","INCIDENT","CHARLOTTE FSDO","N228KH","","","PIPER","PA28","No","UNKNOWN","PERSONAL","TAXI (TXI)","91","NONE","No","1","0","0","0","0","0","0","0","0","0","1","0","0","0","0","0","0","0","0","0"
"No","23-OCT-23","20-OCT-23","16:43:00Z","DESTIN","FLORIDA","UNITED STATES","AIRCRAFT STRUCK A RUNWAY LIGHT WHILE TAXIING, DESTIN, FL.","INCIDENT","ALABAMA AND NW FLORIDA FSDO","N322DP","","","CESSNA","525","No","MINOR","UNKNOWN","TAXI (TXI)","","NONE","No","0","0","0","0","0","0","0","0","0","0","0","0","0","0","0","0","0","0","0","0"
"No","23-OCT-23","21-OCT-23","20:27:00Z","SMYRNA","TENNESSEE","UNITED STATES","AIRCRAFT INCURRED A PROP STRIKE ON LANDING, SMYRNA, TN.","INCIDENT","NASHVILLE FSDO","N387SP","","","CESSNA","172","No","UNKNOWN","PERSONAL","LANDING (LDG)","91","NONE","No","1","0","0","0","0","0","0","0","0","0","0","0","0","0","0","0","0","0","0","0"
"No","23-OCT-23","20-OCT-23","17:30:00Z","ALTAMONT","UTAH","UNITED STATES","AIRCRAFT ON LANDING AND HIT A RUT AND THE LEFT MAIN GEAR COLLAPSED, ALTAMONT, UT.","INCIDENT","SALT LAKE CITY FSDO","N428JT","","","CUBCRAFTERS","CCK-1865","No","UNKNOWN","PERSONAL","LANDING (LDG)","91","NONE","No","1","0","0","0","0","0","0","0","0","0","1","0","0","0","0","0","0","0","0","0"
"No","23-OCT-23","21-OCT-23","17:50:00Z","CHARLESTON, SC","SOUTH CAROLINA","UNITED STATES","AIRCRAFT INCURRED A PROP STRIKE ON LANDING, CHARLESTON, SC.","INCIDENT","COLUMBIA FSDO","N658GF","","","DIAMOND","DA40","No","UNKNOWN","INSTRUCTION","LANDING (LDG)","91","NONE","No","1","0","0","0","0","0","0","0","0","0","1","0","0","0","0","0","0","0","0","0"
"No","23-OCT-23","21-OCT-23","22:20:00Z","SALT LAKE CITY","UTAH","UNITED STATES","AIRCRAFT MADE AN OFF AIRPORT LANDING DUE TO ENGINE ISSUES, SALT LAKE CITY, UT.","INCIDENT","SALT LAKE CITY FSDO","N745TW","","","CESS","172","No","UNKNOWN","PERSONAL","EN ROUTE (ENR)","91","NONE","No","1","0","0","0","0","0","0","0","0","0","0","0","0","0","0","0","0","0","0","0"
"No","23-OCT-23","20-OCT-23","23:57:00Z","WICHITA","KANSAS","UNITED STATES","AIRCRAFT EXPERIENCED ENGINE ISSUES AND MADE A FORCED LANDING ON A ROAD AND STRUCK A SIGN, WICHITA, KS.","INCIDENT","WICHITA FSDO","N1413Y","","","CESSNA","172","No","UNKNOWN","PERSONAL","APPROACH (APR)","91","NONE","No","1","0","0","0","0","0","0","0","0","0","0","0","0","0","0","0","0","0","0","0"
"No","23-OCT-23","22-OCT-23","00:35:00Z","IOLA","KANSAS","UNITED STATES","AIRCRAFT EXPERIENCED ENGINE ISSUES, CRASHED IN A RESIDENTIAL AREA AND STRUCK A TREE, IOLA, KS.","ACCIDENT","WICHITA FSDO","N5324F","","","PIPER","PA28","No","SUBSTANTIAL","PERSONAL","APPROACH (APR)","","SERIOUS","No","0","0","1","0","0","0","0","0","0","0","0","0","0","0","0","0","0","0","0","0"
"No","23-OCT-23","22-OCT-23","19:15:00Z","OTTAWA","OHIO","UNITED STATES","AIRCRAFT LOST POWER AND CRASHED, OTTAWA, OH.","INCIDENT","CLEVELAND FSDO","N6757P","","","PIPER","PA24","No","UNKNOWN","PERSONAL","EN ROUTE (ENR)","91","MINOR","No","0","1","0","0","0","0","0","0","0","0","0","1","0","0","0","0","0","0","0","0"
"No","23-OCT-23","21-OCT-23","18:11:00Z","RICHMOND","VIRGINIA","UNITED STATES","AIRCRAFT CRASHED SHORT OF THE AIRPORT INTO A RESIDENTIAL YARD, RICHMOND, VA.","INCIDENT","RICHMOND FSDO","N7716G","","","CESSNA","172","No","MINOR","PERSONAL","APPROACH (APR)","91","NONE","No","1","0","0","0","0","0","0","0","0","0","2","0","0","0","0","0","0","0","0","0"
"No","23-OCT-23","22-OCT-23","18:30:00Z","JACKSONVILLE","FLORIDA","UNITED STATES","AIRCRAFT GEAR COLLAPSED ON LANDING, JACKSONVILLE, FL.","INCIDENT","ORLANDO FSDO","N8230Z","","","EXPERIMENTAL","BUCCANEER 2","No","MINOR","PERSONAL","LANDING (LDG)","91","NONE","No","1","0","0","0","0","0","0","0","0","0","0","0","0","0","0","0","0","0","0","0"
"No","23-OCT-23","20-OCT-23","22:10:00Z","ST GEORGE","UTAH","UNITED STATES","AIRCRAFT GROUND LOOPED ON LANDING, ST GEORGE, UT.","INCIDENT","SALT LAKE CITY FSDO","N9605R","","","CHRISTEN INDUSTRIES","A-1","No","MINOR","PERSONAL","LANDING (LDG)","91","NONE","No","1","0","0","0","0","0","0","0","0","0","0","0","0","0","0","0","0","0","0","0"
"Yes","24-OCT-23","23-OCT-23","21:20:00Z","PIERRE","SOUTH DAKOTA","UNITED STATES","AIRCRAFT CRASHED IN A FIELD UNDER UNKNOWN CIRCUMSTANCES, PIERRE, SD.","ACCIDENT","RAPID CITY FSDO","N92884","","","PIPER","PA46","No","UNKNOWN","PERSONAL","UNKNOWN (UNK)","91","FATAL","Yes","0","0","1","0","0","0","0","0","0","0","0","0","0","1","0","0","0","0","0","0"
"No","24-OCT-23","20-OCT-23","20:00:00Z","TELLICO PLAINS","TENNESSEE","UNITED STATES","AIRCRAFT LANDED LONG AND NOSED OVER, TELLICO PLAINS, TN.","ACCIDENT","NASHVILLE FSDO","N958TW","","","AVIAT AIRCRAFT","A-1C-200","No","SUBSTANTIAL","PERSONAL","LANDING (LDG)","91","NONE","No","1","0","0","0","0","0","0","0","0","0","0","0","0","0","0","0","0","0","0","0"
"No","24-OCT-23","22-OCT-23","23:20:00Z","WALLACE","NORTH CAROLINA","UNITED STATES","AIRCRAFT LANDED LONG AND RAN OFF THE END OF THE RUNWAY DAMAGING A RUNWAY LIGHT, WALLACE, NC.","INCIDENT","GREENSBORO FSDO","N6103R","","","CESSNA","T210","No","MINOR","PERSONAL","LANDING (LDG)","91","NONE","No","1","0","0","0","0","0","0","0","0","0","0","0","0","0","0","0","0","0","0","0"
"No","24-OCT-23","23-OCT-23","18:35:00Z","FAYETTE","ALABAMA","UNITED STATES","AIRCRAFT LANDED GEAR UP, FAYETTE, AL.","INCIDENT","ALABAMA AND NW FLORIDA FSDO","N9653M","","","MOONEY","M20C","No","MINOR","PERSONAL","LANDING (LDG)","91","NONE","No","1","0","0","0","0","0","0","0","0","0","0","0","0","0","0","0","0","0","0","0"
"No","24-OCT-23","23-OCT-23","18:42:00Z","PALM COAST","FLORIDA","UNITED STATES","AIRCRAFT INCURRED A TAIL STRIKE ON LANDING, PALM COAST, FL.","INCIDENT","ORLANDO FSDO","N838ER","RDL838","EMBRY RIDDLE AERONAUTICAL UNIVERSITY","TEXTRON","172","No","UNKNOWN","FAR 141 PILOT SCHOOL","LANDING (LDG)","91","NONE","No","1","0","0","0","0","0","0","0","0","0","1","0","0","0","0","0","0","0","0","0"
"No","16-OCT-23","15-OCT-23","14:53:00Z","RED OAK","IOWA","UNITED STATES","AIRCRAFT EXPERIENCED UNUSUAL VIBRATIONS AND LANDED ON A CLOSED RUNWAY STRIKING CONSTRUCTION EQUIPMENT, RED OAK, IA.","ACCIDENT","DES MOINES FSDO","N6JA","","","CIRRUS","SR22","No","SUBSTANTIAL","PERSONAL","UNKNOWN (UNK)","91","NONE","No","1","0","0","0","0","0","0","0","0","0","1","0","0","0","0","0","0","0","0","0"
"No","16-OCT-23","15-OCT-23","11:53:00Z","OAK ISLAND","NORTH CAROLINA","UNITED STATES","AIRCRAFT EXPERIENCED ENGINE ISSUES WHILE DEPARTING AND CRASHED JUST PAST AIRPORT PROPERTY STRIKING TREES, OAK ISLAND, NC.","ACCIDENT","GREENSBORO FSDO","N72FU","","","CZECH SPORT AIRCRAFT","SPORTCRUISER","No","SUBSTANTIAL","PERSONAL","TAKEOFF (TOF)","91","MINOR","No","0","1","0","0","0","0","0","0","0","0","0","0","0","0","0","0","0","0","0","0"
"No","16-OCT-23","13-OCT-23","18:40:00Z","EASTSOUND","WASHINGTON","UNITED STATES","AIRCRAFT ATTEMPTED GO-AROUND, LOST CONTROL AND WENT OFF RUNWAY INTO A FIELD, EASTSOUND, WA.","ACCIDENT","SEATTLE FSDO","N509Z","","","PIPER","PA46","No","SUBSTANTIAL","PERSONAL","MANEUVERING (MNV)","91","NONE","No","1","0","0","0","0","0","0","0","0","0","3","0","0","0","0","0","0","0","0","0"
"No","16-OCT-23","13-OCT-23","17:00:00Z","EASTON","MARYLAND","UNITED STATES","AIRCRAFT CRASHED WHILE DEPARTING FOR UNKNOWN REASONS, EASTON, MD.","ACCIDENT","BALTIMORE FSDO","N975CD","","","ROTORSPORT UK","MTOSPORT","No","SUBSTANTIAL","PERSONAL","TAKEOFF (TOF)","91","SERIOUS","No","0","0","1","0","0","0","0","0","0","0","0","0","0","0","0","0","0","0","0","0"
"No","16-OCT-23","14-OCT-23","16:50:00Z","MIAMI","FLORIDA","UNITED STATES","AIRCRAFT STRUCK A DELIVERY TRUCK WHILE TAXIING TO THE GATE, MIAMI, FL.","INCIDENT","SOUTH FLORIDA FSDO","N302SA","AAL924","AMERICAN AIRLINES","BOEING","737","No","UNKNOWN","COMMERCIAL","TAXI (TXI)","121","NONE","No","0","0","0","0","0","0","0","0","0","0","0","0","0","0","0","0","0","0","0","0"
"No","16-OCT-23","15-OCT-23","18:08:00Z","MIAMI","FLORIDA","UNITED STATES","AIRCRAFT SRUCK A BIRD CRACKING THE WINDSHIELD, MIAMI, FL","INCIDENT","SOUTH FLORIDA FSDO","N335RT","AAL1400","AMERICAN AIRLINES","BOEING","737","No","UNKNOWN","COMMERCIAL","UNKNOWN (UNK)","121","NONE","No","2","0","0","0","0","4","0","0","0","0","164","0","0","0","0","0","0","0","0","0"
"No","16-OCT-23","14-OCT-23","17:56:00Z","DETROIT","MICHIGAN","UNITED STATES","AIRCRAFT STRUCK A BIRD ON TAKEOFF DAMAGING #1 ENGINE COWLING AND LEADING EDGE OF WING, DETROIT, MI.","INCIDENT","EAST MICHIGAN FSDO","N3252DN","DAL1139","DELTA AIRLINES","AIRBUS","A321","No","MINOR","COMMERCIAL","TAKEOFF (TOF)","121","NONE","No","0","0","0","0","0","0","0","0","0","0","0","0","0","0","0","0","0","0","0","0"
"No","16-OCT-23","15-OCT-23","17:05:00Z","HONOLULU","HAWAII","UNITED STATES","AIRCRAFT STRUCK A BIRD AFTER LANDING, HONOLULU, HI.","INCIDENT","HONOLULU FSDO","N129CG","FDY629","","CESSNA","208","No","UNKNOWN","CARGO","LANDING (LDG)","135","NONE","No","1","0","0","0","0","0","0","0","0","0","0","0","0","0","0","0","0","0","0","0"
"No","16-OCT-23","15-OCT-23","17:05:00Z","FRANKSVILLE","WISCONSIN","UNITED STATES","AIRCRAFT EXPERIENCED ENGINE ISSUES ON DEPARTURE, LANDED IN A SOD FIELD AND FLIPPED OVER, FRANKSVILLE, WI.","INCIDENT","MILWAUKEE FSDO","N42VZ","","","EXPERIMENTAL","TVAP-4","No","UNKNOWN","PERSONAL","TAKEOFF (TOF)","91","NONE","No","1","0","0","0","0","0","0","0","0","0","0","0","0","0","0","0","0","0","0","0"
"No","16-OCT-23","13-OCT-23","14:20:00Z","MINNEAPOLIS","MINNESOTA","UNITED STATES","AIRCRAFT STRUCK A FLOCK OF BIRDS ON APPROACH DAMAGING RADOME, MINNEAPOLIS, MN.","INCIDENT","MINNEAPOLIS FSDO","N304DE","","","TEXTRON","B300","No","UNKNOWN","UNKNOWN","APPROACH (APR)","","NONE","No","0","0","0","0","0","0","0","0","0","0","0","0","0","0","0","0","0","0","0","0"
"No","16-OCT-23","15-OCT-23","17:42:00Z","DAYTONA BEACH","FLORIDA","UNITED STATES","AIRCRAFT WHILE TAXIING, WINGTIP MADE CONTACT WITH THE WINGTIP OF N309ER, DAYTONA BEACH, FL.","INCIDENT","ORLANDO FSDO","N307ER","ERU307","EMBRY RIDDLE AERONAUTICAL UNIVERSITY","DIAMOND","DA40","No","UNKNOWN","FAR 141 PILOT SCHOOL","TAXI (TXI)","91","NONE","No","1","0","0","0","0","0","0","0","0","0","1","0","0","0","0","0","0","0","0","0"
"No","16-OCT-23","15-OCT-23","17:42:00Z","DAYTONA BEACH","FLORIDA","UNITED STATES","AIRCRAFT WHILE TAXIING, WINGTIP MADE CONTACT WITH WINGTIP OF N307ER, DAYTONA BEACH, FL.","INCIDENT","ORLANDO FSDO","N309ER","ERU309","EMBRY RIDDLE AERONAUTICAL UNIVERSITY","DIAMOND","DA40","No","UNKNOWN","FAR 141 PILOT SCHOOL","TAXI (TXI)","91","NONE","No","1","0","0","0","0","0","0","0","0","0","1","0","0","0","0","0","0","0","0","0"
"No","16-OCT-23","15-OCT-23","15:30:00Z","NORWOOD","MASSACHUSETTS","UNITED STATES","AIRCRAFT EXPERIENCED A PROP STRIKE ON LANDING, NORWOOD, MA.","INCIDENT","BOSTON FSDO","N323JT","","","DIAMOND","DA40","No","UNKNOWN","PERSONAL","LANDING (LDG)","91","UNKNOWN","No","0","0","0","0","1","0","0","0","0","0","0","0","0","0","0","0","0","0","0","0"
"No","16-OCT-23","16-OCT-23","00:48:00Z","SANTA ANA","CALIFORNIA","UNITED STATES","AIRCRAFT LOST CONTROL AND VEERED OFF RUNWAY INTO THE GRASS, SANTA ANA, CA.","INCIDENT","LONG BEACH FSDO","N348ME","","","CESS","172","No","UNKNOWN","PERSONAL","UNKNOWN (UNK)","91","NONE","No","1","0","0","0","0","0","0","0","0","0","0","0","0","0","0","0","0","0","0","0"
"No","16-OCT-23","16-OCT-23","00:57:00Z","JANESVILLE","WISCONSIN","UNITED STATES","AIRCRAFT STRUCK A BIRD LEAVING A DENT IN THE RIGHT WING, JANESVILLE, WI.","INCIDENT","MILWAUKEE FSDO","N421VL","","","VANS","RV7","No","UNKNOWN","PERSONAL","UNKNOWN (UNK)","91","NONE","No","1","0","0","0","0","0","0","0","0","0","0","0","0","0","0","0","0","0","0","0"
"No","16-OCT-23","14-OCT-23","15:13:00Z","ORLANDO","FLORIDA","UNITED STATES","AIRCRAFT GEAR COLLAPSED ON TAXIWAY, ORLANDO, FL.","INCIDENT","ORLANDO FSDO","N956BC","","","PROGRESSIVE AERODYNE","SEAREY","No","UNKNOWN","PERSONAL","UNKNOWN (UNK)","91","NONE","No","1","0","0","0","0","0","0","0","0","0","0","0","0","0","0","0","0","0","0","0"
"No","16-OCT-23","14-OCT-23","23:15:00Z","BELLINGHAM","WASHINGTON","UNITED STATES","AIRCRAFT CONDUCTING TOUCH AND GO, EXITED RUNWAY AND STRUCK RUNWAY LIGHTS, BELLINGHAM, WA.","INCIDENT","SEATTLE FSDO","N2012N","","","BEECH","C23","No","MINOR","INSTRUCTION","MANEUVERING (MNV)","91","NONE","No","1","0","0","0","0","0","0","0","0","0","0","0","0","0","0","0","0","0","0","0"
"No","16-OCT-23","14-OCT-23","20:20:00Z","SHERMAN","TEXAS","UNITED STATES","AIRCRAFT WAS LANDING AND NOSED OVER, SHERMAN, TX.","INCIDENT","NORTH TEXAS FSDO","N6417X","","","CESSNA","180","No","UNKNOWN","PERSONAL","LANDING (LDG)","91","NONE","No","1","0","0","0","0","0","0","0","0","0","1","0","0","0","0","0","0","0","0","0"
"No","16-OCT-23","13-OCT-23","14:00:00Z","DENTON","TEXAS","UNITED STATES","AIRCRAFT LANDED AND VEERED OFF RUNWAY INTO THE GRASS, DENTON, TX.","INCIDENT","NORTH TEXAS FSDO","N6605J","","","PIPER","PA28","No","UNKNOWN","PERSONAL","LANDING (LDG)","91","NONE","No","1","0","0","0","0","0","0","0","0","0","0","0","0","0","0","0","0","0","0","0"
"No","17-OCT-23","14-OCT-23","15:00:00Z","MYAKKA CITY","FLORIDA","UNITED STATES","AIRCRAFT VEERED OFF THE RUNWAY STRIKING A FENCE AND FLIPPING OVER, MYAKKA CITY, FLORIDA.","ACCIDENT","TAMPA FSDO","N87621","","","MONOCOUPE","90AL-115","No","SUBSTANTIAL","PERSONAL","TAKEOFF (TOF)","91","MINOR","No","0","1","0","0","0","0","0","0","0","0","0","0","0","0","0","0","0","0","0","0"
"No","17-OCT-23","16-OCT-23","18:15:00Z","MOUNT STERLING","ILLINOIS","UNITED STATES","GYROCOPTER LOST POWER ON DOWNWIND AND CRASHED 100 FEET WEST OF THE RUNWAY, MOUNT STERLING, ILLINOIS.","INCIDENT","SPRINGFIELD FSDO","N90HM","","","MAGNI","M24","No","UNKNOWN","PERSONAL","LANDING (LDG)","91","NONE","No","1","0","0","0","0","0","0","0","0","0","0","0","0","0","0","0","0","0","0","0"
"No","17-OCT-23","16-OCT-23","20:30:00Z","READING","PENNSYLVANIA","UNITED STATES","NOSE GEAR FAILED DURING LANDING, READING, PENNSYLVANIA.","INCIDENT","ALLENTOWN FSDO","N557JB","","","VANS","RV6A","No","UNKNOWN","PERSONAL","LANDING (LDG)","91","NONE","No","1","0","0","0","0","0","0","0","0","0","1","0","0","0","0","0","0","0","0","0"
"No","17-OCT-23","16-OCT-23","20:20:00Z","NASHVILLE","TENNESSEE","UNITED STATES","AIRCRAFT EXPERIENCED GEAR UP LANDING, NASHVILLE, TENNESSEE.","INCIDENT","NASHVILLE FSDO","N584R","","","BEECH","35","No","MINOR","PERSONAL","LANDING (LDG)","91","NONE","No","1","0","0","0","0","0","0","0","0","0","0","0","0","0","0","0","0","0","0","0"
"No","17-OCT-23","13-OCT-23","21:00:00Z","FAIRFIELD","UTAH","UNITED STATES","AIRCRAFT GROUND LOOPED ON LANDING, FAIRFIELD, UTAH.","INCIDENT","SALT LAKE CITY FSDO","N866SA","","","ZLIN","SRO SAVAGE","No","UNKNOWN","PERSONAL","LANDING (LDG)","91","NONE","No","1","0","0","0","0","0","0","0","0","0","1","0","0","0","0","0","0","0","0","0"
"No","17-OCT-23","16-OCT-23","13:29:00Z","HOLLYWOOD","FLORIDA","UNITED STATES","WHILE ATTEMPTING TO LAND, THE AIRCRAFT HIT A TAXIWAY SIGN WITH THE LEFT MAIN GEAR, HOLLYWOOD, FLORIDA.","INCIDENT","South Florida FSDO","N6345B","","","CESSNA","172","No","MINOR","PERSONAL","LANDING (LDG)","91","NONE","No","1","0","0","0","0","0","0","0","0","0","0","0","0","0","0","0","0","0","0","0"
"No","17-OCT-23","17-OCT-23","00:05:00Z","ORLANDO","FLORIDA","UNITED STATES","AIRCRAFT RAN INTO THE GRASS ON LANDING, ORLANDO, FLORIDA.","INCIDENT","ORLANDO FSDO","N46299","","","CESSNA","172","No","NONE","PERSONAL","LANDING (LDG)","91","NONE","No","1","0","0","0","0","0","0","0","0","0","0","0","0","0","0","0","0","0","0","0"
"No","17-OCT-23","05-OCT-23","01:44:00Z","SAN DIEGO","CALIFORNIA","UNITED STATES","FLIGHT ATTENDANT STRUCK HEAD DURING FLIGHT, SAN DIEGO, CALIFORNIA.","INCIDENT","SAN DIEGO FSDO","N8723Q","SWA2014","SOUTHWEST AIRLINES","BOEING","737","No","NONE","COMMERCIAL","EN ROUTE (ENR)","121","MINOR","No","2","0","0","0","0","0","1","0","0","0","0","0","0","0","0","0","0","0","0","0"
"No","18-OCT-23","17-OCT-23","14:20:00Z","TAMPA","FLORIDA","UNITED STATES","REPORTED A BIRD STRIKE AFTER DEPARTING RUNWAY 1L. CONTINUED AND LANDED MIA. POST-FLIGHT INSPECTION REVEALED DAMAGE TO
NOSE CONE","INCIDENT","SOUTH FLORDIA FSDO","N9022G","AAL1306","","AIRBUS","A319","No","MINOR","COMMERCIAL","TAKEOFF (TOF)","121","UNKNOWN","No","0","0","0","0","0","0","0","0","0","0","0","0","0","0","0","0","0","0","0","0"
"No","18-OCT-23","17-OCT-23","20:30:00Z","GREELY","COLORADO","UNITED STATES","LOSS OF ENGINE POWER AND COLLIDED WITH HANGARS ON THE GROUND.","ACCIDENT","DENVER","N41DH","","","DEHAVILLAND","DH 82A","No","SUBSTANTIAL","PERSONAL","TAXI (TXI)","","MINOR","No","0","1","0","0","0","0","0","0","0","0","0","1","0","0","0","0","0","0","0","0"
"No","18-OCT-23","17-OCT-23","14:50:00Z","OCALA","FLORIDA","UNITED STATES","AIRCRAFT EXPERIENCED AN ENGINE FAILURE AFTER TAKEOFF AND CRASHED IN THE GRASS NORTH OF RUNWAY 36 ON AIRPORT PROPERTY","INCIDENT","ORLANDO FSDO","N118T","","","COSTRUZIONI AERONAUTICHE TECNA","P2010","No","UNKNOWN","INSTRUCTION","INITIAL CLIMB (ICL)","91","UNKNOWN","No","0","0","0","0","2","0","0","0","0","0","0","0","0","0","0","0","0","0","0","0"
"No","18-OCT-23","16-OCT-23","19:50:00Z","MENA","ARKANSAS","UNITED STATES","NOSE GEAR COLLAPSED ON LANDING ROLL RWY 27. ACFT TOWED TO R AND C AVIATION WITHOUT FURTHER INCIDENT","INCIDENT","LITTLE ROCK FSDO","N924V","","","BEECH","V35B","No","UNKNOWN","PERSONAL","LANDING (LDG)","91","UNKNOWN","No","0","0","0","0","2","0","0","0","0","0","0","0","0","0","0","0","0","0","0","0"
"No","18-OCT-23","17-OCT-23","18:50:00Z","WILLIAMS","ARIZONA","UNITED STATES","AIRCRAFT CRASHED FOR UNKNOWN REASONS ON DEPARTURE","ACCIDENT","SCOTTSDALE","N6192J","","","PIPER","PA-28-140","No","SUBSTANTIAL","PERSONAL","INITIAL CLIMB (ICL)","91","FATAL","Yes","0","0","0","1","0","0","0","0","0","0","0","0","0","2","0","0","0","0","0","0"
"No","19-OCT-23","18-OCT-23","19:15:00Z","ATLANTA","GEORGIA","UNITED STATES","AIRCRAFT RAN OFF THE END OF THE RUNWAY AND STRUCK EMAS AFTER LEFT MAIN LANDING GEAR LOCKED UP.","ACCIDENT","ATLANTA FSDO","N93GA","","","BEECH","BE30","No","SUBSTANTIAL","PERSONAL","LANDING (LDG)","91","NONE","No","2","0","0","0","0","0","0","0","0","0","0","0","0","0","0","0","0","0","0","0"
"No","19-OCT-23","14-OCT-23","14:10:00Z","ALBUQUERQUE","NEW MEXICO","UNITED STATES","BALLOON WHILE LANDING STRUCK A CHAIN LINK FENCE CAUSING BASKET TO LAY OVER.","ACCIDENT","Albuquerque FSDO","N315RR","","","CAMERON","A-315","No","NONE","COMMERCIAL","LANDING (LDG)","61","SERIOUS","No","1","0","0","0","0","0","0","0","0","0","10","0","1","0","0","0","0","0","0","0"
"Yes","19-OCT-23","18-OCT-23","20:15:00Z","BANDERA","WASHINGTON","UNITED STATES","AIRCRAFT DEPARTED RUNWAY AND FLIPPED OVER AFTER AIRCRAFT DID NOT STOP AFTER BRAKE APPLICATION.","ACCIDENT","SEATTLE FSDO","N734LJ","","","CESSNA","C172","No","SUBSTANTIAL","PERSONAL","LANDING (LDG)","91","NONE","No","2","0","0","0","0","0","0","0","0","0","0","0","0","0","0","0","0","0","0","0"
"No","19-OCT-23","18-OCT-23","17:00:00Z","PLEASANT PRAIRIE","WISCONSIN","UNITED STATES","AIRCRAFT STRUCK A BIRD DURING CRUISE AND BROKE FRONT WINDSCREEN","INCIDENT","MILWAUKEE FSDO","N13NN","","","BELL","B206","No","MINOR","UNKNOWN","EN ROUTE (ENR)","","MINOR","No","1","1","0","0","0","0","0","0","0","0","0","0","0","0","0","0","0","0","0","0"
"No","19-OCT-23","17-OCT-23","14:50:00Z","MITCHELL","INDIANA","UNITED STATES","AIRCRAFT STRUCK A BIRD AND AUTO ROTATED INTO A FIELD","INCIDENT","Indianapolis FSDO","N490AE","","","BELL","B206L-4","No","UNKNOWN","AMBULANCE","EN ROUTE (ENR)","135","NONE","No","3","0","0","0","0","0","0","0","0","0","0","0","0","0","0","0","0","0","0","0"
"No","17-OCT-23","16-OCT-23","19:30:00Z","KLAWOCK","ALASKA","UNITED STATES","AIRCRAFT EXPERIENCED A BRAKE FAILURE CAUSING THE AIRCRAFT TO VEER OFF OF RUNWAY AND PROP STRUCK THE GROUND, KLAWOCK, ALASKA.","INCIDENT","JUNEAU FSDO","N1229C","","ISLAND AIR EXPRESS","CESSNA","208","No","MINOR","COMMERCIAL","TAXI (TXI)","135","NONE","No","1","0","0","0","0","0","0","0","0","0","0","0","0","0","0","0","0","0","0","0"
"No","19-OCT-23","18-OCT-23","14:55:00Z","ALBANY","GEORGIA","UNITED STATES","AIRCRAFT LANDING GEAR COLLAPSED AFTER AN IMMEDIATE LANDING DUE TO SMOKE IN THE COCKPIT","INCIDENT","ATLANTA FSDO","N889FT","","","BEECH","BE58","No","MINOR","PERSONAL","EN ROUTE (ENR)","91","NONE","No","2","0","0","0","0","0","0","0","0","0","0","0","0","0","0","0","0","0","0","0"
"No","19-OCT-23","18-OCT-23","23:05:00Z","MOHAVE","CALIFORNIA","UNITED STATES","AIRCRAFT NOSE GEAR COLLAPSED AFTER LANDING","INCIDENT","LAS VEGAS FSDO","N8036M","","","CESSNA","C310","No","MINOR","PERSONAL","LANDING (LDG)","91","NONE","No","1","0","0","0","0","0","0","0","0","0","0","0","0","0","0","0","0","0","0","0"
"No","19-OCT-23","18-OCT-23","23:36:00Z","PUEBLO","COLORADO","UNITED STATES","AIRCRAFT SLID OFF OF RUNWAY AFTER MAIN LANDING GEAR DID NOT DEPLY","INCIDENT","DENVER FSDO","N9597X","","","CESSNA","C219","No","UNKNOWN","PERSONAL","LANDING (LDG)","91","NONE","No","1","0","0","0","0","0","0","0","0","0","0","0","0","0","0","0","0","0","0","0"
"No","20-OCT-23","19-OCT-23","21:30:00Z","OKLAHOMA CITY","OKLAHOMA","UNITED STATES","AIRCRAFT CLIPPED TH NOSE CONE OF ANOTHER AIRCRAFT DURING TAXI, OKLAHOMA CITY, OKLAHOMA.","INCIDENT","WILL ROGERS FSDO","N865MK","","","CESSNA","525B","No","UNKNOWN","PERSONAL","TAXI (TXI)","91","NONE","No","2","0","0","0","0","0","0","0","0","0","0","0","0","0","0","0","0","0","0","0"
"No","20-OCT-23","20-OCT-23","00:15:00Z","SPRINGFIELD","ILLINOIS","UNITED STATES","AIRCRFAT EXERIENCED A BIRDSTRIKE DURING LANDING, SPRINGFIELD, ILLINOIS.","INCIDENT","SPRINGFIELD FSDO","N645B","","","EMBRAER","EMB505","No","UNKNOWN","PERSONAL","APPROACH (APR)","91","NONE","No","2","0","0","0","0","0","0","0","0","0","0","0","0","0","0","0","0","0","0","0"
"No","20-OCT-23","19-OCT-23","02:21:00Z","CHICAGO","ILLINOIS","UNITED STATES","FOD DAMAGE DISCOVERED AFTER LANDING, CHICAGO, ILLINOIS.","INCIDENT","GREATER CHICAGO FSDO","N859GT","GTI8104","ATLAS AIR INC.","BOEING","748","No","UNKNOWN","COMMERCIAL","UNKNOWN (UNK)","121","NONE","No","2","0","0","0","0","0","0","0","0","0","3","0","0","0","0","0","0","0","0","0"
