"UPDATED","ENTRY_DATE","EVENT_LCL_DATE","EVENT_LCL_TIME","LOC_CITY_NAME","LOC_STATE_NAME","LOC_CNTRY_NAME","RMK_TEXT","EVENT_TYPE_DESC","FSDO_DESC","REGIST_NBR","FLT_NBR","ACFT_OPRTR","ACFT_MAKE_NAME","ACFT_MODEL_NAME","ACFT_MISSING_FLAG","ACFT_DMG_DESC","FLT_ACTIVITY","FLT_PHASE","FAR_PART","MAX_INJ_LVL","FATAL_FLAG","FLT_CRW_INJ_NONE","FLT_CRW_INJ_MINOR","FLT_CRW_INJ_SERIOUS","FLT_CRW_INJ_FATAL","FLT_CRW_INJ_UNK","CBN_CRW_INJ_NONE","CBN_CRW_INJ_MINOR","CBN_CRW_INJ_SERIOUS","CBN_CRW_INJ_FATAL","CBN_CRW_INJ_UNK","PAX_INJ_NONE","PAX_INJ_MINOR","PAX_INJ_SERIOUS","PAX_INJ_FATAL","PAX_INJ_UNK","GRND_INJ_NONE","GRND_INJ_MINOR","GRND_INJ_SERIOUS","GRND_INJ_FATAL","GRND_INJ_UNK"
"No","10-APR-24","09-APR-24","13:06:00Z","OKLAHOMA CITY","OKLAHOMA","UNITED STATES","AIRCRAFT STRUCK A BIRD ON TAKEOFF DAMAGING THE VERTICAL STABILIZER, OKLAHOMA CITY, OK.","INCIDENT","WILL ROGERS FSDO","N243MH","","","RAYTHEON","B300","No","UNKNOWN","PERSONAL","TAKEOFF (TOF)","91","NONE","No","1","0","0","0","0","0","0","0","0","0","0","0","0","0","0","0","0","0","0","0"
"No","10-APR-24","09-APR-24","19:43:00Z","TRENTON","NEW JERSEY","UNITED STATES","AIRCRAFT STRUCK A BIRD ON LANDING DAMAGING THE LANDING GEAR, TRENTON, NJ.","INCIDENT","PHILADELPHIA FSDO","N596WS","","","CIRRUS","SR22","No","MINOR","PERSONAL","LANDING (LDG)","91","NONE","No","1","0","0","0","0","0","0","0","0","0","0","0","0","0","0","0","0","0","0","0"
"No","10-APR-24","09-APR-24","15:45:00Z","PUEBLO","COLORADO","UNITED STATES","AIRCRAFT LANDED HARD AND NOSE GEAR COLLAPSED, PUEBLO, CO.","INCIDENT","DENVER FSDO","N994DA","","","DIAMOND","DA20","No","MINOR","INSTRUCTION","LANDING (LDG)","91","NONE","No","1","0","0","0","0","0","0","0","0","0","0","0","0","0","0","0","0","0","0","0"
"No","10-APR-24","08-APR-24","22:15:00Z","PORTALES","NEW MEXICO","UNITED STATES","AIRCRAFT WAS DEPARTING AND AFTER ROTATION VEERED OFF THE RUNWAY, PORTALES, NM.","ACCIDENT","LUBBOCK FSDO","N2147C","","","CESSNA","195","No","SUBSTANTIAL","PERSONAL","TAKEOFF (TOF)","91","MINOR","No","0","1","0","0","0","0","0","0","0","0","0","2","0","0","0","0","0","0","0","0"
"No","10-APR-24","10-APR-24","04:28:00Z","ATLANTA","GEORGIA","UNITED STATES","AIRCRAFT LANDED AND WENT INTO THE OVERRUN AREA, RE-ENTERED THE RUNWAY DAMAGING THE RUNWAY STOP BAR LIGHT, ATLANTA, GA.","INCIDENT","ATLANTA FSDO","N895CR","LN895CR","AIR METHODS","PILATUS","PC12","No","UNKNOWN","AMBULANCE","LANDING (LDG)","","NONE","No","1","0","0","0","0","0","0","0","0","0","0","0","0","0","0","0","0","0","0","0"
"No","11-APR-24","09-APR-24","00:16:00Z","NEW YORK","NEW YORK","UNITED STATES","AIRCRAFT TAXIING TO RUNWAY AND FLIGHT ATTENDANTS INJURIED DURING HARD BRAKING, NEW YORK, NY.","ACCIDENT","NEW YORK FSDO","N782AN","AAL106","AMERICAN AIRLINES","BOEING","777","No","NONE","COMMERCIAL","TAXI (TXI)","121","SERIOUS","No","2","0","0","0","0","0","1","1","0","0","0","0","0","0","0","0","0","0","0","0"
"No","11-APR-24","10-APR-24","19:30:00Z","COUNCIL BLUFFS","IOWA","UNITED STATES","AIRCRAFT DEPARTING WITH A CROSSWIND, LOST DIRECTIONAL CONTROL AND VEERED OFF RUNWAY AND OVER A BERM, COUNCIL BLUFFS, IA.","ACCIDENT","DES MOINES FSDO","N675LF","","","DEHAVILLAND","DH 82A","No","SUBSTANTIAL","PERSONAL","TAKEOFF (TOF)","91","NONE","No","1","0","0","0","0","0","0","0","0","0","0","0","0","0","0","0","0","0","0","0"
"No","11-APR-24","10-APR-24","18:15:00Z","BUFFALO","NEW YORK","UNITED STATES","AIRCRAFT TAKING OFF AND ROLLED OVER ON ITS SIDE, BUFFAO, NY.","INCIDENT","ROCHESTER FSDO","N107RW","","","ZENITH","CH601XLB","No","UNKNOWN","PERSONAL","TAKEOFF (TOF)","91","UNKNOWN","No","0","0","0","0","1","0","0","0","0","0","0","0","0","0","0","0","0","0","0","0"
"No","11-APR-24","10-APR-24","18:42:00Z","HOLLIS","MAINE","UNITED STATES","AIRCRAFT RAN OUT OF FUEL AND LANDED ON A ROAD, HOLLIS, ME.","INCIDENT","PORTLAND ME FSDO","N180VW","","","CESSNA","180","No","NONE","PERSONAL","EN ROUTE (ENR)","91","NONE","No","1","0","0","0","0","0","0","0","0","0","0","0","0","0","0","0","0","0","0","0"
"No","10-APR-24","09-APR-24","21:44:00Z","ALTURAS","CALIFORNIA","UNITED STATES","AIRCRAFT WING STRUCK THE GROUND WHILE SEEDING AND CRASHED INTO THE WATER, ALTURAS, CA.","ACCIDENT","RENO FSDO","N40261","","","AYRES CORPORATION","S2R-G10","No","SUBSTANTIAL","AERIAL APPLICATION","MANEUVERING (MNV)","137","FATAL","Yes","0","0","0","1","0","0","0","0","0","0","0","0","0","0","0","0","0","0","0","0"
"No","10-APR-24","09-APR-24","13:45:00Z","CEIBA","PUERTO RICO","UNITED STATES","AIRCRAFT STRUCK GROUND WITH THE TAIL ROTOR WHILE PERFORMING MANEUVERS, CEIBA, PR.","ACCIDENT","SAN JUAN FSDO","N5841Z","","","MD HELICOPTERS","369FF","No","SUBSTANTIAL","UNKNOWN","MANEUVERING (MNV)","91","NONE","No","1","0","0","0","0","0","0","0","0","0","1","0","0","0","0","0","0","0","0","0"
"No","11-APR-24","10-APR-24","23:30:00Z","PLAINVIEW","TEXAS","UNITED STATES","AIRCRAFT CONDUCTING TOUCH AND GOS, TOUCHED DOWN AND LANDING GEAR WAS INADVERTENTLY RETRACTED, PLAINVIEW, TX.","INCIDENT","LUBBOCK FSDO","N804R","","","BEECH","K35","No","UNKNOWN","UNKNOWN","MANEUVERING (MNV)","91","NONE","No","1","0","0","0","0","0","0","0","0","0","1","0","0","0","0","0","0","0","0","0"
"No","11-APR-24","10-APR-24","19:45:00Z","FORT COLLINS","COLORADO","UNITED STATES","AIRCRAFT INCURRED A TAIL STRIKE ON LANDING RIPPING OFF THE TIE DOWN HOOK, FORT COLLINS, CO.","INCIDENT","DENVER FSDO","N3547L","","","CESSNA","172","No","MINOR","INSTRUCTION","LANDING (LDG)","91","NONE","No","1","0","0","0","0","0","0","0","0","0","1","0","0","0","0","0","0","0","0","0"
"No","11-APR-24","10-APR-24","20:30:00Z","GRAND RAPIDS","MICHIGAN","UNITED STATES","AIRCRAFT EXPERIENCED ENGINE ISSUES AFTER DEPARTURE, ELECTED TO RETURN TO AIRPORT AND COULDN'T MAKE IT SO LANDED IN MUD 1/4 MILE FROM RUNWAY, GRAND RAPIDS, MI.","INCIDENT","GRAND RAPIDS FSDO","N5267V","","","CESSNA","T210","No","NONE","PERSONAL","TAKEOFF (TOF)","91","NONE","No","1","0","0","0","0","0","0","0","0","0","0","0","0","0","0","0","0","0","0","0"
"No","11-APR-24","10-APR-24","00:35:00Z","CORONA","CALIFORNIA","UNITED STATES","AIRCRAFT LANDED GEAR UP, CORONA, CA.","INCIDENT","RIVERSIDE FSDO","N6679X","","","BEECH","A36","No","MINOR","PERSONAL","LANDING (LDG)","91","NONE","No","1","0","0","0","0","0","0","0","0","0","1","0","0","0","0","0","0","0","0","0"
"No","12-APR-24","11-APR-24","16:57:00Z","GRAND JUNCTION","COLORADO","UNITED STATES","AIRCRAFT ON LANDING,  LOST CONTROL WHILE GETTING STUNG BY WASPS THAT WERE IN THE VENT AND INCURRED A PROP STRIKE, GRAND JUNCTION, CO.","INCIDENT","SALT LAKE CITY FSDO","N2252V","","","CESSNA","140","No","MINOR","INSTRUCTION","LANDING (LDG)","91","NONE","No","1","0","0","0","0","0","0","0","0","0","1","0","0","0","0","0","0","0","0","0"
"No","12-APR-24","11-APR-24","20:45:00Z","AUBURN","WASHINGTON","UNITED STATES","AIRCRAFT RIGHT MAIN GEAR COLLAPSED ON LANDING, SLID OFF RUNWAY STRIKING A SIGN AND LIGHTS, AUBURN, WA.","ACCIDENT","SEATTLE FSDO","N806RC","","","CESSNA","P210","No","SUBSTANTIAL","PERSONAL","LANDING (LDG)","91","NONE","No","1","0","0","0","0","0","0","0","0","0","0","0","0","0","0","0","0","0","0","0"
"No","12-APR-24","25-MAR-24","22:13:00Z","GREENVILLE","MISSISSIPPI","UNITED STATES","AIRCRAFT ENCOUNTERED WIND SHEAR ON LANDING AND THE RIGHT WING HIT THE RUNWAY, GREENVILLE, MS.","INCIDENT","JACKSON FSDO","N246JR","","","CESSNA","750","No","UNKNOWN","UNKNOWN","LANDING (LDG)","91","NONE","No","2","0","0","0","0","0","0","0","0","0","0","0","0","0","0","0","0","0","0","0"
"No","12-APR-24","11-APR-24","13:23:00Z","SULLIVAN","MISSOURI","UNITED STATES","AIRCRAFT EXPERIENCED ENGINE ISSUES AND LANDED IN A FIELD, SULLIVAN, MO.","INCIDENT","KANSAS CITY FSDO","N651ED","","","PIPER","PA32","No","UNKNOWN","PERSONAL","EN ROUTE (ENR)","91","NONE","No","1","0","0","0","0","0","0","0","0","0","1","0","0","0","0","0","0","0","0","0"
"No","12-APR-24","12-APR-24","00:53:00Z","MANASSAS","VIRGINIA","UNITED STATES","AIRCRAFT DECLARED AN EMERGENCY DUE TO LOW FUEL, DIVERTED TO HEF AND LANDED SHORT OF THE RUNWAY, MANASSAS, VA.","INCIDENT","WASHINGTON FSDO","N5506G","","","CESSNA","150","No","UNKNOWN","PERSONAL","EN ROUTE (ENR)","91","NONE","No","1","0","0","0","0","0","0","0","0","0","0","0","0","0","0","0","0","0","0","0"
"No","12-APR-24","11-APR-24","07:11:00Z","LAS VEGAS","NEVADA","UNITED STATES","AIRCRAFT LANDED AND POST FLIGHT INSPECTION REVEALED MISSING LOWER WING PANEL, LAS VEGAS, NV.","INCIDENT","LAS VEGAS FSDO","N24224","UAL1960","UNITED AIRLINES","BOEING","737","No","UNKNOWN","COMMERCIAL","STANDING (STD)","121","NONE","No","0","0","0","0","0","0","0","0","0","0","0","0","0","0","0","0","0","0","0","0"
"No","09-APR-24","31-MAR-24","00:40:00Z","HERMISTON","OREGON","UNITED STATES","AIRCRAFT LOST DIRECTIONAL CONTROL ON TAKEOFF VEERING OFF RUNWAY AND FLIPPING OVER, HERMISTON, OR.","ACCIDENT","PORTLAND FSDO","N188CG","","","KITFOX","SERIES 7 STI","No","SUBSTANTIAL","INSTRUCTION","TAKEOFF (TOF)","","NONE","No","1","0","0","0","0","0","0","0","0","0","1","0","0","0","0","0","0","0","0","0"
"No","09-APR-24","04-APR-24","20:12:00Z","MERRITT ISLAND","FLORIDA","UNITED STATES","AIRCRAFT NOSE GEAR COLLAPSED ON LANDING, MERRITT ISLAND, FL.","INCIDENT","ORLANDO FSDO","N2159S","","","PIPER","PA34","No","MINOR","PERSONAL","LANDING (LDG)","91","NONE","No","1","0","0","0","0","0","0","0","0","0","0","0","0","0","0","0","0","0","0","0"
"Yes","09-APR-24","08-APR-24","15:25:00Z","TITUSVILLE","FLORIDA","UNITED STATES","AIRCRAFT LANDED, VEERED OFF RUNWAY INTO THE GRASS, RE-ENTERED RUNWAY AND WHILE STATIONARY THE ENGINE CAUGHT ON FIRE, TITUSVILLE, FL.","INCIDENT","ORLANDO FSDO","N101FT","","","NORTH AMERICAN","T-6G","No","MINOR","PERSONAL","LANDING (LDG)","91","NONE","No","1","0","0","0","0","0","0","0","0","0","1","0","0","0","0","0","0","0","0","0"
"No","09-APR-24","09-APR-24","01:20:00Z","ODENTON","MARYLAND","UNITED STATES","AIRCRAFT STRUCK A BIRD, ODENTON, MD.","INCIDENT","BALTIMORE FSDO","N522ME","STAT10","STAT MEDEVAC","EUROCOPTER","MBB-BK 117 C-2","No","UNKNOWN","AMBULANCE","EN ROUTE (ENR)","135","MINOR","No","0","1","0","0","0","0","0","0","0","0","0","0","0","0","0","0","0","0","0","0"
"No","09-APR-24","08-APR-24","19:47:00Z","LOS ANGELES","CALIFORNIA","UNITED STATES","AIRCRAFT FRONT LANDING GEAR HIT PAVEMENT DURING TOUCH AND GO BREAKING THE TOP WHEEL COVER, LOS ANGELES, CA.","INCIDENT","LOS ANGELES FSDO","N882AB","","","CIRRUS","SR20","No","UNKNOWN","UNKNOWN","MANEUVERING (MNV)","91","NONE","No","1","0","0","0","0","0","0","0","0","0","0","0","0","0","0","0","0","0","0","0"
"No","09-APR-24","08-APR-24","15:30:00Z","CARRABASSETT","MAINE","UNITED STATES","AIRCRAFT LANDED SHORT OF THE RUNWAY, CARRABASSETT, ME.","INCIDENT","PORTLAND ME FSDO","N6465P","","","PIPER","PA24","No","UNKNOWN","PERSONAL","LANDING (LDG)","91","NONE","No","1","0","0","0","0","0","0","0","0","0","3","0","0","0","0","0","0","0","0","0"
"No","09-APR-24","08-APR-24","16:50:00Z","CLARKSVILLE","ARKANSAS","UNITED STATES","AIRCRAFT CRASHED SHORTLY AFTER TAKEOFF DUE TO ENGINE ISSUES, CLARKSVILLE, AR.","ACCIDENT","LITTLE ROCK FSDO","N131N","","","TEMCO","D-16A","No","SUBSTANTIAL","PERSONAL","TAKEOFF (TOF)","91","UNKNOWN","No","0","0","0","0","1","0","0","0","0","0","0","0","0","0","3","0","0","0","0","0"
"No","09-APR-24","08-APR-24","18:24:00Z","JOHNSTOWN","PENNSYLVANIA","UNITED STATES","AIRCRAFT LANDED GEAR UP, JOHNSTOWN, PA.","INCIDENT","ALLEGHENY FSDO","N52885","","","CESSNA","177RG","No","UNKNOWN","PERSONAL","LANDING (LDG)","91","NONE","No","1","0","0","0","0","0","0","0","0","0","0","0","0","0","0","0","0","0","0","0"
"No","09-APR-24","09-APR-24","01:09:00Z","BALTIMORE","MARYLAND","UNITED STATES","AIRCRAFT STRUCK A BIRD DAMAGING LEADING EDGE, BALTIMORE, MD.","INCIDENT","BALTIMORE FSDO","N558WN","SWA5762","SOUTHWEST AIRLINES","BOEING","737","No","UNKNOWN","COMMERCIAL","APPROACH (APR)","121","NONE","No","0","0","0","0","0","0","0","0","0","0","0","0","0","0","0","0","0","0","0","0"
"No","18-APR-24","15-APR-24","18:22:00Z","LONGVIEW","TEXAS","UNITED STATES","AIRCRAFT MADE A HARD LANDING ON THE RIGHT MAIN, STRIKING THE RIGHT WINGTIP, LONGVIEW, TX.","INCIDENT","NORTH TEXAS FSDO","N798L","","","AMERICAN CHAMPION","7ECA","No","UNKNOWN","INSTRUCTION","LANDING (LDG)","91","NONE","No","1","0","0","0","0","0","0","0","0","0","1","0","0","0","0","0","0","0","0","0"
"No","18-APR-24","17-APR-24","16:40:00Z","DENTON","TEXAS","UNITED STATES","AIRCRAFT DEPARTED, EXPERIENCED ENGINE ISSUES AND MADE AN EMERGENCY LANDING IN A FIELD, DENTON, TX.","INCIDENT","NORTH TEXAS FSDO","N3564W","","","PIPER","PA32","No","UNKNOWN","PERSONAL","TAKEOFF (TOF)","91","NONE","No","1","0","0","0","0","0","0","0","0","0","0","0","0","0","0","0","0","0","0","0"
"No","18-APR-24","17-APR-24","22:58:00Z","PHOENIX","ARIZONA","UNITED STATES","AIRCRAFT TAXIING AND CLIPPED THE REAR RUDDER OF N5999B, PHOENIX, AZ.","INCIDENT","SCOTTSDALE FSDO","N207NX","","","PILATUS","PC12","No","UNKNOWN","PERSONAL","TAXI (TXI)","91","NONE","No","1","0","0","0","0","0","0","0","0","0","2","0","0","0","0","0","0","0","0","0"
"No","18-APR-24","17-APR-24","22:58:00Z","PHOENIX","ARIZONA","UNITED STATES","AIRCRAFT WAS HOLDING SHORT OF RUNWAY AND REAR RUDDER WAS CLIPPED BY N207NX, PHOENIX, AZ.","INCIDENT","SCOTTSDALE FSDO","N5999B","","","CESSNA","182","No","UNKNOWN","PERSONAL","STANDING (STD)","91","NONE","No","1","0","0","0","0","0","0","0","0","0","0","0","0","0","0","0","0","0","0","0"
"No","18-APR-24","17-APR-24","15:30:00Z","STILLWATER","OKLAHOMA","UNITED STATES","AIRCRAFT LANDED AND POST FLIGHT INSPECTION REVEALED A PROP STRIKE AND DAMAGE TO UNDERSIDE OF BOTH WINGS, STILLWATER, OK.","INCIDENT","WILL ROGERS FSDO","N426B","","","BEECH","A35","No","UNKNOWN","PERSONAL","LANDING (LDG)","91","NONE","No","1","0","0","0","0","0","0","0","0","0","3","0","0","0","0","0","0","0","0","0"
"No","18-APR-24","17-APR-24","18:00:00Z","SANTA TERESA","NEW MEXICO","UNITED STATES","AIRCRAFT PERFORMING TOUCH-AND-GO VEERED OFF RUNWAY INTO A DITCH, SANTA TERESA, NM.","INCIDENT","ALBUQUERQUE FSDO","N8230W","","","PIPER","PA28","No","UNKNOWN","UNKNOWN","MANEUVERING (MNV)","91","NONE","No","1","0","0","0","0","0","0","0","0","0","1","0","0","0","0","0","0","0","0","0"
"No","18-APR-24","17-APR-24","18:34:00Z","MOBERLY","MISSOURI","UNITED STATES","AIRCRAFT STRUCK A BIRD AND LANDED IN A FIELD, MOBERLY, MO.","INCIDENT","KANSAS CITY FSDO","N12521","","","CESSNA","172","No","MINOR","OTHER","UNKNOWN (UNK)","91","NONE","No","1","0","0","0","0","0","0","0","0","0","0","0","0","0","0","0","0","0","0","0"
"No","18-APR-24","17-APR-24","10:45:00Z","MILWAUKEE","WISCONSIN","UNITED STATES","AIRCRAFT STRUCK BIRDS ON LANDING DAMAGING FUSELAGE ON RIGHT SIDE, MILWAUKEE, WI.","INCIDENT","MILWAUKEE FSDO","N605GT","ABX2042","ABX AIR","BOEING","767","No","UNKNOWN","CARGO","LANDING (LDG)","121","NONE","No","2","0","0","0","0","0","0","0","0","0","0","0","0","0","0","0","0","0","0","0"
"No","19-APR-24","17-APR-24","10:45:00Z","MILWAUKEE","WISCONSIN","UNITED STATES","AIRCRAFT DECLARED AN EMERGENCY DUE TO STRIKING SEVERAL SEAGULLS FLYING ACROSS THE RUNWAY
AS ACFT WAS ABOUT TO TOUCHDOWN. POST FLIGHT INSPECTION REVEALED DAMAGE TO FAN
BLADES OF RIGHT ENGINE","INCIDENT","MILWAUKEE","N650GT","","","BOEING","B767","No","MINOR","CARGO","LANDING (LDG)","","NONE","No","2","0","0","0","0","0","0","0","0","0","0","0","0","0","0","0","0","0","0","0"
"No","16-APR-24","15-APR-24","16:30:00Z","STATESVILLE","NORTH CAROLINA","UNITED STATES","AIRCRAFT LANDED GEAR UP, STATESVILLE, NC.","INCIDENT","CHARLOTTE FSDO","N4312D","","","BEECH","G35","No","UNKNOWN","PERSONAL","LANDING (LDG)","91","NONE","No","1","0","0","0","0","0","0","0","0","0","0","0","0","0","0","0","0","0","0","0"
"No","16-APR-24","15-APR-24","16:40:00Z","MADISON","WISCONSIN","UNITED STATES","AIRCRAFT BLEW A TIRE WHILE TAXIING FOR DEPARTURE, MADISON, WI.","INCIDENT","MILWAUKEE FSDO","N8157Z","","","CIRRUS","SR20","No","MINOR","PERSONAL","TAXI (TXI)","91","NONE","No","1","0","0","0","0","0","0","0","0","0","0","0","0","0","0","0","0","0","0","0"
"No","16-APR-24","15-APR-24","18:07:00Z","SHELBYVILLE","TENNESSEE","UNITED STATES","AIRCRAFT LANDED, ENCOUNTERED A GUST OF WIND AND FLIPPED OVER, SHELBYVILLE, TN.","INCIDENT","NASHVILLE FSDO","N73605","","","CESSNA","172","No","UNKNOWN","UNKNOWN","LANDING (LDG)","91","NONE","No","1","0","0","0","0","0","0","0","0","0","0","0","0","0","0","0","0","0","0","0"
"No","17-APR-24","16-APR-24","17:20:00Z","ASHLAND","MISSOURI","UNITED STATES","AIRCRAFT CRASHED INTO TREES UNDER UNKNOWN CIRCUMSTANCES, ASHLAND, MO.","ACCIDENT","KANSAS CITY FSDO","N451MA","","","PIPER","PA46","No","SUBSTANTIAL","PERSONAL","EN ROUTE (ENR)","91","FATAL","Yes","0","0","0","1","0","0","0","0","0","0","0","0","0","0","0","0","0","0","0","0"
"No","17-APR-24","31-MAR-24","17:00:00Z","CONYERS","GEORGIA","UNITED STATES","AIRCRAFT DURING AN ABORTED TAKEOFF, OVERRAN THE RUNWAY AND CAME TO REST IN A POND, CONYERS, GA.","ACCIDENT","ATLANTA FSDO","N3420E","","","AERONCA","11AC","No","SUBSTANTIAL","PERSONAL","TAKEOFF (TOF)","91","MINOR","No","0","1","0","0","0","0","0","0","0","0","0","0","0","0","0","0","0","0","0","0"
"No","17-APR-24","16-APR-24","15:47:00Z","SUSSEX","NEW JERSEY","UNITED STATES","AIRCRAFT PERFORMING A GO-AROUND, STALLED AND CRASHED NEAR THE RUNWAY, SUSSEX, NJ.","INCIDENT","ALLENTOWN FSDO","N150RZ","","","CESSNA","150","No","UNKNOWN","PERSONAL","MANEUVERING (MNV)","91","MINOR","No","0","1","0","0","0","0","0","0","0","0","0","0","0","0","0","0","0","0","0","0"
"No","15-APR-24","14-APR-24","05:28:00Z","SAN BERNARDINO","CALIFORNIA","UNITED STATES","AIRCRAFT CRASHED UNDER UNKNOWN CIRCUMSTANCES, SAN BERNARDINO, CA.","ACCIDENT","RIVERSIDE FSDO","N965BC","","","GULFSTREAM","695A","No","UNKNOWN","UNKNOWN","EN ROUTE (ENR)","91","FATAL","Yes","0","0","0","1","0","0","0","0","0","0","0","0","0","0","0","0","0","0","0","0"
"Yes","15-APR-24","12-APR-24","20:35:00Z","POWELL","TENNESSEE","UNITED STATES","AIRCRAFT CRASHED UNDER UNKNOWN CIRCUMSTANCES NEAR A ROAD, POWELL, TN.","ACCIDENT","NASHVILLE FSDO","N9236J","","","PIPER","PA32R","No","SUBSTANTIAL","PERSONAL","EN ROUTE (ENR)","91","FATAL","Yes","0","0","0","1","0","0","0","0","0","0","0","0","0","0","0","0","0","0","0","0"
"No","15-APR-24","15-APR-24","00:15:00Z","TORRANCE","CALIFORNIA","UNITED STATES","AIRCRAFT EXPERIENCED ENGINE ISSUES BEFORE CRASHING INTO THE OCEAN AND PILOT WAS ABLE TO SWIM TO SHORE, TORRANCE, CA.","ACCIDENT","LONG BEACH FSDO","N8047S","","","PIPER","PA32R","No","SUBSTANTIAL","PERSONAL","UNKNOWN (UNK)","91","NONE","No","1","0","0","0","0","0","0","0","0","0","0","0","0","0","0","0","0","0","0","0"
"No","15-APR-24","13-APR-24","17:55:00Z","ST LOUIS","MISSOURI","UNITED STATES","AIRCRAFT VEERED OFF RUNWAY DURING TAKEOFF ROLL FOR UNKNOWN REASONS DAMAGING NOSE, RIGHT MAIN GEAR, WING AND PROP, ST LOUIS, MO.","INCIDENT","ST LOUIS FSDO","N594M","","","CIRRUS","SR20","No","UNKNOWN","PERSONAL","TAKEOFF (TOF)","91","NONE","No","1","0","0","0","0","0","0","0","0","0","1","0","0","0","0","0","0","0","0","0"
"No","15-APR-24","15-APR-24","01:30:00Z","ROCKY MOUNT","NORTH CAROLINA","UNITED STATES","AIRCRAFT EXPEREINCED ENGINE ISSUES AND CRASHED NEAR A ROAD, ROCKY MOUNT, NC.","ACCIDENT","GREENSBORO FSDO","N3FR","","","CESSNA","R172","No","DESTROYED","PERSONAL","UNKNOWN (UNK)","91","NONE","No","1","0","0","0","0","0","0","0","0","0","0","0","0","0","0","0","0","0","0","0"
"No","15-APR-24","13-APR-24","13:15:00Z","ORLANDO","FLORIDA","UNITED STATES","AIRCRAFT PERFORMING TOUCH AND GO INCURRED A TAIL STRIKE, ORLANDO, FL.","INCIDENT","ORLANDO FSDO","N828ER","ERU828","EMBRY RIDDLE AERONAUTICAL UNIVERSITY","TEXTRON","172","No","UNKNOWN","FAR 141 PILOT SCHOOL","MANEUVERING (MNV)","91","NONE","No","1","0","0","0","0","0","0","0","0","0","1","0","0","0","0","0","0","0","0","0"
"No","15-APR-24","13-APR-24","20:20:00Z","ZEPHYRHILLS","FLORIDA","UNITED STATES","AIRCRAFT ON TAKEOFF ROLL AND FRONT NOSE GEAR COLLAPSED, ZEPHYRHILLS, FL.","INCIDENT","TAMPA FSDO","N17AT","","","BEECH","76","No","MINOR","PERSONAL","TAKEOFF (TOF)","91","NONE","No","1","0","0","0","0","0","0","0","0","0","0","0","0","0","0","0","0","0","0","0"
"No","15-APR-24","14-APR-24","22:56:00Z","PORTSMOUTH","NEW HAMPSHIRE","UNITED STATES","AIRCRAFT LANDED AND VEERED OFF RUNWAY INTO THE GRASS, PORTSMOUTH, NH.","INCIDENT","PORTLAND ME FSDO","N19LH","","","ROCKWELL INTERNATIONAL","114","No","UNKNOWN","PERSONAL","LANDING (LDG)","91","NONE","No","1","0","0","0","0","0","0","0","0","0","0","0","0","0","0","0","0","0","0","0"
"No","15-APR-24","15-APR-24","01:00:00Z","LUTHER","OKLAHOMA","UNITED STATES","AIRCRAFT PRACTICING TOUCH AND GOS, LOST POWER ON DEPARTURE AND CRASHED, LUTHER, OK.","INCIDENT","WILL ROGERS FSDO","N124BM","","","EXPERIMENTAL","SE5A REPLICA","No","UNKNOWN","PERSONAL","MANEUVERING (MNV)","91","MINOR","No","0","1","0","0","0","0","0","0","0","0","0","0","0","0","0","0","0","0","0","0"
"No","15-APR-24","14-APR-24","23:05:00Z","ORMOND BEACH","FLORIDA","UNITED STATES","AIRCRAFT LANDED GEAR UP, ORMOND BEACH, FL.","INCIDENT","ORLANDO FSDO","N405XP","","","SCODA AERONAUTICA","SUPER PETREL XP","No","UNKNOWN","PERSONAL","LANDING (LDG)","91","NONE","No","1","0","0","0","0","0","0","0","0","0","1","0","0","0","0","0","0","0","0","0"
"No","15-APR-24","12-APR-24","15:05:00Z","HOUSTON","TEXAS","UNITED STATES","AIRCRAFT LANDED AND VEERED OFF RUNWAY INTO THE GRASS, HOUSTON, TX.","INCIDENT","HOUSTON FSDO","N517AF","","","PIPER","PA28","No","UNKNOWN","UNKNOWN","LANDING (LDG)","91","NONE","No","1","0","0","0","0","0","0","0","0","0","0","0","0","0","0","0","0","0","0","0"
"No","15-APR-24","13-APR-24","19:09:00Z","SCOTTSDALE","ARIZONA","UNITED STATES","AIRCRAFT LANDED AND NOSE GEAR COLLAPSED, SCOTTSDALE, AZ.","INCIDENT","SCOTTSDALE FSDO","N522RK","","","CIRRUS","SR22T","No","MINOR","PERSONAL","LANDING (LDG)","91","NONE","No","1","0","0","0","0","0","0","0","0","0","3","0","0","0","0","0","0","0","0","0"
"No","15-APR-24","13-APR-24","16:29:00Z","SAVANNAH","GEORGIA","UNITED STATES","AIRCRAFT LANDED AND WHILE TAXIING TO THE FBO, STRUCK A FENCE, SAVANNAH, GA.","INCIDENT","ATLANTA FSDO","N528MJ","","","CESSNA","182","No","UNKNOWN","PERSONAL","TAXI (TXI)","91","NONE","No","1","0","0","0","0","0","0","0","0","0","0","0","0","0","0","0","0","0","0","0"
"No","15-APR-24","12-APR-24","15:08:00Z","CONCORD","NORTH CAROLINA","UNITED STATES","AIRCRAFT GEAR COLLAPSED ON LANDING, CONCORD, NC.","INCIDENT","CHARLOTTE FSDO","N777NT","","","CESSNA","210","No","UNKNOWN","PERSONAL","LANDING (LDG)","91","NONE","No","1","0","0","0","0","0","0","0","0","0","1","0","0","0","0","0","0","0","0","0"
"No","15-APR-24","12-APR-24","20:28:00Z","GRAND FORKS","NORTH DAKOTA","UNITED STATES","AIRCRAFT ON TAKEOFF AND VEERED INTO THE GRASS, GRAND FORKS, ND.","INCIDENT","FARGO FSDO","N817ND","","","PIPER","PA28","No","UNKNOWN","PERSONAL","TAKEOFF (TOF)","91","NONE","No","1","0","0","0","0","0","0","0","0","0","0","0","0","0","0","0","0","0","0","0"
"No","15-APR-24","13-APR-24","18:20:00Z","SAN ANTONIO","TEXAS","UNITED STATES","AIRCRAFT ENCOUNTERED A  GUST OF WIND AFTER LANDING AND WENT INTO THE GRASS, SAN ANTONIO, TX.","INCIDENT","SAN ANTONIO FSDO","N823HE","","","VANS","RV14","No","UNKNOWN","PERSONAL","LANDING (LDG)","91","NONE","No","1","0","0","0","0","0","0","0","0","0","0","0","0","0","0","0","0","0","0","0"
"No","15-APR-24","12-APR-24","02:00:00Z","KALAUPAPA","HAWAII","UNITED STATES","AIRCRAFT LANDED AND WENT OFF END OF RUNWAY, KALAUPAPA, HI.","INCIDENT","HONOLULU FSDO","N839MA","","SOUTHERN AIRWAYS EXPRESS","CESSNA","208","No","NONE","ON DEMAND","LANDING (LDG)","135","NONE","No","2","0","0","0","0","0","0","0","0","0","9","0","0","0","0","0","0","0","0","0"
"No","15-APR-24","12-APR-24","18:20:00Z","CROSS CITY","FLORIDA","UNITED STATES","AIRCRAFT MASTER SWITCH WAS INADVERTENTLY TURNED OFF AND LANDED IN A FIELD, CROSS CITY, FL.","INCIDENT","TAMPA FSDO","N878DC","","","ZENITH","STOL CH750","No","UNKNOWN","PERSONAL","EN ROUTE (ENR)","91","NONE","No","1","0","0","0","0","0","0","0","0","0","0","0","0","0","0","0","0","0","0","0"
"No","16-APR-24","13-APR-24","22:21:00Z","PUEBLO","COLORADO","UNITED STATES","AIRCRAFT ABORTED TAKEOFF DUE TO SMOKE COMING FROM THE RIGHT SIDE LANDING GEAR AND ARFF EXTINGUISHED THE FIRE, PUEBLO, CO.","INCIDENT","DENVER FSDO","N50GK","","","PIPER","PA46","No","MINOR","PERSONAL","TAKEOFF (TOF)","91","NONE","No","1","0","0","0","0","0","0","0","0","0","0","0","0","0","0","0","0","0","0","0"
"No","15-APR-24","15-APR-24","03:18:00Z","SACRAMENTO","CALIFORNIA","UNITED STATES","AIRCRAFT STRUCK A BIRD ON TAKEOFF, SACRAMENTO, CA.","INCIDENT","SACRAMENTO FSDO","N920TA","","","CESSNA","172","No","UNKNOWN","UNKNOWN","TAKEOFF (TOF)","91","NONE","No","1","0","0","0","0","0","0","0","0","0","1","0","0","0","0","0","0","0","0","0"
"No","15-APR-24","12-APR-24","20:23:00Z","MONROEVILLE","ALABAMA","UNITED STATES","AIRCRAFT RIGHT LANDING GEAR COLLAPSED ON LANDING, MONROEVILLE, AL.","INCIDENT","ALABAMA AND NW FLORIDA FSDO","N3686B","","","NAVION","G","No","UNKNOWN","PERSONAL","LANDING (LDG)","91","NONE","No","1","0","0","0","0","0","0","0","0","0","1","0","0","0","0","0","0","0","0","0"
"No","15-APR-24","13-APR-24","15:00:00Z","WINTER HAVEN","FLORIDA","UNITED STATES","AIRCRAFT LANDED GEAR UP, WINTER HAVEN, FL.","ACCIDENT","ORLANDO FSDO","N3846H","","","MOONEY","M20J","No","SUBSTANTIAL","PERSONAL","LANDING (LDG)","91","NONE","No","1","0","0","0","0","0","0","0","0","0","0","0","0","0","0","0","0","0","0","0"
"No","15-APR-24","12-APR-24","22:18:00Z","WILLCOX","ARIZONA","UNITED STATES","AIRCRAFT ENCOUNTERED A WIND GUST WHILE DEPARTING AND WAS PUSHED INTO A WALL NEAR THE RUNWAY SHEARING OFF LEFT LANDING GEAR, WILLCOX, AZ.","INCIDENT","SCOTTSDALE FSDO","N4011R","","","PIPER","PA32","No","UNKNOWN","OTHER","TAKEOFF (TOF)","91","NONE","No","1","0","0","0","0","0","0","0","0","0","2","0","0","0","0","0","0","0","0","0"
