"UPDATED","ENTRY_DATE","EVENT_LCL_DATE","EVENT_LCL_TIME","LOC_CITY_NAME","LOC_STATE_NAME","LOC_CNTRY_NAME","RMK_TEXT","EVENT_TYPE_DESC","FSDO_DESC","REGIST_NBR","FLT_NBR","ACFT_OPRTR","ACFT_MAKE_NAME","ACFT_MODEL_NAME","ACFT_MISSING_FLAG","ACFT_DMG_DESC","FLT_ACTIVITY","FLT_PHASE","FAR_PART","MAX_INJ_LVL","FATAL_FLAG","FLT_CRW_INJ_NONE","FLT_CRW_INJ_MINOR","FLT_CRW_INJ_SERIOUS","FLT_CRW_INJ_FATAL","FLT_CRW_INJ_UNK","CBN_CRW_INJ_NONE","CBN_CRW_INJ_MINOR","CBN_CRW_INJ_SERIOUS","CBN_CRW_INJ_FATAL","CBN_CRW_INJ_UNK","PAX_INJ_NONE","PAX_INJ_MINOR","PAX_INJ_SERIOUS","PAX_INJ_FATAL","PAX_INJ_UNK","GRND_INJ_NONE","GRND_INJ_MINOR","GRND_INJ_SERIOUS","GRND_INJ_FATAL","GRND_INJ_UNK"
"No","17-OCT-22","15-OCT-22","21:32:00Z","PETALUMA","CALIFORNIA","UNITED STATES","AIRCRAFT LANDED, VEERED OFF RUNWAY DUE TO A WIND GUST AND FLIPPED OVER, PETALUMA, CA.","ACCIDENT","OAKLAND FSDO","N42PT","","","BOEING","A75N","No","SUBSTANTIAL","PERSONAL","LANDING (LDG)","91","NONE","No","1","0","0","0","0","0","0","0","0","0","0","0","0","0","0","0","0","0","0","0"
"No","17-OCT-22","15-OCT-22","20:00:00Z","DALLAS","TEXAS","UNITED STATES","AIRCRAFT EXPERIENCED ENGINE ISSUES, STRUCK POWERLINE AND ROAD SIGN, DALLAS, TX.","INCIDENT","NORTH TEXAS FSDO","N84LT","","","DIAMOND","DA62","No","UNKNOWN","PERSONAL","APPROACH (APR)","91","NONE","No","1","0","0","0","0","0","0","0","0","0","1","0","0","0","0","0","0","0","0","0"
"No","17-OCT-22","15-OCT-22","17:15:00Z","CHICO","CALIFORNIA","UNITED STATES","AIRCRAFT ABORTED TAKEOFF AFTER LOSING CARGO DOOR, CHICO, CA.","INCIDENT","SACRAMENTO FSDO","N169BZ","","","LANCAIR","LEGACY 2000","No","UNKNOWN","PERSONAL","TAKEOFF (TOF)","91","NONE","No","1","0","0","0","0","0","0","0","0","0","0","0","0","0","0","0","0","0","0","0"
"No","17-OCT-22","15-OCT-22","16:04:00Z","PRESCOTT","ARIZONA","UNITED STATES","AIRCRAFT PRACTICING TOUCH AND GOS, WENT OFF THE RUNWAY, HIT A SIGN AND FLIPPED OVER, PRESCOTT, AZ.","ACCIDENT","SCOTTSDALE FSDO","N270L","","","AEROPRAKT MANUFACTURING SP ZOO","A22LS","No","SUBSTANTIAL","PERSONAL","MANEUVERING (MNV)","91","MINOR","No","0","1","0","0","0","0","0","0","0","0","0","0","0","0","0","0","0","0","0","0"
"No","17-OCT-22","16-OCT-22","19:17:00Z","LEBANON","NEW HAMPSHIRE","UNITED STATES","AIRCRAFT LANDED AND WHILE TAXIING STRUCK A TAXIWAY LIGHT, LEBANON, NH.","INCIDENT","PORTLAND ME FSDO","N220MD","CYO220","","LEARJET","60","No","UNKNOWN","ON DEMAND","TAXI (TXI)","135","NONE","No","2","0","0","0","0","0","0","0","0","0","0","0","0","0","0","0","0","0","0","0"
"No","17-OCT-22","14-OCT-22","21:50:00Z","PELL CITY","ALABAMA","UNITED STATES","AIRCRAFT LANDED IN A RESIDENTIAL BACKYARD DUE TO ENGINE ISSUES, PELL CITY, AL.","INCIDENT","ALABAMA AND NW FLORIDA FSDO","N302BM","","","GLASAIR","SPORTSMAN GS2","No","MINOR","PERSONAL","EN ROUTE (ENR)","91","NONE","No","1","0","0","0","0","0","0","0","0","0","0","0","0","0","0","0","0","0","0","0"
"No","27-OCT-22","23-OCT-22","00:15:00Z","WARREN","OHIO","UNITED STATES","AIRCRAFT DEPARTED A PRIVATE FIELD, EXPERIENCED ELEVATOR CONTROL ISSUES, CRASHED INTO A NEARBY FIELD, POST CRASH FIRE","ACCIDENT","CLEVELAND FSDO","N160JR","","","STOLP STARDUSTER","SA300","No","DESTROYED","PERSONAL","INITIAL CLIMB (ICL)","91","SERIOUS","No","0","0","1","0","0","0","0","0","0","0","0","0","1","0","0","0","0","0","0","0"
"No","17-OCT-22","16-OCT-22","18:40:00Z","HUNTSVILLE","ALABAMA","UNITED STATES","AIRCRAFT COWLING BOLT SEPARATED AND STRUCK THE PROPELLER AND RETURNED TO LAND, HUNTSVILLE, AL.","INCIDENT","ALABAMA AND NW FLORIDA FSDO","N428MB","","","PROGRESSIVE AERODYNE","SEAREY","No","UNKNOWN","PERSONAL","UNKNOWN (UNK)","91","NONE","No","1","0","0","0","0","0","0","0","0","0","0","0","0","0","0","0","0","0","0","0"
"No","17-OCT-22","17-OCT-22","00:48:00Z","INDIANAPOLIS","INDIANA","UNITED STATES","AIRCRAFT LANDED AND VEERED OFF RUNWAY INTO A DITCH, INDIANAPOLIS, IN.","INCIDENT","INDIANAPOLIS FSDO","N471TT","","","CIRRUS","SR20","No","UNKNOWN","PERSONAL","LANDING (LDG)","91","NONE","No","1","0","0","0","0","0","0","0","0","0","1","0","0","0","0","0","0","0","0","0"
"No","17-OCT-22","16-OCT-22","13:37:00Z","WEST ALEXANDRIA","OHIO","UNITED STATES","AIRCRAFT CRASHED UNDER UNKNOWN CIRCUMSTANCES IN A FIELD, WEST ALEXANDRIA, OH.","ACCIDENT","CINCINNATI FSDO","N48789","","","KOLB","FIRESTAR II","No","DESTROYED","PERSONAL","EN ROUTE (ENR)","91","SERIOUS","No","0","0","1","0","0","0","0","0","0","0","0","0","0","0","0","0","0","0","0","0"
"No","17-OCT-22","15-OCT-22","18:58:00Z","TUCSON","ARIZONA","UNITED STATES","AIRCRAFT LANDED, VEERED OFF RUNWAY INTO ROUGH TERRAIN, GEAR COLLAPSED AND LEFT WING CAME TO REST ON THE GROUND, TUCSON, AZ.","ACCIDENT","SCOTTSDALE FSDO","N7746Y","","","PIPER","PA30","No","SUBSTANTIAL","PERSONAL","LANDING (LDG)","91","NONE","No","1","0","0","0","0","0","0","0","0","0","1","0","0","0","0","0","0","0","0","0"
"No","17-OCT-22","16-OCT-22","18:55:00Z","DORRIS","CALIFORNIA","UNITED STATES","AIRCRAFT EXPERIENCED LOSS OF LIFT AND CAME TO REST IN A TREE, DORRIS, CA.","INCIDENT","SACRAMENTO FSDO","N8677P","","","POWRACHUTE","AIRWOLF 912ULS","No","MINOR","PERSONAL","TAKEOFF (TOF)","91","NONE","No","1","0","0","0","0","0","0","0","0","0","0","0","0","0","0","0","0","0","0","0"
"No","17-OCT-22","16-OCT-22","15:20:00Z","MESA","ARIZONA","UNITED STATES","AIRCRAFT LANDED GEAR UP, MESA, AZ.","INCIDENT","SCOTTSDALE FSDO","N9280P","","","PIPER","PA24","No","UNKNOWN","PERSONAL","LANDING (LDG)","91","NONE","No","1","0","0","0","0","0","0","0","0","0","0","0","0","0","0","0","0","0","0","0"
"No","17-OCT-22","15-OCT-22","01:30:00Z","DEAD COW","NEVADA","UNITED STATES","AIRCRAFT MADE A HARD LANDING ON LAKE BED AND GEAR COLLAPSED, DEAD COW, NV.","ACCIDENT","SACRAMENTO FSDO","N24186","","","PIPER","J3F-60","No","SUBSTANTIAL","PERSONAL","LANDING (LDG)","91","MINOR","No","1","0","0","0","0","0","0","0","0","0","0","1","0","0","0","0","0","0","0","0"
"No","27-OCT-22","26-OCT-22","21:10:00Z","MCEWEN","ARKANSAS","UNITED STATES","AIRCRAFT LANDED IN A FIELD DUE TO FUEL EXHAUSTION, THEN NOSED INTO A DITCH.","ACCIDENT","LITTLE ROCK FSDO","N8457D","","","PIPER","PA22","No","SUBSTANTIAL","PERSONAL","LANDING (LDG)","91","NONE","No","1","0","0","0","0","0","0","0","0","0","0","0","0","0","0","0","0","0","0","0"
"No","27-OCT-22","26-OCT-22","22:43:00Z","LONG BEACH","CALIFORNIA","UNITED STATES","AIRCRAFT LOST CONTROL ON LANDING TO THE RUNWAY AND GROUND LOOPED.","ACCIDENT","LONG BEACH FSDO","N75321","","","BOEING","PT17","No","SUBSTANTIAL","PERSONAL","LANDING (LDG)","91","NONE","No","1","0","0","0","0","0","0","0","0","0","1","0","0","0","0","0","0","0","0","0"
"No","27-OCT-22","26-OCT-22","00:30:00Z","MORGAN","LOUISIANA","UNITED STATES","AIRCRAFT CRASHED UNDER UNKNOWN CIRCUMSTANCES 20NM OFFSHORE FROM MORGAN CITY, LA.","ACCIDENT","BATON ROUGE FSDO","N34BM","UNKNOWN","GULF HELICOPTERS LLC","BELL","407","No","DESTROYED","COMMERCIAL","UNKNOWN (UNK)","135","FATAL","Yes","0","0","0","1","0","0","0","0","0","0","0","0","0","0","2","0","0","0","0","0"
"No","27-OCT-22","25-OCT-22","16:45:00Z","MOBILE","ALABAMA","UNITED STATES","AIRCRAFT STRUCK A BIRD DURING TAKEOFF ROLL, LOST ENGINE COWLING TO THE RIGHT ENGINE, ENGINE COWLING CAME TO REST AT THE DEPARTURE END OF THE RUNWAY.","INCIDENT","ALABAMA & NW FLORIDA FSDO","N785FD","FDX9030","FEDERAL EXPRESS CORP","BOEING","757-200","No","UNKNOWN","COMMERCIAL","TAKEOFF (TOF)","91","NONE","No","2","0","0","0","0","0","0","0","0","0","0","0","0","0","0","0","0","0","0","0"
"No","27-OCT-22","26-OCT-22","22:13:00Z","NAPA","CALIFORNIA","UNITED STATES","AIRCRAFT ON DEPARTURE STRUCK A LARGE FLOCK OF SMALL BIRDS, THE PIC REPORTED SIGNIFICANT DAMAGE TO THE RIGHT-SIDE ENGINE, AIRCRAFT RETURNED BACK TO THE RUNWAY.","INCIDENT","SACRAMENTO FSDO","N946WT","JTL946","JET LINX AVIATION","RAYTHEON","HAWKER 800XP","No","UNKNOWN","CORPORATE","TAKEOFF (TOF)","135","NONE","No","2","0","0","0","0","0","0","0","0","0","0","0","0","0","0","0","0","0","0","0"
"No","27-OCT-22","25-OCT-22","15:50:00Z","WINTER HAVEN","FLORIDA","UNITED STATES","AIRCRAFT EXPERIENCED MECHANICAL ISSUES WHILE CONDUCTING TOUCH AND GO APPROACHES, THE PILOT REPORTED ENGINE FAILURE AND WAS UNABLE TO RESTART THE ENGINE. THE AIRCRAFT STRUCK SEVERAL TREES AND CAME TO REST IN A FIELD.","INCIDENT","ORLANDO FSDO","N6ND","","","CHAMPION","7FC","No","UNKNOWN","PERSONAL","INITIAL CLIMB (ICL)","91","NONE","No","1","0","0","0","0","0","0","0","0","0","0","0","0","0","0","0","0","0","0","0"
"No","27-OCT-22","22-OCT-22","18:05:00Z","FREDERICK","MARYLAND","UNITED STATES","AIRCRAFT WAS CLEARED TO LAND, ON LANDING ROLL THE AIRCRAFT VEERED LEFT AND FOUND OUT THAT THEY HAD A FLAT TIRE. THE AIRCRAFT REQUIRED A TOW OFF OF THE RUNWAY TO GO BACK TO THE RAMP. LATER FOUND DAMAGE TO THE PROP.","INCIDENT","BALTIMORE FSDO","N471MR","","","CESSNA","172","No","MINOR","PERSONAL","LANDING (LDG)","91","NONE","No","1","0","0","0","0","0","0","0","0","0","0","0","0","0","0","0","0","0","0","0"
"Yes","17-OCT-22","16-OCT-22","22:29:00Z","CORDOVA","ALASKA","UNITED STATES","AIRCRAFT CRASHED UNDER UNKNOWN CIRCUMSTANCES IN ROUGH TERRAIN, CORDOVA, AK.","ACCIDENT","JUNEAU FSDO","N3432W","","","PIPER","PA32","No","SUBSTANTIAL","UNKNOWN","EN ROUTE (ENR)","135","FATAL","Yes","0","0","0","1","0","0","0","0","0","0","0","0","0","0","0","0","0","0","0","0"
"No","17-OCT-22","17-OCT-22","00:19:00Z","STATESBORO","GEORGIA","UNITED STATES","AIRCRAFT LANDED, TAXIED TO THE RAMP, A PASSENGER EXITED AND WAS STRUCK BY THE PROPELLER, STATESBORO, GA.","ACCIDENT","ATLANTA FSDO","N2476Y","","","CESSNA","172","No","UNKNOWN","PERSONAL","TAXI (TXI)","91","FATAL","Yes","1","0","0","0","0","0","0","0","0","0","2","0","0","1","0","0","0","0","0","0"
"No","17-OCT-22","14-OCT-22","14:55:00Z","KNOXVILLE","TENNESSEE","UNITED STATES","AIRCRAFT ON LANDING VEERED OFF RUNWAY, KNOXVILLE, TN.","INCIDENT","NASHVILLE FSDO","N26944","","","GULFSTREAM AMERICAN","AA-5A","No","UNKNOWN","INSTRUCTION","LANDING (LDG)","91","NONE","No","1","0","0","0","0","0","0","0","0","0","0","0","0","0","0","0","0","0","0","0"
"No","17-OCT-22","15-OCT-22","10:30:00Z","ELZABETHTOWN","KENTUCKY","UNITED STATES","AIRCRAFT WAS FOUND UNOCCUPIED IN A DITGH NEAR DEPARTURE END OF RUNWAY WITH LEFT MAIN GEAR DAMAGE, ELIZABETHTOWN, KY.","INCIDENT","LOUISVILLE FSDO","N63663","","","CESSNA","172","No","UNKNOWN","UNKNOWN","STANDING (STD)","","UNKNOWN","No","0","0","0","0","0","0","0","0","0","0","0","0","0","0","0","0","0","0","0","0"
"Yes","18-OCT-22","17-OCT-22","12:41:00Z","HOLLYWOOD","FLORIDA","UNITED STATES","AIRCRAFT CRASHED UNDER UNKNOWN CIRCUMSTANCES INTO A HOME OFF THE APPROACH END OF THE RUNWAY, HOLLYWOOD, FL.","ACCIDENT","SOUTH FLORIDA FSDO","N32856","","","AERO ADVENTURE","ADVENTURA II","No","DESTROYED","INSTRUCTION","APPROACH (APR)","91","FATAL","Yes","0","0","0","1","0","0","0","0","0","0","0","0","0","1","0","0","0","0","0","0"
"No","18-OCT-22","15-OCT-22","15:00:00Z","LAKE ISABEL","WASHINGTON","UNITED STATES","AIRCRAFT EXPERIENCED WINDSHEAR ON TAKEOFF AND CRASHED INTO THE LAKE, LAKE ISABEL, WA.","ACCIDENT","SEATTLE FSDO","N129KB","","","PROGRESSIVE AERODYNE","SEAREY","No","SUBSTANTIAL","PERSONAL","TAKEOFF (TOF)","91","NONE","No","1","0","0","0","0","0","0","0","0","0","1","0","0","0","0","0","0","0","0","0"
"No","18-OCT-22","16-OCT-22","14:00:00Z","BOSCOBEL","WISCONSIN","UNITED STATES","AIRCRAFT ON LANDING EXPERIENCED A GUST OF WIND AND WAS PUSHED OFF THE RUNWAY INTO THE GRASS DAMAGING LANDING GEAR, BOSCOBEL, WI.","INCIDENT","MILWAUKEE FSDO","N701BT","","","CIRRUS","SR22","No","UNKNOWN","PERSONAL","LANDING (LDG)","91","NONE","No","1","0","0","0","0","0","0","0","0","0","1","0","0","0","0","0","0","0","0","0"
"Yes","18-OCT-22","17-OCT-22","23:05:00Z","MOKULEIA","HAWAII","UNITED STATES","AIRCRAFT LANDED GEAR UP, MOKULEIA, HI.","INCIDENT","HONOLULU FSDO","N1302J","","","ROCKWELL INTERNATIONAL","112A","No","MINOR","PERSONAL","LANDING (LDG)","91","NONE","No","1","0","0","0","0","0","0","0","0","0","0","0","0","0","0","0","0","0","0","0"
"No","18-OCT-22","14-OCT-22","20:00:00Z","LAWRENCEBURG","TENNESSEE","UNITED STATES","AIRCRAFT SLID OFF THE RUNWAY DUE TO A GUST OF WIND DAMAGING NOSE AND TAIL, LAWRENCEBURG, TN.","ACCIDENT","NASHVILLE FSDO","N63597","","","HOWARD AIRCRAFT","DGA-15P","No","SUBSTANTIAL","PERSONAL","UNKNOWN (UNK)","91","NONE","No","1","0","0","0","0","0","0","0","0","0","0","0","0","0","0","0","0","0","0","0"
"No","18-OCT-22","15-OCT-22","12:30:00Z","SALEM","NEW HAMPSHIRE","UNITED STATES","AIRCRAFT STRUCK THE ROOF OF A HOME DAMAGING THE ROOF AND CHIMNEY, SALEM, NH.","INCIDENT","PORTLAND ME FSDO","N75213","","","KUBICEK","BB51Z","No","NONE","PERSONAL","UNKNOWN (UNK)","91","NONE","No","1","0","0","0","0","0","0","0","0","0","1","0","0","0","0","0","0","0","0","0"
"No","19-OCT-22","18-OCT-22","15:56:00Z","RAPID CITY","SOUTH DAKOTA","UNITED STATES","AIRCRAFT NOSE GEAR COLLAPSED ON LANDING, RAPID CITY, SD.","INCIDENT","RAPID CITY FSDO","N85WC","","","CIRRUS","SR22","No","UNKNOWN","PERSONAL","LANDING (LDG)","91","NONE","No","1","0","0","0","0","0","0","0","0","0","0","0","0","0","0","0","0","0","0","0"
"No","19-OCT-22","18-OCT-22","17:05:00Z","EVANSTON","WYOMING","UNITED STATES","AIRCRAFT ON TAKEOFF, BECAME AIRBORNE AND SETTLED BACK DOWN ON RUNWAY, VEERED OFF RUNWAY AND GEAR COLLAPSED AND INCURRRED A PROP STRIKE, EVANSTON, WY.","INCIDENT","DENVER FSDO","N5793C","","","CESSNA","170","No","UNKNOWN","PERSONAL","TAKEOFF (TOF)","91","NONE","No","1","0","0","0","0","0","0","0","0","0","0","0","0","0","0","0","0","0","0","0"
"No","19-OCT-22","15-OCT-22","15:30:00Z","MARBLE CANYON","ARIZONA","UNITED STATES","AIRCRAFT DEPARTED, ATTEMPTED AN APPROACH AND DID A NOSE DIVE CRASHING SHORT OF THE AIRSTRIP, MARBLE CANYON, AZ.","INCIDENT","LAS VEGAS FSDO","N6031Q","","","MOONEY","M20E","No","UNKNOWN","PERSONAL","TAKEOFF (TOF)","91","UNKNOWN","No","0","0","0","0","1","0","0","0","0","0","0","0","0","0","0","0","0","0","0","0"
"No","19-OCT-22","18-OCT-22","13:20:00Z","WINCHESTER","VIRGINIA","UNITED STATES","AIRCRAFT INCURRED A PROP STRIKE AND VEERED OFF RUNWAY DURING LANDING, WINCHESTER, VA.","INCIDENT","WASHINGTON FSDO","N7518W","","","PIPER","PA28","No","UNKNOWN","PERSONAL","LANDING (LDG)","91","NONE","No","1","0","0","0","0","0","0","0","0","0","2","0","0","0","0","0","0","0","0","0"
"No","19-OCT-22","18-OCT-22","17:53:00Z","ORLANDO","FLORIDA","UNITED STATES","AIRCRAFT STRUCK A BIRD LEAVING A DENT IN THE ENGINE COWLING, ORLANDO, FL.","INCIDENT","ORLANDO FSDO","N528ND","","AEROSIM ACADEMY","CESSNA","172","No","MINOR","FAR 141 PILOT SCHOOL","APPROACH (APR)","91","NONE","No","1","0","0","0","0","0","0","0","0","0","1","0","0","0","0","0","0","0","0","0"
"No","20-OCT-22","14-OCT-22","21:00:00Z","MONTGOMERY","ALABAMA","UNITED STATES","AIRCRAFT LANDED HARD AND INCURRED A PROP STRIKE, MONTGOMERY, AL.","INCIDENT","ALABAMA AND NW FLORIDA FSDO","N11NT","","","PIPER","PA28","No","UNKNOWN","PERSONAL","LANDING (LDG)","91","NONE","No","1","0","0","0","0","0","0","0","0","0","0","0","0","0","0","0","0","0","0","0"
"No","20-OCT-22","19-OCT-22","19:40:00Z","IMMOKALEE","FLORIDA","UNITED STATES","AIRCRAFT STRUCK A BIRD, IMMOKALEE, FL.","INCIDENT","SOUTH FLORIDA FSDO","N120VA","","","VULCANAIR","V1.0","No","MINOR","PERSONAL","EN ROUTE (ENR)","91","NONE","No","1","0","0","0","0","0","0","0","0","0","0","0","0","0","0","0","0","0","0","0"
"No","20-OCT-22","19-OCT-22","16:00:00Z","MANKATO","MINNESOTA","UNITED STATES","AIRCRAFT EXPERIENCED A RUNWAY EXCURSION, INCURRED A PROP STRIKE AND GEAR COLLAPSED, MANKATO, MN.","INCIDENT","MINNEAPOLIS FSDO","N349MK","","","PIPER","PA28","No","UNKNOWN","INSTRUCTION","UNKNOWN (UNK)","91","NONE","No","1","0","0","0","0","0","0","0","0","0","0","0","0","0","0","0","0","0","0","0"
"No","17-OCT-22","14-OCT-22","21:12:00Z","DAYTONA BEACH","FLORIDA","UNITED STATES","AIRCRAFT CRASHED ON LANDING AND CAME TO REST ON ITS SIDE, DAYTONA BEACH, FL.","INCIDENT","ORLANDO FSDO","N306MB","","","ROBINSON","R44","No","UNKNOWN","SIGHT SEEING","LANDING (LDG)","","UNKNOWN","No","0","0","0","0","1","0","0","0","0","0","0","0","0","0","0","0","0","0","0","0"
"No","21-OCT-22","20-OCT-22","17:10:00Z","GEORGETOWN","CALIFORNIA","UNITED STATES","AIRCRAFT LOST CONTROL DURING LANDING, RAN OFF THE RUNWAY, RIGHT LANDING GEAR SEPARATED FROM THE AIRCRAFT, GEORGETOWN, CALIFORNIA.","INCIDENT","SACRAMENTO FSDO","N55DC","","","CESSNA","140","No","UNKNOWN","PERSONAL","LANDING (LDG)","91","NONE","No","1","0","0","0","0","0","0","0","0","0","0","0","0","0","0","0","0","0","0","0"
"No","21-OCT-22","20-OCT-22","00:40:00Z","MILWAUKEE","WISCONSIN","UNITED STATES","AIRCRAFT DURING TAXI, RAN OVER TWO TAXIWAY LIGHTS, MILWAUKEE, WISCONSIN.","INCIDENT","MILWAUKEE FSDO","N7817J","SWA765","SOUTHWEST","BOEING","737","No","UNKNOWN","COMMERCIAL","TAXI (TXI)","121","NONE","No","2","0","0","0","0","0","0","0","0","0","0","0","0","0","0","0","0","0","0","0"
"No","24-OCT-22","22-OCT-22","17:20:00Z","YORK","PENNSYLVANIA","UNITED STATES","AIRCRAFT EXPERIENCED ENGINE ISSUES ON LANDING, LANDED HARD ON A HILL ADJACENT TO RUNWAY AND STRUCK A FENCE, YORK, PA.","INCIDENT","HARRISBURG FSDO","N36ZN","","","CESSNA","A185","No","UNKNOWN","PERSONAL","LANDING (LDG)","91","MINOR","No","0","1","0","0","0","0","0","0","0","0","0","0","0","0","0","0","0","0","0","0"
"No","24-OCT-22","21-OCT-22","18:30:00Z","DEVILS LAKE","NORTH DAKOTA","UNITED STATES","AIRCRAFT EXPERIENCED ENGINE FAILURE AFTER TAKEOFF, TEARDROPPED AND LANDED STRIKING THE RIGHT WINGTIP, DEVILS LAKE, ND.","INCIDENT","FARGO FSDO","N358TS","","","EXPERIMENTAL","WH4 HARPOON","No","UNKNOWN","PERSONAL","TAKEOFF (TOF)","91","NONE","No","1","0","0","0","0","0","0","0","0","0","2","0","0","0","0","0","0","0","0","0"
"No","24-OCT-22","21-OCT-22","19:30:00Z","COATESVILLE","PENNSYLVANIA","UNITED STATES","AIRCRAFT WENT OFF THE END OF THE RUNWAY FOR UNKNOWN REASONS, COATESVILLE, PA.","INCIDENT","PHILADELPHIA FSDO","N501MA","","","PIPER","PA28","No","UNKNOWN","PERSONAL","UNKNOWN (UNK)","91","NONE","No","1","0","0","0","0","0","0","0","0","0","0","0","0","0","0","0","0","0","0","0"
"No","24-OCT-22","22-OCT-22","17:30:00Z","VAN NUYS","CALIFORNIA","UNITED STATES","AIRCRAFT WAS TAXIING AND STRUCK N1064X WHICH WAS PARKED, VAN NUYS, CA.","INCIDENT","VAN NUYS FSDO","N537HF","","","CESSNA","172","No","MINOR","PERSONAL","TAXI (TXI)","91","NONE","No","1","0","0","0","0","0","0","0","0","0","0","0","0","0","0","0","0","0","0","0"
"No","24-OCT-22","22-OCT-22","17:30:00Z","VAN NUYS","CALIFORNIA","UNITED STATES","AIRCRAFT WAS PARKED PREPAREING FOR DEPARTURE AND WAS STRUCK BY N537HF, VAN NUYS, CA.","INCIDENT","VAN NUYS FSDO","N1064X","","","PIPER","PA28","No","MINOR","PERSONAL","STANDING (STD)","91","NONE","No","1","0","0","0","0","0","0","0","0","0","0","0","0","0","0","0","0","0","0","0"
"No","24-OCT-22","23-OCT-22","21:14:00Z","SACRAMENTO","CALIFORNIA","UNITED STATES","AIRCRAFT LANDED GEAR UP, SACRAMENTO, CA.","INCIDENT","SACRAMENTO FSDO","N4695J","","","PIPER","PA28R","No","UNKNOWN","PERSONAL","LANDING (LDG)","91","NONE","No","1","0","0","0","0","0","0","0","0","0","0","0","0","0","0","0","0","0","0","0"
"No","24-OCT-22","21-OCT-22","23:00:00Z","LINDEN","NEW JERSEY","UNITED STATES","AIRCRAFT LANDED GEAR UP, LINDEN, NJ.","INCIDENT","TETERBORO FSDO","N7655J","","","PIPER","PA28R","No","UNKNOWN","PERSONAL","LANDING (LDG)","91","NONE","No","1","0","0","0","0","0","0","0","0","0","0","0","0","0","0","0","0","0","0","0"
"No","24-OCT-22","23-OCT-22","21:00:00Z","SPARTANBURG","SOUTH CAROLINA","UNITED STATES","AIRCRAFT DEPARTED, EXPERIENCED ENGINE ISSUES AND LANDED ON A ROAD, SPARTANBURG, SC.","INCIDENT","COLUMBIA FSDO","N8580N","","","PIPER","PA28","No","MINOR","PERSONAL","TAKEOFF (TOF)","91","NONE","No","1","0","0","0","0","0","0","0","0","0","3","0","0","0","0","0","0","0","0","0"
"No","24-OCT-22","23-OCT-22","20:30:00Z","LAKE WORTH","FLORIDA","UNITED STATES","AIRCRAFT MADE A FORCED LANDING AT A PARK FOR UNKNOWN REASONS AFTER DEPARTURE, LAKE WORTH, FL.","INCIDENT","SOUTH FLORIDA FSDO","N39628","","","PIPER","PA32RT","No","UNKNOWN","PERSONAL","TAKEOFF (TOF)","91","MINOR","No","0","1","0","0","0","0","0","0","0","0","0","0","0","0","0","0","0","0","0","0"
"No","21-OCT-22","21-OCT-22","20:45:00Z","TOUGHKENAMON","PENNSYLVANIA","UNITED STATES","AIRCRAFT LANDED HARD AND VEERED OFF RUNWAY INTO AN EMBANKMENT AND FLIPPED OVER, TOUGHKENAMON, PA.","INCIDENT","PHILADELPHIA FSDO","N80619","","","CESSNA","172","No","UNKNOWN","INSTRUCTION","LANDING (LDG)","91","MINOR","No","0","1","0","0","0","0","0","0","0","0","0","0","0","0","0","0","0","0","0","0"
"No","24-OCT-22","22-OCT-22","14:30:00Z","POPLAR BLUFF","MISSOURI","UNITED STATES","AIRCRAFT LANDED AND GROUND LOOPED, POPLAR BLUFF, MO.","INCIDENT","ST LOUIS FSDO","N84096","","","AERONCA","7AC","No","UNKNOWN","INSTRUCTION","LANDING (LDG)","91","NONE","No","1","0","0","0","0","0","0","0","0","0","1","0","0","0","0","0","0","0","0","0"
"No","20-OCT-22","19-OCT-22","19:41:00Z","CHARLOTTE","NORTH CAROLINA","UNITED STATES","AIRCRAFT ENCOUNTERED MODERATE TURBULENCE INJURYING A FLIGHT ATTENDANT, CHARLOTTE, NC.","INCIDENT","CHARLOTTE FSDO","AAL2544","AAL2544","AMERICAN AIRLINES","AIRBUS","A321","No","NONE","COMMERCIAL","EN ROUTE (ENR)","121","MINOR","No","2","0","0","0","0","0","1","0","0","0","0","0","0","0","0","0","0","0","0","0"
"No","21-OCT-22","20-OCT-22","19:58:00Z","NOGALES","ARIZONA","UNITED STATES","AIRCRAFT WAS ON APPROACH WENT AROUND UNABLE TO GAIN ALTITUDE AND CRASH LANDED, NOGALES, ARIZONA.","ACCIDENT","SCOTTSDALE FSDO","N50JM","","","BEECH","35B","No","DESTROYED","PERSONAL","LANDING (LDG)","91","MINOR","No","0","1","0","0","0","0","0","0","0","0","0","1","0","0","0","0","0","0","0","0"
"No","28-OCT-22","28-OCT-22","01:30:00Z","FORT WORTH","TEXAS","UNITED STATES","AIRCRAFT EXPERIENCED ENGINE ISSUES AND LANDED SHORT OF THE RUNWAY, GEAR COLLAPSED AND SKIDDED INTO A FIELD, FORT WORTH, TX.","INCIDENT","NORTH TEXAS FSDO","N36X","","","CESSNA","T210","No","UNKNOWN","PERSONAL","APPROACH (APR)","91","NONE","No","1","0","0","0","0","0","0","0","0","0","1","0","0","0","0","0","0","0","0","0"
"No","21-OCT-22","20-OCT-22","16:35:00Z","SANFORD","FLORIDA","UNITED STATES","AIRCRAFT STRUCK BIRD DURING DEPARTURE, SANFORD, FLORIDA.","INCIDENT","ALLENTOWN FSDO","N235NV","AAY5312","ALLEGIANT AIR LINES","AIRBUS","A320","No","MINOR","COMMERCIAL","INITIAL CLIMB (ICL)","121","NONE","No","2","0","0","0","0","4","0","0","0","0","170","0","0","0","0","0","0","0","0","0"
"No","28-OCT-22","18-SEP-22","15:32:00Z","ALBANY","GEORGIA","UNITED STATES","AIRCRAFT ABORTED TAKEOFF WHEN IT DID NOT ROTATE ON DEPARTURE AND ENTERED THE OVERRUN AREA, ALBANY, GA.","INCIDENT","ATLANTA FSDO","N910AJ","","","ISRAEL AIRCRAFT","GULFSTREAM 100","No","NONE","UNKNOWN","TAKEOFF (TOF)","","NONE","No","2","0","0","0","0","0","0","0","0","0","0","0","0","0","0","0","0","0","0","0"
"No","28-OCT-22","27-OCT-22","19:20:00Z","AMARILLO","TEXAS","UNITED STATES","AIRCRAFT STRUCK A COYOTE ON TAKEOFF DAMAGING LEFT WHEEL FAIRING, AMARILLO, TX.","INCIDENT","LUBBOCK FSDO","N217SY","","","CIRRUS","SR22","No","MINOR","PERSONAL","TAKEOFF (TOF)","91","NONE","No","1","0","0","0","0","0","0","0","0","0","0","0","0","0","0","0","0","0","0","0"
"No","28-OCT-22","27-OCT-22","20:05:00Z","SARASOTA","FLORIDA","UNITED STATES","AIRCRAFT CRASHED FOR UNKNOWN REASONS NEAR A ROAD, SARASOTA, FL.","INCIDENT","TAMPA FSDO","N442H","","","ROBINSON","R44","No","UNKNOWN","UNKNOWN","EN ROUTE (ENR)","91","MINOR","No","0","1","0","0","0","0","0","0","0","0","0","1","0","0","0","0","0","0","0","0"
"No","28-OCT-22","27-OCT-22","21:15:00Z","LATROBE","PENNSYLVANIA","UNITED STATES","AIRCRAFT STRUCK A BIRD ON APPROACH LEAVING A DENT ON THE LEFT WING, LATROBE, PA.","INCIDENT","ALLEGHENY FSDO","N737HE","","","CESSNA","172","No","MINOR","INSTRUCTION","APPROACH (APR)","91","NONE","No","1","0","0","0","0","0","0","0","0","0","1","0","0","0","0","0","0","0","0","0"
"No","28-OCT-22","27-OCT-22","20:05:00Z","TUSKEGEE","ALABAMA","UNITED STATES","AIRCRAFT LANDED HARD DAMAGING LEFT MAIN GEAR STRUT, NOSE GEAR AND PROP, TUSKEGEE, AL.","INCIDENT","ALABAMA AND NW FLORIDA FSDO","N858AU","","AUBURN UNIVERSITY","CESSNA","172","No","UNKNOWN","FAR 141 PILOT SCHOOL","LANDING (LDG)","91","NONE","No","1","0","0","0","0","0","0","0","0","0","1","0","0","0","0","0","0","0","0","0"
"No","28-OCT-22","27-OCT-22","14:15:00Z","ROBERTA","GEORGIA","UNITED STATES","AIRCRAFT RAN OFF THE END OF THE RUNWAY FOR UNKNOWN REASONS, ROBERTA, GA.","ACCIDENT","ATLANTA FSDO","N4349R","","","CESSNA","172","No","SUBSTANTIAL","PERSONAL","LANDING (LDG)","91","MINOR","No","0","1","0","0","0","0","0","0","0","0","2","0","0","0","0","0","0","0","0","0"
"No","28-OCT-22","27-OCT-22","01:10:00Z","KENAI","ALASKA","UNITED STATES","AIRCRAFT DEPARTED, EXPERIENCED ENGINE ISSUES AND LANDED ON A ROAD, KENAI, AK.","INCIDENT","ANCHORAGE FSDO","N811PD","","","PIPER","PA22","No","UNKNOWN","INSTRUCTION","TAKEOFF (TOF)","91","NONE","No","1","0","0","0","0","0","0","0","0","0","1","0","0","0","0","0","0","0","0","0"
"No","28-OCT-22","26-OCT-22","22:43:00Z","LONG BEACH","CALIFORNIA","UNITED STATES","AIRCRAFT LOST CONTROL ON LANDING AND GROUND LOOPED, LONG BEACH, CA.","ACCIDENT","LONG BEACH FSDO","N75321","","","BOEING","A75N1","No","SUBSTANTIAL","PERSONAL","LANDING (LDG)","91","NONE","No","1","0","0","0","0","0","0","0","0","0","1","0","0","0","0","0","0","0","0","0"
"No","28-OCT-22","27-OCT-22","23:20:00Z","RICHMOND","VIRGINIA","UNITED STATES","AIRCRAFT LANDED AND POST FLIGHT INSPECTION REVEALED A SMALL PANEL MISSING FROM THE NUMBER 2 ENGINE PYLON, RICHMOND, VA.","INCIDENT","RICHMOND FSDO","N519JB","JBU1281","JET BLUE","AIRBUS","A320","No","UNKNOWN","COMMERCIAL","STANDING (STD)","121","NONE","No","2","0","0","0","0","0","0","0","0","0","0","0","0","0","0","0","0","0","0","0"
