"UPDATED","ENTRY_DATE","EVENT_LCL_DATE","EVENT_LCL_TIME","LOC_CITY_NAME","LOC_STATE_NAME","LOC_CNTRY_NAME","RMK_TEXT","EVENT_TYPE_DESC","FSDO_DESC","REGIST_NBR","FLT_NBR","ACFT_OPRTR","ACFT_MAKE_NAME","ACFT_MODEL_NAME","ACFT_MISSING_FLAG","ACFT_DMG_DESC","FLT_ACTIVITY","FLT_PHASE","FAR_PART","MAX_INJ_LVL","FATAL_FLAG","FLT_CRW_INJ_NONE","FLT_CRW_INJ_MINOR","FLT_CRW_INJ_SERIOUS","FLT_CRW_INJ_FATAL","FLT_CRW_INJ_UNK","CBN_CRW_INJ_NONE","CBN_CRW_INJ_MINOR","CBN_CRW_INJ_SERIOUS","CBN_CRW_INJ_FATAL","CBN_CRW_INJ_UNK","PAX_INJ_NONE","PAX_INJ_MINOR","PAX_INJ_SERIOUS","PAX_INJ_FATAL","PAX_INJ_UNK","GRND_INJ_NONE","GRND_INJ_MINOR","GRND_INJ_SERIOUS","GRND_INJ_FATAL","GRND_INJ_UNK"
"No","23-MAY-22","20-MAY-22","23:50:00Z","WAYNE","NEBRASKA","UNITED STATES","AIRCRAFT CRASHED ON LANDING DURING THE MAYDAY STOL DRAG AERIAL EVENT UNDER UKNOWN CIRCUMSTANCES, WAYNE, NE.","ACCIDENT","LINCOLN FSDO","N76075","","","CESSNA","140","No","DESTROYED","AIR SHOW","LANDING (LDG)","","FATAL","Yes","0","0","0","1","0","0","0","0","0","0","0","0","0","0","0","0","0","0","0","0"
"No","23-MAY-22","22-MAY-22","17:51:00Z","ERIE","COLORADO","UNITED STATES","AIRCRAFT CRASHED UNDER UNKNOWN CIRCUMSTANCES SHORTLY AFTER TAKEOFF IN A PARK, ERIE, CO.","ACCIDENT","DENVER FSDO","N85CT","","","PIPER","PA32","No","SUBSTANTIAL","PERSONAL","TAKEOFF (TOF)","91","FATAL","Yes","0","0","0","1","0","0","0","0","0","0","0","0","0","1","0","0","0","0","0","0"
"No","23-MAY-22","22-MAY-22","13:01:00Z","CAPE GIRARDEAU","MISSOURI","UNITED STATES","AIRCRAFT CRASHED UNDER UNKNOWN CIRCUMSTANCES 200 FEET OFF RUNWAY, CAPE GIRARDEAU, MO.","ACCIDENT","ST LOUIS FSDO","N590DM","","","MAGNI GYRO","M24 ORION PLUS","No","SUBSTANTIAL","PERSONAL","LANDING (LDG)","91","FATAL","Yes","0","0","0","1","0","0","0","0","0","0","0","0","0","0","0","0","0","0","0","0"
"No","23-MAY-22","23-MAY-22","00:55:00Z","PANAMA CITY","FLORIDA","UNITED STATES","AIRCRAFT EXPEREINCED ENGINE ISSUES, LANDED IN A FIELD, STRUCK A BARBED WIRE FENCE AND CAUGHT ON FIRE, PANAMA CITY, FL.","ACCIDENT","ALABAMA AND NW FLORIDA FSDO","N310DC","","","CESSNA","310","No","SUBSTANTIAL","PERSONAL","EN ROUTE (ENR)","91","NONE","No","1","0","0","0","0","0","0","0","0","0","0","0","0","0","0","0","0","0","0","0"
"No","23-MAY-22","21-MAY-22","23:00:00Z","PRINEVILLE","OREGON","UNITED STATES","AIRCRAFT DURING A CROSSWING LANDING VEERED OFF THE RUNWAY AND LEFT WIND STRUCK A TREE, PRINEVILLE, OR.","ACCIDENT","PORTLAND FSDO","N811RF","","","VANS","RV6","No","SUBSTANTIAL","PERSONAL","LANDING (LDG)","91","NONE","No","1","0","0","0","0","0","0","0","0","0","0","0","0","0","0","0","0","0","0","0"
"No","21-MAY-22","21-MAY-22","00:57:00Z","BIG LAKE","ALASKA","UNITED STATES","AIRCRAFT EXITED RUNWAY AND WENT INTO A SWAMPY AREA, BIG LAKE, AK.","ACCIDENT","ANCHORAGE FSDO","N2692D","","","CESSNA","170","No","SUBSTANTIAL","PERSONAL","LANDING (LDG)","91","NONE","No","1","0","0","0","0","0","0","0","0","0","0","0","0","0","0","0","0","0","0","0"
"No","23-MAY-22","22-MAY-22","16:13:00Z","PRESCOTT","ARIZONA","UNITED STATES","AIRCRAFT DEPARTED, EXPERIENCED ENGINE ISSUES AND TRIED RETURNING TO THE AIRPORT AND FAILED, PRESCOTT, AZ.","ACCIDENT","SCOTTSDALE FSDO","N8540X","","","CESSNA","P172","No","SUBSTANTIAL","PERSONAL","APPROACH (APR)","91","UNKNOWN","No","0","0","0","0","1","0","0","0","0","0","0","0","0","0","0","0","0","0","0","0"
"No","23-MAY-22","20-MAY-22","15:05:00Z","FLAGSTAFF","ARIZONA","UNITED STATES","AIRCRAFT STRUCKE FENCE POLE WITH LEADING EDGE OF LEFT WING DURING TAXI, FLAGSTAFF, AZ.","INCIDENT","SCOTTSDALE FSDO","N875FE","CFS8775","FEDERAL EXPRESS","CESSNA","208","No","MINOR","CARGO","TAXI (TXI)","","NONE","No","1","0","0","0","0","0","0","0","0","0","0","0","0","0","0","0","0","0","0","0"
"No","23-MAY-22","18-MAY-22","05:27:00Z","DENVER","COLORADO","UNITED STATES","AIRCRAFT STRUCK A BIRD ON LANDING DAMAGING RADOME, DENVER, CO.","INCIDENT","DENVER FSDO","N705FR","FFT519","FRONTIER AIRLINES","AIRBUS","A321","No","UNKNOWN","COMMERCIAL","LANDING (LDG)","121","NONE","No","2","0","0","0","0","0","0","0","0","0","0","0","0","0","0","0","0","0","0","0"
"No","23-MAY-22","21-MAY-22","15:00:00Z","MILLBROOK","NEW YORK","UNITED STATES","AIRCRAFT LANDED AND FLIPPED OVER, MILLBROOK, NY.","INCIDENT","TETERBORO FSDO","N123SQ","","","WILDERNESS FLYER","SQ3","No","MINOR","PERSONAL","LANDING (LDG)","91","MINOR","No","0","1","0","0","0","0","0","0","0","0","0","0","0","0","0","0","0","0","0","0"
"No","23-MAY-22","22-MAY-22","15:00:00Z","THERMOPOLIS","WYOMING","UNITED STATES","AIRCRAFT LANDED GEAR UP, THERMOPOLIS, WY.","INCIDENT","DENVER FSDO","N126SC","","","MOONEY","M20M","No","MINOR","PERSONAL","LANDING (LDG)","91","NONE","No","1","0","0","0","0","0","0","0","0","0","0","0","0","0","0","0","0","0","0","0"
"No","23-MAY-22","21-MAY-22","14:40:00Z","BECKLEY","WEST VIRGINIA","UNITED STATES","AIRCRAFT LANDED HARD, BECKLEY, WV.","INCIDENT","CHARLESTON FSDO","N171JV","","","GLASAIR","GLASTAR","No","UNKNOWN","PERSONAL","LANDING (LDG)","91","MINOR","No","0","1","0","0","0","0","0","0","0","0","0","0","0","0","0","0","0","0","0","0"
"No","23-MAY-22","20-MAY-22","18:45:00Z","CLEWISTON","FLORIDA","UNITED STATES","AIRCRAFT VEERED OFF RUNWAY DURING LANDING, CLEWISTON, FL.","INCIDENT","SOUTH FLORIDA FSDO","N268TA","","","PIAGGIO AERO","P180","No","UNKNOWN","ON DEMAND","LANDING (LDG)","135","NONE","No","1","0","0","0","0","0","0","0","0","0","6","0","0","0","0","0","0","0","0","0"
"No","23-MAY-22","22-MAY-22","00:30:00Z","SELDOVIA","ALASKA","UNITED STATES","AIRCRAFT EXITED RUNWAY AND ENDED UP IN A SWAMP INVERTED, SELDOVIA, AK.","INCIDENT","ANCHORAGE FSDO","N305AM","","","AVIAT","A-1B","No","UNKNOWN","PERSONAL","UNKNOWN (UNK)","91","NONE","No","1","0","0","0","0","0","0","0","0","0","0","0","0","0","0","0","0","0","0","0"
"No","23-MAY-22","22-MAY-22","22:30:00Z","MARION","TEXAS","UNITED STATES","AIRCRAFT BOUNCED AFTER LANDING ON GRASS STRIP, GROUND LOOPED, EXITED THE RUNWAY AND CAME TO REST ON A GRAVEL ROAD, MARION, TX.","INCIDENT","SAN ANTONIO FSDO","N422DE","","","BOEING","A75N1","No","MINOR","PERSONAL","LANDING (LDG)","91","NONE","No","1","0","0","0","0","0","0","0","0","0","1","0","0","0","0","0","0","0","0","0"
"Yes","23-MAY-22","21-MAY-22","18:15:00Z","LANCASTER","OHIO","UNITED STATES","AIRCRAFT CRASHED IN A FIELD UNDER UNKNOWN CIRCUMSTANCES, LANCASTER, OH.","ACCIDENT","COLUMBUS FSDO","N503RK","","","EVEKTOR-AEROTECHNIK","SPORTSTAR","No","SUBSTANTIAL","PERSONAL","EN ROUTE (ENR)","91","NONE","No","1","0","0","0","0","0","0","0","0","0","0","0","0","0","0","0","0","0","0","0"
"No","23-MAY-22","20-MAY-22","17:40:00Z","KEENE","NEW HAMPSHIRE","UNITED STATES","AIRCRAFT GEAR COLLAPSED ON LANDING, KEENE, NH.","INCIDENT","PORTLAND ME FSDO","N516AP","","","CESSNA","177RG","No","UNKNOWN","PERSONAL","LANDING (LDG)","91","NONE","No","1","0","0","0","0","0","0","0","0","0","1","0","0","0","0","0","0","0","0","0"
"No","23-MAY-22","22-MAY-22","15:00:00Z","PORT MOLLER","ALASKA","UNITED STATES","AIRCRAFT HAD A MISHAP AT PORT MOLLER AIRPORT, PORT MOLLER, AK.","INCIDENT","ANCHORAGE FSDO","N757R","","","CESSNA","182","No","UNKNOWN","PERSONAL","UNKNOWN (UNK)","91","UNKNOWN","No","0","0","0","0","1","0","0","0","0","0","0","0","0","0","0","0","0","0","0","0"
"No","23-MAY-22","21-MAY-22","21:25:00Z","WINCHESTER","VIRGINIA","UNITED STATES","AIRCRAFT NOSE GEAR COLLAPSED ON LANDING, WINCHESTER, VA.","INCIDENT","WASHINGTON FSDO","N940FR","","","SOCATA","TBM700","No","UNKNOWN","PERSONAL","LANDING (LDG)","91","NONE","No","1","0","0","0","0","0","0","0","0","0","2","0","0","0","0","0","0","0","0","0"
"No","23-MAY-22","22-MAY-22","14:45:00Z","BLOOMINGTON","WISCONSIN","UNITED STATES","AIRCRAFT EXPERIENCED ENGINE ISSUES AND MADE A FORCED LANDING IN A FIELD, BLOOMINGTON, WI.","INCIDENT","MILWAUKEE FSDO","N3733M","","","PIPER","PA12","No","UNKNOWN","PERSONAL","EN ROUTE (ENR)","91","NONE","No","1","0","0","0","0","0","0","0","0","0","1","0","0","0","0","0","0","0","0","0"
"No","23-MAY-22","22-MAY-22","22:37:00Z","LAWRENCEVILLE","GEORGIA","UNITED STATES","AIRCRAFT LANDED, PORPOISED AND THE RIGHT WING TOUCHED THE RUNWAY, LAWRENCEVILLE, GA.","INCIDENT","ATLANTA FSDO","N6021W","","","PIPER","PA28","No","UNKNOWN","INSTRUCTION","LANDING (LDG)","91","NONE","No","1","0","0","0","0","0","0","0","0","0","0","0","0","0","0","0","0","0","0","0"
"No","23-MAY-22","20-MAY-22","14:17:00Z","ENTERPRISE","ALABAMA","UNITED STATES","AIRCRAFT LANDED IN THE GRASS ADJACENT TO THE RUNWAY GEAR UP, ENTERPRISE, AL.","INCIDENT","ALABAMA AND NW FLORIDA FSDO","N8221R","","","BELLANCA","17-30A","No","UNKNOWN","PERSONAL","LANDING (LDG)","91","NONE","No","1","0","0","0","0","0","0","0","0","0","0","0","0","0","0","0","0","0","0","0"
"No","23-MAY-22","23-MAY-22","00:40:00Z","PORTLAND","OREGON","UNITED STATES","AIRCRAFT VEERED OFF RUNWAY DURING TAKEOFF AND LANDING GEAR COLLAPSED, PORTLAND, OR.","INCIDENT","PORTLAND FSDO","N9840M","","","MAULE","M4","No","UNKNOWN","PERSONAL","TAKEOFF (TOF)","91","NONE","No","1","0","0","0","0","0","0","0","0","0","1","0","0","0","0","0","0","0","0","0"
"No","20-MAY-22","19-MAY-22","20:15:00Z","BEND","OREGON","UNITED STATES","AIRCRAFT LANDED ON RUNWAY 34 AND FLIPPED ON ITS SIDE DUE TO A WIND GUST","INCIDENT","PORTLAND FSDO","N46EX","","","EXTRA","EA300","No","UNKNOWN","UNKNOWN","LANDING (LDG)","","NONE","No","1","0","0","0","0","0","0","0","0","0","0","0","0","0","0","0","0","0","0","0"
"No","20-MAY-22","19-MAY-22","22:34:00Z","HENDERSON","NEVADA","UNITED STATES","AIRCRAFT WAS CLEARED FOR TAKE-OFF AND WAS TAXING ONTO RUNWAY 17R WHEN A WIND GUST LIFTED THE TAIL, RESULTING IN A PROP STRIKE","INCIDENT","LAS VEGAS FSDO","N182RP","","","STODDARD HAMILTON","GLASAIR II","No","MINOR","PERSONAL","TAXI (TXI)","91","NONE","No","1","0","0","0","0","0","0","0","0","0","0","0","0","0","0","0","0","0","0","0"
"No","20-MAY-22","19-MAY-22","20:05:00Z","PORT ARANSAS","TEXAS","UNITED STATES","AIRCRAFT LEFT WING IMPACTED TWO PARKED AIRCRAFT WHILE MANEUVERING TO PARK.","INCIDENT","SAN ANTONIO FSDO","N283JD","","","BEECH","B300","No","MINOR","UNKNOWN","TAXI (TXI)","","NONE","No","1","0","0","0","0","0","0","0","0","0","4","0","0","0","0","0","0","0","0","0"
"No","20-MAY-22","19-MAY-22","16:20:00Z","DELRAY BEACH","FLORIDA","UNITED STATES","AIRCRAFT EXPERIENCE UNUSUAL VIBRATIONS AND MADE A PRECAUTIONARY LANDING ON BEACH","INCIDENT","SOUTH FLORIDA FSDO","448JM","","","EUROCOPTER","AS355","No","UNKNOWN","UNKNOWN","EN ROUTE (ENR)","","NONE","No","1","0","0","0","0","0","0","0","0","0","0","0","0","0","0","0","0","0","0","0"
"No","20-MAY-22","19-MAY-22","17:41:00Z","AUBURN","INDIANA","UNITED STATES","AIRCRAFT STALLED ON LANDING, ROLLED, AND CAME TO REST LEFT OF RUNWAY 27","ACCIDENT","GRAND RAPIDS FSDO","N2128E","","","CESSNA","172","No","SUBSTANTIAL","INSTRUCTION","LANDING (LDG)","","NONE","No","1","0","0","0","0","0","0","0","0","0","0","0","0","0","0","0","0","0","0","0"
"No","20-MAY-22","19-MAY-22","21:45:00Z","TALLAHASSEE","FLORIDA","UNITED STATES","AIRCRAFT NOSE CONE SEPARATED IN FLIGHT, STRIKING WINDSHIELD AND PROP.","INCIDENT","TAMPA FSDO","N5446D","IDAHO46","","CESSNA","172","No","UNKNOWN","PERSONAL","EN ROUTE (ENR)","","NONE","No","1","0","0","0","0","0","0","0","0","0","0","0","0","0","0","0","0","0","0","0"
"No","20-MAY-22","19-MAY-22","16:20:00Z","BAYTOWN","TEXAS","UNITED STATES","AIRCRAFT VEERED OFF RUNWAY AND CRASHED INTO TREES ON TAKEOFF","INCIDENT","HOUSTON FSDO","N7451J","","","PIPER","PA28","No","UNKNOWN","PERSONAL","TAKEOFF (TOF)","","MINOR","No","0","1","0","0","0","0","0","0","0","0","0","1","0","0","0","0","0","0","0","0"
"No","20-MAY-22","19-MAY-22","21:48:00Z","GAINESVILLE","TEXAS","UNITED STATES","AIRCRAFT LANDED LANDING GEAR UP AND SLID DOWN RUNWAY.  AIRCRAFT CONSUMED BY FIRE.","ACCIDENT","NORTH TEXAS FSDO","N7655B","","","BELLANCA","14","No","SUBSTANTIAL","PERSONAL","LANDING (LDG)","","NONE","No","1","0","0","0","0","0","0","0","0","0","0","0","0","0","0","0","0","0","0","0"
"No","20-MAY-22","19-MAY-22","20:00:00Z","DEL RIO","TEXAS","UNITED STATES","AIRCRAFT LANDED GEAR UP","INCIDENT","SAN ANTONIO FSDO","N7950P","","","PIPER","PA24","No","MINOR","UNKNOWN","LANDING (LDG)","","NONE","No","1","0","0","0","0","0","0","0","0","0","1","0","0","0","0","0","0","0","0","0"
"No","26-MAY-22","25-MAY-22","21:46:00Z","MADISON","MINNESOTA","UNITED STATES","AIRCRAFT CAUGHT A GUST OF WIND ON LANDING, BOUNCED TWICE, GROUND LOOPED AND FLIPPED OVER IN A MARSH, MADISON, MN.","ACCIDENT","MINNEAPOLIS FSDO","N125WY","","","AVIAT","A-1C-180","No","DESTROYED","PERSONAL","LANDING (LDG)","91","NONE","No","1","0","0","0","0","0","0","0","0","0","0","0","0","0","0","0","0","0","0","0"
"No","26-MAY-22","25-MAY-22","23:12:00Z","DAYTONA BEACH","FLORIDA","UNITED STATES","AIRCRAFT LANDED AND GEAR COLLAPSED, DAYTONA BEACH, FL.","INCIDENT","ORLANDO FSDO","N33LB","","","BEECH","60","No","MINOR","PERSONAL","LANDING (LDG)","91","NONE","No","1","0","0","0","0","0","0","0","0","0","1","0","0","0","0","0","0","0","0","0"
"No","26-MAY-22","25-MAY-22","21:26:00Z","PUTNAM VALLEY","NEW YORK","UNITED STATES","AIRCRAFT EXPERIENCED ENGINE ISSUES, CLIPPED POWERLINES AND CRASHED IN A FIELD, PUTNAM VALLEY, NY.","INCIDENT","TETERBORO FSDO","N7410B","","","AERONCA","7EC","No","MINOR","PERSONAL","EN ROUTE (ENR)","91","UNKNOWN","No","0","0","0","0","1","0","0","0","0","0","0","0","0","0","0","0","0","0","0","0"
"No","26-MAY-22","23-MAY-22","18:29:00Z","CEBALLOS","DURANGO","MEXICO","AIRCRAFT CRASHED UNDER UNKNOWN CIRCUMSTANCES AND DESTROYED BY FIRE, CEBALLOS, MEXICO.","ACCIDENT","DALLAS IFO","N66CG","","","SMITH","AEROSTAR 601P","No","DESTROYED","PERSONAL","EN ROUTE (ENR)","","FATAL","Yes","0","0","0","1","0","0","0","0","0","0","0","0","0","1","0","0","0","0","0","0"
"No","18-MAY-22","17-MAY-22","13:00:00Z","TETERBORO","NEW JERSEY","UNITED STATES","AIRCRAFT TAXIING FOR DEPARTURE AND LEFT WING CLIPPED THE NOSE CONE OF A GLOBAL AIRCRAFT, TETERBORO, NJ.","INCIDENT","TETERBORO FSDO","N888HK","","","GULFSTREAM","GV-SP","No","UNKNOWN","UNKNOWN","TAXI (TXI)","","NONE","No","2","0","0","0","0","0","0","0","0","0","7","0","0","0","0","0","0","0","0","0"
"No","26-MAY-22","25-MAY-22","00:50:00Z","SHOW LOW","ARIZONA","UNITED STATES","AIRCRAFT CRASHED UNDER UNKNOWN CIRCUMSTANCES JUST AFTER DEPARTURE, SHOW LOW, AZ.","ACCIDENT","SCOTTSDALE FSDO","N5532R","","","CESSNA","172","No","SUBSTANTIAL","PERSONAL","TAKEOFF (TOF)","91","FATAL","Yes","0","0","0","1","0","0","0","0","0","0","0","0","1","0","0","0","0","0","0","0"
"No","26-MAY-22","22-MAY-22","17:00:00Z","WARRENTON","VIRGINIA","UNITED STATES","AIRCRAFT STRUCK A BIRD WHILE DOING ACROBATICS DURING THE AIR SHOW, WARRENTON, VA.","ACCIDENT","WASHINGTON FSDO","N104MX","","","MX AIRCRAFT","MXS","No","SUBSTANTIAL","AIR SHOW","MANEUVERING (MNV)","","NONE","No","1","0","0","0","0","0","0","0","0","0","0","0","0","0","0","0","0","0","0","0"
"No","26-MAY-22","25-MAY-22","16:10:00Z","ORANGE","MASSACHUSETTS","UNITED STATES","AIRCRAFT STRUCK THE TAXIWAY SIGN WHILE TAXIING TO THE RAMP, ORANGE, MA.","INCIDENT","BRADLEY FSDO","N227YZ","","","MAULE","M7","No","UNKNOWN","PERSONAL","TAXI (TXI)","91","NONE","No","1","0","0","0","0","0","0","0","0","0","0","0","0","0","0","0","0","0","0","0"
"No","17-MAY-22","16-MAY-22","22:00:00Z","DOUGLAS","WYOMING","UNITED STATES","AIRCRAFT ATTEMPTED LANDING, WENT AROUND, LOST POWER ON CLIMB AND FORCED LANDING, DOUGLAS, WY.","ACCIDENT","DENVER FSDO","N829PW","","","BACKCOUNTRY SUPER CUBS","BOSS","No","SUBSTANTIAL","PERSONAL","LANDING (LDG)","91","MINOR","No","0","1","0","0","0","0","0","0","0","0","0","0","0","0","0","0","0","0","0","0"
"No","17-MAY-22","16-MAY-22","16:35:00Z","BOWIE","TEXAS","UNITED STATES","AIRCRAFT GEAR COLLAPSED ON LANDING AND SLID OFF RUNWAY, BOWIE, TX.","ACCIDENT","NORTH TEXAS FSDO","N210FK","","","CESSNA","P210","No","SUBSTANTIAL","PERSONAL","LANDING (LDG)","91","NONE","No","1","0","0","0","0","0","0","0","0","0","3","0","0","0","0","0","0","0","0","0"
"No","17-MAY-22","16-MAY-22","20:10:00Z","BOZEMAN","MONTANA","UNITED STATES","AIRCRAFT STRUCK A BIRD ON DEPARTURE DAMAGING RIGHT ENGINE, BOZEMAN, MT.","INCIDENT","HELENA FSDO","N817NN","AAL1612","AMERICAN AIRLINES","BOEING","737","No","UNKNOWN","COMMERCIAL","TAKEOFF (TOF)","121","NONE","No","2","0","0","0","0","0","0","0","0","0","0","0","0","0","0","0","0","0","0","0"
"No","17-MAY-22","15-MAY-22","21:26:00Z","FORT COLLINS","COLORADO","UNITED STATES","AIRCRAFT STRUCK A TAXIWAY LIGHT DURING TAKEOFF, FORT COLLINS, CO.","INCIDENT","DENVER FSDO","N33UW","","","CESSNA","421","No","NONE","PERSONAL","TAKEOFF (TOF)","91","NONE","No","1","0","0","0","0","0","0","0","0","0","3","0","0","0","0","0","0","0","0","0"
"No","17-MAY-22","16-MAY-22","21:00:00Z","OXNARD","CALIFORNIA","UNITED STATES","AIRCRAFT GEAR COLLAPSED ON LANDING, OXNARD, CA.","INCIDENT","VAN NUYS FSDO","N55SG","","","BEECH","95-B55","No","MINOR","PERSONAL","LANDING (LDG)","91","NONE","No","1","0","0","0","0","0","0","0","0","0","1","0","0","0","0","0","0","0","0","0"
"No","17-MAY-22","13-MAY-22","21:54:00Z","ROCHESTER","NEW YORK","UNITED STATES","AIRCRAFT EXPERIENCED A ROTOR BLADE STRIKE WHILE ON THE HELIPAD, ROCHESTER, NY.","INCIDENT","ROCHESTER FSDO","N370SS","","","MESSERSCHMITT-BOLKOW-BLOHM","BK 117 B-2","No","MINOR","AMBULANCE","MANEUVERING (MNV)","","NONE","No","1","0","0","0","0","0","0","0","0","0","0","0","0","0","0","0","0","0","0","0"
"No","17-MAY-22","15-MAY-22","18:15:00Z","MONROE","LOUISIANA","UNITED STATES","AIRCRAFT DECLARED AN EMERGENCY AND DIVERTED TO MLU DUE TO FLIGHT CONTROL VIBRATIONS, LANDED AND POST FLIGHT INSPECTION REVEALED RIGHT ELEVATOR HAD DEPARTED THE AIRCRAFT, MONROE, LA.","INCIDENT","BATON ROUGE FSDO","N619AC","","","CESSNA","421","No","UNKNOWN","PERSONAL","EN ROUTE (ENR)","91","NONE","No","1","0","0","0","0","0","0","0","0","0","4","0","0","0","0","0","0","0","0","0"
"No","17-MAY-22","16-MAY-22","18:15:00Z","ANGOLA","INDIANA","UNITED STATES","AIRCRAFT LANDED HARD AND GEAR COLLAPSED, ANGOLA, IN.","ACCIDENT","GRAND RAPIDS FSDO","N3530H","","","ERCOUPE","415-C","No","SUBSTANTIAL","PERSONAL","LANDING (LDG)","91","NONE","No","1","0","0","0","0","0","0","0","0","0","0","0","0","0","0","0","0","0","0","0"
"No","17-MAY-22","16-MAY-22","16:30:00Z","CALIFORNIA CITY","CALIFORNIA","UNITED STATES","AIRCRAFT LANDED AND VEERED OFF RUNWAY STRIKING PAPI LIGHTS, CALIFORNIA CITY, CA.","INCIDENT","VAN NUYS FSDO","N5089","","","CESSNA","175","No","MINOR","PERSONAL","LANDING (LDG)","91","NONE","No","1","0","0","0","0","0","0","0","0","0","0","0","0","0","0","0","0","0","0","0"
"No","17-MAY-22","16-MAY-22","19:23:00Z","FORT WORTH","TEXAS","UNITED STATES","AIRCRAFT BOUNCED ON LANDING, LOST CONTROL AND VEERED OFF RUNWAY INTO THE GRASS, FORT WORTH, TX.","INCIDENT","NORTH TEXAS FSDO","N8097H","","","PIPER","PA28","No","UNKNOWN","INSTRUCTION","LANDING (LDG)","91","NONE","No","1","0","0","0","0","0","0","0","0","0","0","0","0","0","0","0","0","0","0","0"
"No","18-MAY-22","17-MAY-22","20:00:00Z","CLEBURNE","TEXAS","UNITED STATES","AIRCRAFT CRASHED UNDER UNKNOWN CIRCUMSTANCES IN A FIELD, CLEBURNE, TX.","ACCIDENT","NORTH TEXAS FSDO","N6409L","","","AMERICAN AVIATION","AA-1A","No","DESTROYED","PERSONAL","EN ROUTE (ENR)","91","FATAL","Yes","0","0","0","1","0","0","0","0","0","0","0","0","0","0","0","0","0","0","0","0"
"No","18-MAY-22","17-MAY-22","17:25:00Z","SULLIVAN","MISSOURI","UNITED STATES","AIRCRAFT LANDED GEAR UP, SULLIVAN, MO.","INCIDENT","ST LOUIS FSDO","N70RR","","","PELEGRIN","TARRAGON","No","UNKNOWN","PERSONAL","LANDING (LDG)","91","NONE","No","1","0","0","0","0","0","0","0","0","0","0","0","0","0","0","0","0","0","0","0"
"No","19-MAY-22","19-MAY-22","00:29:00Z","CHRISTMAS VALLEY","OREGON","UNITED STATES","AIRCRAFT CRASHED UNDER UNKNOWN CIRCUMSTANCES ATTEMPTING TO LAND AND BECAME INVERTED, CHRISTMAS VALLEY, OR.","ACCIDENT","PORTLAND FSDO","N851AL","","MED-TRANS","AIRBUS","AS350","No","SUBSTANTIAL","AMBULANCE","LANDING (LDG)","135","SERIOUS","No","0","0","1","0","0","0","0","3","0","0","0","0","0","0","0","0","0","0","0","0"
"No","19-MAY-22","18-MAY-22","16:05:00Z","FARMINGDALE","NEW YORK","UNITED STATES","AIRCRAFT EXPERIENCED A BRAKE ISSUE WHILE TAXIING AND VEERED INTO THE GRASS, FARMINGDALE, NY.","INCIDENT","FARMINGDALE FSDO","N733LY","","","CESSNA","172","No","UNKNOWN","PERSONAL","TAXI (TXI)","91","NONE","No","1","0","0","0","0","0","0","0","0","0","0","0","0","0","0","0","0","0","0","0"
"No","19-MAY-22","12-MAY-22","21:30:00Z","SANTA ANA","CALIFORNIA","UNITED STATES","AIRCRAFT FELT A THUD ON DESCENT AND AFTER LANDING POST FLIGHT INSPECTION REVEALED THE COWLING WAS MISSING AND DAMAGE TO THE TAIL, SANTA ANA, CA.","INCIDENT","LONG BEACH FSDO","N411PC","","","CESSNA","560","No","UNKNOWN","PERSONAL","APPROACH (APR)","91","NONE","No","1","0","0","0","0","0","0","0","0","0","1","0","0","0","0","0","0","0","0","0"
"No","19-MAY-22","18-MAY-22","16:41:00Z","TRENTON","NEW JERSEY","UNITED STATES","AIRCRAFT EXPERIENCED A TAIL STRIKE ON LANDING, TRENTON, NJ.","INCIDENT","PHILADELPHIA FSDO","N331FR","FFT810","FRONTIER AIRLINES","AIRBUS","A320","No","UNKNOWN","COMMERCIAL","LANDING (LDG)","121","NONE","No","2","0","0","0","0","0","0","0","0","0","0","0","0","0","0","0","0","0","0","0"
"No","24-MAY-22","23-MAY-22","18:33:00Z","ST PETERSBURG","FLORIDA","UNITED STATES","AIRCRAFT LANDED AND WENT INTO THE GRASS NOSE DOWN AT THE END OF THE RUNWAY, ST PETERSBURG, FL.","INCIDENT","TAMPA FSDO","N47BP","","","CESSNA","340","No","UNKNOWN","PERSONAL","LANDING (LDG)","91","MINOR","No","0","1","0","0","0","0","0","0","0","0","0","0","0","0","0","0","0","0","0","0"
"No","24-MAY-22","21-MAY-22","00:30:00Z","GAKONA","ALASKA","UNITED STATES","AIRCRAFT INCURRED A PROP STRIKE ON LANDING, GAKONA, AK.","INCIDENT","ANCHORAGE FSDO","N7348L","","","PIPER","PA18","No","MINOR","PERSONAL","LANDING (LDG)","91","NONE","No","1","0","0","0","0","0","0","0","0","0","1","0","0","0","0","0","0","0","0","0"
"No","24-MAY-22","20-MAY-22","21:02:00Z","SULPHUR","OKLAHOMA","UNITED STATES","AIRCRAFT LANDED GEAR UP, SULPHUR, OK.","INCIDENT","WILL ROGERS FSDO","N14746","","","BELLANCA","17-31A","No","MINOR","PERSONAL","LANDING (LDG)","91","NONE","No","1","0","0","0","0","0","0","0","0","0","0","0","0","0","0","0","0","0","0","0"
"No","25-MAY-22","24-MAY-22","16:50:00Z","SEMINOLE","TEXAS","UNITED STATES","AIRCRAFT CRASHED UNDER UNKNOWN CIRCUMSTANCES, SEMINOLE, TX.","ACCIDENT","LUBBOCK FSDO","N78466","","","PIPER","PA12","No","UNKNOWN","PERSONAL","EN ROUTE (ENR)","91","FATAL","Yes","0","0","0","1","0","0","0","0","0","0","0","0","0","0","0","0","0","0","0","0"
"No","17-MAY-22","16-MAY-22","17:45:00Z","WINONA","MISSISSIPPI","UNITED STATES","AIRCRAFT ON DEPARTURE, VEERED OFF RUNWAY STRIKING A TAXIWAY LIGHT AND RUNWAY MARKER SIGN, WINONA, MS.","INCIDENT","JACKSON FSDO","N9639H","","","FLIGHT DESIGN","CTLS","No","UNKNOWN","PERSONAL","TAKEOFF (TOF)","91","NONE","No","1","0","0","0","0","0","0","0","0","0","1","0","0","0","0","0","0","0","0","0"
"No","17-MAY-22","16-MAY-22","15:15:00Z","MACON","GEORGIA","UNITED STATES","AIRCRAFT LANDED GEAR UP, MACON, GA.","INCIDENT","ATLANTA FSDO","N285MG","","","PIPER","PA28R","No","UNKNOWN","PERSONAL","LANDING (LDG)","91","NONE","No","1","0","0","0","0","0","0","0","0","0","2","0","0","0","0","0","0","0","0","0"
"No","17-MAY-22","17-MAY-22","00:22:00Z","GOOSE BAY","ALASKA","UNITED STATES","AIRCRAFT DOING TOUCH-AND-GOS, ENGINE QUIT AND MADE AN EMERGENCY LANDING ON THE BEACH, FLIPPED OVER, TIDE CAME IN AND SWEPT AIRCRAFT OUT TO SEA, GOOSE BAY, AK.","ACCIDENT","JUNEAU FSDO","N927AP","","","TAYLORCRAFT","F19","No","UNKNOWN","PERSONAL","MANEUVERING (MNV)","91","MINOR","No","1","0","0","0","0","0","0","0","0","0","0","1","0","0","0","0","0","0","0","0"
"No","17-MAY-22","17-MAY-22","01:23:00Z","OGDEN","UTAH","UNITED STATES","AIRCRAFT STRUCK A BIRD ON SHORT FINAL DAMAGING LEADING EDGE, OGDEN, UT.","INCIDENT","SALT LAKE CITY FSDO","N20910","","","CESSNA","172","No","MINOR","INSTRUCTION","APPROACH (APR)","91","NONE","No","1","0","0","0","0","0","0","0","0","0","1","0","0","0","0","0","0","0","0","0"
"No","27-MAY-22","26-MAY-22","19:55:00Z","MILWAUKEE","WISCONSIN","UNITED STATES","AIRCRAFT CRASHED UNDER UNKNOWN CIRCUMSTANCES INTO A RESIDENTIAL NEIGHBORHOOD, MILWAUKEE, WI.","ACCIDENT","MILWAUKEE FSDO","N4978B","","","CESSNA","152","No","SUBSTANTIAL","INSTRUCTION","INITIAL CLIMB (ICL)","91","FATAL","Yes","0","0","0","1","0","0","0","0","0","0","0","0","0","0","0","0","0","0","0","0"
"No","27-MAY-22","26-MAY-22","15:05:00Z","TORRANCE","CALIFORNIA","UNITED STATES","AIRCRAFT WHILE TAXIING, THE RIGHT WINGTIP STRUCK A HANGAR, TORRANCE, CA.","INCIDENT","LONG BEACH FSDO","N28DM","","","CESSNA","525","No","UNKNOWN","PERSONAL","TAXI (TXI)","91","NONE","No","1","0","0","0","0","0","0","0","0","0","0","0","0","0","0","0","0","0","0","0"
"No","27-MAY-22","26-MAY-22","21:19:00Z","GLOUCESTER","VIRGINIA","UNITED STATES","AIRCRAFT CRASHESD UNDER UNKNOWN CIRCUMSTANCES NEAR A CHURCH ON PROVIDENCE ROAD, GLOUCESTER, VA.","INCIDENT","RICHMOND FSDO","N658AV","","","AERO ADVENTURE","AVENTURA II","No","UNKNOWN","PERSONAL","EN ROUTE (ENR)","91","NONE","No","1","0","0","0","0","0","0","0","0","0","1","0","0","0","0","0","0","0","0","0"
"No","27-MAY-22","26-MAY-22","18:20:00Z","NEW BRAUNFELS","TEXAS","UNITED STATES","AIRCRAFT ABORTED TAKEOFF AND WENT OFF THE DEPARTURE END OF THE RUNWAY INTO THE GRASS, NEW BRAUNFELS, TX.","INCIDENT","SAN ANTONIO FSDO","N42693","","","CESSNA","182","No","UNKNOWN","PERSONAL","TAKEOFF (TOF)","91","NONE","No","1","0","0","0","0","0","0","0","0","0","0","0","0","0","0","0","0","0","0","0"
"No","27-MAY-22","26-MAY-22","05:00:00Z","HOUSTON","TEXAS","UNITED STATES","AIRCRAFT STRUCK A BIRD, HOUSTON, TX.","INCIDENT","HOUSTON FSDO","N8696E","SWA2734","SOUTHWEST AIRLINES","BOEING","737","No","MINOR","COMMERCIAL","UNKNOWN (UNK)","121","NONE","No","2","0","0","0","0","0","0","0","0","0","0","0","0","0","0","0","0","0","0","0"
