"UPDATED","ENTRY_DATE","EVENT_LCL_DATE","EVENT_LCL_TIME","LOC_CITY_NAME","LOC_STATE_NAME","LOC_CNTRY_NAME","RMK_TEXT","EVENT_TYPE_DESC","FSDO_DESC","REGIST_NBR","FLT_NBR","ACFT_OPRTR","ACFT_MAKE_NAME","ACFT_MODEL_NAME","ACFT_MISSING_FLAG","ACFT_DMG_DESC","FLT_ACTIVITY","FLT_PHASE","FAR_PART","MAX_INJ_LVL","FATAL_FLAG","FLT_CRW_INJ_NONE","FLT_CRW_INJ_MINOR","FLT_CRW_INJ_SERIOUS","FLT_CRW_INJ_FATAL","FLT_CRW_INJ_UNK","CBN_CRW_INJ_NONE","CBN_CRW_INJ_MINOR","CBN_CRW_INJ_SERIOUS","CBN_CRW_INJ_FATAL","CBN_CRW_INJ_UNK","PAX_INJ_NONE","PAX_INJ_MINOR","PAX_INJ_SERIOUS","PAX_INJ_FATAL","PAX_INJ_UNK","GRND_INJ_NONE","GRND_INJ_MINOR","GRND_INJ_SERIOUS","GRND_INJ_FATAL","GRND_INJ_UNK"
"No","01-APR-24","30-MAR-24","17:15:00Z","FORT PIERCE","FLORIDA","UNITED STATES","AIRCRAFT EXPERIENCED ENGINE ISSUES AND CRASHED ON THE RAMP, FORT PIERCE, FL.","ACCIDENT","ORLANDO FSDO","N595ND","","AVIATOR COLLEGE OF AERONAUTICAL SCIENE & TECH","PIPER","PA44","No","UNKNOWN","FAR 141 PILOT SCHOOL","LANDING (LDG)","91","FATAL","Yes","0","0","0","1","0","0","0","0","0","0","0","0","1","0","0","0","0","0","0","0"
"No","01-APR-24","30-MAR-24","18:00:00Z","BEN WHEELER","TEXAS","UNITED STATES","AIRCRAFT EXPERIENCED A GUST OF WIND ON LANDING AND ENDED UP INVERTED, BEN WHEELER, TX.","INCIDENT","NORTH TEXAS FSDO","N3322U","","","CESSNA","182","No","UNKNOWN","PERSONAL","LANDING (LDG)","91","NONE","No","1","0","0","0","0","0","0","0","0","0","0","0","0","0","0","0","0","0","0","0"
"No","01-APR-24","29-MAR-24","16:45:00Z","ORLANDO","FLORIDA","UNITED STATES","AIRCRAFT DEPARTED, EXPERIENCED ENGINE ISSUES AT 50 FEET AND MADE A GEAR UP LANDING SKIDDING OFF THE RUNWAY INTO THE GRASS, ORLANDO, FL.","ACCIDENT","ORLANDO FSDO","N5429K","","","NAVION","NAVION B","No","SUBSTANTIAL","PERSONAL","TAKEOFF (TOF)","91","NONE","No","1","0","0","0","0","0","0","0","0","0","1","0","0","0","0","0","0","0","0","0"
"No","01-APR-24","30-MAR-24","19:00:00Z","NORTH KINGSTOWN","RHODE ISLAND","UNITED STATES","AIRCRAFT CRASHED IN NARRAGANSETT BAY FOR UNKNOWN REASONS, NORTH KINGSTOWN, RI.","ACCIDENT","BOSTON FSDO","N7538P","","","PIPER","PA24","No","DESTROYED","PERSONAL","APPROACH (APR)","91","UNKNOWN","No","0","0","0","0","1","0","0","0","0","0","0","0","0","0","1","0","0","0","0","0"
"No","01-APR-24","30-MAR-24","16:40:00Z","CLERMONT","FLORIDA","UNITED STATES","AIRCRAFT CRASHED IN A FIELD DUE TO ENGINE ISSUES, CLERMONT, FL.","ACCIDENT","ORLANDO FSDO","N20330","","","DTA","VOYAGER II","No","SUBSTANTIAL","PERSONAL","EN ROUTE (ENR)","91","SERIOUS","No","0","0","1","0","0","0","0","0","0","0","0","0","0","0","1","0","0","0","0","0"
"No","01-APR-24","30-MAR-24","09:45:00Z","CHARLOTTE","NORTH CAROLINA","UNITED STATES","AIRCRAFT STRUCK A BIRD AND POST FLIGHT INSPECTION REVEALED DAMAGE TO THE RADOME, CHARLOTTE, NC.","INCIDENT","CHARLOTTE FSDO","N537UW","AAL2777","AMERICAN AIRLINES","AIRBUS","A321","No","MINOR","COMMERCIAL","EN ROUTE (ENR)","121","NONE","No","0","0","0","0","0","0","0","0","0","0","0","0","0","0","0","0","0","0","0","0"
"No","01-APR-24","30-MAR-24","05:50:00Z","COVINGTON","KENTUCKY","UNITED STATES","AIRCRAFT STRUCK A BIRD ON LANDING DAMAGING THE RADOME, COVINGTON, KY.","INCIDENT","CINCINNATI FSDO","N318FL","KII107","KALITTA AIR","BOEING","737","No","UNKNOWN","CARGO","LANDING (LDG)","121","NONE","No","2","0","0","0","0","0","0","0","0","0","0","0","0","0","0","0","0","0","0","0"
"Yes","01-APR-24","30-MAR-24","02:07:00Z","CEDAR RAPDS","IOWA","UNITED STATES","AIRCRAFT STRUCK A BIRD DAMAGING THE NOSE, CEDAR RAPIDS, IA.","INCIDENT","DES MOINES FSDO","N325FL","KII833","KALITTA AIR","BOEING","737","No","MINOR","CARGO","EN ROUTE (ENR)","121","NONE","No","2","0","0","0","0","0","0","0","0","0","0","0","0","0","0","0","0","0","0","0"
"No","01-APR-24","30-MAR-24","17:35:00Z","HUNTSVILLE","ALABAMA","UNITED STATES","AIRCRAFT LANDED AND GEAR COLLAPSED, HUNTSVILLE, AL.","INCIDENT","ALABAMA AND NW FLORIDA FSDO","N222MA","","","LANCAIR","LANCAIR IV","No","MINOR","PERSONAL","LANDING (LDG)","91","NONE","No","1","0","0","0","0","0","0","0","0","0","1","0","0","0","0","0","0","0","0","0"
"No","01-APR-24","29-MAR-24","16:27:00Z","JASPER","GEORGIA","UNITED STATES","AIRCRAFT EXPERIENCED ENGINE ISSUES, MADE AN EMERGENCY LANDING IN A FIELD AND THE WING STRUCK A LIGHT POLE, JASPER, GA.","ACCIDENT","ATLANTA FSDO","N387E","","","VANS","RV9","No","SUBSTANTIAL","PERSONAL","EN ROUTE (ENR)","91","MINOR","No","0","1","0","0","0","0","0","0","0","0","0","0","0","0","0","0","0","0","0","0"
"No","01-APR-24","29-MAR-24","23:00:00Z","DALLAS","TEXAS","UNITED STATES","AIRCRAFT TAXIING AND STRUCK A LIGHT, DALLAS, TX.","INCIDENT","NORTH TEXAS FSDO","N500LR","WWI50","WORLDWIDE JET CHARTER","CANADAIR","CL-600-2B16","No","NONE","ON DEMAND","TAXI (TXI)","135","NONE","No","2","0","0","0","0","0","0","0","0","0","2","0","0","0","0","0","0","0","0","0"
"No","01-APR-24","29-MAR-24","17:48:00Z","HAWKINSVILLE","GEORGIA","UNITED STATES","AIRCRAFT EXPERIENCED A FUEL LINE FEED ISSUE AND MADE AN EMERGENCY LANDING IN A FIELD, HAWKINSVILLE, GA.","INCIDENT","ATLANTA FSDO","N519BW","","","QUARTZ MOUNTAIN AEROSPACE","11E","No","NONE","PERSONAL","UNKNOWN (UNK)","91","NONE","No","1","0","0","0","0","0","0","0","0","0","0","0","0","0","0","0","0","0","0","0"
"No","01-APR-24","29-MAR-24","17:25:00Z","CHANUTE","KANSAS","UNITED STATES","AIRCRAFT DEPARTED, STRUCK A BIRD AND LANDED IN A FIELD, CHANUTE, KS.","INCIDENT","WICHITA FSDO","N910GX","","","BELL","407","No","UNKNOWN","AMBULANCE","TAKEOFF (TOF)","135","UNKNOWN","No","1","0","0","0","0","0","0","0","0","0","2","0","0","0","0","0","0","0","0","0"
"No","01-APR-24","29-MAR-24","18:03:00Z","MESA","ARIZONA","UNITED STATES","AIRCRAFT ON A HIGH-SPEED TAXI ON RUNWAY AND EXITED TO TAXIWAY, LEFT WING CLIPPED THE TAIL OF N28958 WHICH WAS WAITING IN THE RUNUP AREA, MESA, AZ.","INCIDENT","SCOTTSDALE FSDO","N4401E","OXF2880","OXFORD AVIATION ACADEMY","PIPER","PA28","No","UNKNOWN","FAR 141 PILOT SCHOOL","TAXI (TXI)","91","NONE","No","1","0","0","0","0","0","0","0","0","0","0","0","0","0","0","0","0","0","0","0"
"No","01-APR-24","29-MAR-24","18:03:00Z","MESA","ARIZONA","UNITED STATES","AIRCRAFT WAITING IN THE RUNUP AREA AND TAIL WAS STRUCK BY THE LEFT WING OF N4401E, MESA, AZ.","INCIDENT","SCOTTSDALE FSDO","N28958","OXF4560","OXFORD AVIATION ACADEMY","PIPER","PA28","No","UNKNOWN","FAR 141 PILOT SCHOOL","STANDING (STD)","91","NONE","No","1","0","0","0","0","0","0","0","0","0","0","0","0","0","0","0","0","0","0","0"
"No","01-APR-24","29-MAR-24","13:56:00Z","SARASOTA","FLORIDA","UNITED STATES","AIRCRAFT EXPERIENCED A HARD LANDING INCURRING A PROP STRIKE, SARASOTA, FL.","INCIDENT","TAMPA FSDO","N6056V","","","CESSNA","162","No","UNKNOWN","INSTRUCTION","LANDING (LDG)","91","NONE","No","1","0","0","0","0","0","0","0","0","0","0","0","0","0","0","0","0","0","0","0"
"No","01-APR-24","30-MAR-24","21:15:00Z","ANGEL FIRE","NEW MEXICO","UNITED STATES","AIRCRAFT DURING TAKEOFF CAUGHT A CROSSWIND, BLOWN OFF RUNWAY AND ENDED UP IN A DITCH, ANGEL FIRE, NM.","INCIDENT","ALBUQUERQUE FSDO","N9989R","","","BEECH","N35","No","UNKNOWN","PERSONAL","TAKEOFF (TOF)","91","NONE","No","1","0","0","0","0","0","0","0","0","0","3","0","0","0","0","0","0","0","0","0"
"No","03-APR-24","02-APR-24","18:00:00Z","KAPLAN","LOUISIANA","UNITED STATES","AIRCRAFT CRASHED INTO A POND SHORTLY AFTER TAKEOFF, KAPLAN, LA.","ACCIDENT","BATON ROUGE FSDO","N75099","","","SCHWEIZER","G-164B","No","SUBSTANTIAL","AERIAL APPLICATION","TAKEOFF (TOF)","137","MINOR","No","0","1","0","0","0","0","0","0","0","0","0","0","0","0","0","0","0","0","0","0"
"Yes","03-APR-24","02-APR-24","12:02:00Z","LAKELAND","FLORIDA","UNITED STATES","AIRCRAFT CRASHED UNDER UNKNOWN CIRCUMSTANCES, LAKELAND, FL.","ACCIDENT","ORLANDO FSDO","N622PC","","","AEROMARINE","MERLIN LITE","No","SUBSTANTIAL","PERSONAL","TAKEOFF (TOF)","91","FATAL","Yes","0","0","0","1","0","0","0","0","0","0","0","0","0","0","0","0","0","0","0","0"
"No","03-APR-24","02-APR-24","16:02:00Z","ARKADELPHIA","ARKANSAS","UNITED STATES","AIRCRAFT MADE A FORCED LANDING IN A FIELD, ARKADELPHIA, AR.","INCIDENT","LITTLE ROCK FSDO","N86UM","","","MOONEY","M20E","No","UNKNOWN","PERSONAL","EN ROUTE (ENR)","91","UNKNOWN","No","0","0","0","0","1","0","0","0","0","0","0","0","0","0","0","0","0","0","0","0"
"No","03-APR-24","02-APR-24","19:05:00Z","BECKLEY","WEST VIRGINIA","UNITED STATES","AIRCRAFT LANDED AND VEERED OFF RUNWAY INTO THE SAFETY AREA DUE TO A BRAKE ISSUE, BECKLEY, WV.","INCIDENT","CHARLESTON FSDO","N420LW","","","ROCKWELL INTERNATIONAL","690B","No","MINOR","PERSONAL","LANDING (LDG)","91","NONE","No","1","0","0","0","0","0","0","0","0","0","1","0","0","0","0","0","0","0","0","0"
"No","03-APR-24","25-MAR-24","20:47:00Z","LA VERNE","CALIFORNIA","UNITED STATES","AIRCRAFT LANDED AND GROUND LOOPED, LA VERNE, CA.","INCIDENT","LOS ANGELES FSDO","N241MA","","","AVIAT AIRCRAFT","A-1C-180","No","MINOR","PERSONAL","LANDING (LDG)","91","NONE","No","1","0","0","0","0","0","0","0","0","0","0","0","0","0","0","0","0","0","0","0"
"No","03-APR-24","03-APR-24","00:15:00Z","APPLETON","WISCONSIN","UNITED STATES","AIRCRAFT WAS BEING DEICED AND STRUCK BY THE DEICING TRUCK DAMAGING THE L-1 DOOR, APPLETON, WI.","INCIDENT","MILWAUKEE FSDO","N929EV","SKW5700","SKYWEST AIRLINES","BOMBARDIER","CL-600-2B19","No","UNKNOWN","COMMERCIAL","STANDING (STD)","121","NONE","No","0","0","0","0","0","0","0","0","0","0","0","0","0","0","0","0","0","0","0","0"
"Yes","04-APR-24","03-APR-24","13:06:00Z","TAMPA","FLORIDA","UNITED STATES","AIRCRAFT ENCOUNTERED SEVERE TURBULENCE INJURYING A FLIGHT ATTENDANT AND PASSENGER, TAMPA, FL.","ACCIDENT","TAMPA FSDO","N567WN","SWA4273","SOUTHWEST AIRLINES","BOEING","737","No","UNKNOWN","COMMERCIAL","APPROACH (APR)","121","SERIOUS","No","2","0","0","0","0","4","0","1","0","0","133","0","1","0","0","0","0","0","0","0"
"No","04-APR-24","03-APR-24","23:45:00Z","LARAMIE","WYOMING","UNITED STATES","AIRCRAFT LANDED GEAR UP, LARAMIE, WY.","INCIDENT","DENVER FSDO","N555HR","","","MOONEY","M20M","No","MINOR","PERSONAL","LANDING (LDG)","91","NONE","No","1","0","0","0","0","0","0","0","0","0","2","0","0","0","0","0","0","0","0","0"
"No","04-APR-24","03-APR-24","16:08:00Z","SANTA BARBARA","CALIFORNIA","UNITED STATES","AIRCRAFT DEPARTED, RETURNED TO AIRPORT DUE TO THE LEFT GEAR BEING STUCK IN THE UP POSITION, LANDED AND VEERED OFF RUNWAY, SANTA BARBARA, CA.","INCIDENT","VAN NUYS FSDO","N3824R","","","BEECH","C24R","No","UNKNOWN","PERSONAL","LANDING (LDG)","91","NONE","No","1","0","0","0","0","0","0","0","0","0","0","0","0","0","0","0","0","0","0","0"
"No","04-APR-24","03-APR-24","19:50:00Z","SACRAMENTO","CALIFORNIA","UNITED STATES","AIRCRAFT EXPERIENCED ENGINE ISSUES AND LANDED IN A FIELD, SACRAMENTO, CA.","INCIDENT","SACRAMENTO FSDO","N4351T","","","PIPER","PA28","No","NONE","PERSONAL","EN ROUTE (ENR)","91","NONE","No","1","0","0","0","0","0","0","0","0","0","1","0","0","0","0","0","0","0","0","0"
"No","04-APR-24","04-APR-24","03:20:00Z","BLUFF DALE","TEXAS","UNITED STATES","AIRCRAFT MADE AN EMERGENCY LANDING IN A FIELD WHEN THE ENGINE BEGAN SMOKING IN FLIGHT AND CAUGHT ON FIRE, BLUFF DALE, TX.","ACCIDENT","NORTH TEXAS FSDO","N8946","","","BELLANCA","7KCAB","No","SUBSTANTIAL","PERSONAL","EN ROUTE (ENR)","91","NONE","No","1","0","0","0","0","0","0","0","0","0","0","0","0","0","0","0","0","0","0","0"
"No","02-APR-24","01-APR-24","11:30:00Z","MUNCIE","INDIANA","UNITED STATES","AIRCRAFT CRASHED UNDER UNKNOWN CIRCUMSTANCES INTO A PEDESTRIAN WALKING PATH, MUNCIE, IN.","ACCIDENT","INDIANAPOLIS FSDO","N8438B","","","PIPER","PA28","No","SUBSTANTIAL","PERSONAL","APPROACH (APR)","91","SERIOUS","No","0","0","1","0","0","0","0","0","0","0","0","0","0","0","0","0","0","2","0","0"
"No","02-APR-24","01-APR-24","19:04:00Z","ROCK SPRINGS","TEXAS","UNITED STATES","AIRCRAFT ENCOUNTERED SEVERE TURBULENCE INJURYING TWO PASSENGERS, ROCK SPRINGS, TX.","INCIDENT","NORTH TEXAS FSDO","N17ZP","","","TEXTRON","680","No","NONE","CORPORATE","EN ROUTE (ENR)","91","MINOR","No","2","0","0","0","0","0","0","0","0","0","0","2","0","0","0","0","0","0","0","0"
"No","02-APR-24","01-APR-24","12:41:00Z","DALLAS-FORT WORTH","TEXAS","UNITED STATES","AIRCRAFT STRUCK A BIRD ON TAKEOFF, DALLAS-FORT WORTH, TX.","INCIDENT","NORTH TEXAS FSDO","N249LR","ASH6021","MESA AIRLINES","BOMBARDIER","CL-600-2D24","No","UNKNOWN","COMMERCIAL","TAKEOFF (TOF)","121","NONE","No","0","0","0","0","0","0","0","0","0","0","0","0","0","0","0","0","0","0","0","0"
"No","02-APR-24","13-MAR-24","18:54:00Z","MANASSAS","VIRGINIA","UNITED STATES","AIRCRAFT STRUCK A BIRD AND POST FLIGHT INSPECTION REVEALED DAMAGE TO THE LEFT WING, MANASSAS, VA.","INCIDENT","WASHINGTON FSDO","N761BF","","","PIPER","PA28","No","MINOR","PERSONAL","EN ROUTE (ENR)","91","NONE","No","1","0","0","0","0","0","0","0","0","0","1","0","0","0","0","0","0","0","0","0"
"No","02-APR-24","02-APR-24","01:10:00Z","TORRANCE","CALIFORNIA","UNITED STATES","AIRCRAFT LANDED GEAR UP, TORRANCE, CA.","INCIDENT","LONG BEACH FSDO","N3803B","","","BEECH","C24R","No","UNKNOWN","PERSONAL","LANDING (LDG)","91","NONE","No","1","0","0","0","0","0","0","0","0","0","0","0","0","0","0","0","0","0","0","0"
"No","02-APR-24","01-APR-24","16:11:00Z","ST AUGUSTINE","FLORIDA","UNITED STATES","AIRCRAFT LANDED AND GEAR COLLAPSED, ST AUGUSTINE, FL.","INCIDENT","ORLANDO FSDO","N7371R","","","BEECH","95-B55","No","UNKNOWN","PERSONAL","LANDING (LDG)","91","NONE","No","1","0","0","0","0","0","0","0","0","0","1","0","0","0","0","0","0","0","0","0"
"No","05-APR-24","04-APR-24","19:56:00Z","SEFFNER","FLORIDA","UNITED STATES","AIRCRAFT CRASHED UNDER UNKNOWN CIRCUMSTANCES IN SEFFNER, FLORIDA","ACCIDENT","TAMPA FSDO","N469JA","","","EVEKTOR-AEROTECHNIK A S","HARMONY LSA","No","SUBSTANTIAL","PERSONAL","UNKNOWN (UNK)","91","MINOR","No","0","1","0","0","0","0","0","0","0","0","0","1","0","0","0","0","0","0","0","0"
"No","05-APR-24","04-APR-24","16:41:00Z","WICHITA","KANSAS","UNITED STATES","AIRCRAFT EXPERIENCED HARD LANDING DAMAGING WING AND LANDING GEAR","ACCIDENT","WICHITA FSDO","N718SP","","","CIRRUS","SR22","No","SUBSTANTIAL","PERSONAL","LANDING (LDG)","91","NONE","No","1","0","0","0","0","0","0","0","0","0","1","0","0","0","0","0","0","0","0","0"
"No","05-APR-24","04-APR-24","21:30:00Z","SANDPOINT","IDAHO","UNITED STATES","AIRCRAFT CRASHED ON LANDING","ACCIDENT","SPOKANE FSDO","N5281D","","","CESSNA","180A","No","SUBSTANTIAL","PERSONAL","LANDING (LDG)","91","NONE","No","1","0","0","0","0","0","0","0","0","0","1","0","0","0","0","0","0","0","0","0"
"No","05-APR-24","04-APR-24","20:07:00Z","MONCURE","NORTH CAROLINA","UNITED STATES","AIRCRAFT EXPERIENCED ENGINE ISSUES AND MADE AN EMERGENCY LANDING","INCIDENT","GREENSBORO FSDO","N360XS","","","BURT DONALD R","LANCAIR 360","No","UNKNOWN","PERSONAL","EN ROUTE (ENR)","91","NONE","No","1","0","0","0","0","0","0","0","0","0","0","0","0","0","0","0","0","0","0","0"
"No","05-APR-24","04-APR-24","19:30:00Z","KENNESAW","GEORGIA","UNITED STATES","AIRCRAFT VEERED OFF RUNWAY AND STRUCK RUNWAY SIGN WITH WING","INCIDENT","ATLANTA FSDO","N581C","","","CIRRUS","SR20","No","MINOR","PERSONAL","LANDING (LDG)","91","NONE","No","1","0","0","0","0","0","0","0","0","0","0","0","0","0","0","0","0","0","0","0"
"No","05-APR-24","04-APR-24","23:20:00Z","VENICE","FLORIDA","UNITED STATES","AIRCRAFT INCURRED DAMAGE ON A GEAR UP TOUCH AND GO","INCIDENT","TAMPA FSDO","N5265C","","","CESSNA","310R","No","MINOR","PERSONAL","LANDING (LDG)","91","NONE","No","1","0","0","0","0","0","0","0","0","0","0","0","0","0","0","0","0","0","0","0"
"No","05-APR-24","04-APR-24","19:45:00Z","ORMOND BEACH","FLORIDA","UNITED STATES","AIRCRAFT EXITED TAXIWAY AND CAME TO REST IN CULVERT","INCIDENT","ORLANDO FSDO","N9755D","","","CESSNA","172","No","UNKNOWN","INSTRUCTION","TAXI (TXI)","91","NONE","No","1","0","0","0","0","0","0","0","0","0","1","0","0","0","0","0","0","0","0","0"
"No","05-APR-24","05-APR-24","02:03:00Z","NIPTON","CALIFORNIA","UNITED STATES","AIRCRAFT EXPERIENCED ENGINE PROBLEM AND PERFORMED OFF FIELD LANDING","ACCIDENT","LAS VEGAS FSDO","N743JT","","","ANDERSON THOMAS C","KITFOX SERIES 5","No","SUBSTANTIAL","PERSONAL","EN ROUTE (ENR)","91","NONE","No","1","0","0","0","0","0","0","0","0","0","0","0","0","0","0","0","0","0","0","0"
"No","08-APR-24","07-APR-24","15:20:00Z","ELLINGTON","CONNECTICUT","UNITED STATES","AIRCRAFT LANDED ON A BERN SHORT OF THE RUNWAY FOR UNKNOWN REASONS, ELLINGTON, CT.","INCIDENT","BRADLEY FSDO","N90JF","FREFAL2","","CESSNA","208","No","UNKNOWN","SKYDIVING","LANDING (LDG)","","NONE","No","2","0","0","0","0","0","0","0","0","0","5","0","0","0","0","0","0","0","0","0"
"No","08-APR-24","06-APR-24","17:49:00Z","KEY BISCAYNE","FLORIDA","UNITED STATES","AIRCRAFT EXPERIENCED ENGINE ISSUES AND CRASHED IN THE WATER, KEY BISCAYNE, FL.","ACCIDENT","SOUTH FLORIDA FSDO","N234ZT","","","ROBINSON","R44","No","SUBSTANTIAL","PERSONAL","EN ROUTE (ENR)","91","NONE","No","1","0","0","0","0","0","0","0","0","0","0","0","0","0","0","0","0","0","0","0"
"No","08-APR-24","06-APR-24","22:00:00Z","CLEVELAND","OHIO","UNITED STATES","AIRCRAFT LANDED, NOSE GEAR COLLAPSED AND ENGINE CAUGHT ON FIRE, CLEVELAND, OH.","ACCIDENT","CLEVELAND FSDO","N1861M","","","BEECH","A36","No","SUBSTANTIAL","PERSONAL","LANDING (LDG)","91","MINOR","No","0","1","0","0","0","0","0","0","0","0","0","0","0","0","1","0","0","0","0","0"
"No","08-APR-24","06-APR-24","02:22:00Z","BOOTHVILLE-VENICE","LOUISIANA","UNITED STATES","AIRCRAFT LANDING ON WATER ENCOUNTERED STRONG WAVES, BOUNCED, LEFT FLOAT BROKE AND LEFT SIDE BECAME SUBMERGED IN WATER, BOOTHVILLE-VENICE, LA.","ACCIDENT","BATON ROUGE FSDO","N7896S","","","CESSNA","U206","No","SUBSTANTIAL","PERSONAL","LANDING (LDG)","91","NONE","No","1","0","0","0","0","0","0","0","0","0","3","0","0","0","0","0","0","0","0","0"
"No","08-APR-24","06-APR-24","19:08:00Z","HUASNA","CALIFORNIA","UNITED STATES","AIRCRAFT LANDED HARD AND STRUCK A FENCE, HUASNA, CA.","ACCIDENT","SAN JOSE FSDO","N8907B","","","CESSNA","172","No","SUBSTANTIAL","PUBLIC USE","LANDING (LDG)","","NONE","No","1","0","0","0","0","0","0","0","0","0","1","0","0","0","0","0","0","0","0","0"
"No","08-APR-24","08-APR-24","01:30:00Z","DEER PARK","WASHINGTON","UNITED STATES","AIRCRAFT TOO SLOW ON APPROACH AND HIT THE GROUND SHORT OF THE RUNWAY AND FLIPPED OVER, DEER PARK, WA.","ACCIDENT","SPOKANE FSDO","N19390","","","CESSNA","150","No","SUBSTANTIAL","PERSONAL","APPROACH (APR)","91","NONE","No","1","0","0","0","0","0","0","0","0","0","0","0","0","0","0","0","0","0","0","0"
"No","08-APR-24","06-APR-24","03:00:00Z","PLAINVIEW","MINNESOTA","UNITED STATES","AIRCRAFT STRUCK A BIRD THAT PENETRATED THE WINDSCREEN, PLAINVIEW, MN.","INCIDENT","MINNEAPOLIS FSDO","N145SZ","","","EUROCOPTER","MBB-BK 117 C-2","No","UNKNOWN","UNKNOWN","EN ROUTE (ENR)","91","NONE","No","1","0","0","0","0","0","0","0","0","0","4","0","0","0","0","0","0","0","0","0"
"No","08-APR-24","05-APR-24","20:00:00Z","ST PAUL","MINNESOTA","UNITED STATES","AIRCRAFT PORPOISED ON LANDING AND LANDING GEAR DETACHED, ST PAUL, MN.","INCIDENT","MINNEAPOLIS FSDO","N245EM","","","VANS","RV12","No","UNKNOWN","INSTRUCTION","LANDING (LDG)","91","NONE","No","1","0","0","0","0","0","0","0","0","0","0","0","0","0","0","0","0","0","0","0"
"No","08-APR-24","06-APR-24","20:00:00Z","LINDEN","NEW JERSEY","UNITED STATES","AIRCRAFT LANDED HARD AND THE GEAR COLLAPSED, LINDEN, NJ.","INCIDENT","TETERBORO FSDO","N273CK","","","LANCAIR","360","No","UNKNOWN","PERSONAL","LANDING (LDG)","91","NONE","No","1","0","0","0","0","0","0","0","0","0","1","0","0","0","0","0","0","0","0","0"
"No","08-APR-24","07-APR-24","13:55:00Z","HENDERSONVILLE","NORTH CAROLINA","UNITED STATES","AIRCRAFT EXPERIENCED ENGINE ISSUES AFTER DEPARTURE AND CRASHED NEAR A RESIDENTIAL AREA, HENDERSONVILLE, NC.","INCIDENT","CHARLOTTE FSDO","N381RS","","","QUAD CITY AIRCRAFT","CHALLENGER II","No","UNKNOWN","PERSONAL","TAKEOFF (TOF)","91","NONE","No","1","0","0","0","0","0","0","0","0","0","0","0","0","0","0","0","0","0","0","0"
"No","08-APR-24","06-APR-24","19:53:00Z","LAFAYETTE","INDIANA","UNITED STATES","AIRCRAFT LANDED, TURNED ONTO TAXIWAY AND LEFT THE PAVEMENT INCURRING A PROP STRIKE AND STRUCK A TAXIWAY LIGHT, LAFAYETTE, IN.","INCIDENT","INDIANAPOLIS FSDO","N571PU","PDU71","PURDUE UNIVERSITY","PIPER","PA44","No","UNKNOWN","FAR 141 PILOT SCHOOL","LANDING (LDG)","91","NONE","No","1","0","0","0","0","0","0","0","0","0","1","0","0","0","0","0","0","0","0","0"
"No","08-APR-24","07-APR-24","18:35:00Z","LAS VEGAS","NEVADA","UNITED STATES","AIRCRAFT ON LANDING AND VEERED OFF RUNWAY INCURRING A PROP STRIKE, LAS VEGAS, NV.","INCIDENT","LAS VEGAS FSDO","N1950F","","","CESSNA","172","No","MINOR","INSTRUCTION","LANDING (LDG)","91","NONE","No","1","0","0","0","0","0","0","0","0","0","0","0","0","0","0","0","0","0","0","0"
"No","08-APR-24","07-APR-24","21:21:00Z","BURLINGTON","WASHINGTON","UNITED STATES","AIRCRAFT INTENDED TO LAND ON A SANDBAR IN THE SKAGIT RIVER, ENCOUNTERED A GUST OF WIND LANDING HARD AND NOSE GEAR COLLAPSED, BURLINGTON, WA.","INCIDENT","SEATTLE FSDO","N7977P","","","ZENITH","CH750 STOL","No","MINOR","INSTRUCTION","LANDING (LDG)","91","NONE","No","1","0","0","0","0","0","0","0","0","0","1","0","0","0","0","0","0","0","0","0"
"No","08-APR-24","05-APR-24","16:03:00Z","GALVESTON","TEXAS","UNITED STATES","AIRCRAFT RIGHT MAIN GEAR COLLAPSED ON LANDING, GALVESTON, TX.","INCIDENT","HOUSTON FSDO","N9996V","","","BELLANCA","17-30A","No","UNKNOWN","PERSONAL","LANDING (LDG)","91","NONE","No","1","0","0","0","0","0","0","0","0","0","0","0","0","0","0","0","0","0","0","0"
"No","08-APR-24","26-MAR-24","18:30:00Z","BATON ROUGE","LOUISIANA","UNITED STATES","AIRCRAFT LANDED HARD FOLLOWING MOVEMENT FROM DOLLEY TO THE TARMAC, BATON ROUGE, LA.","ACCIDENT","BATON ROUGE FSDO","N67183","","","BELL","206","No","SUBSTANTIAL","PUBLIC USE","MANEUVERING (MNV)","","NONE","No","1","0","0","0","0","0","0","0","0","0","0","0","0","0","0","0","0","0","0","0"
"No","05-APR-24","04-APR-24","21:30:00Z","ANTLERS","OKLAHOMA","UNITED STATES","AIRCRAFT CRASHED UNDER UNKNOWN CIRCUMSTANCES NEAR ANTLERS, OKLAHOMA","ACCIDENT","WILL ROGERS FSDO","N88DT","","","FOUTZ","DAVIS DA-3","No","DESTROYED","PERSONAL","UNKNOWN (UNK)","91","FATAL","Yes","0","0","0","1","0","0","0","0","0","0","0","0","0","2","0","0","0","0","0","0"
"No","26-MAR-24","25-MAR-24","13:15:00Z","ST AUGUSTINE","FLORIDA","UNITED STATES","AIRCRAFT CRASHED UNDER UNKNOWN CIRCUMSTANCES SHORTLY AFTER DEPARTURE, ST AUGUSTINE, FL.","ACCIDENT","ORLANDO FSDO","N4387W","","","MOONEY","M20K","No","DESTROYED","PERSONAL","TAKEOFF (TOF)","91","FATAL","Yes","0","0","0","1","0","0","0","0","0","0","0","0","0","1","0","0","0","0","0","0"
"No","26-MAR-24","25-MAR-24","17:16:00Z","SAN SABA","TEXAS","UNITED STATES","AIRCRAFT EXPERIENCED ENGINE ISSUES, DIVERTED TO 81R AND CRASHED SHORT OF THE RUNWAY, SAN SABA, TX.","INCIDENT","SAN ANTONIO FSDO","N498TB","","","CESSNA","T210","No","UNKNOWN","PERSONAL","LANDING (LDG)","91","NONE","No","1","0","0","0","0","0","0","0","0","0","0","0","0","0","0","0","0","0","0","0"
"Yes","26-MAR-24","25-MAR-24","23:49:00Z","KNOXVILLE","TENNESSEE","UNITED STATES","AIRCRAFT ATTEMPTING TO LAND IN THE TENNESSEE RIVER, CRASHED IN THE WATER FOR UNKNOWN REASONS AND FLIPPED OVER, KNOXVILLE, TN.","ACCIDENT","NASHVILLE FSDO","N912GB","","","PROGRESSIVE AERODYNE","SEAREY","No","SUBSTANTIAL","PERSONAL","LANDING (LDG)","91","NONE","No","1","0","0","0","0","0","0","0","0","0","0","0","0","0","0","0","0","0","0","0"
"No","26-MAR-24","26-MAR-24","05:15:00Z","LIHUE","HAWAII","UNITED STATES","AIRCRAFT LANDED AND STRUCK A BIRD DAMAGING THE NOSE, LIHUE, HI.","INCIDENT","HONOLULU FSDO","N550DN","DAL344","DELTA AIRLINES","AIRBUS","A321","No","UNKNOWN","COMMERCIAL","LANDING (LDG)","91","NONE","No","2","0","0","0","0","0","0","0","0","0","183","0","0","0","0","0","0","0","0","0"
"No","27-MAR-24","26-MAR-24","21:10:00Z","LAKEPORT","CALIFORNIA","UNITED STATES","AIRCRAT GEAR COLLAPSED ON LANDING AND SLID OFF RUNWAY, LAKEPORT, CA.","INCIDENT","SACRAMENTO FSDO","N264DM","","","GLASAIR","GLASAIR RG","No","MINOR","PERSONAL","LANDING (LDG)","91","NONE","No","1","0","0","0","0","0","0","0","0","0","1","0","0","0","0","0","0","0","0","0"
"No","27-MAR-24","26-MAR-24","21:10:00Z","LAKEPORT","CALIFORNIA","UNITED STATES","AIRCRAFT ON DEPARTURE, ENGINE STALLED, LANDED AND RAN OFF RUNWAY, LAKEPORT, CA.","INCIDENT","SACRAMENTO FSDO","N3374V","","","BEECH","F35","No","MINOR","PERSONAL","TAKEOFF (TOF)","91","NONE","No","1","0","0","0","0","0","0","0","0","0","1","0","0","0","0","0","0","0","0","0"
"No","27-MAR-24","27-MAR-24","00:30:00Z","BLYTHE","CALIFORNIA","UNITED STATES","AIRCRAFT EXPERIENCED ENGINE ISSUES AND LANDED IN THE DESERT DAMAGING LEFT WINGTIP, BLYTHE, CA.","INCIDENT","RIVERSIDE FSDO","N9611","","","NAVAL AIRCRAFT FACTORY","N3N-3","No","MINOR","UNKNOWN","EN ROUTE (ENR)","91","NONE","No","1","0","0","0","0","0","0","0","0","0","1","0","0","0","0","0","0","0","0","0"
"No","27-MAR-24","27-MAR-24","00:54:00Z","INDIANAPOLIS","INDIANA","UNITED STATES","AIRCRAFT STRUCK A BIRD ON DEPARTURE AND RETURNED TO AIRPORT, INDIANAPOLIS, IN.","INCIDENT","INDIANAPOLIS FSDO","N533TX","JLG533","JET LOGISTICS","TEXTRON","525","No","UNKNOWN","AMBULANCE","TAKEOFF (TOF)","135","NONE","No","","0","0","0","0","0","0","0","0","0","0","0","0","0","0","0","0","0","0","0"
"No","27-MAR-24","27-MAR-24","01:42:00Z","PORTLAND","OREGON","UNITED STATES","AIRCRAFT STRUCK A BIRD ON DEPARTURE AND POST FLIGHT INSPECTION REVEALED A DENT IN THE AIRFRAME, PORTLAND, OR.","INCIDENT","PORTLAND FSDO","N48521","","HILLSBORO AERO ACADEMY","CESSNA","152","No","UNKNOWN","FAR 141 PILOT SCHOOL","TAKEOFF (TOF)","91","NONE","No","1","0","0","0","0","0","0","0","0","0","0","0","0","0","0","0","0","0","0","0"
