"UPDATED","ENTRY_DATE","EVENT_LCL_DATE","EVENT_LCL_TIME","LOC_CITY_NAME","LOC_STATE_NAME","LOC_CNTRY_NAME","RMK_TEXT","EVENT_TYPE_DESC","FSDO_DESC","REGIST_NBR","FLT_NBR","ACFT_OPRTR","ACFT_MAKE_NAME","ACFT_MODEL_NAME","ACFT_MISSING_FLAG","ACFT_DMG_DESC","FLT_ACTIVITY","FLT_PHASE","FAR_PART","MAX_INJ_LVL","FATAL_FLAG","FLT_CRW_INJ_NONE","FLT_CRW_INJ_MINOR","FLT_CRW_INJ_SERIOUS","FLT_CRW_INJ_FATAL","FLT_CRW_INJ_UNK","CBN_CRW_INJ_NONE","CBN_CRW_INJ_MINOR","CBN_CRW_INJ_SERIOUS","CBN_CRW_INJ_FATAL","CBN_CRW_INJ_UNK","PAX_INJ_NONE","PAX_INJ_MINOR","PAX_INJ_SERIOUS","PAX_INJ_FATAL","PAX_INJ_UNK","GRND_INJ_NONE","GRND_INJ_MINOR","GRND_INJ_SERIOUS","GRND_INJ_FATAL","GRND_INJ_UNK"
"No","05-MAY-25","04-MAY-25","16:54:00Z","NEW ORLEANS","LOUISIANA","UNITED STATES","AIRCRAFT STRUCK A BIRD LEAVING A DENT ON THE RIGHT STABILIZER, NEW ORLEANS, LA.","INCIDENT","BATON ROUGE FSDO","N8850Q","SWA1722","SOUTHWEST AIRLINES","BOEING","737","No","UNKNOWN","COMMERCIAL","APPROACH (APR)","121","NONE","No","0","0","0","0","0","0","0","0","0","0","0","0","0","0","0","0","0","0","0","0"
"No","06-MAY-25","05-MAY-25","21:43:00Z","POLK","OHIO","UNITED STATES","AIRCRAFT CRASHED UNDER UNKNOWN CIRCUMSTANCES IN A WOODED AREA, POLK, OH.","ACCIDENT","CLEVELAND FSDO","N519EA","","","EXPRESS AIRCRAFT","EXPRESS 2000 FT","No","UNKNOWN","PERSONAL","UNKNOWN (UNK)","91","FATAL","Yes","0","0","0","1","0","0","0","0","0","0","0","0","0","0","0","0","0","0","0","0"
"No","06-MAY-25","05-MAY-25","20:20:00Z","ASHEVILLE","NORTH CAROLINA","UNITED STATES","AIRCRAFT STRUCK A RUNWAY LIGHT, ASHEVILLE, NC.","INCIDENT","CHARLOTTE FSDO","N52HA","","","CESSNA","182T","No","UNKNOWN","PERSONAL","LANDING (LDG)","91","NONE","No","1","0","0","0","0","0","0","0","0","0","0","0","0","0","0","0","0","0","0","0"
"No","06-MAY-25","05-MAY-25","16:32:00Z","LINCOLN","NEBRASKA","UNITED STATES","AIRCRAFT LANDED HARD AND VEERED INTO THE GRASS, LINCOLN, NE.","INCIDENT","LINCOLN FSDO","N367MA","","","CESSNA","172","No","UNKNOWN","PERSONAL","LANDING (LDG)","91","NONE","No","1","0","0","0","0","0","0","0","0","0","0","0","0","0","0","0","0","0","0","0"
"No","06-MAY-25","03-MAY-25","00:00:00Z","STARBUCK","MINNESOTA","UNITED STATES","AIRCRAFT LANDED GEAR UP, STARBUCK, MN.","INCIDENT","MINNEAPOLIS FSDO","N812CH","","","MOONEY","M20B","No","UNKNOWN","PERSONAL","LANDING (LDG)","91","NONE","No","1","0","0","0","0","0","0","0","0","0","1","0","0","0","0","0","0","0","0","0"
"No","06-MAY-25","19-MAR-25","21:00:00Z","UPLAND","CALIFORNIA","UNITED STATES","AIRCRAFT PORPOISED AND INCURRED A PROP STRIKE, UPLAND, CA.","INCIDENT","RIVERSIDE FSDO","N64866","","","CESSNA","172","No","UNKNOWN","PERSONAL","LANDING (LDG)","91","NONE","No","1","0","0","0","0","0","0","0","0","0","0","0","0","0","0","0","0","0","0","0"
"No","06-MAY-25","05-MAY-25","20:12:00Z","PIERSON","FLORIDA","UNITED STATES","AIRCRAFT EXPERIENCED ENGINE ISSUES AND LANDED ON A HIGHWAY, PIERSON, FL.","INCIDENT","ORLANDO FSDO","N82660","","","AERONCA","7AC","No","UNKNOWN","PERSONAL","EN ROUTE (ENR)","91","NONE","No","1","0","0","0","0","0","0","0","0","0","1","0","0","0","0","0","0","0","0","0"
"No","06-MAY-25","05-MAY-25","23:00:00Z","SOUTH ST PAUL","MINNESOTA","UNITED STATES","AIRCRAFT INCURRED A PROP STRIKE ON LANDING, SOUTH ST PAUL, MN.","INCIDENT","MINNEAPOLIS FSDO","N7951W","","","PIPER","PA28","No","UNKNOWN","PERSONAL","LANDING (LDG)","91","NONE","No","1","0","0","0","0","0","0","0","0","0","0","0","0","0","0","0","0","0","0","0"
"No","08-MAY-25","07-MAY-25","22:30:00Z","FLATHEAD LAKE","MONTANA","UNITED STATES","AIRCRAFT SUFFERED A HARD LANDING DUE TO POWER LOSS","INCIDENT","HELENA FSDO","N77TU","","","STEMME GMBH & CO","S10-VT","No","UNKNOWN","PERSONAL","LANDING (LDG)","91","NONE","No","1","0","0","0","0","0","0","0","0","0","0","0","0","0","0","0","0","0","0","0"
"No","08-MAY-25","07-MAY-25","15:29:00Z","BELLEFONTAINE","OHIO","UNITED STATES","AIRCRAFT RIGHT MAIN LANDING GEAR COLLAPSED ON LANDING RESULTING IN PROPELLER STRIKE","INCIDENT","COLUMBUS FSDO","N108LU","","","DIAMOND","DA42","No","UNKNOWN","PERSONAL","LANDING (LDG)","91","NONE","No","1","0","0","0","0","0","0","0","0","0","1","0","0","0","0","0","0","0","0","0"
"No","08-MAY-25","08-MAY-25","00:53:00Z","OCALA","FLORIDA","UNITED STATES","AIRCRAFT CRASHED SOUTH OF THE AIRPORT FOR UNKNOWN REASONS","INCIDENT","ORLANDO FSDO","N174A","","","CESSNA","182A","No","UNKNOWN","PERSONAL","APPROACH (APR)","91","UNKNOWN","No","0","0","0","0","1","0","0","0","0","0","0","0","0","0","0","0","0","0","0","0"
"No","08-MAY-25","07-MAY-25","20:00:00Z","SANFORD","NORTH CAROLINA","UNITED STATES","AIRCRAFT CRASHED 300 YARDS SOUTH OF RUNWAY 3/21 FOR UNKNOWN REASONS","INCIDENT","GREENSBORO FSDO","N499BW","","","DIAMOND","DA40","No","UNKNOWN","PERSONAL","APPROACH (APR)","91","UNKNOWN","No","0","0","0","0","1","0","0","0","0","0","0","0","0","0","1","0","0","0","0","0"
"No","08-MAY-25","07-MAY-25","19:24:00Z","MANSFIELD","OHIO","UNITED STATES","AIRCRAFT ABORTED TAKEOFF DUE TO A VIOLENT NOSE WHEEL SHIMMY. POST FLIGHT INSPECTION FOUND DAMAGE TO THE NOSE WHEEL STRUT.","INCIDENT","CLEVELAND FSDO","N5601E","","","CESSNA","182","No","UNKNOWN","PERSONAL","TAKEOFF (TOF)","91","UNKNOWN","No","1","0","0","0","0","0","0","0","0","0","0","0","0","0","0","0","0","0","0","0"
"No","08-MAY-25","07-MAY-25","17:20:00Z","DUBOIS","PENNSYLVANIA","UNITED STATES","AIRCRAFT LANDED WITH LANDING GEAR RETRACTED, CAUSING DAMAGE TO THE PROPELLER AND FUSELAGE","INCIDENT","ALLEGHENY FSDO","N9124M","","","MOONEY","M20R","No","UNKNOWN","PERSONAL","LANDING (LDG)","91","NONE","No","1","0","0","0","0","0","0","0","0","0","1","0","0","0","0","0","0","0","0","0"
"No","09-MAY-25","08-MAY-25","19:14:00Z","WICHITA","KANSAS","UNITED STATES","AIRCRAFT STRUCK A FLOCK OF BIRDS ON DEPARTURE DAMAGING THE WEATHER RADAR, WICHITA, KS.","INCIDENT","WICHITA FSDO","N971AT","DAL1637","DELTA AIRLINES","BOEING","717","No","UNKNOWN","COMMERCIAL","TAKEOFF (TOF)","121","NONE","No","0","0","0","0","0","0","0","0","0","0","0","0","0","0","0","0","0","0","0","0"
"No","09-MAY-25","08-MAY-25","15:30:00Z","NICKERSON","KANSAS","UNITED STATES","AIRCRAFT DEPARTED, THE MAIN LANDING GEAR WHEELS TOUCHED A PASSING VEHICLE DAMAGING THE SUNROOF, NICKERSON, KS.","INCIDENT","WICHITA FSDO","N3653Y","","","AIR TRACTOR","AT301","No","NONE","AERIAL APPLICATION","TAKEOFF (TOF)","137","NONE","No","1","0","0","0","0","0","0","0","0","0","0","0","0","0","0","0","0","0","0","0"
"No","09-MAY-25","08-MAY-25","23:28:00Z","HOMESTEAD","FLORIDA","UNITED STATES","AIRCRAFT EXPERIENCED ENGINE ISSUES AND CRASHED IN A SWAMP, HOMESTEAD, FL.","INCIDENT","SOUTH FLORIDA FSDO","N5405T","","","CESSNA","172","No","UNKNOWN","PERSONAL","EN ROUTE (ENR)","91","UNKNOWN","No","0","0","0","0","1","0","0","0","0","0","0","0","0","0","1","0","0","0","0","0"
"No","09-MAY-25","08-MAY-25","00:42:00Z","TIFFIN","OHIO","UNITED STATES","AIRCRAFT STRUCK A DEER ON LANDING, TIFFIN, OH.","INCIDENT","CLEVELAND FSDO","N335BG","","","PIPER","PA28","No","UNKNOWN","INSTRUCTION","LANDING (LDG)","91","NONE","No","1","0","0","0","0","0","0","0","0","0","1","0","0","0","0","0","0","0","0","0"
"No","09-MAY-25","08-MAY-25","15:59:00Z","HOUSTON","TEXAS","UNITED STATES","AIRCRAFT LANDED GEAR UP, HOUSTON, TX.","INCIDENT","HOUSTON FSDO","N5338V","","","CESSNA","172RG","No","UNKNOWN","PERSONAL","LANDING (LDG)","91","NONE","No","1","0","0","0","0","0","0","0","0","0","1","0","0","0","0","0","0","0","0","0"
"No","08-MAY-25","30-APR-25","23:00:00Z","DUNCAN","OKLAHOMA","UNITED STATES","AIRCRAFT LANDED THEN VEERED OFF RUNWAY BEFORE FLIPPING OVER IN THE GRASS","ACCIDENT","WILL ROGERS FSDO","N2135Z","","","CESSNA","180","No","SUBSTANTIAL","PERSONAL","LANDING (LDG)","91","NONE","No","1","0","0","0","0","0","0","0","0","0","1","0","0","0","0","0","0","0","0","0"
"No","05-MAY-25","04-MAY-25","00:30:00Z","HICKORY VALLEY","TENNESSEE","UNITED STATES","AIRCRAFT LANDED SHORT OF THE RUNWAY AND THE RIGHT GEAR COLLAPSED, HICKORY VALLEY, TN.","INCIDENT","NASHVILLE FSDO","N66KA","","","BEECH","C90","No","UNKNOWN","PERSONAL","LANDING (LDG)","91","NONE","No","1","0","0","0","0","0","0","0","0","0","0","0","0","0","0","0","0","0","0","0"
"No","29-APR-25","28-APR-25","20:40:00Z","LANCASTER","TEXAS","UNITED STATES","AIRCRAFT EXPERIENCED ENGINE ISSUES AND CRASHED IN A FIELD, LANCASTER, TX.","ACCIDENT","NORTH TEXAS FSDO","N501MS","","","BEECH","C90","No","UNKNOWN","PERSONAL","UNKNOWN (UNK)","91","SERIOUS","No","0","0","1","0","0","0","0","0","0","0","0","2","0","0","0","0","0","0","0","0"
"No","29-APR-25","28-APR-25","20:05:00Z","LAKEVIEW","OREGON","UNITED STATES","AIRCRAFT LANDED AND VEERED OFF RUNWAY INTO A DITCH, LAKEVIEW, OR.","ACCIDENT","PORTLAND FSDO","N4505R","","","PIPER","PA28","No","SUBSTANTIAL","PERSONAL","LANDING (LDG)","91","MINOR","No","0","1","0","0","0","0","0","0","0","0","0","1","0","0","0","0","0","0","0","0"
"No","29-APR-25","28-APR-25","22:13:00Z","NANWALEK","ALASKA","UNITED STATES","AIRCRAFT CRASHED FOR UNKNOWN REASONS ON THE RUNWAY AND WENT INTO THE WATER AT THE END OF THE RUNWAY, NANWALEK, AK.","ACCIDENT","ANCHORAGE FSDO","N91025","","SMOKEY BAY AIR","CESSNA","T207","No","SUBSTANTIAL","ON DEMAND","UNKNOWN (UNK)","135","FATAL","Yes","0","0","0","1","0","0","0","0","0","0","0","0","1","1","0","0","0","0","0","0"
"No","29-APR-25","27-APR-25","04:00:00Z","SAN ANTONIO","TEXAS","UNITED STATES","AIRCRAFT DECLARED AN EMERGENCY AND MADE AN EMERGENCY LANDING IN A RESIDENTIAL NEIGHBORHOOD, SAN ANTONIO, TX.","INCIDENT","SAN ANTONIO FSDO","N488AE","","","BELL","407","No","NONE","AMBULANCE","EN ROUTE (ENR)","135","NONE","No","0","0","0","0","0","0","0","0","0","0","0","0","0","0","0","0","0","0","0","0"
"No","29-APR-25","29-APR-25","03:52:00Z","CHANTILLY","VIRGINIA","UNITED STATES","AIRCRAFT STRUCK A BIRD ON FINAL FOR RUNWAY, CHANTILLY, VA.","INCIDENT","WASHINGTON FSDO","N88359","ASH6362","UNITED AIRLINES","EMBRAER","ERJ 170-200 LR","No","MINOR","COMMERCIAL","APPROACH (APR)","121","NONE","No","0","0","0","0","0","0","0","0","0","0","0","0","0","0","0","0","0","0","0","0"
"No","30-APR-25","29-APR-25","14:30:00Z","LAKE CRESCENT","FLORIDA","UNITED STATES","AIRCRAFT CRASHED INTO THE LAKE FOR UNKNOWN REASONS WHILE CONDUCTING A TOUCH AND GO, LAKE CRESCENT, FL.","ACCIDENT","ORLANDO FSDO","N694W","","","AVIAT AIRCRAFT","A-1B","No","SUBSTANTIAL","PERSONAL","MANEUVERING (MNV)","91","NONE","No","1","0","0","0","0","0","0","0","0","0","1","0","0","0","0","0","0","0","0","0"
"No","30-APR-25","26-APR-25","15:23:00Z","JACKSONVILLE","TEXAS","UNITED STATES","AIRCRAFT ON A TEST FLIGHT, LANDED INVERTED DUE TO A WIND GUST, JACKSONVILLE, TX.","ACCIDENT","NORTH TEXAS FSDO","N7770J","","","JUST AIRCRAFT","HIGHLANDER","No","SUBSTANTIAL","OTHER","LANDING (LDG)","91","NONE","No","1","0","0","0","0","0","0","0","0","0","0","0","0","0","0","0","0","0","0","0"
"No","30-APR-25","29-APR-25","13:53:00Z","JACKSONVILLE","FLORIDA","UNITED STATES","AIRCRAFT MADE A PRECAUTIONARY LANDING IN A FIELD, JACKSONVILLE, FL.","INCIDENT","ORLANDO FSDO","N92JP","","","BELL","407","No","NONE","PUBLIC USE","EN ROUTE (ENR)","91","NONE","No","1","0","0","0","0","0","0","0","0","0","1","0","0","0","0","0","0","0","0","0"
"Yes","30-APR-25","29-APR-25","20:08:00Z","COTTONWOOD","CALIFORNIA","UNITED STATES","AIRCRAFT CRASHED UNDER UNKNOWN CIRCUMSTANCES AND POST CRASH FIRE, COTTONWOOD, CA.","ACCIDENT","SACRAMENTO FSDO","N6310N","","","CHAMPION","7ECA","No","DESTROYED","PERSONAL","UNKNOWN (UNK)","91","FATAL","Yes","0","0","0","1","0","0","0","0","0","0","0","0","0","1","0","0","0","0","0","0"
"Yes","30-APR-25","29-APR-25","12:40:00Z","ST JOHNS","Newfoundland and Labrador","CANADA","AIRCRAFT CRASHED UNDER UNKNOWN CIRCUMSTANCES, ST JOHNS, NL.","ACCIDENT","LOS ANGELES IFO","N4025K","","","AIR TRACTOR","AT802","Yes","UNKNOWN","FERRY","EN ROUTE (ENR)","91","FATAL","Yes","0","0","0","1","0","0","0","0","0","0","0","0","0","0","0","0","0","0","0","0"
"No","01-MAY-25","30-APR-25","14:30:00Z","STEVENSVILLE","MARYLAND","UNITED STATES","AIRCRAFT LANDED AND WIND GUST LIFTED NOSE INTO THE AIR, PILOT ELECTED TO GO AROUND, THE NOSE CAME BACK DOWN AND IMPACTED THE PAVEMENT VEERING OFF RUNWAY RESULTING IN TAIL SEPARATION, STEVENSVILLE, MD.","ACCIDENT","BALTIMORE FSDO","N77SL","","","CIRRUS","SR22","No","SUBSTANTIAL","PERSONAL","LANDING (LDG)","91","NONE","No","1","0","0","0","0","0","0","0","0","0","0","0","0","0","0","0","0","0","0","0"
"No","01-MAY-25","30-APR-25","15:09:00Z","CLAY","NORTH CAROLINA","UNITED STATES","AIRCRAFT CRASHED IN A FIELD FOR UNKNOWN REASONS, CLAY, NC.","INCIDENT","GREENSBORO FSDO","N788MP","","","JUST AIRCRAFT","HIGHLANDER","No","UNKNOWN","PERSONAL","EN ROUTE (ENR)","91","MINOR","No","0","1","0","0","0","0","0","0","0","0","0","0","0","0","0","0","0","0","0","0"
"No","01-MAY-25","29-APR-25","20:20:00Z","MINNEAPOLIS","MINNESOTA","UNITED STATES","AIRCRAFT LANDED AND EXITED RUNWAY, WAS HOLDING WHEN IT WAS STRUCK BY THE WING OF N80619, MINNEAPOLIS, MN.","INCIDENT","MINNEAPOLIS FSDO","N80135","","","CESSNA","172","No","UNKNOWN","PERSONAL","STANDING (STD)","91","NONE","No","1","0","0","0","0","0","0","0","0","0","1","0","0","0","0","0","0","0","0","0"
"No","01-MAY-25","29-APR-25","20:20:00Z","MINNEAPOLIS","MINNESOTA","UNITED STATES","AIRCRAFT WING STRUCK N80135 WHICH WAS HOLDING, MINNEAPOLIS, MN.","INCIDENT","MINNEAPOLIS FSDO","N80619","","","CESSNA","172","No","UNKNOWN","PERSONAL","TAXI (TXI)","91","NONE","No","1","0","0","0","0","0","0","0","0","0","1","0","0","0","0","0","0","0","0","0"
"No","01-MAY-25","30-APR-25","22:52:00Z","OKLAHOMA CITY","OKLAHOMA","UNITED STATES","AIRCRAFT ON LANDING, SKIDDED AND ROLLED OVER ON ITS SIDE FOR UNKNOWN REASONS, OKLAHOMA CITY, OK.","INCIDENT","WILL ROGERS FSDO","N9TV","","NEWS9","BELL","505","No","UNKNOWN","OTHER","LANDING (LDG)","91","MINOR","No","0","1","0","0","0","0","0","0","0","0","0","1","0","0","0","0","0","0","0","0"
"No","01-MAY-25","30-APR-25","16:15:00Z","CLEVELAND","OHIO","UNITED STATES","AIRCRAFT STRUCK A BIRD ON LANDING DAMAGING THE LEADING EDGE OF THE WING, CLEVELAND, OH.","INCIDENT","CLEVELAND FSDO","N641RW","RPA3478","REPUBLIC AIRWAYS","EMBRAER","ERJ 170-100 SE","No","UNKNOWN","COMMERCIAL","LANDING (LDG)","91","NONE","No","0","0","0","0","0","0","0","0","0","0","0","0","0","0","0","0","0","0","0","0"
"No","01-MAY-25","01-MAY-25","04:42:00Z","KENAI","ALASKA","UNITED STATES","AIRCRAFT WAS TAXIING, VEERED OFF RUNWAY AND BECAME STUCK IN A HOLE, KENAI, AK.","INCIDENT","ANCHORAGE FSDO","N8803","","","BELLANCA","7GCBC","No","NONE","PERSONAL","TAXI (TXI)","91","NONE","No","1","0","0","0","0","0","0","0","0","0","0","0","0","0","0","0","0","0","0","0"
"No","02-MAY-25","29-APR-25","08:40:00Z","ST. JOHN","NEWFOUNDLAND","CANADA","AIRCRAFT PRELIM INFO FROM FAA OPS: ST JOHN'S, CANADA/GENERAL AVIATION FATAL ACCIDENT/4-29 0840E/1 FATAL WHEN N4025K, AIR TRACTOR AT8T, ST. JOHN'S, NEWFOUNDLAND (CYYT) - SANTA MARIA ISLAND, PORTUGAL (LPAZ), ACFT LOST CONTACT WITH ATC AND DROPPED OF RADAR 130
ESE ST JOHN'S ARPT (CYYT). 1 POB. CANADIAN COAST GUARD HAS SUSPENDED THE SEARCH. ATC SVCS PROVIDED BY GANDER CENTER. DAMAGE: UNKN. WX: NOT REPORTED. WOC 202-267-3333 JG/JWRCRAFTRAFT
A SINGLE-ENGINE FLOATPLANE WENT MISSING DURING A TRANSATLANTIC FLIGHT. SEARCH EFFORTS ARE ONGOING. A SPOKESPERSON WITH THE JRCC SAYS A PONTOON AND AN EMPTY, ORANGE LIFE RAFT WERE FOUND FLOATING ON THE SURFACE IN THE SEARCH AREA. AN ""OIL SLICK"" WAS ALSO LOCATED. SEARCH SUSPENDED 05/05/2025, 1 PRESUMED FATAL","ACCIDENT","PORTLAND FSDO","N4025K","","","AIR TRACTOR","AT802A","Yes","DESTROYED","FERRY","EN ROUTE (ENR)","91","FATAL","Yes","0","0","0","1","0","0","0","0","0","0","0","0","0","0","0","0","0","0","0","0"
"No","02-MAY-25","01-MAY-25","15:15:00Z","GRASS VALLEY","CALIFORNIA","UNITED STATES","PRELIM INFO FROM FAA OPS: GRASS VALLEY, CA/GENERAL AVIATION FATAL ACCIDENT/0815P/1 FATAL WHEN VFR N52156, CESSNA C77R, AUBURN, CA (AUN) - GRASS VALLEY, CA (GOO), CRASHED UNDER UNKN CIRCUMSTANCES ON RESIDENTIAL ROAD W GOO. ATC SVCS PROVIDED: UNKN. 1 POB. DAMAGE: EXTENT NOT REPORTED. NO GROUND INJURIES-DAMAGES REPORTED. WX: NOT REPORTED. WOC 202-267-3333 RC/RL","ACCIDENT","SACRAMENTO FSDO","N52156","","","CESSNA","177RG","No","DESTROYED","PERSONAL","UNKNOWN (UNK)","91","FATAL","Yes","0","0","0","1","0","0","0","0","0","0","0","0","0","0","0","0","0","0","0","0"
"No","02-MAY-25","01-MAY-25","17:30:00Z","TUSCON","ARIZONA","UNITED STATES","TUCSON, AZ (RYN): N433EZ, LGEZ, RYN-RYN, ON LANDING RUNWAY 06R THE AIRCRAFT VEERED OFF THE RIGHT SIDE OF THE RUNWAY AND STRUCK A RUNWAY SIGN. POB: 1, INJURIES: NONE, DAMAGE: SUBSTANTIAL. 05/01/2025 1730Z","ACCIDENT","SCOTTSDALE FSDO","N433EZ","","","REULAND RICHARD S JR","LONG-EZE","No","SUBSTANTIAL","PERSONAL","LANDING (LDG)","91","NONE","No","1","0","0","0","0","0","0","0","0","0","0","0","0","0","0","0","0","0","0","0"
"No","02-MAY-25","30-APR-25","17:30:00Z","SPARTANBURG","SOUTH CAROLINA","UNITED STATES","AIRCRAFT  SPARTANBURG, SC (SPA): N3869T, P28R, AIRCRAFT EXPERIENCED A GEAR UP LANDING ON RUNWAY 4/22 FOR UNKNOWN REASONS. POB: 1, INJURIES: NONE, DAMAGE: EXTENT UNKNOWN. 04/30/2025 2220Z. (DELAYED NOTIFICATION)","INCIDENT","COLUMBIA FSDO","N3869T","","","PIPER","PA-28R-180","No","UNKNOWN","PERSONAL","LANDING (LDG)","91","NONE","No","1","0","0","0","0","0","0","0","0","0","0","0","0","0","0","0","0","0","0","0"
"No","02-MAY-25","01-MAY-25","23:03:00Z","SAN ANTONIO","TEXAS","UNITED STATES","AIRCRAFT SAN ANTONIO, TX (SAT): N659DM, AVIONS CAP 32, SAT-SAT, EXPERIMENTAL, NOSED UP ON DEPARTURE FROM RWY 4 AND INCURRED A PROP STRIKE. POB: 1, INJURIES: NONE, DAMAGE: EXTENT UNKNOWN. 05/01/2025 2303Z","INCIDENT","SAN ANTONIO FSDO","N659DM","","","AVIONS MUDRY CIE","CAP 232","No","UNKNOWN","PERSONAL","TAKEOFF (TOF)","91","NONE","No","1","0","0","0","0","0","0","0","0","0","0","0","0","0","0","0","0","0","0","0"
"No","02-MAY-25","01-MAY-25","16:29:00Z","FREDERICK","MARYLAND","UNITED STATES","AIRCRAFT FREDERICK, MD (FDK): N616MM, TB30, EXPERIENCED A NOSE GEAR COLLAPSE WHILE LANDING RUNWAY 12 DUE TO A HYDRAULIC ISSUE. POB: 2, INJURIES: NONE, DAMAGE: EXTENT UNKNOWN. 05/01/2025 1629Z","INCIDENT","BALTIMORE FSDO","N616MM","","","SOCATA","TB 30 EPSILON","No","UNKNOWN","PERSONAL","LANDING (LDG)","91","NONE","No","1","0","0","0","0","0","0","0","0","0","1","0","0","0","0","0","0","0","0","0"
"No","02-MAY-25","01-MAY-25","12:01:00Z","GRASS VALLEY","CALIFORNIA","UNITED STATES","AIRCRAFT CRASHED UNDER UNKNOWN CIRCUMSTANCES ON A ROAD, GRASS VALLEY, CA.","ACCIDENT","SACRAMENTO FSDO","N52156","","","CESSNA","172RG","No","UNKNOWN","PERSONAL","EN ROUTE (ENR)","91","FATAL","Yes","0","0","0","1","0","0","0","0","0","0","0","0","0","0","0","0","0","0","0","0"
"No","02-MAY-25","01-MAY-25","16:29:00Z","FREDERICK","MARYLAND","UNITED STATES","AIRCRAFT NOSE GEAR COLLAPSED ON LANDING, FREDERICK, MD.","INCIDENT","BALTIMORE FSDO","N616MM","","","SOCATA","TB 30 EPSILON","No","UNKNOWN","PERSONAL","LANDING (LDG)","91","NONE","No","1","0","0","0","0","0","0","0","0","0","1","0","0","0","0","0","0","0","0","0"
"No","02-MAY-25","06-APR-25","02:34:00Z","FAYETTEVILLE","ARKANSAS","UNITED STATES","AIRCRAFT STRUCK A BIRD ON LANDING LEAVING A DENT IN THE LOWER RIGHT FUSELAGE, FAYETTEVILLE, AR.","INCIDENT","LITTLE ROCK FSDO","N245NN","ENY3452","ENVOY","EMBRAER","ERJ 170-200 LR","No","MINOR","COMMERCIAL","LANDING (LDG)","121","NONE","No","0","0","0","0","0","0","0","0","0","0","0","0","0","0","0","0","0","0","0","0"
"No","02-MAY-25","30-APR-25","22:20:00Z","SPARTANBURG","SOUTH CAROLINA","UNITED STATES","AIRCRAFT LANDED GEAR UP, SPARTANBURG, SC.","INCIDENT","COLUMBIA FSDO","N3869T","","","PIPER","PA28R","No","UNKNOWN","PERSONAL","LANDING (LDG)","91","NONE","No","1","0","0","0","0","0","0","0","0","0","0","0","0","0","0","0","0","0","0","0"
"No","28-APR-25","26-APR-25","14:29:00Z","SPARTA","TENNESSEE","UNITED STATES","AIRCRAFT CRASHED UNDER UNKNOWN CIRCUMSTANCES, SPARTA, TN.","ACCIDENT","NASHVILLE FSDO","N242RE","","","MOONEY","M20TN","No","DESTROYED","PERSONAL","APPROACH (APR)","91","FATAL","Yes","0","0","0","1","0","0","0","0","0","0","0","0","0","2","0","0","0","0","0","0"
"No","28-APR-25","26-APR-25","19:15:00Z","ONTARIO","OREGON","UNITED STATES","AIRCRAFT LOST AIRSPEED, RIGHT WING AND NOSE IMPACTED THE GROUND HALF MILE SHORT OF THE RUNWAY, ONTARIO, OR.","ACCIDENT","BOISE FSDO","N8657R","","","SCHWEIZER","SGS 1-26B","No","SUBSTANTIAL","PERSONAL","APPROACH (APR)","91","UNKNOWN","No","0","0","0","0","1","0","0","0","0","0","0","0","0","0","0","0","0","0","0","0"
"No","28-APR-25","25-APR-25","20:00:00Z","ST GEORGE","UTAH","UNITED STATES","AIRCRAFT LANDED GEAR UP, ST GEORGE, UT.","INCIDENT","SALT LAKE CITY FSDO","N27EH","","","CESSNA","335","No","UNKNOWN","PERSONAL","LANDING (LDG)","91","NONE","No","1","0","0","0","0","0","0","0","0","0","1","0","0","0","0","0","0","0","0","0"
"Yes","28-APR-25","27-APR-25","23:25:00Z","ALPINE","WYOMING","UNITED STATES","AIRCRAFT OVER RAN THE RUNWAY ON LANDING, ALPINE, WY.","INCIDENT","DENVER FSDO","N76JT","","","CESSNA","525A","No","MINOR","PERSONAL","LANDING (LDG)","91","NONE","No","1","0","0","0","0","0","0","0","0","0","1","0","0","0","0","0","0","0","0","0"
"No","28-APR-25","25-APR-25","15:04:00Z","BAR HARBOR","MAINE","UNITED STATES","AIRCRAFT STRUCK A BIRD AND RETURNED TO BHB AND POST FLIGHT INSPECTION REVEALED DAMAGE TO LEFT WING, BAR HARBOR, ME.","INCIDENT","PORTLAND ME FSDO","N401SX","KAP115","CAPE AIR","CESSNA","402","No","MINOR","ON DEMAND","TAKEOFF (TOF)","135","NONE","No","0","0","0","0","0","0","0","0","0","0","0","0","0","0","0","0","0","0","0","0"
"No","28-APR-25","28-APR-25","02:00:00Z","APPLETON","WISCONSIN","UNITED STATES","AIRCRAFT STRUCK A BIRD AND POST FLIGHT INSPECTION REVEALED A DENT IN THE RIGHT WING, APPLETON, WI.","INCIDENT","MILWAUKEE FSDO","N718EV","SKW4748","SKYWEST AIRLINES","BOMBARDIER","CL-600-2C11","No","UNKNOWN","COMMERCIAL","LANDING (LDG)","121","NONE","No","0","0","0","0","0","0","0","0","0","0","0","0","0","0","0","0","0","0","0","0"
"No","28-APR-25","25-APR-25","01:12:00Z","HOUSTON","TEXAS","UNITED STATES","AIRCRAFT STRUCK A BIRD LEAVING A DENT IN THE ENGINE COWLING, HOUSTON, TX.","INCIDENT","HOUSTON FSDO","N738E","","","BOMBARDIER","BD-100-1A10","No","MINOR","CORPORATE","TAKEOFF (TOF)","91","NONE","No","2","0","0","0","0","0","0","0","0","0","0","0","0","0","0","0","0","0","0","0"
"No","28-APR-25","27-APR-25","13:36:00Z","EHRHARDT","SOUTH CAROLINA","UNITED STATES","AIRCRAFT LANDING ON A GRASS STRIP AND CRASHED INTO A BERM AT THE END OF THE RUNWAY, EHRHARDT, SC.","INCIDENT","COLUMBIA FSDO","N3170S","","","CESSNA","182","No","UNKNOWN","PERSONAL","LANDING (LDG)","91","NONE","No","1","0","0","0","0","0","0","0","0","0","0","0","0","0","0","0","0","0","0","0"
"No","28-APR-25","26-APR-25","15:22:00Z","STAUNTON","VIRGINIA","UNITED STATES","AIRCRAFT EXPERIENCED ENGINE ISSUES AND LANDED IN A FIELD, STAUTON, VA.","INCIDENT","RICHMOND FSDO","N9117L","","","CHAMPION","7GCBC","No","UNKNOWN","PERSONAL","APPROACH (APR)","91","NONE","No","1","0","0","0","0","0","0","0","0","0","1","0","0","0","0","0","0","0","0","0"
"No","28-APR-25","25-APR-25","09:34:00Z","FAIRBANKS","ALASKA","UNITED STATES","AIRCRAFT STRUCK A TREE ON TAKEOFF AND MADE AN EMERGENCY LANDING, FAIRBANKS, AK.","INCIDENT","FAIRBANKS FSDO","N9308K","","","STINSON","108","No","UNKNOWN","PERSONAL","TAKEOFF (TOF)","91","MINOR","No","0","1","0","0","0","0","0","0","0","0","0","0","0","0","0","0","0","0","0","0"
"No","28-APR-25","26-APR-25","15:31:00Z","SACRAMENTO","CALIFORNIA","UNITED STATES","AIRCRAFT STRUCK A BIRD ON TAKEOFF DAMAGING THE LANDING GEAR, SACRAMENTO, CA.","INCIDENT","SACRAMENTO FSDO","N35204","UAL1946","UNITED","BOEING","737","No","UNKNOWN","COMMERCIAL","TAKEOFF (TOF)","121","NONE","No","0","0","0","0","0","0","0","0","0","0","0","0","0","0","0","0","0","0","0","0"
"No","05-MAY-25","04-MAY-25","17:58:00Z","SULPHUR","LOUISIANA","UNITED STATES","AIRCRAFT LANDED GEAR UP, SULPHUR, LA.","INCIDENT","BATON ROUGE FSDO","N57651","","","MOONEY","M20J","No","UNKNOWN","PERSONAL","LANDING (LDG)","91","NONE","No","1","0","0","0","0","0","0","0","0","0","0","0","0","0","0","0","0","0","0","0"
"No","07-MAY-25","06-MAY-25","16:58:00Z","READING","PENNSYLVANIA","UNITED STATES","AIRCRAFT VEERED OFF THE RIGHT SIDE OF RUNWAY AND INTO THE GRASS","INCIDENT","ALLENTOWN FSDO","N289RS","","","PAZMANY","PL2","No","UNKNOWN","PERSONAL","LANDING (LDG)","","NONE","No","1","0","0","0","0","0","0","0","0","0","1","0","0","0","0","0","0","0","0","0"
"No","07-MAY-25","06-MAY-25","13:15:00Z","SALISBURY","NORTH CAROLINA","UNITED STATES","AIRCRAFT EXPERIENCED AN ENGINE FAILURE WHILE IN THE TRAFFIC PATTERN AND LANDED IN THE
GRASS ADJACENT TO RUNWAY.","INCIDENT","CHARLOTTE FSDO","N3030U","","","CESSNA","172","No","UNKNOWN","PERSONAL","MANEUVERING (MNV)","91","NONE","No","1","0","0","0","0","0","0","0","0","0","1","0","0","0","0","0","0","0","0","0"
"No","07-MAY-25","06-MAY-25","07:30:00Z","SAN FRANCISCO","CALIFORNIA","UNITED STATES","AIRCRAFT RIGHT WING STRUCK THE LEFT WING OF UNITED 877 DURING PUSHBACK.","INCIDENT","OAKLAND FSDO","N2727U","863","UNITED","BOEING","777","No","UNKNOWN","COMMERCIAL","PUSHBACK/TOWING (PBT)","121","NONE","No","3","0","0","0","0","13","0","0","0","0","202","0","0","0","0","0","0","0","0","0"
"No","07-MAY-25","06-MAY-25","07:30:00Z","SAN FRANCISCO","CALIFORNIA","UNITED STATES","AIRCRAFT LEFT WING WAS STRUCK BY THE RIGHT WING OF UAL863 DURING PUSHBACK","INCIDENT","OAKLAND FSDO","N2645U","877","UNITED","BOEING","777","No","UNKNOWN","COMMERCIAL","PUSHBACK/TOWING (PBT)","121","NONE","No","3","0","0","0","0","13","0","0","0","0","307","0","0","0","0","0","0","0","0","0"
"No","07-MAY-25","06-MAY-25","21:40:00Z","BOULDER CITY","NEVADA","UNITED STATES","AIRCRAFT SUSTAINED ENROUTE HAIL DAMAGE","INCIDENT","LAS VEGAS FSDO","N142SA","CVU42","GRAND CANYON SCENIC AIRLINES","DE HAVILLAND","DHC6","No","UNKNOWN","SIGHT SEEING","EN ROUTE (ENR)","135","NONE","No","1","0","0","0","0","0","0","0","0","0","12","0","0","0","0","0","0","0","0","0"
