"UPDATED","ENTRY_DATE","EVENT_LCL_DATE","EVENT_LCL_TIME","LOC_CITY_NAME","LOC_STATE_NAME","LOC_CNTRY_NAME","RMK_TEXT","EVENT_TYPE_DESC","FSDO_DESC","REGIST_NBR","FLT_NBR","ACFT_OPRTR","ACFT_MAKE_NAME","ACFT_MODEL_NAME","ACFT_MISSING_FLAG","ACFT_DMG_DESC","FLT_ACTIVITY","FLT_PHASE","FAR_PART","MAX_INJ_LVL","FATAL_FLAG","FLT_CRW_INJ_NONE","FLT_CRW_INJ_MINOR","FLT_CRW_INJ_SERIOUS","FLT_CRW_INJ_FATAL","FLT_CRW_INJ_UNK","CBN_CRW_INJ_NONE","CBN_CRW_INJ_MINOR","CBN_CRW_INJ_SERIOUS","CBN_CRW_INJ_FATAL","CBN_CRW_INJ_UNK","PAX_INJ_NONE","PAX_INJ_MINOR","PAX_INJ_SERIOUS","PAX_INJ_FATAL","PAX_INJ_UNK","GRND_INJ_NONE","GRND_INJ_MINOR","GRND_INJ_SERIOUS","GRND_INJ_FATAL","GRND_INJ_UNK","Unk inj none","Unk inj minor","Unk inj serious","Unk inj fatal","Unk inj unk"
"No","17-MAR-26","15-MAR-26","15:00:00Z","COTTONWOOD","ARIZONA","UNITED STATES","AIRCRAFT PORPOISED ON LANDING AND POST FLIGHT INSPECTION REVEALED DAMAGE TO THE FUSELAGE, COTTONWOOD, AZ.","ACCIDENT","SCOTTSDALE FSDO","N178DR","","","CESSNA","177","No","SUBSTANTIAL","PERSONAL","LANDING (LDG)","91","NONE","No","1","0","0","0","0","0","0","0","0","0","0","0","0","0","0","0","0","0","0","0","0","0","0","0","0"
"No","17-MAR-26","16-MAR-26","21:00:00Z","PORTLAND","OREGON","UNITED STATES","AIRCRAFT LANDED AND WHILE TAXIING TO EXIT RUNWAY, THE NOSE GEAR COLLAPSED, PORTLAND, OR.","INCIDENT","PORTLAND FSDO","N212LG","","","LANCAIR","LEGACY","No","MINOR","PERSONAL","LANDING (LDG)","91","NONE","No","1","0","0","0","0","0","0","0","0","0","0","0","0","0","0","0","0","0","0","0","0","0","0","0","0"
"No","17-MAR-26","16-MAR-26","19:53:00Z","VACAVILLE","CALIFORNIA","UNITED STATES","AIRCRAFT LANDED GEAR UP, VACAVILLE, CA.","INCIDENT","SACRAMENTO FSDO","N666RJ","","","CESSNA","177RG","No","MINOR","PERSONAL","LANDING (LDG)","91","NONE","No","1","0","0","0","0","0","0","0","0","0","0","0","0","0","0","0","0","0","0","0","0","0","0","0","0"
"No","17-MAR-26","17-MAR-26","02:15:00Z","EUGENE","OREGON","UNITED STATES","AIRCRAFT LANDED GEAR UP, EUGENE, OR.","INCIDENT","PORTLAND FSDO","N4741S","","","CESSNA","TR182","No","UNKNOWN","PERSONAL","LANDING (LDG)","91","NONE","No","1","0","0","0","0","0","0","0","0","0","0","0","0","0","0","0","0","0","0","0","0","0","0","0","0"
"No","17-MAR-26","16-MAR-26","23:30:00Z","TRENTON","NEW JERSEY","UNITED STATES","AIRCRAFT STRUCK THE LEFT WING TIP ON THE RUNWAY DUE TO CROSS WINDS, TRENTON, NJ.","INCIDENT","PHILADELPHIA FSDO","N719AV","SGX719","SLATE GLOBAL","CANADAIR","CL-600-2B19","No","UNKNOWN","ON DEMAND","LANDING (LDG)","135","NONE","No","2","0","0","0","0","0","0","0","0","0","1","0","0","0","0","0","0","0","0","0","0","0","0","0","0"
"No","27-MAR-26","26-MAR-26","23:13:00Z","LIHUE","HAWAII","UNITED STATES","AIRCRAFT CRASHED OFF THE COAST UNDER UNKNOWN CIRCUMSTANCES, LIHUE, HI.","ACCIDENT","HONOLULU FSDO","N715KV","","","HUGHES","369","No","SUBSTANTIAL","SIGHT SEEING","EN ROUTE (ENR)","135","FATAL","Yes","0","0","0","0","1","0","0","0","0","0","0","0","0","3","1","0","0","0","0","0","0","0","0","0","0"
"No","27-MAR-26","27-MAR-26","02:01:00Z","NEW SMYRNA BEACH","FLORIDA","UNITED STATES","AIRCRAFT STRUCK A BIRD AND POST FLIGHT INSPECTION REVEALED A DENT ON THE LEFT WING, NEW SMYRNA BEACH, FL.","INCIDENT","ORLANDO FSDO","N254EP","EPI254","EPIC FLIGHT ACADEMY","TEXTRON","172","No","UNKNOWN","FAR 141 PILOT SCHOOL","APPROACH (APR)","91","NONE","No","1","0","0","0","0","0","0","0","0","0","1","0","0","0","0","0","0","0","0","0","0","0","0","0","0"
"No","27-MAR-26","26-MAR-26","14:45:00Z","MILLVILLE","NEW JERSEY","UNITED STATES","AIRCRAFT BOUNCED ON LANDING AND INCURRED A PROP STRIKE, MILLVILLE, NJ.","INCIDENT","PHILADELPHIA FSDO","N817FG","","","TEXTRON","172","No","UNKNOWN","PERSONAL","LANDING (LDG)","91","NONE","No","1","0","0","0","0","0","0","0","0","0","0","0","0","0","0","0","0","0","0","0","0","0","0","0","0"
"No","27-MAR-26","26-MAR-26","16:20:00Z","HOUSTON","TEXAS","UNITED STATES","AIRCRAFT ABORTED TAKEOFF DUE TO PROPELLER SPINNER FALLING OFF, HOUSTON, TX.","INCIDENT","HOUSTON FSDO","N1137P","","","PIPISTREL","SINUS 912","No","UNKNOWN","PERSONAL","TAKEOFF (TOF)","91","NONE","No","1","0","0","0","0","0","0","0","0","0","0","0","0","0","0","0","0","0","0","0","0","0","0","0","0"
"No","27-MAR-26","26-MAR-26","21:05:00Z","CAMARILLO","CALIFORNIA","UNITED STATES","AIRCRAFT WAS TAXIING OUT AND STRUCK TWO HANGARS, CAMARILLO, CA.","ACCIDENT","VAN NUYS FSDO","N787HP","","","PIPER","PA46","No","SUBSTANTIAL","PERSONAL","TAXI (TXI)","91","NONE","No","1","0","0","0","0","0","0","0","0","0","0","0","0","0","0","0","0","0","0","0","0","0","0","0","0"
"No","27-MAR-26","26-MAR-26","12:20:00Z","ATLANTA","TEXAS","UNITED STATES","AIRCRAFT WENT OFF THE END OF THE RUNWAY AND THROUGH A FENCE ON TAKEOFF, ATLANTA, TX.","ACCIDENT","NORTH TEXAS FSDO","N1653J","","","PIPER","PA28","No","SUBSTANTIAL","PERSONAL","TAKEOFF (TOF)","91","NONE","No","1","0","0","0","0","0","0","0","0","0","0","0","0","0","0","0","0","0","0","0","0","0","0","0","0"
"No","26-MAR-26","26-MAR-26","20:44:00Z","VAN NUYS","CALIFORNIA","UNITED STATES","AIRCRAFT LEFT WING STRUCK BLAST FENCE, VAN NUYS, CA.","ACCIDENT","VAN NUYS FSDO","N24932","","","CESSNA","152","No","SUBSTANTIAL","PERSONAL","UNKNOWN (UNK)","91","NONE","No","1","0","0","0","0","0","0","0","0","0","0","0","0","0","0","0","0","0","0","0","0","0","0","0","0"
"No","20-MAR-26","19-MAR-26","18:12:00Z","MIAMI","FLORIDA","UNITED STATES","AIRCRAFT LOST THE ENGINE COWLING AND RETURNED TO MIA, MIAMI, FL.","INCIDENT","SOUTH FLORIDA FSDO","N725UW","AAL1181","AMERICAN AIRLINES","AIRBUS","A319","No","UNKNOWN","COMMERCIAL","EN ROUTE (ENR)","121","NONE","No","0","0","0","0","0","0","0","0","0","0","0","0","0","0","0","0","0","0","0","0","0","0","0","0","0"
"No","20-MAR-26","20-MAR-26","00:35:00Z","TRACY","CALIFORNIA","UNITED STATES","AIRCRAFT LANDED GEAR UP, TRACY, CA.","INCIDENT","OAKLAND FSDO","N3851T","","","PIPER","PA28R","No","UNKNOWN","PERSONAL","LANDING (LDG)","91","NONE","No","1","0","0","0","0","0","0","0","0","0","1","0","0","0","0","0","0","0","0","0","0","0","0","0","0"
"No","20-MAR-26","19-MAR-26","23:34:00Z","CARSON CITY","NEVADA","UNITED STATES","AIRCRAFT MADE AN EMERGENCY LANDING AT THE NORTHERN NEVADA CORRECTIONAL CENTER, CARSON CITY, NV.","INCIDENT","RENO FSDO","N288SL","","","AIRPLANE FACTORY","SLING","No","UNKNOWN","PERSONAL","EN ROUTE (ENR)","91","NONE","No","1","0","0","0","0","0","0","0","0","0","1","0","0","0","0","0","0","0","0","0","0","0","0","0","0"
"No","20-MAR-26","20-MAR-26","03:20:00Z","CHICAGO","ILLINOIS","UNITED STATES","AIRCRAFT STRUCK RUNWAY/TAXIWAY LIGHTS WHILE ENTERING RUNWAY, CHICAGO, IL.","INCIDENT","GREATER  CHICAGO FSDO","N15712","UAL1394","UNITED AIRLINES","BOEING","737","No","UNKNOWN","COMMERCIAL","TAXI (TXI)","121","NONE","No","0","0","0","0","0","0","0","0","0","0","0","0","0","0","0","0","0","0","0","0","0","0","0","0","0"
"No","19-MAR-26","19-MAR-26","01:55:00Z","ST HELENS","OREGON","UNITED STATES","AIRCRAFT ATTEMPTING TO DEPART FROM AN ISLAND ALONG THE COLUMBIA RIVER AND BECAME INVERTED IN THE WATER, ST HELENS, OR.","INCIDENT","PORTLAND FSDO","N7632H","","","PIPER","PA12","No","UNKNOWN","PERSONAL","TAKEOFF (TOF)","91","NONE","No","1","0","0","0","0","0","0","0","0","0","0","0","0","0","0","0","0","0","0","0","0","0","0","0","0"
"No","26-MAR-26","25-MAR-26","18:10:00Z","OAKLAND","CALIFORNIA","UNITED STATES","AIRCRAFT STRUCK A BIRD ON LANDING AND POST FLIGHT INSPECTION REVEALED A LARGE DENT IN THE NOSE CONE, OAKLAND, CA.","INCIDENT","OAKLAND FSDO","N856FD","FDX3806","FEDERAL EXPRESS","BOEING","777","No","UNKNOWN","CARGO","LANDING (LDG)","121","NONE","No","2","0","0","0","0","0","0","0","0","0","0","0","0","0","0","0","0","0","0","0","0","0","0","0","0"
"No","26-MAR-26","25-MAR-26","16:26:00Z","STATESBORO","GEORGIA","UNITED STATES","AIRCRAFT CRASHED UNDER UNKNOWN CIRCUMSTANCES IN A FIELD, STATESBORO, GA.","ACCIDENT","ATLANTA FSDO","N220AS","","","EXPERIMENTAL","AIRSHARK","No","DESTROYED","PERSONAL","TAKEOFF (TOF)","91","FATAL","Yes","0","0","0","1","0","0","0","0","0","0","0","0","0","0","0","0","0","0","0","0","0","0","0","0","0"
"No","26-MAR-26","20-MAR-26","21:08:00Z","SHAFTER","CALIFORNIA","UNITED STATES","AIRCRAFT LANDED GEAR UP AND INCURRED A PROP STRIKE, SHAFTER, CA.","INCIDENT","FRESNO FSDO","N584BL","","","BEECH","58","No","MINOR","PERSONAL","LANDING (LDG)","91","NONE","No","1","0","0","0","0","0","0","0","0","0","0","0","0","0","0","0","0","0","0","0","0","0","0","0","0"
"No","26-MAR-26","25-MAR-26","15:00:00Z","GREENEVILLE","TENNESSEE","UNITED STATES","AIRCRAFT LANDED GEAR UP, GREENEVILLE, TN.","INCIDENT","NASHVILLE FSDO","N7018V","","","MOONEY","M20F","No","UNKNOWN","PERSONAL","LANDING (LDG)","91","NONE","No","1","0","0","0","0","0","0","0","0","0","0","0","0","0","0","0","0","0","0","0","0","0","0","0","0"
"No","26-MAR-26","25-MAR-26","21:20:00Z","BLOCK ISLAND","RHODE ISLAND","UNITED STATES","AIRCRAFT CRASHED IN A FIELD AFTER ATTEMPTING TO LAND AT BID, BLOCK ISLAND, RI.","INCIDENT","BOSTON FSDO","N7081H","","","PIPER","PA32","No","UNKNOWN","PERSONAL","LANDING (LDG)","91","UNKNOWN","No","0","0","0","0","1","0","0","0","0","0","0","0","0","0","1","0","0","0","0","0","0","0","0","0","0"
"No","23-MAR-26","19-MAR-26","14:00:00Z","WINSLOW","ARIZONA","UNITED STATES","AIRCRAFT DEPARTED AND WAS UNABLE TO GENERATE LIFT AND CRASHED, WINSLOW, AZ.","ACCIDENT","SCOTTSDALE FSDO","N71FR","","","AEROSPATIALE","SA341G GAZELLE","No","SUBSTANTIAL","PERSONAL","TAKEOFF (TOF)","91","NONE","No","1","0","0","0","0","0","0","0","0","0","1","0","0","0","0","0","0","0","0","0","0","0","0","0","0"
"No","23-MAR-26","21-MAR-26","20:59:00Z","MESA","ARIZONA","UNITED STATES","AIRCRAFT GROUND LOOPED ON LANDING, MESA, AZ.","ACCIDENT","SCOTTSDALE FSDO","N5045V","","","BOEING","A75N","No","SUBSTANTIAL","PERSONAL","LANDING (LDG)","91","NONE","No","1","0","0","0","0","0","0","0","0","0","0","0","0","0","0","0","0","0","0","0","0","0","0","0","0"
"No","23-MAR-26","22-MAR-26","20:20:00Z","BOYCE","LOUISIANA","UNITED STATES","AIRCRAFT CRASHED UNDER UNKNOWN CIRCUMSTANCES, BOYCE, LA.","ACCIDENT","BATON ROUGE FSDO","N886DS","","","BEECHCRAFT","B200GT","No","DESTROYED","PERSONAL","EN ROUTE (ENR)","91","FATAL","Yes","0","0","0","1","0","0","0","0","0","0","0","0","0","0","0","0","0","0","0","0","0","0","0","0","0"
"No","23-MAR-26","22-MAR-26","22:25:00Z","TRUCKEE","CALIFORNIA","UNITED STATES","AIRCRAFT CRASHED UNDER UNKNOWN CIRCUMSTANCES IN MOUNTAINOUS TERRAIN, TRUCKEE, CA.","ACCIDENT","RENO FSDO","N2882W","","","BEECH","A36","No","UNKNOWN","PERSONAL","EN ROUTE (ENR)","91","FATAL","Yes","0","0","0","1","0","0","0","0","0","0","0","0","0","0","0","0","0","0","0","0","0","0","0","0","0"
"No","23-MAR-26","21-MAR-26","16:23:00Z","ELLICOTT","COLORADO","UNITED STATES","AIRCRAFT EXPERIENCED AN UNKNOWN FAILURE AND WENT OFF RUNWAY INTO AN ADJACENT PROPERTY, ELLICOTT, CO.","ACCIDENT","DENVER FSDO","N6305S","","","CESSNA","150","No","SUBSTANTIAL","PERSONAL","LANDING (LDG)","91","UNKNOWN","No","0","0","0","0","1","0","0","0","0","0","0","0","0","0","0","0","0","0","0","0","0","0","0","0","0"
"No","23-MAR-26","21-MAR-26","22:10:00Z","WEST VALLEY CITY","UTAH","UNITED STATES","AIRCRAFT LOST POWER AND MADE AN OFF-AIRPORT LANDING, WEST VALLEY CITY, UT.","ACCIDENT","SALT LAKE CITY FSDO","J7328J","","","PIPER","PA28","No","SUBSTANTIAL","PERSONAL","EN ROUTE (ENR)","91","MINOR","No","0","1","0","0","0","0","0","0","0","0","0","1","0","0","0","0","0","0","0","0","0","0","0","0","0"
"No","23-MAR-26","20-MAR-26","17:43:00Z","STERLING","ILLINOIS","UNITED STATES","AIRCRAFT CRASHED UNDER UNKNOWN CIRCUMSTANCES, STERLING, IL.","ACCIDENT","GREATER CHICAGO FSDO","N9913W","","","PIPER","PA28","No","UNKNOWN","PERSONAL","UNKNOWN (UNK)","91","FATAL","Yes","0","0","0","1","0","0","0","0","0","0","0","0","0","0","0","0","0","0","0","0","0","0","0","0","0"
"No","23-MAR-26","20-MAR-26","19:15:00Z","DENTON","TEXAS","UNITED STATES","AIRCRAFT CRASHED INTO TREES OFF THE DEPARTURE END OF THE RUNWAY AND POST CRASH FIRE, DENTON, TX.","ACCIDENT","NORTH TEXAS FSDO","N65614","","","CESSNA","172","No","UNKNOWN","PERSONAL","TAKEOFF (TOF)","91","SERIOUS","No","0","0","1","0","0","0","0","0","0","0","0","1","0","0","0","0","0","0","0","0","0","0","0","0","0"
"No","23-MAR-26","21-MAR-26","17:00:00Z","SALUDA","SOUTH CAROLINA","UNITED STATES","AIRCRAFT BOUNCED ON LANDING, VEERED OFF RUNWAY AND IMPACTED THE AIRPORT PERIMETER FENCE, SALUDA, SC.","INCIDENT","COLUMBIA FSDO","N15VM","","","BEECH","V35","No","UNKNOWN","PERSONAL","LANDING (LDG)","91","NONE","No","1","0","0","0","0","0","0","0","0","0","1","0","0","0","0","0","0","0","0","0","0","0","0","0","0"
"No","23-MAR-26","21-MAR-26","21:09:00Z","STARBUCK","WASHINGTON","UNITED STATES","AIRCRAFT AIR BRAKE FAILED ON DEPARTURE ROLL AND TIPPED ON ITS NOSE, STARBUCK, WA.","INCIDENT","SPOKANE FSDO","N46SC","","","PIPER","PA12","No","UNKNOWN","PERSONAL","TAKEOFF (TOF)","91","NONE","No","1","0","0","0","0","0","0","0","0","0","0","0","0","0","0","0","0","0","0","0","0","0","0","0","0"
"No","23-MAR-26","18-MAR-26","05:00:00Z","SACRAMENTO","CALIFORNIA","UNITED STATES","AIRCRAFT DURING A HOVER AUTO MANEUVER, IMPACTED THE GROUND HARDER THAN ANTICIPATED, SACRAMENTO, CA.","INCIDENT","SACRAMENTO FSDO","N62RX","","","AIRBUS HELICOPTERS","AS350","No","NONE","AMBULANCE","MANEUVERING (MNV)","135","MINOR","No","1","0","0","0","0","","0","0","0","0","1","1","0","0","0","0","0","0","0","0","0","0","0","0","0"
"No","23-MAR-26","22-MAR-26","21:52:00Z","MOREHEAD","KENTUCKY","UNITED STATES","AIRCRAFT ON LANDING ROLLOUT AND RIGHT MAIN GEAR COLLAPSED, MOREHEAD, KY.","INCIDENT","LOUISVILLE FSDO","N104WM","","","CESSNA","421","No","UNKNOWN","PERSONAL","LANDING (LDG)","91","NONE","No","1","0","0","0","0","0","0","0","0","0","5","0","0","0","0","0","0","0","0","0","0","0","0","0","0"
"No","23-MAR-26","22-MAR-26","17:55:00Z","CONCORD","CALIFORNIA","UNITED STATES","AIRCRAFT LANDED AND SWERVED STRIKING TAXIWAY LIGHTS AND A SIGN, CONCORD, CA.","INCIDENT","OAKLAND FSDO","N211TD","","","CESSNA","172","No","UNKNOWN","PERSONAL","LANDING (LDG)","91","NONE","No","1","0","0","0","0","0","0","0","0","0","1","0","0","0","0","0","0","0","0","0","0","0","0","0","0"
"No","23-MAR-26","21-MAR-26","17:00:00Z","MARTIN","MICHIGAN","UNITED STATES","AIRCRAFT EXPERIENCED ENGINE ISSUES AND LANDED GEAR UP IN A FIELD, MARTIN, MI.","INCIDENT","GRAND RAPIDS FSDO","N305PF","","","MOONEY","M20K","No","UNKNOWN","PERSONAL","EN ROUTE (ENR)","91","NONE","No","1","0","0","0","0","0","0","0","0","0","2","0","0","0","0","0","0","0","0","0","0","0","0","0","0"
"No","23-MAR-26","21-MAR-26","18:59:00Z","MAITLAND","MISSOURI","UNITED STATES","AIRCRAFT EXPERIENCED ENGINE ISSUES AND LANDED IN A FIELD, MAITLAND, MO.","INCIDENT","KANSAS CITY FSDO","N328MA","","","PIPER","PA28R","No","UNKNOWN","PERSONAL","EN ROUTE (ENR)","91","NONE","No","1","0","0","0","0","0","0","0","0","0","0","0","0","0","0","0","0","0","0","0","0","0","0","0","0"
"No","23-MAR-26","20-MAR-26","19:05:00Z","DENVER","COLORADO","UNITED STATES","AIRCRAFT EXPERIENCED ENGINE ISSUES AFTER TAKEOFF, RETURNED TO AIRPORT AND ON LANDING FRONT WHEEL SNAPPED, DENVER, CO.","INCIDENT","DENVER FSDO","N431PZ","","","VANS","RV8","No","UNKNOWN","PERSONAL","TAKEOFF (TOF)","91","NONE","No","1","0","0","0","0","0","0","0","0","0","0","0","0","0","0","0","0","0","0","0","0","0","0","0","0"
"No","23-MAR-26","22-MAR-26","18:50:00Z","PHILADELPHIA","PENNSYLVANIA","UNITED STATES","AIRCRAFT STRUCK A BIRD ON DEPARTURE, RETURNED TO AIRPORT AND POST FLIGHT INSPECTION REVEALED A DENT ABOVE THE COCKPIT, PHILADELPHIA, PA.","INCIDENT","PHILADELPHIA FSDO","N463AA","AAL713","AMERICAN AIRLINES","AIRBUS","A321","No","MINOR","COMMERCIAL","TAKEOFF (TOF)","121","NONE","No","0","0","0","0","0","0","0","0","0","0","0","0","0","0","0","0","0","0","0","0","0","0","0","0","0"
"No","23-MAR-26","22-MAR-26","21:54:00Z","HANOVER","MINNESOTA","UNITED STATES","AIRCRAFT EXPERIENCED ENGINE ISSUES AND LANDED IN A FIELD, HANOVER, MN.","INCIDENT","MINNEAPOLIS FSDO","N524PU","","","PIPER","PA28","No","UNKNOWN","INSTRUCTION","EN ROUTE (ENR)","91","NONE","No","1","0","0","0","0","0","0","0","0","0","1","0","0","0","0","0","0","0","0","0","0","0","0","0","0"
"No","23-MAR-26","22-MAR-26","17:45:00Z","CALIFORNIA","MISSOURI","UNITED STATES","AIRCRAFT ON LANDING AND THE NOSE WHEEL COLLAPSED, CALIFORNIA, MO.","INCIDENT","KANSAS CITY FSDO","N601ZP","","","AIRCRAFT MFG & DEVELOPMENT","CH601XL","No","UNKNOWN","PERSONAL","LANDING (LDG)","91","NONE","No","1","0","0","0","0","0","0","0","0","0","0","0","0","0","0","0","0","0","0","0","0","0","0","0","0"
"No","23-MAR-26","21-MAR-26","13:05:00Z","FORT MYERS","FLORIDA","UNITED STATES","AIRCRAFT ON TAKEOFF, FAILED TO GENERATE SUFFICIENT POWER AND CRASHED INTO BUSHES, FORT MYERS, FL.","INCIDENT","TAMPA FSDO","N2469H","","","TEXTRON","T206","No","UNKNOWN","PERSONAL","TAKEOFF (TOF)","91","UNKNOWN","No","0","0","0","0","1","0","0","0","0","0","0","0","0","0","3","0","0","0","0","0","0","0","0","0","0"
"No","23-MAR-26","20-MAR-26","17:21:00Z","ATLANTA","GEORGIA","UNITED STATES","AIRCRAFT LANDED GEAR UP, ATLANTA, GA.","INCIDENT","ATLANTA FSDO","N7050N","","","BEECH","V35","No","MINOR","PERSONAL","LANDING (LDG)","91","NONE","No","0","0","0","0","0","0","0","0","0","0","0","0","0","0","0","0","0","0","0","0","0","0","0","0","0"
"No","23-MAR-26","21-MAR-26","22:55:00Z","CARROLLTON","INDIANA","UNITED STATES","AIRCRAFT EXPERIENCED ENGINE ISSUES, DECLARED MAYDAY AND LANDED IN A FIELD POSSIBLY DUE TO FUEL EXHAUSTION, CARROLLTON, IN.","INCIDENT","INDIANAPOLIS FSDO","N7149Q","","","CESSNA","172","No","UNKNOWN","PERSONAL","EN ROUTE (ENR)","91","NONE","No","0","0","0","0","0","0","0","0","0","0","0","0","0","0","0","0","0","0","0","0","0","0","0","0","0"
"No","23-MAR-26","21-MAR-26","16:00:00Z","MADISON","INDIANA","UNITED STATES","AIRCRAFT LOST POWER ON TAKEOFF, PORPOISED,  OVERRAN THE RUNWAY INTO A SWAMPY FIELD AND STRUCK A DITCH, MADISON, IN.","INCIDENT","INDIANAPOLIS FSDO","N7548P","","","PIPER","PA24","No","UNKNOWN","PERSONAL","TAKEOFF (TOF)","91","NONE","No","1","0","0","0","0","0","0","0","0","0","2","0","0","0","0","0","0","0","0","0","0","0","0","0","0"
"No","23-MAR-26","19-MAR-26","23:30:00Z","MANVEL","TEXAS","UNITED STATES","AIRCRAFT HAD A PARTIAL RIGHT MAIN GEAR DETACHMENT ON DEPARTURE, RETURNED TO AIRPORT, LANDED AND VEERED OFF RUNWAY INTO A DITCH, MANVEL, TX.","INCIDENT","HOUSTON FSDO","N9058B","","","CHAMPION","7FC","No","UNKNOWN","PERSONAL","TAKEOFF (TOF)","91","NONE","No","1","0","0","0","0","0","0","0","0","0","0","0","0","0","0","0","0","0","0","0","0","0","0","0","0"
"No","23-MAR-26","20-MAR-26","21:00:00Z","BIG BEAR CITY","CALIFORNIA","UNITED STATES","AIRCRAFT ON LANDING AND WENT OFF THE RUNWAY STRIKING MULTIPLE SIGNS, BIG BEAR CITY, CA.","INCIDENT","RIVERSIDE FSDO","N9368A","","","CESSNA","195","No","UNKNOWN","PERSONAL","LANDING (LDG)","91","NONE","No","1","0","0","0","0","0","0","0","0","0","0","0","0","0","0","0","0","0","0","0","0","0","0","0","0"
"No","23-MAR-26","23-MAR-26","04:10:00Z","NEWARK","NEW JERSEY","UNITED STATES","AIRCRAFT STRUCK A BIRD AND POST FLIGHT INSPECTION REVEALED A DENT ON THE NOSE, NEWARK, NJ.","INCIDENT","TETERBORO FSDO","N17565","UAL2602","UNLITED AIRLINES","BOEING","737","No","UNKNOWN","COMMERCIAL","APPROACH (APR)","121","NONE","No","0","0","0","0","0","0","0","0","0","0","0","0","0","0","0","0","0","0","0","0","0","0","0","0","0"
"No","23-MAR-26","20-MAR-26","22:00:00Z","ANCHORAGE","ALASKA","UNITED STATES","AIRCRAFT ENGINE CAUGHT ON FIRE DURING START-UP, ANCHORAGE, AK.","INCIDENT","ANCHORAGE FSDO","N22594","","","CESSNA","150","No","MINOR","PERSONAL","STANDING (STD)","91","NONE","No","1","0","0","0","0","0","0","0","0","0","1","0","0","0","0","0","0","0","0","0","0","0","0","0","0"
"No","23-MAR-26","20-MAR-26","17:55:00Z","WINDTHORST","TEXAS","UNITED STATES","AIRCRAFT HAD AN ODOR IN THE COCKPIT AND MADE AN EMERGENCY LANDING ON A ROAD, WINDTHORST, TX.","INCIDENT","LUBBOCK FSDO","N32462","","","PIPER","PA28","No","NONE","PERSONAL","EN ROUTE (ENR)","91","NONE","No","0","0","0","0","0","0","0","0","0","0","0","0","0","0","0","0","0","0","0","0","0","0","0","0","0"
"No","16-MAR-26","13-MAR-26","00:03:00Z","SANTA YNEZ","CALIFORNIA","UNITED STATES","AIRCRAFT CRASHED UNDER UNKNOWN CIRCUMSTANCES","ACCIDENT","VAN NUYS FSDO","N358FT","","","EXPERIMENTAL","ROTORCRAFT","No","SUBSTANTIAL","PERSONAL","UNKNOWN (UNK)","91","MINOR","No","0","1","0","0","0","0","0","0","0","0","0","0","0","0","0","0","0","0","0","0","0","0","0","0","0"
"No","16-MAR-26","12-MAR-26","01:23:00Z","ST LOUIS","MISSOURI","UNITED STATES","AIRCRAFT EXPERIENCED ISSUES WITH THE #2 ENGINE DUE TO A BIRD STRIKE ON LANDING, AND REPORTED DAMAGE TO THE #2 ENGINE","INCIDENT","ST. LOUIS FSDO","N996AT","DAL1541","DELTA AIR LINES","BOEING","717","No","UNKNOWN","COMMERCIAL","LANDING (LDG)","121","NONE","No","2","0","0","0","0","2","0","0","0","0","108","0","0","0","0","0","0","0","0","0","0","0","0","0","0"
"No","16-MAR-26","15-MAR-26","02:15:00Z","CHICAGO/AURORA","ILLINOIS","UNITED STATES","AIRCRAFT VEERED LEFT AND SLID OFF THE RUNWAY AFTER LANDING","INCIDENT","GREATER CHICAGO FSDO","N30TE","","","DASSAULT","FALCON 10","No","UNKNOWN","PERSONAL","LANDING (LDG)","91","NONE","No","1","0","0","0","0","0","0","0","0","0","0","0","0","0","0","0","0","0","0","0","0","0","0","0","0"
"No","16-MAR-26","13-MAR-26","18:00:00Z","DENTON","TEXAS","UNITED STATES","AIRCRAFT LANDED FAST AND WENT OFF THE END OF THE RUNWAY","INCIDENT","NORTH TEXAS FSDO","N31AJ","","","CESSNA","182","No","NONE","PERSONAL","LANDING (LDG)","91","NONE","No","1","0","0","0","0","0","0","0","0","0","3","0","0","0","0","0","0","0","0","0","0","0","0","0","0"
"No","16-MAR-26","14-MAR-26","16:50:00Z","JEFFERSONVILLE","INDIANA","UNITED STATES","AIRCRAFT STRUCK A DEER RESULTING IN DAMAGE TO THE NOSE AND ABORTED THE TAKEOFF","INCIDENT","INDIANAPOLIS FSDO","N70KB","","","CESSNA","550","No","MINOR","PERSONAL","TAKEOFF (TOF)","91","NONE","No","1","0","0","0","0","0","0","0","0","0","1","0","0","0","0","0","0","0","0","0","0","0","0","0","0"
"No","16-MAR-26","13-MAR-26","00:46:00Z","ONTARIO","OREGON","UNITED STATES","AIRCRAFT STRUCK A BIRD ON SHORT FINAL FOR RUNWAY 33","INCIDENT","BOISE FSDO","N675MA","","","PIPER","PA46","No","MINOR","PERSONAL","APPROACH (APR)","91","NONE","No","1","0","0","0","0","0","0","0","0","0","2","0","0","0","0","0","0","0","0","0","0","0","0","0","0"
"No","16-MAR-26","13-MAR-26","21:55:00Z","SEDALIA","MISSOURI","UNITED STATES","AIRCRAFT EXPERIENCED LOSS OF CONTROL ON DEPARTURE, EXITED THE SIDE OF THE RUNWAY, AND IMPACTED A BERM","INCIDENT","KANSAS CITY FSDO","N2393N","","","AIR TRACTOR","AT400","No","UNKNOWN","PERSONAL","TAKEOFF (TOF)","91","NONE","No","1","0","0","0","0","0","0","0","0","0","0","0","0","0","0","0","0","0","0","0","0","0","0","0","0"
"No","16-MAR-26","13-MAR-26","19:45:00Z","WILLCOX","ARIZONA","UNITED STATES","AIRCRAFT REPORTED A FUEL LEAK AND LANDED ON A GRAVEL ROAD","INCIDENT","SCOTTSDALE FSDO","N3399F","","","CESSNA","182","No","NONE","PERSONAL","LANDING (LDG)","91","NONE","No","1","0","0","0","0","0","0","0","0","0","0","0","0","0","0","0","0","0","0","0","0","0","0","0","0"
"No","16-MAR-26","15-MAR-26","12:30:00Z","CENTRE","ALABAMA","UNITED STATES","AIRCRAFT WENT THROUGH A FENCE DAMAGING THE LEFT WING AFTER STARTING THE ENGINE AT THE FUEL FARM AND INCREASING THE THROTTLE","INCIDENT","ALABAMA AND NORTHWEST FLORIDA FSDO","N3795T","","","PIPER","PA28R","No","UNKNOWN","PERSONAL","STANDING (STD)","91","NONE","No","1","0","0","0","0","0","0","0","0","0","0","0","0","0","0","0","0","0","0","0","0","0","0","0","0"
"No","16-MAR-26","13-MAR-26","14:30:00Z","PEACHTREE CITY","GEORGIA","UNITED STATES","AIRCRAFT EXPERIENCED ENGINE FAILURE AND MADE A FORCED LANDING ON HIGHWAY 74","INCIDENT","ATLANTA FSDO","N6500J","","","PIPER","PA28","No","UNKNOWN","INSTRUCTION","LANDING (LDG)","91","NONE","No","1","0","0","0","0","0","0","0","0","0","1","0","0","0","0","0","0","0","0","0","0","0","0","0","0"
"No","16-MAR-26","14-MAR-26","16:40:00Z","ATHENS","GEORGIA","UNITED STATES","AIRCRAFT LANDED GEAR UP ON RUNWAY 27","INCIDENT","ATLANTA FSDO","N9024P","","","PIPER","PA24","No","UNKNOWN","PERSONAL","LANDING (LDG)","91","NONE","No","1","0","0","0","0","0","0","0","0","0","1","0","0","0","0","0","0","0","0","0","0","0","0","0","0"
"No","16-MAR-26","13-MAR-26","00:16:00Z","FLAGSTAFF","ARIZONA","UNITED STATES","AIRCRAFT POPPED THE NOSE GEAR WHILE LANDING AND CAME TO REST LEFT OF THE RUNWAY","INCIDENT","LAS VEGAS FSDO","N20489","","","CESSNA","T182T","No","MINOR","PERSONAL","LANDING (LDG)","91","NONE","No","1","0","0","0","0","0","0","0","0","0","0","0","0","0","0","0","0","0","0","0","0","0","0","0","0"
"No","16-MAR-26","13-MAR-26","17:35:00Z","MESA","ARIZONA","UNITED STATES","AIRCRAFT VEERED OFF THE RUNWAY WHILE LANDING AND DAMAGED A RUNWAY EDGE LIGHT","INCIDENT","SCOTTSDALE FSDO","N4402U","OXF1791","","PIPER","PA28","No","UNKNOWN","UNKNOWN","LANDING (LDG)","135","NONE","No","1","0","0","0","0","0","0","0","0","0","0","0","0","0","0","0","0","0","0","0","0","0","0","0","0"
"No","16-MAR-26","15-MAR-26","12:44:00Z","HOUSTON","TEXAS","UNITED STATES","AIRCRAFT ARRIVED AT GATE AND REPORTED A FIRE IN THE LEFT MAIN TIRE ASSEMBLY AND DAMAGE TO THE TIRE AND BRAKE ASSEMBLY","INCIDENT","HOUSTON FSDO","N8871Q","SWA1229","SOUTHWEST AIRLINES","BOEING","737","No","FIRE","COMMERCIAL","UNKNOWN (UNK)","121","NONE","No","2","0","0","0","0","2","0","0","0","0","100","0","0","0","0","0","0","0","0","0","0","0","0","0","0"
"No","24-MAR-26","23-MAR-26","16:29:00Z","BOYNTON BEACH","FLORIDA","UNITED STATES","AIRCRAFT CRASHED UNDER UNKNOWN CIRCUMSTANCES INTO A WAREHOUSE, BOYNTON BEACH, FL.","ACCIDENT","SOUTH FLORIDA FSDO","N478AT","","","ROBINSON","R44","No","SUBSTANTIAL","INSTRUCTION","EN ROUTE (ENR)","91","FATAL","Yes","0","0","0","1","0","0","0","0","0","0","0","0","0","1","0","0","0","0","0","0","0","0","0","0","0"
