"UPDATED","ENTRY_DATE","EVENT_LCL_DATE","EVENT_LCL_TIME","LOC_CITY_NAME","LOC_STATE_NAME","LOC_CNTRY_NAME","RMK_TEXT","EVENT_TYPE_DESC","FSDO_DESC","REGIST_NBR","FLT_NBR","ACFT_OPRTR","ACFT_MAKE_NAME","ACFT_MODEL_NAME","ACFT_MISSING_FLAG","ACFT_DMG_DESC","FLT_ACTIVITY","FLT_PHASE","FAR_PART","MAX_INJ_LVL","FATAL_FLAG","FLT_CRW_INJ_NONE","FLT_CRW_INJ_MINOR","FLT_CRW_INJ_SERIOUS","FLT_CRW_INJ_FATAL","FLT_CRW_INJ_UNK","CBN_CRW_INJ_NONE","CBN_CRW_INJ_MINOR","CBN_CRW_INJ_SERIOUS","CBN_CRW_INJ_FATAL","CBN_CRW_INJ_UNK","PAX_INJ_NONE","PAX_INJ_MINOR","PAX_INJ_SERIOUS","PAX_INJ_FATAL","PAX_INJ_UNK","GRND_INJ_NONE","GRND_INJ_MINOR","GRND_INJ_SERIOUS","GRND_INJ_FATAL","GRND_INJ_UNK"
"No","05-JUL-24","04-JUL-24","22:00:00Z","WAMEGO","KANSAS","UNITED STATES","AIRCRAFT CONDUCTING STOP AND GOS, MADE A SHORT FIELD LANDING, ATTEMPTED TO DEPART AND RAN OFF END OF RUNWAY INTO A FIELD, WAMEGO, KS.","INCIDENT","WICHITA FSDO","N521KS","","","CESSNA","172R","No","UNKNOWN","INSTRUCTION","MANEUVERING (MNV)","91","NONE","No","1","0","0","0","0","0","0","0","0","0","1","0","0","0","0","0","0","0","0","0"
"No","05-JUL-24","04-JUL-24","19:49:00Z","BRAD","TEXAS","UNITED STATES","AIRCRAFT HIT A WAVE AND CRASHED INTO POSSUM KINGDOM LAKE WHILE SCOOPING WATER, BRAD, TX.","INCIDENT","NORTH TEXAS FSDO","N983LA","","","AIR TRACTOR","AT802","No","UNKNOWN","FIREFIGHTING","MANEUVERING (MNV)","","NONE","No","1","0","0","0","0","0","0","0","0","0","0","0","0","0","0","0","0","0","0","0"
"No","05-JUL-24","05-JUL-24","01:15:00Z","SHERMAN","TEXAS","UNITED STATES","AIRCRAFT CLIPPED A FENCE ON TAKEOFF AND SKIDDED ACROSS A ROAD INTO A DITCH, SHERMAN, TX.","INCIDENT","NORTH TEXAS FSDO","N80740","","","GLOBE","GC-1B","No","UNKNOWN","PERSONAL","TAKEOFF (TOF)","91","MINOR","No","1","0","0","0","0","0","0","0","0","0","0","1","0","0","0","0","0","0","0","0"
"No","05-JUL-24","04-JUL-24","23:45:00Z","NEW FLORENCE","MISSOURI","UNITED STATES","AIRCRAFT CRASHED INTO A FIELD AFTER STRIKING A TREE, NEW FLORENCE, MO.","INCIDENT","ST LOUIS FSDO","N225AM","","","ROBINSON","R44","No","UNKNOWN","AERIAL APPLICATION","MANEUVERING (MNV)","137","NONE","No","1","0","0","0","0","0","0","0","0","0","0","0","0","0","0","0","0","0","0","0"
"No","28-JUN-24","27-JUN-24","12:45:00Z","DALLAS","TEXAS","UNITED STATES","AIRCRAFT EXPERIENCED ENGINE ISSUES AND CRASHED INTO A CONSTRUCTION SITE AND CAUGHT ON FIRE, DALLAS, TX.","ACCIDENT","NORTH TEXAS FSDO","N414BS","","","CESSNA","414","No","SUBSTANTIAL","PERSONAL","INITIAL CLIMB (ICL)","91","FATAL","Yes","0","0","0","1","0","0","0","0","0","0","0","0","1","1","0","0","0","0","0","0"
"No","28-JUN-24","27-JUN-24","17:30:00Z","ELLICOTT","COLORADO","UNITED STATES","AIRCRAFT CRASHED ON TAKEOFF AND FLIPPED OVER, ELLICOTT, CO.","INCIDENT","DENVER FSDO","N10ZR","","","EXPERIMENTAL","DESERT FOX 1","No","UNKNOWN","PERSONAL","TAKEOFF (TOF)","91","UNKNOWN","No","0","0","0","0","1","0","0","0","0","0","0","0","0","0","0","0","0","0","0","0"
"No","01-JUL-24","28-JUN-24","22:43:00Z","BIG CREEK","IDAHO","UNITED STATES","AIRCRAFT CRASHED UNDER UNKNOWN CIRCUMSTANCES, BIG CREEK, ID.","ACCIDENT","BOISE FSDO","N6210A","","","CESSNA","182","No","UNKNOWN","PERSONAL","INITIAL CLIMB (ICL)","91","FATAL","Yes","0","0","0","1","0","0","0","0","0","0","0","0","1","0","0","0","0","0","0","0"
"No","01-JUL-24","29-JUN-24","21:31:00Z","SIDNEY","NEW YORK","UNITED STATES","AIRCRAFT CRASHED UNDER UNKNOWN CIRCUMSTANCES, SIDNEY, NY.","ACCIDENT","ALBANY FSDO","N85PG","","","PIPER","PA46","No","UNKNOWN","PERSONAL","EN ROUTE (ENR)","91","FATAL","Yes","0","0","0","1","0","0","0","0","0","0","0","0","0","4","0","0","0","0","0","0"
"No","01-JUL-24","30-JUN-24","21:03:00Z","SELDEN","KANSAS","UNITED STATES","AIRCRAFT CRASHED UNDER UNKNOWN CIRCUMSTANCES IN A FIELD AND POST CRASH FIRE, SELDEN, KS.","ACCIDENT","WICHITA FSDO","N14137","","","WACO","YKC","No","UNKNOWN","PERSONAL","UNKNOWN (UNK)","91","FATAL","Yes","0","0","0","1","0","0","0","0","0","0","0","0","0","1","0","0","0","0","0","0"
"No","01-JUL-24","30-JUN-24","15:55:00Z","SALUDA","SOUTH CAROLINA","UNITED STATES","AIRCRAFT EXPERIENCED ENGINE ISSUES AND CRASHED ON A GOLF COURSE, SALUDA, SC.","ACCIDENT","COLUMBIA FSDO","N94NF","","","VANS","RV9","No","DESTROYED","PERSONAL","UNKNOWN (UNK)","91","SERIOUS","No","0","0","1","0","0","0","0","0","0","0","0","0","1","0","0","0","0","0","0","0"
"No","01-JUL-24","28-JUN-24","21:25:00Z","JUNEAU","ALASKA","UNITED STATES","AIRCRAFT EXPERIENCED ENGINE ISSUES ON TAKEOFF AND MADE AN EMERGENCY LANDING ON A TIDAL FLAT, JUNEAU, AK.","ACCIDENT","JUNEAU FSDO","N590DB","","","DEHAVILLAND","DHC-2","No","SUBSTANTIAL","PERSONAL","TAKEOFF (TOF)","91","NONE","No","1","0","0","0","0","0","0","0","0","0","1","0","0","0","0","0","0","0","0","0"
"No","01-JUL-24","13-JUN-24","16:30:00Z","NORFOLK","VIRGINIA","UNITED STATES","AIRCRAFT LANDED HARD, PORPOISED AND INCURRED A PROP STRIKE, NORFOLK, VA.","ACCIDENT","RICHMOND FSDO","N272HF","","","TEXTRON","172","No","SUBSTANTIAL","PERSONAL","LANDING (LDG)","91","NONE","No","1","0","0","0","0","0","0","0","0","0","2","0","0","0","0","0","0","0","0","0"
"No","01-JUL-24","28-JUN-24","17:14:00Z","CEDAR CITY","UTAH","UNITED STATES","AIRCRAFT LOST CONTROL ON LANDING DUE TO WIND AND FLIPPED OVER, CEDAR CITY, UT.","ACCIDENT","SALT LAKE CITY FSDO","N315CF","","","AVIAT AIRCRAFT","A-1C-200","No","SUBSTANTIAL","PERSONAL","LANDING (LDG)","91","MINOR","No","0","1","0","0","0","0","0","0","0","0","0","0","0","0","0","0","0","0","0","0"
"No","01-JUL-24","29-JUN-24","21:45:00Z","MIDLAND","TEXAS","UNITED STATES","AIRCRAFT LANDED GEAR UP, MIDLAND, TX.","ACCIDENT","LUBBOCK FSDO","N451M","","","LANCAIR","IVP","No","SUBSTANTIAL","PERSONAL","LANDING (LDG)","91","NONE","No","1","0","0","0","0","0","0","0","0","0","1","0","0","0","0","0","0","0","0","0"
"No","01-JUL-24","29-JUN-24","22:40:00Z","TOCCOA","GEORGIA","UNITED STATES","AIRCRAFT LANDED AND THE GEAR COLLAPSED, TOCCOA, GA.","INCIDENT","ATLANTA FSDO","N7849","","","GRUMMAN","G-164A","No","UNKNOWN","UNKNOWN","LANDING (LDG)","","NONE","No","1","0","0","0","0","0","0","0","0","0","0","0","0","0","0","0","0","0","0","0"
"No","01-JUL-24","29-JUN-24","11:30:00Z","SUFFOLK","ENGLAND","UNITED KINGDOM","AIRCRAFT CRASHED ON LANDING, SUFFOLK, UNITED KINGDOM.","ACCIDENT","NEW YORK IFO","N65JF","","","PIPER","PA28","No","SUBSTANTIAL","PERSONAL","LANDING (LDG)","","MINOR","No","0","1","0","0","0","0","0","0","0","0","0","3","0","0","0","0","0","0","0","0"
"No","01-JUL-24","28-JUN-24","17:00:00Z","PORT CLINTON","OHIO","UNITED STATES","AIRCRAFT LANDED GEAR UP, PORT CLINTON, OH.","INCIDENT","CLEVELAND FSDO","N17NS","","","MOONEY","M20J","No","UNKNOWN","PERSONAL","LANDING (LDG)","91","NONE","No","1","0","0","0","0","0","0","0","0","0","0","0","0","0","0","0","0","0","0","0"
"No","01-JUL-24","30-JUN-24","16:15:00Z","LAND O' LAKES","WISCONSIN","UNITED STATES","AIRCRAFT CRASHED IN A WOODED AREA FOR UNKNOWN REASONS, LAND O' LAKES, WI.","INCIDENT","MILWAUKEE FSDO","N47RT","","","RAYTHEON","A36","No","UNKNOWN","PERSONAL","UNKNOWN (UNK)","91","MINOR","No","0","1","0","0","0","0","0","0","0","0","0","1","0","0","0","0","0","0","0","0"
"No","01-JUL-24","01-JUL-24","00:00:00Z","ATHENS","OHIO","UNITED STATES","AIRCRAFT CAUGHT A CROSSWIND ON LANDING AND WENT THROUGH A FENCE INTO A DITCH, ATHENS, OH.","INCIDENT","COLUMBUS FSDO","N75DM","","","CESSNA","T210","No","UNKNOWN","PERSONAL","LANDING (LDG)","91","NONE","No","1","0","0","0","0","0","0","0","0","0","1","0","0","0","0","0","0","0","0","0"
"No","01-JUL-24","30-JUN-24","15:50:00Z","COLBY","KANSAS","UNITED STATES","AIRCRAFT SLID OFF END OF RUNWAY INTO MUD, COLBY, KS.","INCIDENT","WICHITA FSDO","N316GV","","GRANDVIEW AVIATION","EMBRAER","EMB-505","No","UNKNOWN","ON DEMAND","UNKNOWN (UNK)","135","NONE","No","2","0","0","0","0","0","0","0","0","0","3","0","0","0","0","0","0","0","0","0"
"No","01-JUL-24","30-JUN-24","22:57:00Z","RICHMOND","VIRGINIA","UNITED STATES","AIRCRAFT LANDED AND STRUCK MULTIPLE RUNWAY LIGHTS AND A TAXIWAY SIGN, RICHMOND, VA.","INCIDENT","RICHMOND FSDO","N865HC","","","CESSNA","525","No","UNKNOWN","PERSONAL","LANDING (LDG)","91","NONE","No","0","0","0","0","0","0","0","0","0","0","0","0","0","0","0","0","0","0","0","0"
"No","01-JUL-24","29-JUN-24","01:05:00Z","OXNARD","CALIFORNIA","UNITED STATES","AIRCRAFT ON LANDING, VEERED OFF THE RUNWAY AND WENT INTO THE GRASS, OXNARD, CA.","INCIDENT","VAN NUYS FSDO","N2835Q","","","CESSNA","172","No","UNKNOWN","PERSONAL","LANDING (LDG)","91","NONE","No","1","0","0","0","0","0","0","0","0","0","0","0","0","0","0","0","0","0","0","0"
"No","01-JUL-24","29-JUN-24","22:00:00Z","GREENSBORO","NORTH CAROLINA","UNITED STATES","AIRCRAFT STRUCK A BIRD AND POST FLIGHT INSPECTION REVEALED DAMAGE TO THE COWLING AND NOSE, GREENSBORO, NC.","INCIDENT","GREENSBORO FSDO","N4642R","","","PIPER","PA28","No","UNKNOWN","PERSONAL","EN ROUTE (ENR)","91","NONE","No","0","0","0","0","0","0","0","0","0","0","0","0","0","0","0","0","0","0","0","0"
"No","01-JUL-24","29-JUN-24","22:06:00Z","LEWISTON","NORTH CAROLINA","UNITED STATES","AIRCRAFT DECLARED AN EMERGENCY AND LANDED IN A FIELD, LEWISTON, NC.","INCIDENT","GREENSBORO FSDO","N46118","","","CESSNA","172","No","UNKNOWN","PERSONAL","EN ROUTE (ENR)","91","NONE","No","1","0","0","0","0","0","0","0","0","0","0","0","0","0","0","0","0","0","0","0"
"No","01-JUL-24","29-JUN-24","18:39:00Z","DURANGO","COLORADO","UNITED STATES","AIRCRAFT GEAR COLLAPSED ON LANDING, DURANGO, CO.","INCIDENT","SALT LAKE CITY FSDO","N57247","","","MOONEY","M20K","No","MINOR","PERSONAL","LANDING (LDG)","91","NONE","No","1","0","0","0","0","0","0","0","0","0","1","0","0","0","0","0","0","0","0","0"
"No","01-JUL-24","30-JUN-24","22:08:00Z","ALBUQUERQUE","NEW MEXICO","UNITED STATES","AIRCRAFT LANDED, EXPERIENCED A BRAKE FIRE AND ARFF EXTINGUISHED THE FIRE, ALBUQUERQUE, NM.","INCIDENT","ALBUQUERQUE FSDO","N5479A","SCX3014","AMAZON PRIME","BOEING","737","No","FIRE","CARGO","LANDING (LDG)","121","NONE","No","2","0","0","0","0","0","0","0","0","0","0","0","0","0","0","0","0","0","0","0"
"Yes","01-JUL-24","01-JUL-24","01:15:00Z","SAN BERNARDINO","CALIFORNIA","UNITED STATES","AIRCRAFT EXPERIENCED ENGINE ISSUES AND CRASHED IN A REMOTE LOCATION, SAN BERNARDINO, CA.","ACCIDENT","RIVERSIDE FSDO","N6553R","","","BEECH","B19","No","SUBSTANTIAL","OTHER","EN ROUTE (ENR)","91","MINOR","No","0","1","0","0","0","0","0","0","0","0","1","0","0","0","0","0","0","0","0","0"
"No","08-JUL-24","07-JUL-24","20:35:00Z","LAFAYETTE","TENNESSEE","UNITED STATES","AIRCRAFT CRASHED FOR UNKNOWN REASONS ATTEMPTING A TOUCH AND GO.","ACCIDENT","NASHVILLE FSDO","N692BS","","","MISSOULA AVIATION LLC","SUPER DRIFTER","No","UNKNOWN","PERSONAL","LANDING (LDG)","91","SERIOUS","No","0","0","1","0","0","0","0","0","0","0","0","0","0","0","1","0","0","0","0","0"
"No","08-JUL-24","07-JUL-24","01:54:00Z","EUREKA","UTAH","UNITED STATES","AIRCRAFT CRASHED UNDER UNKNOWN CIRCUMSTANCES IMPACTING TERRAIN.","ACCIDENT","SALT LAKE CITY FSDO","N969RC","","","FANTASY AIR SRO","ALLEGRO 2007","No","DESTROYED","PERSONAL","UNKNOWN (UNK)","91","FATAL","Yes","0","0","0","1","0","0","0","0","0","0","0","0","0","0","0","0","0","0","0","0"
"No","08-JUL-24","06-JUL-24","05:37:00Z","EATONVILLE","WASHINGTON","UNITED STATES","AIRCRAFT CRASHED AFTER TAKEOFF INTO TERRAIN UNDER UNKNOWN CIRCUMSTANCES.","ACCIDENT","SEATTLE FSDO","N3464D","","","CHAMPION","7GCBC","No","DESTROYED","PERSONAL","TAKEOFF (TOF)","91","FATAL","Yes","0","0","0","1","0","0","0","0","0","0","0","0","0","1","0","0","0","0","0","0"
"No","02-JUL-24","30-JUN-24","22:24:00Z","TACOMA","WASHINGTON","UNITED STATES","AIRCRAFT ON LANDING, VEERED OFF RUNWAY INTO THE GRASS, TACOMA, WA.","ACCIDENT","SEATTLE FSDO","N4402B","","","CESSNA","170","No","SUBSTANTIAL","PERSONAL","LANDING (LDG)","91","NONE","No","1","0","0","0","0","0","0","0","0","0","1","0","0","0","0","0","0","0","0","0"
"No","02-JUL-24","01-JUL-24","12:00:00Z","HOMESTEAD","FLORIDA","UNITED STATES","AIRCRAFT BOUNCED ON LANDING AND INCURRED A PROP STRIKE, HOMESTEAD, FL.","INCIDENT","SOUTH FLORIDA FSDO","N9SK","","","MOONEY","M20K","No","UNKNOWN","PERSONAL","LANDING (LDG)","91","NONE","No","1","0","0","0","0","0","0","0","0","0","0","0","0","0","0","0","0","0","0","0"
"No","02-JUL-24","01-JUL-24","13:30:00Z","DILLON","MONTANA","UNITED STATES","AIRCRAFT DECLARED MAYDAY AND DIVERTED TO DLN DUE TO SMOKE IN THE COCKPIT AND LANDED SAFELY, DILLON, MT.","INCIDENT","HELENA FSDO","N16EK","","","CESSNA","172","No","MINOR","PERSONAL","EN ROUTE (ENR)","91","NONE","No","1","0","0","0","0","0","0","0","0","0","0","0","0","0","0","0","0","0","0","0"
"No","02-JUL-24","01-JUL-24","20:51:00Z","GREENVILLE","NORTH CAROLINA","UNITED STATES","AIRCRAFT LANDED AND NOSE GEAR COLLAPSED, GREENVILLE, NC.","INCIDENT","GREENSBORO FSDO","N9308Q","","","BEECH","95-B55","No","MINOR","PERSONAL","LANDING (LDG)","91","NONE","No","1","0","0","0","0","0","0","0","0","0","1","0","0","0","0","0","0","0","0","0"
"No","02-JUL-24","30-JUN-24","15:00:00Z","LELAND","MISSISSIPPI","UNITED STATES","AIRCRAFT DEPARTING, LOST LIFT AND CRASHED IN A FIELD, GROUND LOOPED AND STRUCK TREES, LELAND, MS.","ACCIDENT","JACKSON FSDO","N9185K","","","AIR TRACTOR","AT402","No","SUBSTANTIAL","AERIAL APPLICATION","TAKEOFF (TOF)","137","NONE","No","1","0","0","0","0","0","0","0","0","0","0","0","0","0","0","0","0","0","0","0"
"No","02-JUL-24","01-JUL-24","16:00:00Z","REDMOND","OREGON","UNITED STATES","AIRCRAFT ABORTED TAKEOFF, BRAKES LOCKED UP AND VEERED OFF RUNWAY, REDMOND, OR.","INCIDENT","PORTLAND FSDO","N10111","","","LANCAIR","LC41-550FG","No","MINOR","PERSONAL","TAKEOFF (TOF)","91","NONE","No","1","0","0","0","0","0","0","0","0","0","3","0","0","0","0","0","0","0","0","0"
"No","03-JUL-24","02-JUL-24","19:10:00Z","SAN DIEGO","CALIFORNIA","UNITED STATES","AIRCRAFT EXPERIENCED ENGINE ISSUES, OVERSHOT RUNWAY AND CRASHED ON THE DEPARTURE END, SAN DIEGO, CA.","INCIDENT","SAN DIEGO FSDO","N74C","","","CESSNA","172","No","UNKNOWN","PERSONAL","LANDING (LDG)","91","MINOR","No","0","1","0","0","0","0","0","0","0","0","0","0","0","0","0","0","0","0","0","0"
"No","03-JUL-24","02-JUL-24","20:30:00Z","SCAPPOOSE","OREGON","UNITED STATES","AIRCRAFT ON LANDING AND FOR UNKNOWN REASONS CRASHED INTO A TAXIWAY, SCAPPOOSE, OR.","ACCIDENT","PORTLAND FSDO","N725FA","","","VANS","RV12","No","SUBSTANTIAL","PERSONAL","LANDING (LDG)","91","SERIOUS","No","0","0","1","0","0","0","0","0","0","0","0","0","0","0","0","0","0","0","0","0"
"No","03-JUL-24","03-JUL-24","00:42:00Z","LEXINGTON","NORTH CAROLINA","UNITED STATES","AIRCRAFT LOST CONTROL WHILE TAXIING AND RAN THROUGH A GRASSY AREA, NOSE GEAR DETACHED AND FLIPPED OVER, LEXINGTON, NC.","INCIDENT","GREENSBORO FSDO","N3DB","","","GLASAIR","III","No","UNKNOWN","PERSONAL","TAXI (TXI)","91","UNKNOWN","No","0","0","0","0","1","0","0","0","0","0","0","0","0","0","0","0","0","0","0","0"
"No","03-JUL-24","02-JUL-24","17:50:00Z","EUGENE","OREGON","UNITED STATES","AIRCRAFT HAD A BLOWN TIRE THAT DAMAGED ELECTRICAL WIRES AND PANELING ASSOCIATED WITH THE LANDING GEAR, EUGENE, OR.","INCIDENT","PORTLAND FSDO","N199SY","SKW3352","SKYWEST AIRLINES","EMBRAER","ERJ 170-200 LR","No","UNKNOWN","COMMERCIAL","LANDING (LDG)","121","NONE","No","0","0","0","0","0","0","0","0","0","0","0","0","0","0","0","0","0","0","0","0"
"No","03-JUL-24","27-JUN-24","18:49:00Z","GREEN BAY","WISCONSIN","UNITED STATES","AIRCRAFT LANDED, VEERED OFF RUNWAY AND POST FLIGHT INSPECTION REVEALED DAMAGE TO THE FIREWALL, GREEN BAY, WI.","INCIDENT","MILWAUKEE FSDO","N351ME","","","CESSNA","172","No","MINOR","PERSONAL","LANDING (LDG)","91","NONE","No","1","0","0","0","0","0","0","0","0","0","0","0","0","0","0","0","0","0","0","0"
"No","03-JUL-24","02-JUL-24","19:23:00Z","MERRITT ISLAND","FLORIDA","UNITED STATES","AIRCRAFT LANDED AND VEERED OFF RUNWAY INTO A RIVER, MERRITT ISLAND, FL.","INCIDENT","ORLANDO FSDO","N373CA","","","PIPER","PA28","No","UNKNOWN","PERSONAL","LANDING (LDG)","91","NONE","No","1","0","0","0","0","0","0","0","0","0","0","0","0","0","0","0","0","0","0","0"
"No","03-JUL-24","02-JUL-24","21:20:00Z","NEW YORK","NEW YORK","UNITED STATES","AIRCRAFT RETURNED TO AIRPORT AFTER ANOTHER AIRCRAFT REPORTED SEEING DEBRIS FALL FROM JBU153 DURING DEPARTURE, NEW YORK, NY.","INCIDENT","NEW YORK FSDO","N507JT","JBU153","JET BLUE AIRLINES","AIRBUS","A320","No","UNKNOWN","COMMERCIAL","TAKEOFF (TOF)","121","NONE","No","0","0","0","0","0","0","0","0","0","0","0","0","0","0","0","0","0","0","0","0"
"No","03-JUL-24","02-JUL-24","22:06:00Z","DEATH VALLEY","CALIFORNIA","UNITED STATES","AIRCRAFT EXPERIENCED ENGINE ISSUES AND LANDED ON A HIGHWAY, DEATH VALLEY, CA.","INCIDENT","LAS VEGAS FSDO","N539T","","","BEECH","35","No","NONE","PERSONAL","EN ROUTE (ENR)","91","NONE","No","1","0","0","0","0","0","0","0","0","0","1","0","0","0","0","0","0","0","0","0"
"No","03-JUL-24","02-JUL-24","14:40:00Z","ATLANTA","GEORGIA","UNITED STATES","AIRCRAFT STRUCK A BIRD AND POST FLIGHT INSPECTION REVEALED DAMAGE TO THE RIGHT WING, ATLANTA, GA.","INCIDENT","ATLANTA FSDO","N715TA","","","CIRRUS","SR20","No","MINOR","INSTRUCTION","EN ROUTE (ENR)","91","NONE","No","1","0","0","0","0","0","0","0","0","0","1","0","0","0","0","0","0","0","0","0"
"No","28-JUN-24","28-JUN-24","00:12:00Z","CASPER","WYOMING","UNITED STATES","AIRCRAFT LANDED, VEERED OFF RUNWAY AND STRUCK A RUNWAY LIGHT, CASPER, WY.","INCIDENT","DENVER FSDO","N10TP","","","AIR TRACTOR","AT802","No","NONE","UNKNOWN","LANDING (LDG)","","NONE","No","1","0","0","0","0","0","0","0","0","0","0","0","0","0","0","0","0","0","0","0"
"Yes","28-JUN-24","27-JUN-24","18:00:00Z","NEWARK","NEW JERSEY","UNITED STATES","AIRCRAFT LANDED AND STRUCK A SIGN EXITING ONTO TAXIWAY, NEWARK, NJ.","ACCIDENT","TETERBORO FSDO","N122CR","","","EMBRAER","EMB-500","No","SUBSTANTIAL","UNKNOWN","LANDING (LDG)","","NONE","No","2","0","0","0","0","0","0","0","0","0","0","0","0","0","0","0","0","0","0","0"
"No","28-JUN-24","27-JUN-24","19:34:00Z","ORLANDO","FLORIDA","UNITED STATES","AIRCRAFT LANDED HARD, ORLANDO, FL.","INCIDENT","ORLANDO FSDO","N174SC","","","AIRBUS","AS350","No","UNKNOWN","PUBLIC USE","LANDING (LDG)","","NONE","No","1","0","0","0","0","0","0","0","0","0","2","0","0","0","0","0","0","0","0","0"
"No","28-JUN-24","27-JUN-24","17:35:00Z","NEW BRAUNFELS","TEXAS","UNITED STATES","AIRCRAFT RAN OFF THE RUNWAY INTO THE GRASS DURING TOUCH AND GO, NEW BRAUNFELS, TX.","INCIDENT","SAN ANTONIO FSDO","N999NF","","","PIPER","PA44","No","UNKNOWN","INSTRUCTION","MANEUVERING (MNV)","91","NONE","No","1","0","0","0","0","0","0","0","0","0","1","0","0","0","0","0","0","0","0","0"
"Yes","28-JUN-24","27-JUN-24","21:03:00Z","TULSA","OKLAHOMA","UNITED STATES","AIRCRAFT LANDED, VEERED OFF RUNWAY DUE TO WIND AND RIGHT WING STRUCK THE GROUND, TULSA, OK.","INCIDENT","WILL ROGERS FSDO","N1765T","","","PIPER","PA28","No","MINOR","PERSONAL","LANDING (LDG)","91","NONE","No","1","0","0","0","0","0","0","0","0","0","0","0","0","0","0","0","0","0","0","0"
"No","28-JUN-24","27-JUN-24","05:00:00Z","COEUR D'ALENE","IDAHO","UNITED STATES","AIRCRAFT LANDED, WHILE TAXIING TO PARKING, STRUCK A CONCRETE BARRIER DAMAGING THE PROPELLER AND NOSE GEAR, COEUR D'ALENE, ID.","INCIDENT","SPOKANE FSDO","N2569W","","","MOONEY","M20E","No","MINOR","PERSONAL","TAXI (TXI)","91","NONE","No","1","0","0","0","0","0","0","0","0","0","0","0","0","0","0","0","0","0","0","0"
"No","08-JUL-24","05-JUL-24","14:17:00Z","ANDALE","KANSAS","UNITED STATES","AIRCRAFT CRASHED UNDER UNKNOWN CIRCUMSTANCES.","ACCIDENT","WICHITA KS FSDO","N51017","","","FABER VINCENT","SCORPION 133","No","DESTROYED","PERSONAL","MANEUVERING (MNV)","91","FATAL","Yes","0","0","0","1","0","0","0","0","0","0","0","0","0","0","0","0","0","0","0","0"
"No","08-JUL-24","06-JUL-24","20:33:00Z","SCAPPOOSE","OREGON","UNITED STATES","AIRCRAFT CRASHED UNDER UNKNOWN CIRCUMSTANCES.","ACCIDENT","PORTLAND OREGON FSDO","N96558","","","BAXTER DANIEL DAVID","STARDUSTER TOO SA300","No","SUBSTANTIAL","PERSONAL","UNKNOWN (UNK)","91","NONE","No","1","0","0","0","0","0","0","0","0","0","0","0","0","0","0","0","0","0","0","0"
"No","08-JUL-24","05-JUL-24","18:05:00Z","KALISPELL","MONTANA","UNITED STATES","AIRCRAFT CGTKC STRUCK N336X WHILE TAXIING FOR DEPARTURE.","INCIDENT","HELENA FSDO","N336X","","","MOONEY","M20","No","MINOR","PERSONAL","STANDING (STD)","91","NONE","No","2","0","0","0","0","0","0","0","0","0","1","0","0","0","0","0","0","0","0","0"
"No","08-JUL-24","07-JUL-24","15:50:00Z","RENO","NEVADA","UNITED STATES","AIRCRAFT GROUND LOOPED WHILE LANDING.","INCIDENT","RENO FSDO","N42EK","","","PITTS","SPECIAL S1S","No","UNKNOWN","PERSONAL","LANDING (LDG)","91","NONE","No","1","0","0","0","0","0","0","0","0","0","0","0","0","0","0","0","0","0","0","0"
"No","08-JUL-24","06-JUL-24","18:19:00Z","PUEBLO","COLORADO","UNITED STATES","AIRCRAFT LANDED AND REPORTED A BRAKE MALFUNCTION WHICH CASUED IT TO VEER OFF THE RUNWAY.","INCIDENT","DENVER FSDO","N116SK","LN116SK","AIR METHODS","PILATUS","PC12","No","UNKNOWN","AMBULANCE","LANDING (LDG)","135","NONE","No","2","0","0","0","0","0","0","0","0","0","2","0","0","0","0","0","0","0","0","0"
"No","08-JUL-24","06-JUL-24","13:00:00Z","LEESBURG","FLORIDA","UNITED STATES","AIRCRAFT LANDED WITH GEAR DOWN IN A LAKE AND SANK.","INCIDENT","ORLANDO FSDO","N222D","","","TROZZI THOMAS","SEAREY","No","UNKNOWN","PERSONAL","LANDING (LDG)","91","NONE","No","1","0","0","0","0","0","0","0","0","0","1","0","0","0","0","0","0","0","0","0"
"No","08-JUL-24","05-JUL-24","19:12:00Z","DAYTON","NEVADA","UNITED STATES","AIRCRAFT RAN OUT OF FUEL AND MADE AN EMERGENCY LANDING ON A HIGHWAY.","INCIDENT","RENO FSDO","N311PW","","","AERO COMMANDER","500-A","No","NONE","PERSONAL","EN ROUTE (ENR)","91","NONE","No","1","0","0","0","0","0","0","0","0","0","0","0","0","0","0","0","0","0","0","0"
"No","08-JUL-24","06-JUL-24","14:28:00Z","ATWATER","MINNESOTA","UNITED STATES","AIRCRAFT WENT OFF THE END OF A GRASS STRIP DURING LANDING AND FLIPPED OVER IN A BEAN FIELD.","INCIDENT","MINNEAPOLIS FSDO","N312FM","","","VANS","RV-8","No","MINOR","PERSONAL","LANDING (LDG)","91","MINOR","No","0","1","0","0","0","0","0","0","0","0","0","0","0","0","0","0","0","0","0","0"
"No","08-JUL-24","06-JUL-24","17:13:00Z","ST PETERSBURG-CLEARWATER","FLORIDA","UNITED STATES","AIRCRAFT REPORTED A BIRD STRIKE WHILE IN RIGHT DOWNWIND AND LANDED WITHOUT INCIDENT. PILOT REPORTED THAT THE WINDSHIELD CAVED IN AND THE ELECTRICAL SWITCHBOARD COLLAPSED INTO THE COCKPIT.","INCIDENT","TAMPA FSDO","N471A","","","PIPER","P28A","No","UNKNOWN","INSTRUCTION","LANDING (LDG)","141","UNKNOWN","No","0","0","0","0","2","0","0","0","0","0","0","0","0","0","0","0","0","0","0","0"
"No","08-JUL-24","05-JUL-24","18:17:00Z","CHARLOTTE","NORTH CAROLINA","UNITED STATES","AIRCRAFT EXECUTED A GO AROUND AND STRUCK RUNWAY WITH LEFT WING. AIRCRAFT WAS RESEQUENCED AND LANDED.","INCIDENT","CHARLOTTE FSDO","N591NN","JIA5144","PSA AIRLINES","BOMBARDIER","CL-600","No","UNKNOWN","COMMERCIAL","LANDING (LDG)","121","UNKNOWN","No","0","0","0","0","2","0","0","0","0","0","0","0","0","0","0","0","0","0","0","0"
"No","08-JUL-24","05-JUL-24","15:40:00Z","CHICAGO","ILLINOIS","UNITED STATES","AIRCRAFT REPORTED A BIRDSTRIKE ON SHORT FINAL. POST FLIGHT INSPECTION REVEALED DAMAGE TO THE #1 ENGINE, EXTENT UNKNOWN.","INCIDENT","CHICAGO FSDO","N918AN","AA1924","AMERICAN AIRLINES","BOEING","737","No","UNKNOWN","COMMERCIAL","LANDING (LDG)","121","UNKNOWN","No","0","0","0","0","2","0","0","0","0","0","0","0","0","0","0","0","0","0","0","0"
"No","08-JUL-24","08-JUL-24","03:20:00Z","ATLANTA","GEORGIA","UNITED STATES","AIRCRAFT STRUCK A BIRD ON LANDING CAUSING DAMAGE TO RADOME.","INCIDENT","ATLANTA FSDO","N977AT","DAL3138","DELTA","BOEING","717","No","UNKNOWN","COMMERCIAL","LANDING (LDG)","121","NONE","No","2","0","0","0","0","0","0","0","0","0","0","0","0","0","0","0","0","0","0","0"
"No","08-JUL-24","07-JUL-24","03:30:00Z","LAKE HAVASU CITY","ARIZONA","UNITED STATES","AIRCRAFT REPORTED A LOSS OF POWER AND FUEL PRESSURE AND MADE A LANDING IN THE DESERT.","INCIDENT","PHOENIX FSDO","N991AL","","","SLING AIRCRAFT","SLING LSA","No","UNKNOWN","PERSONAL","LANDING (LDG)","91","NONE","No","1","0","0","0","0","0","0","0","0","0","1","0","0","0","0","0","0","0","0","0"
"No","08-JUL-24","04-JUL-24","17:19:00Z","LEADVILLE","COLORADO","UNITED STATES","AIRCRAFT'S NOSE GEAR COLLAPSED AND AIRCRAFT WENT OFF THE END OF RUNWAY BENDING BOTH PROPS.","INCIDENT","DENVER FSDO","N1652T","","","CESSNA","414","No","UNKNOWN","PERSONAL","LANDING (LDG)","91","NONE","No","1","0","0","0","0","0","0","0","0","0","1","0","0","0","0","0","0","0","0","0"
"No","08-JUL-24","08-JUL-24","03:12:00Z","EASTSOUND","WASHINGTON","UNITED STATES","AIRCRAFT LANDED AND THE LEFT GEAR COLLAPSED CAUSING AIRCRAFT TO VEER INTO GRASS MEDIAN.","INCIDENT","SEATTLE FSDO","N2416K","","","LUSCOMBE","8E","No","UNKNOWN","PERSONAL","LANDING (LDG)","91","NONE","No","1","0","0","0","0","0","0","0","0","0","0","0","0","0","0","0","0","0","0","0"
"No","08-JUL-24","06-JUL-24","17:30:00Z","DENVER","COLORADO","UNITED STATES","AIRCRAFT STRUCK RUNWAY EDGE LIGHT WHILE EXITING RUNWAY","INCIDENT","DENVER FSDO","N7457L","","","PIPER","PA18","No","UNKNOWN","PERSONAL","TAXI (TXI)","91","UNKNOWN","No","0","0","0","0","1","0","0","0","0","0","0","0","0","0","0","0","0","0","0","0"
"No","08-JUL-24","06-JUL-24","14:55:00Z","STILLWATER","OKLAHOMA","UNITED STATES","AIRCRAT NOSED OVER DURING LANDING ON LAKE.","INCIDENT","OKLAHOMA CITY FSDO","N9987Z","","","PROGRESSIVE AERODYNE","SEAREY LSA","No","UNKNOWN","PERSONAL","LANDING (LDG)","91","MINOR","No","0","1","0","0","0","0","0","0","0","0","0","1","0","0","0","0","0","0","0","0"
"No","08-JUL-24","06-JUL-24","20:26:00Z","FORT MORGAN","COLORADO","UNITED STATES","AIRCRAFT HAD FLAP RETRACTION MALFUNCTION CAUSING AILERONS TO BE JAMMED. AIRCRAFT MADE EMERGENCY LANDING ON HIGHWAY.","INCIDENT","DENVER FSDO","N23788","","","CESSNA","172","No","UNKNOWN","INSTRUCTION","LANDING (LDG)","91","NONE","No","2","0","0","0","0","0","0","0","0","0","0","0","0","0","0","0","0","0","0","0"
