"UPDATED","ENTRY_DATE","EVENT_LCL_DATE","EVENT_LCL_TIME","LOC_CITY_NAME","LOC_STATE_NAME","LOC_CNTRY_NAME","RMK_TEXT","EVENT_TYPE_DESC","FSDO_DESC","REGIST_NBR","FLT_NBR","ACFT_OPRTR","ACFT_MAKE_NAME","ACFT_MODEL_NAME","ACFT_MISSING_FLAG","ACFT_DMG_DESC","FLT_ACTIVITY","FLT_PHASE","FAR_PART","MAX_INJ_LVL","FATAL_FLAG","FLT_CRW_INJ_NONE","FLT_CRW_INJ_MINOR","FLT_CRW_INJ_SERIOUS","FLT_CRW_INJ_FATAL","FLT_CRW_INJ_UNK","CBN_CRW_INJ_NONE","CBN_CRW_INJ_MINOR","CBN_CRW_INJ_SERIOUS","CBN_CRW_INJ_FATAL","CBN_CRW_INJ_UNK","PAX_INJ_NONE","PAX_INJ_MINOR","PAX_INJ_SERIOUS","PAX_INJ_FATAL","PAX_INJ_UNK","GRND_INJ_NONE","GRND_INJ_MINOR","GRND_INJ_SERIOUS","GRND_INJ_FATAL","GRND_INJ_UNK"
"No","20-FEB-24","16-FEB-24","21:30:00Z","DAYTONA BEACH","FLORIDA","UNITED STATES","AIRCRAFT SIDE WINDOW SEPARATED WHILE DEPARTING, DAYTONA BEACH, FL.","INCIDENT","ORLANDO FSDO","N6262H","","","PIPER","PA23","No","MINOR","PERSONAL","TAKEOFF (TOF)","91","NONE","No","1","0","0","0","0","0","0","0","0","0","0","0","0","0","0","0","0","0","0","0"
"No","20-FEB-24","19-FEB-24","18:23:00Z","GREENVILLE","SOUTH CAROLINA","UNITED STATES","AIRCRAFT LANDED GEAR UP, GREENVILLE, SC.","INCIDENT","COLUMBIA FSDO","N7748M","","","MOONEY","M20C","No","UNKNOWN","PERSONAL","LANDING (LDG)","91","NONE","No","1","0","0","0","0","0","0","0","0","0","1","0","0","0","0","0","0","0","0","0"
"No","20-FEB-24","19-FEB-24","19:40:00Z","MOUNT PLEASANT","TEXAS","UNITED STATES","AIRCRAFT EXPERIENCED ENGINE ISSUES AND LANDED IN A FIELD, MOUNT PLEASANT, TX.","INCIDENT","NORTH TEXAS FSDO","N50581","","","CESSNA","150","No","UNKNOWN","UNKNOWN","EN ROUTE (ENR)","91","NONE","No","1","0","0","0","0","0","0","0","0","0","1","0","0","0","0","0","0","0","0","0"
"No","16-FEB-24","15-FEB-24","01:58:00Z","GARY","INDIANA","UNITED STATES","AIRCRAFT STRUCK A BIRD AND POST FLIGHT INSPECTION REVEALED A DENT IN THE RIGHT WING, GARY, IN.","INCIDENT","GREATER CHICAGO FSDO","N3033T","","","PIPER","PA28","No","UNKNOWN","INSTRUCTION","EN ROUTE (ENR)","91","NONE","No","1","0","0","0","0","0","0","0","0","0","0","0","0","0","0","0","0","0","0","0"
"No","21-FEB-24","20-FEB-24","19:15:00Z","HANA","HAWAII","UNITED STATES","AIRCRAFT TAIL ROTOR WAS HIT WITH UNSECURED RAIN GEAR THAT FLEW OUT, HANA, HI.","ACCIDENT","HONOLULU FSDO","N690WA","","","HUGHES","369","No","SUBSTANTIAL","PERSONAL","EN ROUTE (ENR)","91","NONE","No","1","0","0","0","0","0","0","0","0","0","1","0","0","0","0","0","0","0","0","0"
"No","21-FEB-24","20-FEB-24","22:25:00Z","AUSTIN","TEXAS","UNITED STATES","AIRCRAFT TAXIED TOO CLOSE BEHIND N219JA AND FLIPPED OVER, AUSTIN, TX.","ACCIDENT","SAN ANTONIO FSDO","N6762A","","","CESSNA","172","No","SUBSTANTIAL","PERSONAL","TAXI (TXI)","91","NONE","No","1","0","0","0","0","0","0","0","0","0","0","0","0","0","0","0","0","0","0","0"
"No","21-FEB-24","20-FEB-24","12:30:00Z","FARMINGDALE","NEW YORK","UNITED STATES","AIRCRAFT EXPERIENCED ENGINE ISSUES AND LANDED ON SOUTHERN STATE PARKWAY, FARMINGDALE, NY.","INCIDENT","FARMINGDALE FSDO","N33667","","","PIPER","PA28","No","UNKNOWN","PERSONAL","APPROACH (APR)","91","MINOR","No","0","1","0","0","0","0","0","0","0","0","0","1","0","0","0","0","0","0","0","0"
"No","21-FEB-24","20-FEB-24","15:15:00Z","PUNTA GORDA","FLORIDA","UNITED STATES","AIRCRAFT VEERED OFF RUNWAY INTO THE GRASS WHILE LANDING, PUNTA GORDA, FL.","INCIDENT","TAMPA FSDO","N154PA","","","PIPER","PA28","No","UNKNOWN","INSTRUCTION","LANDING (LDG)","91","NONE","No","1","0","0","0","0","0","0","0","0","0","0","0","0","0","0","0","0","0","0","0"
"No","21-FEB-24","20-FEB-24","22:35:00Z","LAOTTO","INDIANA","UNITED STATES","AIRCRAFT ATTEMPTED TO LAND IN A FIELD, THE SUN OBSTRUCTED THE PILOT'S VISION, STRUCK A TREE AND CRASHED, LAOTTO, IN.","INCIDENT","GRAND RAPIDS FSDO","N358AK","","","CUBCRAFTERS","CCX-2000","No","UNKNOWN","PERSONAL","LANDING (LDG)","91","MINOR","No","0","1","0","0","0","0","0","0","0","0","0","0","0","0","0","0","0","0","0","0"
"No","21-FEB-24","21-FEB-24","19:30:00Z","PERRYVILLE","MISSOURI","UNITED STATES","AIRCRAFT LANDED ON A SANDBAR ON THE MISSISSIPPI RIVER, THE LEFT MAIN GEAR BECAME STUCK IN THE SAND AND TIPPED ON ITS NOSE, PERRYVILLE, MO.","INCIDENT","ST LOUIS FSDO","N3650K","","","PIPER","J3C-65","No","UNKNOWN","PERSONAL","LANDING (LDG)","91","NONE","No","1","0","0","0","0","0","0","0","0","0","1","0","0","0","0","0","0","0","0","0"
"No","21-FEB-24","20-FEB-24","16:10:00Z","OKLAHOMA CITY","OKLAHOMA","UNITED STATES","AIRCRAFT NOSE GEAR COLLAPSED ON LANDING, OKLAHOMA CITY, OK.","INCIDENT","WILL ROGERS FSDO","N5958Q","","","MOONEY","M20E","No","UNKNOWN","PERSONAL","LANDING (LDG)","91","NONE","No","1","0","0","0","0","0","0","0","0","0","0","0","0","0","0","0","0","0","0","0"
"No","21-FEB-24","20-FEB-24","17:36:00Z","DUNNELLON","FLORIDA","UNITED STATES","AIRCRAFT DECLARED AN EMERGENCY DUE TO ENGINE ISSUES AND LANDED IN A FIELD, DUNNELLON, FL.","ACCIDENT","ORLANDO FSDO","N8158F","","","CESSNA","150","No","SUBSTANTIAL","PERSONAL","EN ROUTE (ENR)","91","NONE","No","1","0","0","0","0","0","0","0","0","0","0","0","0","0","0","0","0","0","0","0"
"No","21-FEB-24","20-FEB-24","19:41:00Z","MARKS","MISSISSIPPI","UNITED STATES","AIRCRAFT BOUNCED ON LANDING, BECAME AIRBORNE, STALLED AND CRASHED IN THE GRASS, MARKS, MS.","ACCIDENT","JACKSON FSDO","N14YY","","","CESSNA","182","No","UNKNOWN","PERSONAL","LANDING (LDG)","91","SERIOUS","No","0","0","1","0","0","0","0","0","0","0","0","0","0","0","0","0","0","0","0","0"
"No","21-FEB-24","19-FEB-24","22:30:00Z","SAN FRANCISCO","CALIFORNIA","UNITED STATES","AIRCRAFT RIGHT HAND SIDE INBOARD SLAT BROKE OFF DURING DEPARTURE, SAN FRANCISCO, CA.","INCIDENT","OAKLAND FSDO","N57111","UAL354C","UNITED AIRLINES","BOEING","757","No","UNKNOWN","COMMERCIAL","TAKEOFF (TOF)","121","NONE","No","0","0","0","0","0","0","0","0","0","0","0","0","0","0","0","0","0","0","0","0"
"No","21-FEB-24","18-FEB-24","20:09:00Z","BOGOTA","CUNDINAMARCA","COLOMBIA","AIRCRAFT EXPERIENCED SEVERE TURBULENCE INJURYING FLIGHT ATTENDANTS AND A PASSENGER, BOGOTA, COLOMBIA.","INCIDENT","MIAMI IFO","N176DZ","DAL253","DELTA AIRLINES","BOEING","767","No","UNKNOWN","COMMERCIAL","EN ROUTE (ENR)","121","MINOR","No","2","0","0","0","0","0","4","0","0","0","0","1","0","0","0","0","0","0","0","0"
"No","21-FEB-24","17-FEB-24","14:54:00Z","CHANTILLY","VIRGINIA","UNITED STATES","AIRCRAFT ENCOUNTERED A  TAIL STRIKE DURING DEPARTURE AND RETURNED TO IAD, CHANTILLY, VA.","INCIDENT","WASHINGTON FSDO","N69059","UAL345","UNITED AIRLINES","BOEING","767","No","UNKNOWN","COMMERCIAL","TAKEOFF (TOF)","121","NONE","No","0","0","0","0","0","0","0","0","0","0","0","0","0","0","0","0","0","0","0","0"
