"UPDATED","ENTRY_DATE","EVENT_LCL_DATE","EVENT_LCL_TIME","LOC_CITY_NAME","LOC_STATE_NAME","LOC_CNTRY_NAME","RMK_TEXT","EVENT_TYPE_DESC","FSDO_DESC","REGIST_NBR","FLT_NBR","ACFT_OPRTR","ACFT_MAKE_NAME","ACFT_MODEL_NAME","ACFT_MISSING_FLAG","ACFT_DMG_DESC","FLT_ACTIVITY","FLT_PHASE","FAR_PART","MAX_INJ_LVL","FATAL_FLAG","FLT_CRW_INJ_NONE","FLT_CRW_INJ_MINOR","FLT_CRW_INJ_SERIOUS","FLT_CRW_INJ_FATAL","FLT_CRW_INJ_UNK","CBN_CRW_INJ_NONE","CBN_CRW_INJ_MINOR","CBN_CRW_INJ_SERIOUS","CBN_CRW_INJ_FATAL","CBN_CRW_INJ_UNK","PAX_INJ_NONE","PAX_INJ_MINOR","PAX_INJ_SERIOUS","PAX_INJ_FATAL","PAX_INJ_UNK","GRND_INJ_NONE","GRND_INJ_MINOR","GRND_INJ_SERIOUS","GRND_INJ_FATAL","GRND_INJ_UNK"
"No","04-APR-22","03-APR-22","20:00:00Z","HOUSTON","TEXAS","UNITED STATES","AIRCRAFT WHILE TAXIING TO THE RAMP VEERED OFF THE TAXIWAY, HOUSTON, TX.","INCIDENT","HOUSTON FSDO","N9CK","EJM384","EXECUTIVE JET MANAGEMENT","GULFSTREAM","GV-SP","No","UNKNOWN","ON DEMAND","TAXI (TXI)","135","NONE","No","2","0","0","0","0","1","0","0","0","0","0","0","0","0","0","0","0","0","0","0"
"No","04-APR-22","02-APR-22","16:00:00Z","COLUMBUS","OHIO","UNITED STATES","AIRCRAFT PERFORMING SURVEY WORK, REPORTED A CRACK IN THE LEFT WING AND DIVERTED TO CMH, COLUMBUS, OH.D","INCIDENT","COLUMBUS FSDO","N1107Q","","","CESSNA","310","No","UNKNOWN","OTHER","EN ROUTE (ENR)","91","NONE","No","1","0","0","0","0","0","0","0","0","0","0","0","0","0","0","0","0","0","0","0"
"No","06-APR-22","05-APR-22","15:30:00Z","SEYMOUR","TEXAS","UNITED STATES","AIRCRAFT CONDUCTING AERIAL HERDING, PILOT LANDED AND EXITED THE HELICOPTER WITH ROTORS TURNING, RESULTING IN A ROLLOVER, SEYMOUR, TX.","ACCIDENT","LUBBOCK FSDO","N999FR","","","ROBINSON","R22","No","SUBSTANTIAL","OTHER","LANDING (LDG)","","NONE","No","0","0","0","0","0","0","0","0","0","0","0","0","0","0","0","0","0","0","0","0"
"No","06-APR-22","05-APR-22","17:15:00Z","ST GEORGE","UTAH","UNITED STATES","AIRCRAFT GEAR COLLAPSED ON LANDING, ST GEORGE, UT.","INCIDENT","SALT LAKE CITY FSDO","N47445","","","PIPER","PA28R","No","UNKNOWN","PERSONAL","LANDING (LDG)","91","NONE","No","1","0","0","0","0","0","0","0","0","0","0","0","0","0","0","0","0","0","0","0"
"No","06-APR-22","05-APR-22","17:43:00Z","MARLIN","TEXAS","UNITED STATES","AIRCRAFT CRASHED UNDER UNKNOWN CIRCUMSTANCES, MARLIN, TX.","ACCIDENT","NORTH TEXAS FSDO","N858JA","","","CESSNA","TU206","No","UNKNOWN","OTHER","LANDING (LDG)","91","FATAL","Yes","0","0","0","1","0","0","0","0","0","0","0","0","0","1","0","0","0","0","0","0"
"No","06-APR-22","05-APR-22","18:58:00Z","STERLING","VIRGINIA","UNITED STATES","AIRCRAFT STRUCK A BIRD ON DEPARTURE, RETURNED TO AIRPORT, STERLING, VA.","INCIDENT","WASHINGTON FSDO","N353QS","EJA353","NETJETS","EMBRAER","EMB-505","No","UNKNOWN","ON DEMAND","TAKEOFF (TOF)","135","NONE","No","2","0","0","0","0","0","0","0","0","0","4","0","0","0","0","0","0","0","0","0"
"No","06-APR-22","05-APR-22","13:55:00Z","SAN DIEGO","CALIFORNIA","UNITED STATES","AIRCRAFT LOST NOSE GEAR ON LANDING, SAN DIEGO, CA.","INCIDENT","SAN DIEGO FSDO","N360VW","","","LANCAIR","320","No","MINOR","PERSONAL","LANDING (LDG)","91","NONE","No","1","0","0","0","0","0","0","0","0","0","1","0","0","0","0","0","0","0","0","0"
"No","07-APR-22","06-APR-22","21:45:00Z","TUCSON","ARIZONA","UNITED STATES","AIRCRAFT LANDED AND VEERED OFF RUNWAY INTO A DITCH AND FLIPPED OVER, TUCSON, AZ.","ACCIDENT","SCOTTSDALE FSDO","N733EJ","","","CESSNA","172","No","SUBSTANTIAL","PERSONAL","LANDING (LDG)","91","NONE","No","1","0","0","0","0","0","0","0","0","0","1","0","0","0","0","0","0","0","0","0"
"No","07-APR-22","06-APR-22","08:40:00Z","GOOSE BAY","LABRADOR","CANADA","AIRCRAFT EXPERIENCED ENGINE ISSUES, DECLARED MAYDAY AND CRASHED, GOOSE BAY, CANADA.","ACCIDENT","LOS ANGELES IFO","N8064X","","","PIPER","PA28","No","UNKNOWN","PERSONAL","EN ROUTE (ENR)","","SERIOUS","No","0","0","1","0","0","0","0","0","0","0","0","0","0","0","0","0","0","0","0","0"
"No","07-APR-22","05-APR-22","19:00:00Z","LAKELAND","FLORIDA","UNITED STATES","AIRCRAFT ON LANDING, THE AXLE BROKE AND THE WHEEL DETACHED AND NOSED OVER, LAKELAND, FL.","ACCIDENT","ORLANDO FSDO","N622SC","","","JUST AIRCRAFT","HIGHLANDER","No","SUBSTANTIAL","AIR SHOW","LANDING (LDG)","91","NONE","No","1","0","0","0","0","0","0","0","0","0","0","0","0","0","0","0","0","0","0","0"
"No","07-APR-22","07-APR-22","03:21:00Z","PHOENIX","ARIZONA","UNITED STATES","AIRCRAFT ROLLED OVER DURING LANDING, PHOENIX, AZ.","ACCIDENT","SCOTTSDALE FSDO","N19VH","","","ROBINSON","R22","No","SUBSTANTIAL","INSTRUCTION","LANDING (LDG)","91","NONE","No","1","0","0","0","0","0","0","0","0","0","0","0","0","0","0","0","0","0","0","0"
"No","07-APR-22","06-APR-22","15:10:00Z","BANGOR","MAINE","UNITED STATES","AIRCRAFT LANDED AND VEERED OFF RUNWAY INTO THE MUD, BANGOR, ME.","INCIDENT","PORTLAND ME FSDO","N954MA","","","PIPER","PA32","No","UNKNOWN","PERSONAL","LANDING (LDG)","91","NONE","No","1","0","0","0","0","0","0","0","0","0","0","0","0","0","0","0","0","0","0","0"
"No","07-APR-22","06-APR-22","10:55:00Z","BIRMINGHAM","ALABAMA","UNITED STATES","AIRCRAFT TAXIING AND VEERED OFF RUNWAY INTO THE GRASS AND BECAME STUCK, BIRMINGHAM, AL.","INCIDENT","ALABAMA AND NW FLORIDA FSDO","N4837A","","","CESSNA","414","No","NONE","PERSONAL","TAXI (TXI)","91","NONE","No","1","0","0","0","0","0","0","0","0","0","4","0","0","0","0","0","0","0","0","0"
"Yes","07-APR-22","06-APR-22","19:20:00Z","PALO ALTO","CALIFORNIA","UNITED STATES","AIRCRAFT LANDED FAST, BOUNCED AND VEERED LEFT ENDING UP ON ITS NOSE, PALO ALTO, CA.","INCIDENT","SAN JOSE FSDO","N6076C","","","CESSNA","162","No","MINOR","INSTRUCTION","LANDING (LDG)","91","NONE","No","1","0","0","0","0","0","0","0","0","0","0","0","0","0","0","0","0","0","0","0"
"Yes","07-APR-22","06-APR-22","16:50:00Z","MESA","ARIZONA","UNITED STATES","AIRCRAFT LANDED GEAR UP, MESA, AZ.","INCIDENT","SCOTTSDALE FSDO","N8547P","","","PIPER","PA24","No","MINOR","PERSONAL","LANDING (LDG)","91","NONE","No","1","0","0","0","0","0","0","0","0","0","1","0","0","0","0","0","0","0","0","0"
"No","07-APR-22","06-APR-22","14:26:00Z","WATERVILLE","MAINE","UNITED STATES","AIRCRAFT GEAR COLLAPSED ON LANDING AND INCURRED A PROP STRIKE, WATERVILLE, ME.","INCIDENT","PORTLAND ME FSDO","N9440D","","","CESSNA","172RG","No","UNKNOWN","PERSONAL","LANDING (LDG)","91","NONE","No","1","0","0","0","0","0","0","0","0","0","0","0","0","0","0","0","0","0","0","0"
"No","07-APR-22","06-APR-22","21:56:00Z","SABETHA","KANSAS","UNITED STATES","AIRCRAFT LANDED AND NOSE GEAR COLLAPSED, SABETHA, KS.","INCIDENT","WICHITA FSDO","N3866T","","","PIPER","PA28R","No","UNKNOWN","PERSONAL","LANDING (LDG)","91","NONE","No","1","0","0","0","0","0","0","0","0","0","0","0","0","0","0","0","0","0","0","0"
"No","08-APR-22","07-APR-22","23:12:00Z","ANGEL FIRE","NEW MEXICO","UNITED STATES","AIRCRAFT LANDED AND VEERED OFF RUNWAY INTO THE MUD, ANGEL FIRE, NM.","INCIDENT","ALBUQUERQUE FSDO","N6359B","","","CESSNA","T210","No","MINOR","PERSONAL","LANDING (LDG)","91","NONE","No","1","0","0","0","0","0","0","0","0","0","3","0","0","0","0","0","0","0","0","0"
"No","08-APR-22","07-APR-22","15:35:00Z","LAFAYETTE","LOUISIANA","UNITED STATES","AIRCRAFT NOSE GEAR COLLAPSED ON LANDING, LAFAYETTE, LA.","INCIDENT","BATON ROUGE FSDO","N994P","","","LANCAIR","IV","No","UNKNOWN","PERSONAL","LANDING (LDG)","91","NONE","No","1","0","0","0","0","0","0","0","0","0","1","0","0","0","0","0","0","0","0","0"
"No","08-APR-22","07-APR-22","14:15:00Z","ATLANTA","GEORGIA","UNITED STATES","AIRCRAFT DEPARTED, EXPERIENCED ENGINE ISSUES AND LANDED ON A HIGHWAY, ATLANTA, GA.","INCIDENT","ATLANTA FSDO","N623W","","","AMERICAN","AA-1","No","UNKNOWN","PERSONAL","TAKEOFF (TOF)","91","NONE","No","1","0","0","0","0","0","0","0","0","0","0","0","0","0","0","0","0","0","0","0"
"No","08-APR-22","06-APR-22","16:30:00Z","LAKELAND","FLORIDA","UNITED STATES","AIRCRAFT DAMAGED LEFT MAIN WHEEL AND TAIL WHEEL DURING LANDING, LAKELAND, FL.","INCIDENT","ORLANDO FSDO","N385BV","","","NEW CENTURY AEROSPORT","RADIAL ROCKET","No","MINOR","PERSONAL","LANDING (LDG)","91","NONE","No","1","0","0","0","0","0","0","0","0","0","0","0","0","0","0","0","0","0","0","0"
"No","08-APR-22","07-APR-22","21:40:00Z","GREENVILLE","SOUTH CAROLINA","UNITED STATES","AIRCRAFT REPORTED LOSING AN ENGINE COWLING AFTER DEPARTURE, GREENVILLE, SC.","INCIDENT","COLUMBIA FSDO","N17GG","","","BEECH","B300","No","UNKNOWN","PERSONAL","TAKEOFF (TOF)","91","NONE","No","1","0","0","0","0","0","0","0","0","0","0","0","0","0","0","0","0","0","0","0"
"No","08-APR-22","22-APR-21","19:00:00Z","PERRY","SOUTH CAROLINA","UNITED STATES","AIRCRAFT CRASHED UNDER UNKNOWN CIRCUMSTANCES CAUSING THE TAIL SECTION TO SEPARATE FROM THE AIRCRAFT, PERRY, SC.","ACCIDENT","COLUMBIA FSDO","N571RD","","","SCHEMPP","VENTUS","No","SUBSTANTIAL","PERSONAL","UNKNOWN (UNK)","91","UNKNOWN","No","0","0","0","0","1","0","0","0","0","0","0","0","0","0","0","0","0","0","0","0"
"No","04-APR-22","03-APR-22","19:32:00Z","HONOLULU","HAWAII","UNITED STATES","AIRCRAFT CREW MEMBER CLIMBED OUT OF CREW BUNK AND BROKE LEG, HONOLULU, HI.","ACCIDENT","HONOLULU FSDO","N832AA","AAL123","AMERICAN AIRLINES","BOEING","787","No","NONE","COMMERCIAL","EN ROUTE (ENR)","121","SERIOUS","No","2","0","0","0","0","0","0","1","0","0","0","0","0","0","0","0","0","0","0","0"
"No","04-APR-22","02-APR-22","20:00:00Z","LAYTONSVILLE","MARYLAND","UNITED STATES","AIRCRAFT CLIPPED THE FENCE WITH LANDING GEAR BEFORE TOUCHDOWN, LAYTONSVILLE, MD.","ACCIDENT","BALTIMORE FSDO","N123LS","","","CESSNA","177RG","No","SUBSTANTIAL","PERSONAL","LANDING (LDG)","91","MINOR","No","0","1","0","0","0","0","0","0","0","0","0","0","0","0","0","0","0","0","0","0"
"No","04-APR-22","03-APR-22","20:20:00Z","JEAN","NEVADA","UNITED STATES","AIRCRAFT CRASHED UNDER UNKNOWN CIRCUMSTANCES SHORT OF THE RUNWAY, JEAN, NV.","ACCIDENT","LAS VEGAS FSDO","N333BM","","","SONERAI","II","No","SUBSTANTIAL","PERSONAL","LANDING (LDG)","91","MINOR","No","0","1","0","0","0","0","0","0","0","0","0","0","0","0","0","0","0","0","0","0"
"No","04-APR-22","02-APR-22","18:47:00Z","DEATH VALLEY NATIONAL PARK","CALIFORNIA","UNITED STATES","AIRCRAFT LANDED AND GEAR COLLAPSED, DEATH VALLEY NATIONAL PARK, CA.","ACCIDENT","LAS VEGAS FSDO","N727DF","","","GLASAIR","II","No","SUBSTANTIAL","PERSONAL","LANDING (LDG)","91","NONE","No","1","0","0","0","0","0","0","0","0","0","0","0","0","0","0","0","0","0","0","0"
"No","04-APR-22","02-APR-22","15:19:00Z","MORRISTOWN","NEW JERSEY","UNITED STATES","AIRCRAFT LANDED, VEERED OFF RUNWAY AND RIGHT WING STRUCK THE GRASS, MORRISTOWN, NJ.","INCIDENT","TETERBORO FSDO","N877W","","","LEARJET","45","No","UNKNOWN","PERSONAL","LANDING (LDG)","91","NONE","No","2","0","0","0","0","0","0","0","0","0","2","0","0","0","0","0","0","0","0","0"
"No","04-APR-22","03-APR-22","21:40:00Z","VAN NUYS","CALIFORNIA","UNITED STATES","AIRCRAFT SUSTAINED DAMAGE FROM JET BLAST CAUSING THE WING TIP AND PROPELLER TO STRIKE THE GROUND, VAN NUYS, CA.","ACCIDENT","VAN NUYS FSDO","N3901L","","","CESSNA","172","No","SUBSTANTIAL","INSTRUCTION","TAXI (TXI)","91","NONE","No","1","0","0","0","0","0","0","0","0","0","1","0","0","0","0","0","0","0","0","0"
"No","04-APR-22","02-APR-22","14:29:00Z","FORT WHITE","FLORIDA","UNITED STATES","AIRCRAFT CRASHED IN A FIELD FOR UNKNOWN REASONS, FORT WHITE, FL.","ACCIDENT","ORLANDO FSDO","N7057L","","","HUGHES","269","No","SUBSTANTIAL","PERSONAL","EN ROUTE (ENR)","91","UNKNOWN","No","0","0","0","0","1","0","0","0","0","0","0","0","0","0","1","0","0","0","0","0"
"No","04-APR-22","01-APR-22","20:00:00Z","MERCED","CALIFORNIA","UNITED STATES","AIRCRAFT STRUCK A WIRE, MERCED, CA.","ACCIDENT","FRESNO FSDO","N9287U","","","BELL","OH-58A","No","SUBSTANTIAL","AERIAL APPLICATION","MANEUVERING (MNV)","137","MINOR","No","0","1","0","0","0","0","0","0","0","0","0","0","0","0","0","0","0","0","0","0"
"No","04-APR-22","03-APR-22","20:00:00Z","BOSTON","MASSACHUSETTS","UNITED STATES","AIRCRAFT STRUCK A BIRD DAMAGING NOSE CONE, BOSTON, MA.","INCIDENT","BOSTON FSDO","N707TW","DAL2436","DELTA AIRLINES","BOEING","757","No","MINOR","COMMERCIAL","APPROACH (APR)","121","NONE","No","2","0","0","0","0","0","0","0","0","0","0","0","0","0","0","0","0","0","0","0"
"No","04-APR-22","01-APR-22","17:00:00Z","LAUREL","MONTANA","UNITED STATES","AIRCRAFT INCURRED A PROP STRIKE AFTER LANDING, LAUREL, MT.","INCIDENT","HELENA FSDO","N85JK","","","SOCATA","TBM700","No","UNKNOWN","PERSONAL","LANDING (LDG)","91","NONE","No","1","0","0","0","0","0","0","0","0","0","0","0","0","0","0","0","0","0","0","0"
"No","04-APR-22","01-APR-22","21:05:00Z","FORT MYERS","FLORIDA","UNITED STATES","AIRCRAFT NOSE GEAR COLLAPSED AFTER LANDING, FORT MYERS, FL.","INCIDENT","TAMPA FSDO","N534WC","","","VANS","RV6","No","UNKNOWN","PERSONAL","LANDING (LDG)","91","NONE","No","1","0","0","0","0","0","0","0","0","0","1","0","0","0","0","0","0","0","0","0"
"No","04-APR-22","03-APR-22","23:56:00Z","KAHULUI","HAWAII","UNITED STATES","AIRCRAFT WAS TAXIING AND ENCOUNTERED A GUST OF WIND RESULTING IN A PROP STRIKE, KAHULUI, HI.","INCIDENT","HONOLULU FSDO","N738FA","","","CESSNA","172","No","UNKNOWN","PERSONAL","TAXI (TXI)","91","NONE","No","1","0","0","0","0","0","0","0","0","0","0","0","0","0","0","0","0","0","0","0"
"No","04-APR-22","03-APR-22","17:45:00Z","HOUSTON","TEXAS","UNITED STATES","AIRCRAFT PRACTICING TOUCH AND GOS, CAUGHT BY A CROSSWIND AND VEERED OFF THE RUNWAY, HOUSTON, TX.","INCIDENT","HOUSTON FSDO","N857CP","","","CESSNA","172","No","UNKNOWN","PERSONAL","TAKEOFF (TOF)","91","UNKNOWN","No","0","0","0","0","1","0","0","0","0","0","0","0","0","0","0","0","0","0","0","0"
"No","04-APR-22","02-APR-22","13:17:00Z","CROSBYTON","TEXAS","UNITED STATES","AIRCRAFT MADE A FORCED LANDING IN A FIELD, CROSBYTON, TX.","INCIDENT","LUBBOCK FSDO","N2242L","","","BEECH","C23","No","UNKNOWN","PERSONAL","EN ROUTE (ENR)","91","NONE","No","1","0","0","0","0","0","0","0","0","0","1","0","0","0","0","0","0","0","0","0"
"No","04-APR-22","02-APR-22","23:40:00Z","STONY POINT","NORTH CAROLINA","UNITED STATES","AIRCRAFT EXPERIENCED ENGINE ISSUES AND CRASHED IN A RESIDENTIAL AREA, STONY POINT, NC.","INCIDENT","CHARLOTTE FSDO","N2656V","","","CESSNA","170","No","UNKNOWN","PERSONAL","EN ROUTE (ENR)","91","SERIOUS","No","0","0","1","0","0","0","0","0","0","0","0","0","1","0","0","0","0","0","0","0"
"No","04-APR-22","01-APR-22","18:30:00Z","GREENVILLE","NORTH CAROLINA","UNITED STATES","AIRCRAFT LANDED GEAR UP, GREENVILLE, NC.","INCIDENT","GREENSBORO FSDO","N4306A","","","BEECH","E55","No","UNKNOWN","PERSONAL","LANDING (LDG)","91","NONE","No","1","0","0","0","0","0","0","0","0","0","0","0","0","0","0","0","0","0","0","0"
"No","04-APR-22","03-APR-22","23:55:00Z","COLORADO SPRINGS","COLORADO","UNITED STATES","AIRCRAFT CRASHED UNDER UNKNOWN CIRCUMSTANCES ON LANDING, COLORADO SPRINGS, CO.","ACCIDENT","DENVER FSDO","N9119W","","","PIPER","PA28","No","UNKNOWN","PERSONAL","LANDING (LDG)","91","SERIOUS","No","0","0","1","0","0","0","0","0","0","0","0","0","0","0","2","0","0","0","0","0"
"No","04-APR-22","01-APR-22","10:15:00Z","NEW YORK","NEW YORK","UNITED STATES","AIRCRAFT DURING PUSHBACK, TUG JACK-KNIFED CAUSING A CRACK IN THE RADOME, NEW YORK, NY.","INCIDENT","NEW YORK FSDO","N8514F","SWA1430","SOUTHWEST AIRLINES","BOEING","737","No","UNKNOWN","COMMERCIAL","PUSHBACK/TOWING (PBT)","121","NONE","No","2","0","0","0","0","0","0","0","0","0","0","0","0","0","0","0","0","0","0","0"
"No","04-APR-22","01-APR-22","10:15:00Z","MILWAUKEE","WISCONSIN","UNITED STATES","AIRCRAFT WAS TAXIING TO DEICE PAD AND VEERED OFF TAXIWAY, MILWAUKEE, WI.","INCIDENT","MILWAUKEE FSDO","N7835A","SWA1862","SOUTHWEST AIRLINES","BOEING","737","No","UNKNOWN","COMMERCIAL","TAXI (TXI)","121","NONE","No","2","0","0","0","0","0","0","0","0","0","0","0","0","0","0","0","0","0","0","0"
"No","05-APR-22","04-APR-22","17:24:00Z","DAYTONA BEACH","FLORIDA","UNITED STATES","AIRCRAFT RIGHT WING STRUCK A BIRD, DAYTONA BEACH, FL.","INCIDENT","ORLANDO FSDO","N496ER","ERU496","EMBRY RIDDLE AERONAUTICAL UNIV","CESSNA","172","No","MINOR","FAR 141 PILOT SCHOOL","APPROACH (APR)","91","NONE","No","1","0","0","0","0","0","0","0","0","0","1","0","0","0","0","0","0","0","0","0"
"No","05-APR-22","31-MAR-22","22:55:00Z","ARLINGTON","TEXAS","UNITED STATES","AIRCRAFT VEERED OFF TAXIWAY INTO THE MUD, ARLINGTON, TX.","INCIDENT","NORTH TEXAS FSDO","N208US","JUS208","USA JET AIRLINES","MCDONNELL DOUGLAS","DC9","No","NONE","ON DEMAND","TAXI (TXI)","","NONE","No","2","0","0","0","0","0","0","0","0","0","0","0","0","0","0","0","0","0","0","0"
"Yes","05-APR-22","04-APR-22","21:00:00Z","HONOLULU","HAWAII","UNITED STATES","AIRCRAFT WAS TAXIING AND LEFT WING CLIPPED A HANGAR, HONOLULU, HI.","INCIDENT","HONOLULU FSDO","N911ZE","","HAWAII LIFE FLIGHT","BEECH","C90","No","MINOR","AMBULANCE","TAXI (TXI)","135","NONE","No","1","0","0","0","0","2","0","0","0","0","1","0","0","0","0","0","0","0","0","0"
"No","05-APR-22","04-APR-22","23:55:00Z","MINNEAPOLIS","MINNESOTA","UNITED STATES","AIRCRAFT PROP WAS DAMAGED WHEN NOSE GEAR CAME OFF DURING LANDING, MINNEAPOLIS, MN.","INCIDENT","MINNEAPOLIS FSDO","N2626Z","","","CESSNA","T206","No","UNKNOWN","PERSONAL","LANDING (LDG)","91","NONE","No","1","0","0","0","0","0","0","0","0","0","1","0","0","0","0","0","0","0","0","0"
"No","05-APR-22","04-APR-22","16:20:00Z","ORANGE","TEXAS","UNITED STATES","AIRCRAFT EXPERIENCED ENGINE ISSUES AND MADE AN EMERGENCY LANDING GEAR UP IN A MARSH, ORANGE, TX.","INCIDENT","HOUSTON FSDO","N4803T","","","CESSNA","R182","No","UNKNOWN","OTHER","EN ROUTE (ENR)","91","NONE","No","1","0","0","0","0","0","0","0","0","0","0","0","0","0","0","0","0","0","0","0"
"No","05-APR-22","03-APR-22","21:00:00Z","LONGVIEW","TEXAS","UNITED STATES","AIRCRAFT BOUNCED ON LANDING DAMAGING PROP, LONGVIEW, TX.","INCIDENT","NORTH TEXAS FSDO","N52602","","","CESSNA","172","No","UNKNOWN","INSTRUCTION","LANDING (LDG)","91","NONE","No","1","0","0","0","0","0","0","0","0","0","0","0","0","0","0","0","0","0","0","0"
"No","05-APR-22","05-APR-22","02:30:00Z","DAYTONA BEACH","FLORIDA","UNITED STATES","AIRCRAFT WAS TAXIING AND VEERED OFF TAXIWAY STRIKING A TAXIWAY LIGHT, DAYTONA BEACH, FL.","INCIDENT","ORLANDO FSDO","N64791","","","CESSNA","172","No","UNKNOWN","PERSONAL","TAXI (TXI)","91","UNKNOWN","No","0","0","0","0","0","0","0","0","0","0","0","0","0","0","0","0","0","0","0","0"
"No","15-APR-22","14-APR-22","19:00:00Z","NASHVILLE","TENNESSEE","UNITED STATES","AIRCRAFT WAS TAXIING FOR DEPARTURE AND WAS ASKED TO EXECUTIVE A 180 DEGREE TURN TO AVOID AN AICRAFT THAT HAD A FLAT TIRE, IN THE PROCESS OF THE TURN, VEERED OFF TAXIWAY INTO THE GRASS, NASHVILLE, TN.","INCIDENT","NASHVILLE FSDO","N103DM","","","CIRRUS","SF50","No","UNKNOWN","PERSONAL","TAXI (TXI)","91","NONE","No","1","0","0","0","0","0","0","0","0","0","0","0","0","0","0","0","0","0","0","0"
"No","15-APR-22","14-APR-22","16:20:00Z","COLDWATER","KANSAS","UNITED STATES","AIRCRAFT NOSE GEAR COLLAPSED ON LANDING, COLDWATER, KS.","INCIDENT","WICHITA FSDO","N421GT","","","CESSNA","421","No","UNKNOWN","PERSONAL","LANDING (LDG)","91","NONE","No","1","0","0","0","0","0","0","0","0","0","3","0","0","0","0","0","0","0","0","0"
"No","15-APR-22","14-APR-22","18:55:00Z","HUNTSVILLE","TEXAS","UNITED STATES","AIRCRAFT CRASHED UNDER UNKNOWN CIRCUMSTANCES, HUNTSVILLE, TX.","INCIDENT","HOUSTON FSDO","N78096","","","GLOBE","GC-1B","No","UNKNOWN","PERSONAL","UNKNOWN (UNK)","91","MINOR","No","0","1","0","0","0","0","0","0","0","0","0","0","0","0","0","0","0","0","0","0"
"No","15-APR-22","14-APR-22","14:09:00Z","WASHINGTON","DISTRICT OF COLUMBIA","UNITED STATES","AIRCRAFT STRUCK A BIRD ON LANDING DAMAGING RIGHT WING, WASHINGTON, DC.","INCIDENT","WASHINGTON FSDO","N227JQ","RPA5676","DELTA AIRLINES","EMBRAER","ERJ-170-200","No","UNKNOWN","COMMERCIAL","LANDING (LDG)","121","NONE","No","2","0","0","0","0","0","0","0","0","0","0","0","0","0","0","0","0","0","0","0"
"No","15-APR-22","15-APR-22","02:39:00Z","DETROIT","MICHIGAN","UNITED STATES","AIRCRAFT SRUCK A BIRD ON LANDING AND POST FLIGHT INSPECTION REVEALED BIRD WAS INGESTED INTO RIGHT ENGINE, DETROIT, MI.","INCIDENT","EAST MICHIGAN FSDO","N678NK","NKS2143","SPIRIT AIRLINES","AIRBUS","A321","No","UNKNOWN","COMMERCIAL","LANDING (LDG)","121","UNKNOWN","No","2","0","0","0","0","0","0","0","0","0","0","0","0","0","0","0","0","0","0","0"
"No","15-APR-22","14-APR-22","23:27:00Z","WICKENBURG","ARIZONA","UNITED STATES","AIRCRAFT LANDED GEAR UP, WICKENBURG, AZ.","INCIDENT","SCOTTSDALE FSDO","N10HL","","","CESSNA","210","No","UNKNOWN","PERSONAL","LANDING (LDG)","91","NONE","No","1","0","0","0","0","0","0","0","0","0","1","0","0","0","0","0","0","0","0","0"
"No","15-APR-22","14-APR-22","23:15:00Z","MESA","ARIZONA","UNITED STATES","AIRCRAFT VEERED OFF RUNWAY UNDER UNKNOWN CIRCUMSTANCES, MESA, AZ.","INCIDENT","SCOTTSDALE FSDO","N4402W","OXF1890","CAE OXFORD AVIATION ACADEMY","PIPER","PA28","No","MINOR","FAR 141 PILOT SCHOOL","UNKNOWN (UNK)","91","NONE","No","1","0","0","0","0","0","0","0","0","0","1","0","0","0","0","0","0","0","0","0"
"No","05-APR-22","04-APR-22","17:14:00Z","MANVILLE","NEW JERSEY","UNITED STATES","AIRCRAFT CRASHED UNDER UNKNOWN CIRCUMSTANCES IN A YARD, MANVILLE, NJ.","INCIDENT","ALLENTOWN FSDO","N41XL","","","MOONEY","M20M","No","UNKNOWN","PERSONAL","EN ROUTE (ENR)","91","MINOR","No","0","1","0","0","0","0","0","0","0","0","0","0","0","0","0","0","0","0","0","0"
"No","05-APR-22","29-MAR-22","23:45:00Z","MIDLAND","TEXAS","UNITED STATES","AIRCRAFT ENCOUNTERED SEVERE TURBULENCE INJURYING A PASSENGER, MIDLAND, TX.","ACCIDENT","LUBBOCK FSDO","N469SL","","","BEECH","B200","No","UNKNOWN","CORPORATE","APPROACH (APR)","91","SERIOUS","No","1","0","0","0","0","4","0","1","0","0","0","0","0","0","0","0","0","0","0","0"
"No","11-APR-22","09-APR-22","00:02:00Z","HOUSTON","TEXAS","UNITED STATES","AIRCRAFT LANDED AND VEERED OFF RUNWAY INTO A DITCH, HOUSTON, TX.","ACCIDENT","HOUSTON FSDO","N1141U","","","CESSNA","172","No","SUBSTANTIAL","PERSONAL","LANDING (LDG)","91","NONE","No","1","0","0","0","0","0","0","0","0","0","0","0","0","0","0","0","0","0","0","0"
"No","11-APR-22","08-APR-22","21:48:00Z","CHULA VISTA","CALIFORNIA","UNITED STATES","AIRCRAFT CRASHED SHORTLY AFTER TAKEOFF, CHULA VISTA, CA.","ACCIDENT","SAN DIEGO FSDO","N3156D","","","RANS","S-4 COYOTE 1","No","SUBSTANTIAL","PERSONAL","TAKEOFF (TOF)","91","NONE","No","1","0","0","0","0","0","0","0","0","0","0","0","0","0","0","0","0","0","0","0"
"No","11-APR-22","08-APR-22","17:30:00Z","HOUSTON","TEXAS","UNITED STATES","AIRCRAFT LANDED GEAR UP, HOUSTON, TX.","ACCIDENT","HOUSTON FSDO","N5338V","","","CESSNA","172RG","No","SUBSTANTIAL","INSTRUCTION","LANDING (LDG)","91","NONE","No","1","0","0","0","0","0","0","0","0","0","1","0","0","0","0","0","0","0","0","0"
"No","11-APR-22","10-APR-22","21:40:00Z","BIRCHWOOD","ALASKA","UNITED STATES","AIRCRAFT LANDED, VEERED OFF RUNWAY, HIT A SNOWBANK AND FLIPPED OVER, BIRCHWOOD, AK.","ACCIDENT","ANCHORAGE FSDO","N8020L","","","CESSNA","172","No","SUBSTANTIAL","PERSONAL","LANDING (LDG)","91","NONE","No","1","0","0","0","0","0","0","0","0","0","0","0","0","0","0","0","0","0","0","0"
"No","11-APR-22","10-APR-22","20:50:00Z","PALM COAST","FLORIDA","UNITED STATES","AIRCRAFT LANDED AND VEERED OFF RUNWAY INTO THE GRASS, PALM COAST, FL.","INCIDENT","ORLANDO FSDO","N416ER","ERU416","EMBRY RIDDLE AEROANUTICAL UNIV","CESSNA","172","No","UNKNOWN","FAR 141 PILOT SCHOOL","LANDING (LDG)","91","NONE","No","1","0","0","0","0","0","0","0","0","0","0","0","0","0","0","0","0","0","0","0"
"No","11-APR-22","09-APR-22","19:11:00Z","CHARLOTTE","NORTH CAROLINA","UNITED STATES","AIRCRAFT STRUCK A BIRD AND POST FLIGHT INSPECTION REVEALED DAMAGE TO THE PITOT TUBE, CHARLOTTE, NC.","INCIDENT","CHARLOTTE FSDO","N576NN","","","BOMBARDIER","CL-600-2D24","No","UNKNOWN","COMMERCIAL","APPROACH (APR)","121","NONE","No","2","0","0","0","0","0","0","0","0","0","0","0","0","0","0","0","0","0","0","0"
"No","11-APR-22","10-APR-22","15:10:00Z","AUBURN","MAINE","UNITED STATES","AIRCRAFT DEPARTED AND THE RIGHT SIDE WINDOW BLEW OUT AND THE WINDSHIELD CRACKED, AUBURN, ME.","INCIDENT","PORTLAND ME FSDO","N7KJ","","","LANCAIR","IV","No","UNKNOWN","PERSONAL","TAKEOFF (TOF)","91","NONE","No","1","0","0","0","0","0","0","0","0","0","1","0","0","0","0","0","0","0","0","0"
"No","11-APR-22","09-APR-22","03:04:00Z","VALYERMO","CALIFORNIA","UNITED STATES","AIRCRAFT CRASHED UNDER UNKNOWN CIRCUMSTANCES ON MORNING MOUNTAIN, VALYERMO, CA.","INCIDENT","VAN NUYS FSDO","N212NM","","","SCHLEICHER","ASK 21","No","UNKNOWN","PERSONAL","EN ROUTE (ENR)","91","NONE","No","1","0","0","0","0","0","0","0","0","0","0","0","0","0","0","0","0","0","0","0"
"Yes","11-APR-22","07-APR-22","02:00:00Z","COLORADO SPRINGS","COLORADO","UNITED STATES","AIRCRAFT VEERED OFF RUNWAY DURING LANDING AND STRUCK WINDSOCK DAMAGING PROP AND LEFT WING, COLORADO SPRINGS, CO.","ACCIDENT","DENVER FSDO","N248G","","","CIRRUS","SR22","No","SUBSTANTIAL","PERSONAL","LANDING (LDG)","91","NONE","No","1","0","0","0","0","0","0","0","0","0","0","0","0","0","0","0","0","0","0","0"
"No","11-APR-22","08-APR-22","17:25:00Z","FORT PIERCE","FLORIDA","UNITED STATES","AIRCRAFT LANDED AND VEERED INTO THE GRASS, FORT PIERCE, FL.","INCIDENT","ORLANDO FSDO","N555TD","","","CONSOLIDATED AERONAUTICS","LAKE LA-4","No","UNKNOWN","PERSONAL","LANDING (LDG)","91","NONE","No","1","0","0","0","0","0","0","0","0","0","0","0","0","0","0","0","0","0","0","0"
"No","11-APR-22","09-APR-22","17:05:00Z","REDDING","CALIFORNIA","UNITED STATES","AIRCRAFT WHILE TAXIING FOR DEPARTURE VEERED OFF TAXIWAY STRIKING PERIMETER FENCE, REDDING, CA.","INCIDENT","SACRAMENTO FSDO","N756JG","","","CESSNA","U206","No","MINOR","PERSONAL","TAXI (TXI)","91","NONE","No","1","0","0","0","0","0","0","0","0","0","0","0","0","0","0","0","0","0","0","0"
