"UPDATED","ENTRY_DATE","EVENT_LCL_DATE","EVENT_LCL_TIME","LOC_CITY_NAME","LOC_STATE_NAME","LOC_CNTRY_NAME","RMK_TEXT","EVENT_TYPE_DESC","FSDO_DESC","REGIST_NBR","FLT_NBR","ACFT_OPRTR","ACFT_MAKE_NAME","ACFT_MODEL_NAME","ACFT_MISSING_FLAG","ACFT_DMG_DESC","FLT_ACTIVITY","FLT_PHASE","FAR_PART","MAX_INJ_LVL","FATAL_FLAG","FLT_CRW_INJ_NONE","FLT_CRW_INJ_MINOR","FLT_CRW_INJ_SERIOUS","FLT_CRW_INJ_FATAL","FLT_CRW_INJ_UNK","CBN_CRW_INJ_NONE","CBN_CRW_INJ_MINOR","CBN_CRW_INJ_SERIOUS","CBN_CRW_INJ_FATAL","CBN_CRW_INJ_UNK","PAX_INJ_NONE","PAX_INJ_MINOR","PAX_INJ_SERIOUS","PAX_INJ_FATAL","PAX_INJ_UNK","GRND_INJ_NONE","GRND_INJ_MINOR","GRND_INJ_SERIOUS","GRND_INJ_FATAL","GRND_INJ_UNK"
"No","05-AUG-22","04-AUG-22","18:20:00Z","OGDEN","UTAH","UNITED STATES","AIRCRAFT EXPERIENCED ENGINE ISSUES AND MADE AN EMERGENCY LANDING IN A FIELD, OGDEN, UT.","INCIDENT","SALT LAKE CITY FSDO","N447","","","GLASAIR","GLASTAR","No","NONE","PERSONAL","EN ROUTE (ENR)","91","NONE","No","1","0","0","0","0","0","0","0","0","0","0","0","0","0","0","0","0","0","0","0"
"No","05-AUG-22","04-AUG-22","17:30:00Z","HOLLY RIDGE","NORTH CAROLINA","UNITED STATES","AIRCRAFT LANDING GEAR CAUGHT POWERLINE AND FELL TO THE GROUND, HOLLY RIDGE, NC.","ACCIDENT","GREENSBORO FSDO","N8865T","","","CESSNA","182","No","SUBSTANTIAL","PERSONAL","LANDING (LDG)","91","MINOR","No","0","1","0","0","0","0","0","0","0","0","0","0","0","0","0","0","0","0","0","0"
"No","05-AUG-22","04-AUG-22","12:30:00Z","INDIANOLA","IOWA","UNITED STATES","AIRCRAFT STRUCK POWERLINE ON DESCENT, INDIANOLA, IA.","ACCIDENT","DES MOINES FSDO","N801UM","","","ULTRAMAGIC","M-56C","No","DESTROYED","PERSONAL","APPROACH (APR)","91","NONE","No","1","0","0","0","0","0","0","0","0","0","0","0","0","0","0","0","0","0","0","0"
"No","05-AUG-22","04-AUG-22","21:00:00Z","MIDLAND","TEXAS","UNITED STATES","AIRCRAFT BOUNCED DURING LANDING DUE TO A CROSSWIND, NOSE GEAR COLLAPSED AND INCURRED A PROP STRIKE, MIDLAND, TX.","INCIDENT","LUBBOCK FSDO","N4691K","","","CESSNA","182","No","UNKNOWN","PERSONAL","LANDING (LDG)","91","NONE","No","1","0","0","0","0","0","0","0","0","0","0","0","0","0","0","0","0","0","0","0"
"No","05-AUG-22","04-AUG-22","17:20:00Z","HOUSTON","TEXAS","UNITED STATES","AIRCRAFT TAXIING AND WING TIP STRUCK THE MIRROR OF A PARKED FUEL TRUCK, HOUSTON, TX.","INCIDENT","HOUSTON FSDO","N6797G","","","CESSNA","150","No","UNKNOWN","INSTRUCTION","TAXI (TXI)","91","NONE","No","1","0","0","0","0","0","0","0","0","0","0","0","0","0","0","0","0","0","0","0"
"No","05-AUG-22","03-AUG-22","15:15:00Z","MISSION","TEXAS","UNITED STATES","AIRCRAFT GEAR COLLAPSED ON LANDING AND INCURRED A PROP STRIKE, MISSION, TX.","INCIDENT","SAN ANTONIO FSDO","N6810","","","BEECH","58","No","UNKNOWN","PERSONAL","LANDING (LDG)","91","NONE","No","1","0","0","0","0","0","0","0","0","0","1","0","0","0","0","0","0","0","0","0"
"No","03-AUG-22","02-AUG-22","16:45:00Z","CHENEYVILLE","LOUISIANA","UNITED STATES","AIRCRAFT CRASHED UNDER UNKNOWN CIRCUMSTANCES NEAR AN INTERSTATE, CHENEYVILLE, LA.","ACCIDENT","BATON ROUGE FSDO","N9184Q","","","AIR TRACTOR","AT-502","No","UNKNOWN","AERIAL APPLICATION","EN ROUTE (ENR)","137","FATAL","Yes","0","0","0","1","0","0","0","0","0","0","0","0","0","0","0","0","0","0","0","0"
"No","03-AUG-22","02-AUG-22","15:57:00Z","GREENVILLE","SOUTH CAROLINA","UNITED STATES","AIRCRAFT LANDED GEAR UP, GREENVILLE, SC.","INCIDENT","COLUMBIA FSDO","N32196","","","PIPER","PA28R","No","MINOR","INSTRUCTION","LANDING (LDG)","91","NONE","No","1","0","0","0","0","0","0","0","0","0","1","0","0","0","0","0","0","0","0","0"
"No","03-AUG-22","01-AUG-22","15:00:00Z","LA GRANGE","GEORGIA","UNITED STATES","AIRCRAFT GEAR COLLAPSED ON LANDING, LA GRANGE, GA.","INCIDENT","ATLANTA FSDO","N7810P","","","PIPER","PA24","No","MINOR","PERSONAL","LANDING (LDG)","91","NONE","No","1","0","0","0","0","0","0","0","0","0","0","0","0","0","0","0","0","0","0","0"
"No","03-AUG-22","02-AUG-22","12:00:00Z","LE MARS","IOWA","UNITED STATES","AIRCRAFT CRASHED IN A FIELD DUE TO ENGINE ISSUES, LE MARS, IA.","INCIDENT","DES MOINES FSDO","N4010X","","","AYRES CORPORATION","S2R-T34","No","UNKNOWN","AERIAL APPLICATION","MANEUVERING (MNV)","137","NONE","No","1","0","0","0","0","0","0","0","0","0","0","0","0","0","0","0","0","0","0","0"
"No","03-AUG-22","03-AUG-22","00:20:00Z","NOBLESVILLE","INDIANA","UNITED STATES","AIRCRAFT WAS LANDING NEAR A SCHOOL AND STRUCK POWERLINES, NOBLESVILLE, IN.","INCIDENT","INDIANAPOLIS FSDO","N118JS","","","KUBICEK","BB34Z","No","UNKNOWN","PERSONAL","LANDING (LDG)","91","NONE","No","1","0","0","0","0","0","0","0","0","0","4","0","0","0","0","0","0","0","0","0"
"No","03-AUG-22","02-AUG-22","21:40:00Z","ST PAUL","MINNESOTA","UNITED STATES","AIRCRAFT STRUCK SEVERAL GEESE AND POST FLIGHT INSPECTION REVEALED DAMAGE TO THE RADOME, ST PAUL, MN.","INCIDENT","MINNEAPOLIS FSDO","N93M","","3M","GULFSTREAM","GVI","No","MINOR","CORPORATE","APPROACH (APR)","91","NONE","No","2","0","0","0","0","0","0","0","0","0","0","0","0","0","0","0","0","0","0","0"
"No","03-AUG-22","02-AUG-22","21:11:00Z","BETHEL","ALASKA","UNITED STATES","AIRCRAFT STRUCK RUNWAY LIGHTS ON LANDING, BETHEL, AK.","INCIDENT","ANCHORAGE FSDO","LYC406","","LYNDEN AIR CARGO","LOCKHEED","C130","No","NONE","CARGO","LANDING (LDG)","","NONE","No","2","0","0","0","0","0","0","0","0","0","0","0","0","0","0","0","0","0","0","0"
"No","04-AUG-22","02-AUG-22","12:00:00Z","SOUTH HAVEN","MICHIGAN","UNITED STATES","AIRCRAFT CRASHED UNDER UNKNOWN CIRCUMSTANCES, SOUTH HAVEN, MI.","ACCIDENT","GRAND RAPIDS FSDO","N9784Q","","","SMITH","AEROSTAR 600","No","DESTROYED","INSTRUCTION","MANEUVERING (MNV)","91","FATAL","Yes","0","0","0","1","0","0","0","0","0","0","0","0","0","1","0","0","0","0","0","0"
"No","04-AUG-22","03-AUG-22","19:32:00Z","CYNTHIANA","KENTUCKY","UNITED STATES","AIRCRAFT CRASHED UNDER UNKNOWN CIRCUMSTANCES, CYNTHIANA, KY.","ACCIDENT","LOUISVILLE FSDO","N88550","","","PIPER","J3C","No","SUBSTANTIAL","PERSONAL","LANDING (LDG)","91","FATAL","Yes","0","0","0","1","0","0","0","0","0","0","0","0","1","0","0","0","0","0","0","0"
"No","04-AUG-22","03-AUG-22","17:00:00Z","MAHONING TOWNSHIP","PENNSYLVANIA","UNITED STATES","AIRCRAFT CRASHED UNDER UNKNOWN CIRCUMSTANCES, MAHONING TOWNSHIP, PA.","INCIDENT","ALLEGHENY FSDO","N45CA","","","ROBINSON","R44","No","UNKNOWN","PERSONAL","EN ROUTE (ENR)","91","MINOR","No","0","1","0","0","0","0","0","0","0","0","2","0","0","0","0","0","0","0","0","0"
"No","04-AUG-22","03-AUG-22","15:00:00Z","MELVILLE","LOUISIANA","UNITED STATES","AIRCRAFT CRASHED IN A FIELD AFTER HITTING A TREE AND CAUGHT ON FIRE, MELVILLE, LA.","ACCIDENT","BATON ROUGE FSDO","N41850","","","AIR TRACTOR","AT-502","No","DESTROYED","AERIAL APPLICATION","MANEUVERING (MNV)","137","UNKNOWN","No","0","0","0","0","1","0","0","0","0","0","0","0","0","0","0","0","0","0","0","0"
"No","04-AUG-22","03-AUG-22","16:11:00Z","WINSTON SALEM","NORTH CAROLINA","UNITED STATES","AIRCRAFT GEAR COLLAPSED ON LANDING, WINSTON SALEM, NC.","INCIDENT","GREENSBORO FSDO","N310WN","","","CESSNA","310","No","MINOR","PERSONAL","LANDING (LDG)","91","NONE","No","1","0","0","0","0","0","0","0","0","0","0","0","0","0","0","0","0","0","0","0"
"No","04-AUG-22","03-AUG-22","16:20:00Z","BUTLER","PENNSYLVANIA","UNITED STATES","AIRCRAFT LANDED AND VEERED OFF RUNWAY INTO THE GRASS, BUTLER, PA.","INCIDENT","ALLEGHENY FSDO","N459BT","","","CIRRUS","SR20","No","UNKNOWN","PERSONAL","LANDING (LDG)","91","NONE","No","1","0","0","0","0","0","0","0","0","0","0","0","0","0","0","0","0","0","0","0"
"No","04-AUG-22","03-AUG-22","15:00:00Z","CARLSBAD","NEW MEXICO","UNITED STATES","AIRCRAFT LANDED GEAR UP, CARLSBAD, NM.","INCIDENT","LUBBOCK FSDO","N620WG","","","SOCATA","TMB700","No","UNKNOWN","PERSONAL","LANDING (LDG)","91","NONE","No","1","0","0","0","0","0","0","0","0","0","1","0","0","0","0","0","0","0","0","0"
"No","04-AUG-22","03-AUG-22","19:18:00Z","CRANBERRY","PENNSYLVANIA","UNITED STATES","AIRCRAFT ENCOUNTERED A GUST OF WIND ON LANDING AND WAS BLOWN OFF RUNWAY INTO TREES, CRANBERRY, PA.","INCIDENT","ALLEGHENY FSDO","N9325H","","","AERONCA","7BCM","No","UNKNOWN","PERSONAL","LANDING (LDG)","91","MINOR","No","0","1","0","0","0","0","0","0","0","0","0","2","0","0","0","0","0","0","0","0"
"No","04-AUG-22","30-JUL-22","14:40:00Z","MECOSTA","MICHIGAN","UNITED STATES","AIRCRAFT LANDED, VEERED OFF RUNWAY AND NOSED OVER, MECOSTA, MI.","ACCIDENT","GRAND RAPIDS FSDO","N2902N","","","CESSNA","120","No","SUBSTANTIAL","PERSONAL","LANDING (LDG)","91","NONE","No","1","0","0","0","0","0","0","0","0","0","0","0","0","0","0","0","0","0","0","0"
"No","05-AUG-22","04-AUG-22","22:30:00Z","NOVATO","CALIFORNIA","UNITED STATES","AIRCRAFT GEAR COLLAPSED ON LANDING, NOVATO, CA.","INCIDENT","OAKLAND FSDO","N8687Q","","","BEECH","S35","No","UNKNOWN","PERSONAL","LANDING (LDG)","91","NONE","No","1","0","0","0","0","0","0","0","0","0","1","0","0","0","0","0","0","0","0","0"
"No","05-AUG-22","28-JUL-22","01:05:00Z","DILLINGHAM","ALASKA","UNITED STATES","AIRCRAFT MADE AN EMERGENCY LANDING, DILLINGHAM, AK.","ACCIDENT","ANCHORAGE FSDO","N6908M","","","CESSNA","207","No","SUBSTANTIAL","PERSONAL","LANDING (LDG)","91","NONE","No","1","0","0","0","0","0","0","0","0","0","1","0","0","0","0","0","0","0","0","0"
"No","05-AUG-22","16-MAY-22","23:30:00Z","CRESCENT LALKE","OREGON","UNITED STATES","AIRCRAFT ON A TOUCH AND GO ON DEPARTURE, AFRAID THEY WOULD NOT CLEAR TREES, LANDED ON THE RUNWAY AND VEERED OFF INTO SOFT SAND AND BECAME STUCK, CRESCET LAKE, OR.","INCIDENT","PORTLAND FSDO","N48286","","","CESSNA","152","No","UNKNOWN","INSTRUCTION","TAKEOFF (TOF)","91","NONE","No","1","0","0","0","0","0","0","0","0","0","1","0","0","0","0","0","0","0","0","0"
"No","05-AUG-22","05-AUG-22","01:00:00Z","MADISON","MISSISSIPPI","UNITED STATES","AIRCRAFT EXPERIENCED ENGINE ISSUES AND LANDED ON A ROAD, MADISON, MS.","INCIDENT","JACKSON FSDO","N8110S","","","CESSNA","150","No","NONE","PERSONAL","EN ROUTE (ENR)","91","NONE","No","1","0","0","0","0","0","0","0","0","0","1","0","0","0","0","0","0","0","0","0"
"No","05-AUG-22","05-AUG-22","01:30:00Z","PORTLAND","OREGON","UNITED STATES","AIRCRAFT GEAR COLLAPSED ON LANDING, PORTLAND, OR.","INCIDENT","PORTLAND FSDO","N135JC","","","MOONEY","M20F","No","UNKNOWN","PERSONAL","LANDING (LDG)","91","NONE","No","1","0","0","0","0","0","0","0","0","0","0","0","0","0","0","0","0","0","0","0"
"No","04-AUG-22","03-AUG-22","18:58:00Z","JACKSONVILLE","FLORIDA","UNITED STATES","AIRCRAFT ENCOUNTERED SEVERE TURBULENCE, JACKSONVILLE, FL.","INCIDENT","ORLANDO FSDO","N842JS","","","CESSNA","560","No","MINOR","ON DEMAND","EN ROUTE (ENR)","135","UNKNOWN","No","0","0","0","0","2","0","0","0","0","0","0","0","0","0","0","0","0","0","0","0"
"No","05-AUG-22","04-AUG-22","14:50:00Z","CHINO","CALIFORNIA","UNITED STATES","AIRCRAFT LANDED WITH THE LEFT GEAR PARTIALLY DOWN AND VEERED OFF RUNWAY, CHINO, CA.","INCIDENT","RIVERSIDE FSDO","N3827Y","","","CESSNA","210","No","UNKNOWN","PERSONAL","LANDING (LDG)","91","NONE","No","1","0","0","0","0","0","0","0","0","0","0","0","0","0","0","0","0","0","0","0"
"No","01-AUG-22","29-JUL-22","15:35:00Z","ORLANDO","FLORIDA","UNITED STATES","AIRCRAFT STRUCK A BIRD SHORTLY AFTER TAKEOFF, ORLANDO, FL.","INCIDENT","ORLANDO FSDO","N733RV","","","CESSNA","172","No","UNKNOWN","PERSONAL","TAKEOFF (TOF)","91","NONE","No","1","0","0","0","0","0","0","0","0","0","0","0","0","0","0","0","0","0","0","0"
"Yes","27-JUL-22","26-JUL-22","17:18:00Z","ANCHORAGE","ALASKA","UNITED STATES","AIRCRAFT CRASHED UNDER UNKNOWN CIRCUMSTANCES IN WATER LANE WHILE DEPARTING, ANCHORAGE, AK.","ACCIDENT","ANCHORAGE FSDO","N9776R","","REGAL AIR","DEHAVILLAND","DHC2","No","SUBSTANTIAL","SIGHT SEEING","TAKEOFF (TOF)","135","SERIOUS","No","0","1","0","0","0","0","0","0","0","0","0","4","2","0","0","0","0","0","0","0"
"No","27-JUL-22","26-JUL-22","22:00:00Z","ANIAK","ALASKA","UNITED STATES","AIRCRAFT CRASHED UNDER UNKNOWN CIRCUMSTANCES ON A DIRT STRIP, ANIAK, AK.","ACCIDENT","ANCHORAGE FSDO","N4743T","","","MAULE","M4","No","SUBSTANTIAL","PERSONAL","UNKNOWN (UNK)","91","NONE","No","1","0","0","0","0","0","0","0","0","0","0","0","0","0","0","0","0","0","0","0"
"No","27-JUL-22","26-JUL-22","23:24:00Z","SEATTLE","WASHINGTON","UNITED STATES","AIRCRAFT CRASHED UNDER UNKNOWN CIRCUMSTANCES INTO THE WATER OFF ALKI BEACH, SEATTLE, WA.","ACCIDENT","SEATTLE FSDO","N45517","","","CESSNA","150","No","SUBSTANTIAL","PERSONAL","EN ROUTE (ENR)","91","NONE","No","1","0","0","0","0","0","0","0","0","0","0","0","0","0","0","0","0","0","0","0"
"Yes","27-JUL-22","27-JUL-22","00:26:00Z","DENVER","COLORADO","UNITED STATES","AIRCRAFT ON DEPARTURE AND STRUCK A BIRD IN THE LEFT ENGINE CAUSING A FIRE, TAKEOFF ABORTED AND BLEW RIGHT MAIN TIRES, DENVER, CO.","INCIDENT","DENVER FSDO","N332DN","DAL1057","DELTA AIRLINES","AIRBUS","A321","No","UNKNOWN","COMMERCIAL","TAKEOFF (TOF)","121","NONE","No","2","0","0","0","0","0","0","0","0","0","197","0","0","0","0","0","0","0","0","0"
"No","27-JUL-22","26-JUL-22","14:36:00Z","NEW YORK","NEW YORK","UNITED STATES","AIRCRAFT WAS AT THE GATE WHEN A HOLE IN THE FUSELAGE WAS DISCOVERED, NEW YORK, NY.","INCIDENT","NEW YORK FSDO","N822DN","","DELTA AIRLINES","BOEING","737","No","UNKNOWN","COMMERCIAL","STANDING (STD)","121","UNKNOWN","No","0","0","0","0","0","0","0","0","0","0","0","0","0","0","0","0","0","0","0","0"
"No","27-JUL-22","25-JUL-22","20:00:00Z","BLOCK ISLAND","RHODE ISLAND","UNITED STATES","AIRCRAFT LANDED AND WAS TAXIING WHEN THE LEFT WING CLIPPED A FENCE, BLOCK ISLAND, RI.","INCIDENT","BOSTON FSDO","N913AF","","","PILATUS","PC12","No","MINOR","PERSONAL","TAXI (TXI)","91","UNKNOWN","No","0","0","0","0","1","0","0","0","0","0","0","0","0","0","0","0","0","0","0","0"
"No","27-JUL-22","23-JUL-22","16:30:00Z","LIVINGSTON","MONTANA","UNITED STATES","AIRCRAFT LOST DIRECTIONAL CONTROL AND VEERED OFF RUNWAY INTO AN EMBANKMENT DURING LANDING, LIVINGSTON, MT.","ACCIDENT","HELENA FSDO","N2482W","","","SCHWEIZER","SGS 2-33","No","SUBSTANTIAL","PERSONAL","LANDING (LDG)","91","NONE","No","1","0","0","0","0","0","0","0","0","0","1","0","0","0","0","0","0","0","0","0"
"No","27-JUL-22","26-JUL-22","08:30:00Z","NEW ORLEANS","LOUISIANA","UNITED STATES","AIRCRAFT LANDED AND GEAR COLLAPSED AND VEERED OFF RUNWAY CLIPPIING A RUNWAY LIGHT, NEW ORELANS, LA.","INCIDENT","BATON ROUGE FSDO","N199PL","","AIR RELDAN","BEECH","E90","No","UNKNOWN","ON DEMAND","LANDING (LDG)","135","NONE","No","2","0","0","0","0","0","0","0","0","0","0","0","0","0","0","0","0","0","0","0"
"No","28-JUL-22","26-JUL-22","17:00:00Z","KNOX","INDIANA","UNITED STATES","AIRCRAFT CRASHED IIN A FIELD SHORTLY AFTER TAKEOFF, KNOX, IN.","ACCIDENT","GREATER CHICAGO FSDO","N629EH","","","SCHWEIZER","G-164B","No","DESTROYED","AERIAL APPLICATION","TAKEOFF (TOF)","137","NONE","No","1","0","0","0","0","0","0","0","0","0","0","0","0","0","0","0","0","0","0","0"
"No","28-JUL-22","28-JUL-22","01:07:00Z","ANCHORAGE","ALASKA","UNITED STATES","AIRCRAFT LANDED AND VEERED OFF RUNWAY STRIKING WEATHER SENSORS, ANCHORAGE, AK.","ACCIDENT","ANCHORAGE FSDO","N6165V","","","LAKE","LA-4-200","No","SUBSTANTIAL","PERSONAL","LANDING (LDG)","91","NONE","No","1","0","0","0","0","0","0","0","0","0","0","0","0","0","0","0","0","0","0","0"
"No","28-JUL-22","27-JUL-22","19:15:00Z","BLOOMSBURG","PENNSYLVANIA","UNITED STATES","AIRCRAFT TAIL BOOM STRUCK POWERLINES, CRASHED AND FLIPPED OVER, BLOOMSBURG, PA.","INCIDENT","HARRISBURG FSDO","N132HD","","","BELL","OH-58A","No","UNKNOWN","AERIAL APPLICATION","MANEUVERING (MNV)","137","NONE","No","1","0","0","0","0","0","0","0","0","0","0","0","0","0","0","0","0","0","0","0"
"No","28-JUL-22","27-JUL-22","17:50:00Z","HOLLYWOOD","FLORIDA","UNITED STATES","AIRCRAFT LOST CONTROL WHILE HOVERING, BEGAN TO SPIN, STRUCK THE GROUND AND ROLLED, HOLLYWOOD, FL.","INCIDENT","SOUTH FLORIDA FSDO","N42WC","","","ROBINSON","R22","No","UNKNOWN","PERSONAL","MANEUVERING (MNV)","91","MINOR","No","0","0","0","0","1","0","0","0","0","0","0","1","0","0","0","0","0","0","0","0"
"Yes","28-JUL-22","27-JUL-22","17:21:00Z","KASILOF","ALASKA","UNITED STATES","AIRCRAFT CRASHED UNDER UNKNOWN CIRCUMSTANCES, KASILOF, AK.","ACCIDENT","ANCHORAGAE FSDO","N58SQ","","","BACKCOUNTRY SUPER CUBS","SQ-2","No","SUBSTANTIAL","PERSONAL","EN ROUTE (ENR)","91","SERIOUS","No","0","0","1","0","0","0","0","0","0","0","1","0","0","0","0","0","0","0","0","0"
"No","28-JUL-22","27-JUL-22","18:31:00Z","MARSTON MILLS","MASSACHUSETTS","UNITED STATES","AIRCRAFT LANDED AND VEERED OFF RUNWAY INTO TREES, MARSTON MILLS, MA.","INCIDENT","BOSTON FSDO","N7437G","","","CESSNA","172","No","UNKNOWN","PERSONAL","LANDING (LDG)","91","NONE","No","1","0","0","0","0","0","0","0","0","0","1","0","0","0","0","0","0","0","0","0"
"No","28-JUL-22","27-JUL-22","15:00:00Z","FARMINGTON","MISSOURI","UNITED STATES","AIRCRAFT GEAR COLLAPSED ON LANDING, FARMINGTON, MO.","INCIDENT","ST LOUIS FSDO","N21007","","","MOONEY","M20C","No","UNKNOWN","PERSONAL","LANDING (LDG)","91","NONE","No","1","0","0","0","0","0","0","0","0","0","1","0","0","0","0","0","0","0","0","0"
"No","28-JUL-22","27-JUL-22","19:45:00Z","MIAMI","FLORIDA","UNITED STATES","AIRCRAFT EXPERIENCED ENGINE ISSUES AND LANDED ON A HIGHWAY, MIAMI, FL.","INCIDENT","SOUTH FLORIDA FSDO","N25469","","","CESSNA","152","No","NONE","PERSONAL","EN ROUTE (ENR)","91","NONE","No","1","0","0","0","0","0","0","0","0","0","1","0","0","0","0","0","0","0","0","0"
"No","28-JUL-22","27-JUL-22","05:36:00Z","PECOS","TEXAS","UNITED STATES","AIRCRAFT MADE AN EMERGENCY LANDING ON AN INTERSTATE DUE TO AN ENGINE FIRE, PECOS, TX.","INCIDENT","LUBBOCK FSDO","N9384R","","","MOONEY","M20K","No","UNKNOWN","PERSONAL","EN ROUTE (ENR)","91","NONE","No","1","0","0","0","0","0","0","0","0","0","0","0","0","0","0","0","0","0","0","0"
"No","29-JUL-22","28-JUL-22","14:20:00Z","OSHKOSH","WISCONSIN","UNITED STATES","DURING TAXI TO RUNWAY, N694V RAN INTO THE BACK OF N79KM, OSHKOSH, WISCONSIN.","ACCIDENT","MILWAUKEE FSDO","N694V","","","VANS","RV8","No","SUBSTANTIAL","PERSONAL","TAXI (TXI)","91","NONE","No","1","0","0","0","0","0","0","0","0","0","0","0","0","0","0","0","0","0","0","0"
"No","29-JUL-22","28-JUL-22","17:30:00Z","ITHACA","NEBRASKA","UNITED STATES","CROP DUSTER AUTO-ROTATED AFTER STRIKING A WIRE.  FIRE DEPT EXTINGUISHED GRASS FIRE CAUSED BY THE CRASH, ITHACA, NEBRASKA.","ACCIDENT","LINCOLN FSDO","N719TF","","","ROBINSON","R44","No","SUBSTANTIAL","AERIAL APPLICATION","UNKNOWN (UNK)","137","NONE","No","1","0","0","0","0","0","0","0","0","0","0","0","0","0","0","0","0","0","0","0"
"No","29-JUL-22","28-JUL-22","19:45:00Z","DALLAS","TEXAS","UNITED STATES","AIRCRAFT CRASHED AFTER REPORTING A ROUGH RUNNING ENGINE, DALLAS, TEXAS.","ACCIDENT","NORTH TEXAS FSDO","N3027J","","","PIPER","PA32","No","DESTROYED","PERSONAL","UNKNOWN (UNK)","91","SERIOUS","No","0","0","1","0","0","0","0","0","0","0","0","0","0","0","0","0","0","0","0","0"
"No","29-JUL-22","22-JUL-22","18:30:00Z","NEOSHO","MISSOURI","UNITED STATES","AIRCRAFT STRUCK TREES DURING TAXI, NEOSHO, MISSOURI.","ACCIDENT","KANSAS CITY FSDO","N8367T","","","PIPER","PA28","No","DESTROYED","PERSONAL","TAXI (TXI)","91","NONE","No","1","0","0","0","0","0","0","0","0","0","1","0","0","0","0","0","0","0","0","0"
"No","29-JUL-22","27-JUL-22","19:52:00Z","SAN FRANCISCO","CALIFORNIA","UNITED STATES","FLIGHT CREW REPORTED AN ISSUE WITH THE AUTOPILOT CAUSING A FLIGHT ATTENDANT TO FALL AND SUSTAIN A BROKEN ANKLE REQUIRING SURGERY, SAN FRANCISCO, CALIFORNIA.","ACCIDENT","OAKLAND FSDO","N557XJ","XOJ557","XOJET","BOMBARDIER","BD100 1A10","No","NONE","COMMERCIAL","UNKNOWN (UNK)","135","SERIOUS","No","2","0","0","0","0","0","0","1","0","0","0","0","0","0","0","0","0","0","0","0"
"No","29-JUL-22","28-JUL-22","21:15:00Z","TALKEETNA","ALASKA","UNITED STATES","DURING LANDING, AIRCRAFT VEERED THROUGH INFIELD & TAXIWAY A COMING TO A STOP IN THE RAMP AREA, TALKEETNA, ALASKA.","INCIDENT","ANCHORAGE FSDO","N320KT","","","DE HAVILLAND","DHC3","No","UNKNOWN","ON DEMAND","LANDING (LDG)","135","NONE","No","1","0","0","0","0","0","0","0","0","0","9","0","0","0","0","0","0","0","0","0"
"No","27-JUL-22","26-JUL-22","22:02:00Z","PORTLAND","ARKANSAS","UNITED STATES","AIRCRAFT COLLIDED WITH N749LA, PORTLAND, AR.","ACCIDENT","LITTLE ROCK FSDO","N214RL","","","AIR TRACTOR","AT-802","No","DESTROYED","AERIAL APPLICATION","UNKNOWN (UNK)","137","SERIOUS","No","0","0","1","0","0","0","0","0","0","0","0","0","0","0","0","0","0","0","0","0"
"No","29-JUL-22","28-JUL-22","19:00:00Z","SAN DIEGO","CALIFORNIA","UNITED STATES","LEFT WING AND PROPELLER STRUCK GROUND DURING LANDING, SAN DIEGO, CALIFORNIA.","INCIDENT","SAN DIEGO FSDO","N41757","","","PIPER","PA28","No","UNKNOWN","PERSONAL","UNKNOWN (UNK)","91","NONE","No","1","0","0","0","0","0","0","0","0","0","0","0","0","0","0","0","0","0","0","0"
"No","29-JUL-22","28-JUL-22","23:36:00Z","COUNCIL BLUFFS","IOWA","UNITED STATES","NOSE LANDING GEAR COLLAPSED DURING LANDING ROLLOUT, COUNCIL BLUFFS, IOWA.","INCIDENT","DES MOINES FSDO","N84331","","","PIPER","PA32","No","UNKNOWN","PERSONAL","LANDING (LDG)","91","NONE","No","1","0","0","0","0","0","0","0","0","0","1","0","0","0","0","0","0","0","0","0"
"No","01-AUG-22","29-JUL-22","20:29:00Z","FUQUAY-VARINA","NORTH CAROLINA","UNITED STATES","AIRCRAFT LANDED HARD AND LOST TIRE, FUQUAY-VARINA, NC.","ACCIDENT","GREENSBORO FSDO","N497CA","","","C A S A","CN 212-200","No","UNKNOWN","UNKNOWN","LANDING (LDG)","91","SERIOUS","No","0","0","1","0","1","0","0","0","0","0","0","0","0","0","0","0","0","0","0","0"
"No","01-AUG-22","30-JUL-22","14:10:00Z","MELROSE","FLORIDA","UNITED STATES","AIRCRAFT CRASHED UNDER UNKNOWN CIRCUMSTANCES AT THE INTERSECTION OF TWO ROADS, MELROSE, FL.","ACCIDENT","ORLANDO FSDO","N8680G","","","TANGOGYRO","TANGO 2","No","UNKNOWN","PERSONAL","EN ROUTE (ENR)","91","FATAL","Yes","0","0","0","1","0","0","0","0","0","0","0","0","0","1","0","0","0","0","0","0"
"No","01-AUG-22","30-JUL-22","18:09:00Z","UTE","IOWA","UNITED STATES","AIRCRAFT CRASHED IN A FIELD AFTER STRIKING POWERLINE AND CAUGHT ON FIRE, UTE, IA.","ACCIDENT","DES MOINES FSDO","N501MW","","","AIR TRACTOR","AT-502","No","DESTROYED","AERIAL APPLICATION","MANEUVERING (MNV)","137","FATAL","Yes","0","0","0","1","0","0","0","0","0","0","0","0","0","0","0","0","0","0","0","0"
"No","01-AUG-22","29-JUL-22","20:10:00Z","ANDALUSIA","ALABAMA","UNITED STATES","AIRCRAFT ATTEMPTING TO LAND, STRUCK A POWERLINE AND CRASHED TO THE GROUND, ANDALUSIA, AL.","ACCIDENT","ALABAMA AND NW FLORIDA FSDO","N124LN","","AIR METHODS","EUROCOPTER","AS 350","No","DESTROYED","AMBULANCE","LANDING (LDG)","135","MINOR","No","0","1","0","0","0","0","2","0","0","0","0","0","0","0","0","0","0","0","0","0"
"No","01-AUG-22","30-JUL-22","10:25:00Z","INDIANOLA","IOWA","UNITED STATES","AIRCRAFT STRUCK A POWERLINE AFTER TAKEOFF, INDIANOLA, IA.","INCIDENT","DES MOINES FSDO","N316EB","","","ARBC","150A","No","MINOR","PERSONAL","TAKEOFF (TOF)","","MINOR","No","0","1","0","0","0","0","0","0","0","0","0","3","0","0","0","0","0","0","0","0"
"No","01-AUG-22","30-JUL-22","21:32:00Z","WHITE BEAR LAKE","MINNESOTA","UNITED STATES","AIRCRAFT FLIPPED OVER AFTER LANDING ON THE LAKE DUE TO THE LANDING GEAR BEING DOWN, WHITE BEAR LAKE, MN.","INCIDENT","MINNEAPOLIS FSDO","N405","","","AVIAT","A-1","No","UNKNOWN","PERSONAL","LANDING (LDG)","91","MINOR","No","0","1","0","0","0","0","0","0","0","0","0","0","0","0","0","0","0","0","0","0"
"No","01-AUG-22","31-JUL-22","18:50:00Z","MARSHALL","MISSOURI","UNITED STATES","AIRCRAFT STRUCK A POWERLINE AND CRASHED IN THE FIELD, MARSHALL, MO.","ACCIDENT","KANSAS CITY FSDO","N458SG","","","ROBINSON","R44","No","SUBSTANTIAL","AERIAL APPLICATION","MANEUVERING (MNV)","137","NONE","No","1","0","0","0","0","0","0","0","0","0","0","0","0","0","0","0","0","0","0","0"
"No","01-AUG-22","30-JUL-22","18:30:00Z","RIDGELAND","SOUTH CAROLINA","UNITED STATES","AIRCRAFT EXPERIENCED ELECTRICAL ISSUES AND LANDED IN A FIELD STRIKING A TREE, RIDGELAND, SC.","INCIDENT","COLUMBIA FSDO","N887MJ","","","TEXTRON","G36","No","UNKNOWN","PERSONAL","EN ROUTE (ENR)","91","MINOR","No","0","1","0","0","0","0","0","0","0","0","0","0","0","0","0","0","0","0","0","0"
"No","01-AUG-22","30-JUL-22","16:20:00Z","EPHRATAH","NEW YORK","UNITED STATES","AIRCRAFT CRASHED UNDER UNKNOWN CIRCUMSTANCES AFTER TAKEOFF, EPHRATAH, NY.","ACCIDENT","ALBANY FSDO","N1358K","","","LUSCOMBE","8A","No","UNKNOWN","PERSONAL","TAKEOFF (TOF)","91","SERIOUS","No","0","0","1","0","0","0","0","0","0","0","0","0","0","0","0","0","0","0","0","0"
"No","01-AUG-22","30-JUL-22","15:04:00Z","LIVERMORE","CALIFORNIA","UNITED STATES","AIRCRAFT CRASHED 200 FEET SHORT OF THE RUNWAY HITTING APPROACH LIGHTS, LIVERMORE, CA.","ACCIDENT","OAKLAND FSDO","N2591V","","","CESSNA","177R","No","SUBSTANTIAL","PERSONAL","LANDING (LDG)","91","NONE","No","1","0","0","0","0","0","0","0","0","0","0","0","0","0","0","0","0","0","0","0"
"No","01-AUG-22","30-JUL-22","19:50:00Z","STAR CITY","ARKANSAS","UNITED STATES","AIRCRAFT ABORTED TAKEOFF, OVERRAN THE END OF THE RUNWAY INTO THE GRASS, NOSE GEAR COLLAPSED AND FLIPPED OVER, STAR CITY, AR.","ACCIDENT","LITTLE ROCK FSDO","N3260V","","","BEECH","35","No","SUBSTANTIAL","PERSONAL","TAKEOFF (TOF)","91","NONE","No","1","0","0","0","0","0","0","0","0","0","1","0","0","0","0","0","0","0","0","0"
"No","01-AUG-22","30-JUL-22","14:40:00Z","COLUMBUS","OHIO","UNITED STATES","AIRCRAFT LANDED HARD, GROUND LOOPED, VEERED OFF RUNWAY AND GEAR COLLAPSED, COLUMBUS, OH.","ACCIDENT","COLUMBUS FSDO","N9162K","","","STINSON","108","No","SUBSTANTIAL","PERSONAL","LANDING (LDG)","91","NONE","No","1","0","0","0","0","0","0","0","0","0","0","0","0","0","0","0","0","0","0","0"
"No","01-AUG-22","29-JUL-22","23:00:00Z","STURGEON LAKE","MINNESOTA","UNITED STATES","AIRCRAFT MADE AN EMERGENCY LANDING DUE TO FUEL EXHAUSTION, FOUND FUEL, DEPARTED AND CAME IN CONTACT WITH TREES, STURGEON LAKE, MN.","ACCIDENT","MINNEAPOLIS FSDO","N42584","","","PIPER","J3C","No","SUBSTANTIAL","PERSONAL","EN ROUTE (ENR)","91","NONE","No","1","0","0","0","0","0","0","0","0","0","0","0","0","0","0","0","0","0","0","0"
